item_key,title,abstract,authors,year,item_type,sources,source_queue
J8FP9HT5,Interactions with generative AI: wearables to measure developer experience and productivity objectively,"With recent advances in AI, many technology firms and developers are exploring whether Generative AI (GenAI) tools can help improve productivity, code quality and the overall developer experience. Current evaluations primarily depend on subjective questionnaire data or code quality metrics. A supplemental objective, continuous, real-time developer-centered measure is missing. Wearables with body sensors that measure the physiological activity of a person have the aforementioned benefits. With their help, impeding factors from GenAI tools on a developer's well-being and cognitive load may be detected. Implications for productivity may be deduced from these cognitive load measures. This research aims to use body sensor data to (1) assess the ability of wearables to measure developers' cognitive load in their everyday working context to then (2) evaluate developer experience, productivity and GenAI interactions in real-life work environments. A holistic mixed-method approach by combining subjective and objective measures in a developer-centered manner is taken.",C. Brandebusemeyer,2025,conferencePaper,ieee,keep_queue
47D9YAKU,The missing grammar of EU law: an explicit norm priority architecture for the European single market,"Drawing on HLA Hart, Niklas Luhmann, and Jürgen Habermas, this article argues that EU governance suffers from a structural paradox: highly formalised primary / Empirically, eight case studies-ranging from supply chain trilemmas to AI Act gridlocks-demonstrate how this missing grammar contributes substantially",Hans Mund,2026,journalArticle,ssrn,maybe_queue
7PRIXNYU,AI and artworks: legal and technical issues,"The issue of intellectual property rights protection connected to AI development is a new and difficult road for the law to tread. / This paper seeks to provide an overview on the roots of these two connected fields: generative AI and intellectual property. / Generative AI, intellectual property, copyright, AI copyright, generative AI",Francesco Mittica,2024,journalArticle,ssrn,maybe_queue
UPJE3BH7,Vibe coding XR: accelerating AI + XR prototyping with XR blocks and gemini,"While large language models (LLMs) have accelerated 2D software development through intent-driven ""vibe coding"", prototyping intelligent Extended Reality (XR) experiences remains a major challenge. The fundamental barrier is not just the steep learning curve for human creators, but that low-level sensor APIs and complex game engine hierarchies are ill-suited for LLM reasoning, routinely exceeding context windows and inducing syntax hallucinations. To bridge this gap, we contribute XR Blocks, an open-source, LLM-native WebXR framework. Unlike traditional engines, XR Blocks introduces a semantic ""Reality Model"" that aligns spatial computing primitives (users, physical environments, and agents) with natural language, providing a robust, concise vocabulary optimized for generative AI. Building upon this foundation, we present Vibe Coding XR, an end-to-end prototyping workflow that leverages LLMs to translate high-level prompts (e.g., ""create a dandelion that reacts to my hand"") directly into functional, physics-aware mixed-reality applications. To minimize the friction of on-device testing, the workflow introduces a seamless desktop ""simulated reality"" to headset deployment loop. Finally, we introduce VCXR60, a pilot dataset of 60 XR prompts paired with an automated evaluation pipeline. Our technical evaluation demonstrates high one-shot execution success, enabling practitioners to bypass lowlevel hurdles and rapidly move from ""idea to reality"". Code and live demos are available at https://github.com/google/xrblocks and http://xrblocks.github.io/gem.",Du; Hersh; Li; Numan; Qian,2026,preprint,arxiv,maybe_queue
4KCG7WRN,Metaphysical quandary of synthetic media transparency,The interaction between human creativity and generative AI presents both opportunities and challenges concerning free speech and innovation. / property.,Darrell Mottley,2025,journalArticle,ssrn,maybe_queue
LYM9RE6K,LLM biases,"Transformer-based agentic AI is rapidly being deployed on major platforms to help users shop, watch, and navigate content with less effort. / For managers, the immediate implication is to treat these as operational risk factors and to monitor concentration and drift over time, rather than assuming",Jinhui Han; Ming Hu; Xilin Zhang,2026,journalArticle,ssrn,maybe_queue
6Y83JT5F,Bridging theory and practice in AI-driven supply chains: prioritizing LLM adoption challenges and SCOR-based applications,"The integration of artificial intelligence (AI) into supply chains is reshaping decision-making, yet the role of large language models (LLMs) remains under-theorized and weakly connected to operational frameworks such as the Supply Chain Operations Reference (SCOR) model. Unlike conventional AI tools, LLMs are generative, rely on unstructured data, and introduce interpretability risks, creating distinct opportunities and challenges for supply chain management (SCM). This study adopts a two-phase, theory-driven approach to examine these challenges. First, LLM adoption barriers were identified through a comprehensive literature review and structured using the Technology–Organization–Environment framework and Dynamic Capability Theory, then validated using a Delphi study with industry experts. Second, the Combinative Distance-based Assessment and Comparative Solution (COCOSO) method was applied to prioritize the identified challenges. Results show that “Understanding LLM Outputs,” “Risk of Over-Reliance on AI,” and “Limitations in Complex Optimization Problems” are the most critical barriers, indicating that interpretability and human–AI interaction outweigh data-related concerns emphasized in prior AI research. In contrast to existing AI-focused SCM research, this study contributes by providing a theory-informed, expert-validated prioritization of LLM-specific adoption challenges and illustrating how these challenges relate to value creation across SCOR process layers. The study further offers a SCOR-aligned decision-support roadmap for managers and policymakers and establishes a structured foundation for future empirical research on LLM-enabled supply chains. © 2026 Elsevier B.V.",Sonar; Ghag; Sharma,2026,journalArticle,,maybe_queue
Z4CNWLH6,SAFE-CITY-AI: responsible governance of AI-enabled surveillance for mega sporting events in smart city contexts,"This study examines the adoption and governance of AI-driven surveillance in mega sporting events and develops a framework to support their responsible / By integrating smart city governance with responsible AI principles, this study offers a timely foundation for policymakers, event organisers, and researchers / AI-enabled surveillance, Mega Sporting Events, Smart city governance, responsible AI, accountability and transparency, urban safety and security",Sk Tahsin Hossain; Tan Yigitcanlar; Nathalie Crutzen; David M. Herold; Nadine Kathrin Ostern,2026,journalArticle,ssrn,maybe_queue
UZZ5WQ8Z,The Black Box Society: The Secret Algorithms That Control Money and Information,,Pasquale,2015,book,naimi-book|naimi-references,maybe_queue
A8LZJ2Q3,Information is physical: assessing the planetary trade-offs of AI transformation,"It argues that current governance, which relies largely on voluntary corporate disclosure, market based instruments and fragmented national regulation, / In response, the paper examines various governance approaches, from pre-deployment planetary, environmental and health impact assessments, standardised / AI Governance, AI Transformation, Environment, Planetary Limits, Environmental Impact, AI, AI Regulation, Planetary Justice, Compute Regulation",Can Şimşek,2026,journalArticle,ssrn,maybe_queue
N8HSZ7BC,Licoeval: evaluating LLMs on license compliance in code generation,"Recent advances in Large Language Models (LLMs) have revolutionized code generation, leading to widespread adoption of AI coding tools by developers. However, LLMs can generate license-protected code without providing the necessary license information, leading to potential intellectual property violations during software production. This paper addresses the critical, yet underexplored, issue of license compliance in LLM-generated code by establishing a benchmark to evaluate the ability of LLMs to provide accurate license information for their generated code. To establish this benchmark, we conduct an empirical study to identify a reasonable standard for “striking similarity” that excludes the possibility of independent creation, indicating a copy relationship between the LLM output and certain opensource code. Based on this standard, we propose LiCoEval, to evaluate the license compliance capabilities of LLMs, i.e., the ability to provide accurate license or copyright information when they generate code with striking similarity to already existing copyrighted code. Using LiCoEval, we evaluate 14 popular LLMs, finding that even top-performing LLMs produce a non-negligible proportion (0.88 % to 2.01 %) of code strikingly similar to existing open-source implementations. Notably, most LLMs fail to provide accurate license information, particularly for code under copyleft licenses. These findings underscore the urgent need to enhance LLM compliance capabilities in code generation tasks. Our study provides a foundation for future research and development to improve license compliance in AIassisted software development, contributing to both the protection of open-source software copyrights and the mitigation of legal risks for LLM users.",W. Xu; K. Gao; H. He; M. Zhou,2025,conferencePaper,ieee,keep_queue
J4K79SSU,Development of an LLM-based system for automatic code generation from HEP publications,"Ensuring the reproducibility of physics results is one of the crucial challenges in high-energy physics (HEP). In this study, we develop a proof-of-concept system that uses large language models (LLMs) to extract analysis procedures from HEP publications and generate executable analysis code for reproducing published results. Our method consists of two stages. In the first stage, open-weight LLMs extract event selection criteria, object definitions, and other relevant analysis information from a target paper and, when necessary, from its referenced publications, and then produce a structured selection list. In the second stage, the structured selection list is used to generate analysis code, which is then executed and validated iteratively. As a benchmark, we use the ATLAS $H \to ZZ^{*} \to 4\ell$ analysis based on proton-proton collision data recorded in 2015 and 2016 and released as ATLAS Open Data. This benchmark allows direct comparison between the generated results and the published analysis, as well as comparison with a manually developed baseline implementation. We separately evaluate selection extraction and code generation in order to clarify the current capabilities and limitations of open-weight LLMs for HEP analysis reproduction. Our initial results show that recent open-weight models can recover many documented selection criteria from papers and references, and that in some runs they can generate event selections fully matching a baseline implementation at the event level. At the same time, stochasticity, hallucination, and execution failure remain significant challenges. These results suggest that LLMs are already promising as human-in-the-loop tools for reproducibility support, although they are not yet reliable as fully autonomous HEP analysis agents. In this paper, we report the design of the prototype system and its initial performance evaluation.",Saito; Kishimoto; Tanaka,2026,preprint,arxiv,maybe_queue
