item_key,title,abstract,authors,year,item_type,sources,source_queue
4WXSFCZ8,AI and privacy: a paradox?,"Case studies, including the provisional ban of OpenAI's ChatGPT by the Italian Data Protection Authority and data breaches involving AI applications, underscore / Focusing on Pakistan, the study highlights the absence of data protection laws and AI regulations, emphasizing the necessity of comprehensive governance",Areeba Iqbal Qureshi,2023,journalArticle,ssrn,maybe_queue
YPX238KE,Algorithms and administrative law: a comparative framework for accountability,"Administrative Law, Algorithmic Accountability, Artificial Intelligence, Comparative Law, Governance, Public Administration, Judicial Review, Legal Technology",Hassan Khalid Ranjha,2025,journalArticle,ssrn,keep_queue
WTIGL8KR,Representative litigation settlement agreements in artificial intelligence copyright infringement disputes: a comparative reflection based on the U.S. bartz case,"The high-density, decentralized copyright conflicts triggered by generative AI training require more than ad hoc solutions; they demand structural governance / Generative AI, Representative Litigation, Class Action, Settlement Agreement, Copyright Disputes, Fair Use, Training-Licensing Market",Chan Hou Lou,2026,journalArticle,ssrn,maybe_queue
HTAT9BYC,Evaluating GPU code translation approaches to optimize CFD efficiency,"Computational Fluid Dynamics (CFD) enables engineers to simulate and analyze fluid flow behavior in complex systems, playing a crucial role in the design, research, and development of aerospace vehicles. However, high-fidelity simulations often require extensive computational resources, with runtimes spanning several days. Graphics Processing Unit (GPU) computing has demonstrated significant speed improvements over traditional Central Processing Unit (CPU)-based methods, but transitioning CFD codes to GPU architectures requires complex adaptation and optimization for parallel execution. This study evaluates methods for converting CPU-based CFD codes to GPU execution by analyzing result accuracy, runtime performance, and power consumption. Various code transition methodologies—including code regeneration translators, compiler-based acceleration, and AI-assisted code conversion—were applied to a simple, stationary Fortran code. The various adapted versions were executed on a GPU-accelerated system and compared against the original Fortran implementation running on a CPU. Power consumption, runtime, and solution accuracy were assessed using energy metrics, pointwise error analysis, and global error norms. Preliminary results indicate that compiler-based acceleration achieves the highest code efficiency but requires the longest translation time. AI-assisted conversion speeds up the process but demands human oversight to ensure accuracy and performance. Code regeneration translators offer the fastest conversion but often produce suboptimal GPU code. Ongoing analysis will further refine these comparisons to identify the most effective approach. Final results will provide practical guidance and valuable insights for CFD engineers, supporting the efficient and reliable adaptation of legacy CPU-based code to GPU computing for faster, more cost-effective simulations. © 2025, American Institute of Aeronautics and Astronautics Inc, AIAA. All rights reserved.",Sivakumaran; Gaitonde,2025,conferencePaper,,maybe_queue
3WHLQDXQ,Reappraisal of section 230 CDA for tackling unethical corporate use of artificial intelligence: did congress surpass its time to handle intermediaries?,"Communications Decency Act § 230, enacted in compliance with constitutional principles and influenced by the Universal Declaration of Human Rights (UDHR / Act. / Internet Intermediaries, Section 230, Artificial Intelligence, Digital Services Act (DSA), EU AI Act, Intermediary Liability, Online Manipulation, Human",Romana Afroze,2025,journalArticle,ssrn,maybe_queue
JGQNH4XX,The digital gorilla: rebalancing power in the age of AI,"This article offers a new conceptual foundation for AI governance by treating such systems as a fourth societal actor-what we term the ""Digital Gorilla / dynamic checks and balances among the four actors, rather than today's more reactive and compliance-driven approaches. / AI governance, AI policy, AI regulation, algorithmic governance, constitutional design, institutional design, polycentric governance, democratic legitimacy",M. Alejandra Parra-Orlandoni; Roxanne A. Schnyder; Christopher J. Mallet,2026,journalArticle,ssrn,keep_queue
2W92E8FH,The living CX system: designing total experience in the AI era,"Customers do not experience companies through strategy documents or governance structures — they experience them as living, adaptive systems of interaction / frameworks including the EU AI Act.",Sushil Katdare,2026,journalArticle,ssrn,maybe_queue
UVV8HVVG,Legal aspects of access to human-generated data and other essential inputs for AI training,"Covering AI regulation, data (access) governance regimes, EU and domestic competition law as well as gatekeeper rules for digital markets, we show that / model collapse, data contamination, artificial intelligence, AI governance, competition law, antitrust law, generative AI, large language models, reinforcement",John Burden; Maurice Chiodo; Henning Grosse Ruse-Khan; Lisa Markschies; Dennis Müller,2024,journalArticle,ssrn,keep_queue
UCAALU46,"Music metadata minefield: prior initiatives, interoperability and how to let GenAI's copyright traces transpire","industry and EU Initiatives at the start of the online era for music consumption between the early 2000s and the early 2010s, aiming for centralised copyright / Metadata, Copyright, AI Act, Article 50 AI Act, Article 53 AI Act, Music metadata, GenAI, Generative AI Music, DGA, Data intermediary, Streaming services",Etienne Valk,2025,journalArticle,ssrn,maybe_queue
NFKS3BYE,"The impact of artificial intelligence on financial decision-making: an empirical investigation of AI adoption, institutional governance, and decision quality in banking","The findings indicate a strong positive relationship between AI adoption and decision-making quality. / In particular, organisations that invest in explainability tools and structured AI governance achieve superior outcomes relative to those relying on opaque / Artificial Intelligence Financial Decision-Making AI Adoption Banking Institutions Algorithmic Governance Machine Learning Explainable AI Credit Risk Non-Performing / Difference-in-Differences Panel Data Regulatory Fragmentation Human-AI Complementarity AEGIS Framework Behavioural Finance, Financial Decision Making, AI Adoption",Kamaluddin Siddique,2026,journalArticle,ssrn,maybe_queue
EEYPB3GU,AI safety (grokking) - controlled nirvana: emptiness windows as a structural safety mechanism for post-grokking AI systems,"AI alignment, grokking, self-reference, corrigibility, shutdownability, structural safety, AI Safety, post-grokking",Qien Huang,2026,journalArticle,ssrn,maybe_queue
P54Q3QHZ,"Retrieve, refine, or both? Using task-specific guidelines for secure python code generation","Large Language Models (LLMs) are increasingly used for code generation, but they often produce code with security vulnerabilities. While techniques like fine-tuning and instruction tuning can improve security, they are computationally expensive and require large amounts of secure code data. Recent studies have explored prompting techniques to enhance code security without additional training. Among these, Recursive Criticism and Improvement (RCI) has demonstrated strong improvements by iteratively refining the generated code by leveraging LLMs' self-critiquing capabilities. However, RCI relies on the model's ability to identify security flaws, which is constrained by its training data and susceptibility to hallucinations. This paper investigates the impact of incorporating taskspecific secure coding guidelines extracted from MITRE's CWE and CodeQL recommendations into LLM prompts. For this, we employ Retrieval-Augmented Generation (RAG) to dynamically retrieve the relevant guidelines that help the LLM avoid generating insecure code. We compare RAG with RCI, observing that both deliver comparable performance in terms of code security, with RAG consuming considerably less time and fewer tokens. Additionally, combining both approaches further reduces the amount of insecure code generated, requiring only slightly more resources than $R C I$ alone, highlighting the benefit of adding relevant guidelines in improving LLM-generated code security.",C. Tony; E. Iannone; R. Scandariato,2025,conferencePaper,ieee,keep_queue
FFPZJJ2D,Several issues regarding data governance in AGI,"Third, AGI-to-AGI data sharing could occur at speeds and complexities beyond human oversight. / We conclude that effective AGI data governance requires built-in constraints, continuous monitoring mechanisms, dynamic governance structures, international / AGI, Data Governance, AI Regulation",Masayuki Hatta,2025,journalArticle,ssrn,keep_queue
Z2VYE325,"ZelC: a cybersecurity-native programming language for intent-gated, capability-scoped, evidence-generating operations in the agentic AI era","General-purpose languages (GPLs) can automate these workflows, but they model security actuation as ordinary side effects of arbitrary code, leaving safety, governance / AI era. / incident response, policy-as-code, capability security, effect systems, information-flow control, tamper-evident logs, Merkle trees, proof-carrying code, agentic / AI safety, abstract interpretation, domain-specific languages, kinetic gate",Haja Mo,2026,journalArticle,ssrn,maybe_queue
VZQVYH4P,Research interpretation of article 14 of the EU AI act: human in command in manufacturing,"The rapid integration of artificial intelligence (AI) into various sectors necessitates rigorous frameworks to ensure that human oversight remains central, aligning with regulatory requirements such as Article 14 of the European Union’s AI Act. This paper introduces the “Human in Command” model, a novel approach designed to foster effective human-AI collaboration, particularly in manufacturing environments. Our model is bifurcated into two primary components: Design4Command and FeelingInCommand. Design4Command outlines a comprehensive set of methodologies for constructing human-AI-teams that emphasize human leadership and decision-making authority, ensuring that AI systems enhance rather than replace human capabilities. FeelingInCommand, on the other hand, presents innovative metrics and tools for assessing the psychological and ergonomic factors impacting humans’ perception of control and efficacy when interacting with AI systems. Using this model, organizations can optimize the efficiency and satisfaction of human operators in AI-enhanced settings. This paper details the theoretical underpinnings of our approach, the design principles of our methodologies, and potential applications across various domains, offering a guideline for developers and policymakers aiming to preserve human oversight in the age of AI. © IFIP International Federation for Information Processing 2024.",Aschenbrenner; Jantzen; Colloseus; Sell; Kempen,2024,conferencePaper,wos,keep_queue
XIMJ3DHW,Explainable fairness in regulatory algorithmic auditing,The framework promotes algorithmic accountability and transparency by focusing on explainability to regulators and the public.,Cathy O'Neil; Holli Sargeant; Jacob Appel,2023,journalArticle,ssrn,keep_queue
85WQZRIB,Artificial intelligence and copyright law in Nigeria: challenges and proposals for reform,"This paper examines the intersection of AI and copyright law under Nigeria's Copyright Act 2022. / The findings reveal that Nigeria's copyright regime currently offers no clear protection for AI-generated content, leaving creators vulnerable. / Artificial intelligence, copyright law, Nigeria, authorship, generative AI, Copyright",Nathaniel Adebayo Ajiboye,2026,journalArticle,ssrn,maybe_queue
7I5YYF7L,Systems integration model for AI solutions with explainability requirements,"Then, the missing elements to operationalize those legal obligations were extracted from AI frameworks such as (a) the NIST AI Risk Management Framework / (AI RMF1.0), (b) the standard ISO/IEC 42001:2023 Artificial Intelligence Management Systems, (c) the Singapore Model AI Governance Framework, and (d)",Dr. Sandra Smyth,2025,journalArticle,ssrn,keep_queue
3XXT9ADG,The framework is the message: legal and ethical implications of ChatGPT,"At the same time, however, generative AI has its dark side such as accuracy risk, the threat of large-scale unemployment, potential security vulnerabilities / infrastructurally might help in the development of law and policy and also the ethics of AI with the emergence of foundation models, specifically focusing on ChatGPT",Amanda Turnbull,2025,journalArticle,ssrn,maybe_queue
2SNAHVWW,Impact-oriented licensing for artificial intelligence: a conceptual framework for a new domain of AI governance,"Socio-Legal Studies, Artificial Intelligence, Technology Policy, Platform Governance, Private Ordering, Digital Commons, Impact-Oriented Licensing, AI Law, Algorithmic / Accountability, Collective Governance",Em Lenartowicz,2025,journalArticle,ssrn,keep_queue
PQ9JED2I,"Risks of AI-driven vulnerability identification, exploitation, and code exposure","mitigation framework organized around ten pillars and discusses the regulatory landscape, including the EU AI Act (enforceable August 2026), the NIST AI / Risk Management Framework, and ISO/IEC 42001.",Khanim Avsuvarova,2026,journalArticle,ssrn,keep_queue
FP7VC4B7,The intuitive appeal of explainable machines,"algorithmic accountability, explanations, law and technology, machine learning, big data, privacy, discrimination",Andrew D. Selbst; Solon Barocas,2018,journalArticle,ssrn,maybe_queue
7HWSHJ6Y,Experimental regulations for AI: sandboxes for morals and mores,"Key examples are the EU Coordinated Plan on AI and the recently published EU AI Regulation Proposal which refer to the importance of experimenting with / the Fintech sector, regulatory sandboxes create a testbed for a selected number of innovative projects, by waiving otherwise applicable rules, guiding compliance / Artificial Intelligence, regulatory sandboxes, AI, technology, innovation, law, regulation, experimental regulations, experimental legal regimes, EU AI / Regulation",Sofia Ranchordas,2021,journalArticle,ssrn,keep_queue
MQ5KZQTX,Human and machine: how software engineers perceive and engage with AI-assisted code reviews compared to their peers,"The integration of artificial intelligence (AI) continues to increase and evolve, including in software engineering (SE). This integration involves processes traditionally entrusted to humans, such as coding. However, the impact on sociotechnical processes like code review remains underexplored. In this interview-based study (20 interviewees), we investigate how software engineers perceive and engage with Large Language Model (LLM)-assisted code reviews compared to human peerled reviews. In this inherently human-centric process, we aim to understand how software engineers navigate the introduction of AI into collaborative workflows. We found that engagement in code review is multi-dimensional, spanning cognitive, emotional, and behavioral dimensions. The introduction of LLM-assisted review impacts some of these attributes. For example, there is less need for emotional regulation and coping mechanisms when dealing with an LLM compared to peers. However, the cognitive load sometimes is higher in dealing with LLM-generated feedback due to its excessive details. Software engineers use a similar sense-making process to evaluate and adopt feedback suggestions from their peers and the LLM. However, the LLM feedback adoption is constrained by trust and lack of context in the review. Our findings contribute to a deeper understanding of how AI tools are impacting SE socio-technical processes and provide insights into the future of AI-human collaboration in SE practices.",A. Alami; N. Ernst,2025,conferencePaper,ieee,keep_queue
MPYEG962,"Rebuilding the foundations of management in the AI era: a proposal for the ""quartet model"" through a symphony of ISO, process mining, IMS, and blockchain","Framework as an ""AI- readable API,"" (2) Process Mining as an ""X-ray machine for business reality,"" (3) the Integrated Management System (IMS) as an ""enterprise-wide / Integrated Management System (IMS), Process Mining, Blockchain, ISO 9001, AI Governance, AI Agent",Atsushi Funaishi,2025,journalArticle,ssrn,maybe_queue
KR3YTCXS,From DORA to the AI act: the new 'digital suitability' standard for financial institutions,"The EU AI Act (Regulation 2024/1689), the Digital Operational Resilience Act (Regulation 2022/2554), and the UK Operational Resilience regime (FCA PS21 / but does not address algorithmic fairness; the AI Act provides algorithmic accountability but lacks resilience requirements; GDPR provides individual / digital suitability, EU AI Act, DORA, operational resilience, algorithmic accountability, financial regulation",Michal Wilczopolski,2026,journalArticle,ssrn,keep_queue
ABDFJPZZ,AI liability in Europe: how does it complement risk regulation and deal with the problem of human oversight?,"In the European Union and elsewhere around the world, AI governance is turning towards risk regulation. / While risk regulations like the AI Act regulate some aspects of these human and machine interactions, they do not offer those impacted by AI systems any / AI Liability, AI Act, Human in the loop, Human-AI systems, AI harms, Liability law, fault based liability, strict liability, AI complexity, AI opacity",Beatriz Botero Arcila,2023,journalArticle,ssrn,keep_queue
TSKXN5SS,The darkest mirror: how AI authority bias threatens individual agency and what architecture must do about it,"The dominant AI safety framework-""human in the loop""-assumes that humans positioned downstream of AI systems will catch what those systems get wrong. / The mechanism is authority bias: once an AI system achieves authority status, anchoring, automation bias, and confirmation bias systematically suppress / AI safety, automation bias, authority bias, human oversight, RLHF, Boyd OODA, AI governance, human-AI decision-making, epistemic honesty, architectural / AI design",Rafael Maryahin,2026,journalArticle,ssrn,keep_queue
WLH95BHX,Lethal autonomous weapon systems and automation bias,"To this end, placing them under meaningful human control emerges as an important political and legal objective. / First observed in other industries of civilian nature like aviation or health, automation bias has the potential to negate most if not all of supervision / Lethal Autonomous Weapon Systems, Killer Robots, International Humanitarian Law, Meaningful Human Control, Automation Bias",Gokhan Guneysu,2025,journalArticle,ssrn,maybe_queue
W45LQPBM,The harm blindness framework: a practical application methodology for stakeholder harm prevention in technology development,"motivation-agnostic design addresses a significant limitation of existing ethical frameworks, which typically require ethical commitment as a precondition for adoption / stakeholder analysis, harm prevention, technology ethics, risk management, AI governance, development methodology",Travis Gilly,2026,journalArticle,ssrn,keep_queue
S975LMQ9,Artificial intelligence and criminal justice: predictive policing and due process,"Artificial Intelligence, Predictive Policing, Due Process, Criminal Justice, Constitutional Law, Human Rights, Algorithmic Accountability, Legal Framework",Hassan Khalid Ranjha,2025,journalArticle,ssrn,maybe_queue
WF5KK298,Monetary policy tech: a primer to novel techniques for monetary policy analysis and business processes,"Most, but not all of these developments are related to artificial intelligence (AI), including machine learning (ML). / While AI and ML tools offer significant potential benefits, we emphasize the importance of human oversight and governance to ensure the reliability and / Monetary policy, Central Banking, Artificial Intelligence, Large Language Models. JEL codes: E52, C53, C45, C55, D83",Maximilian Freier; Douglas Araujo,2025,journalArticle,ssrn,maybe_queue
MFKY7QMT,Advancing secure and standard source code generation techniques,"The rise of ChatGPT and GitHub Copilot has sparked a surge in developers leveraging large language models (LLMs) for code generation, aiming to automate software development processes. However, these tools can generate substandard and vulnerable code. Notably, a significant portion of developers in the US embrace LLMs due to productivity boost. However, research indicates that LLM-generated code may compromise security, with users often overestimating its reliability. To address these challenges, this proposal aims to enhance the quality and security of generated code in outputs. The proposal includes an empirical study of code generation models' training sets and benchmarks for code and security smells. It also consists of a framework, SALLM, to automatically benchmark code generation models from the security perspective. This proposal is a work in progress in creating quality datasets to reinforce the code generation model and generate standard and secure code. By establishing trust in LLM-based tools and generating secure and standard code, developers can confidently integrate them into their workflows and rely on them.",M. L. Siddiq,2025,conferencePaper,ieee,keep_queue
LW97CFN3,Implementing article 9 of the EU AI act,The EU's AI Act introduces various 'essential requirements' which providers of 'high-risk AI systems' must comply with before their AI system can be placed / Although safety risk management systems are well established under the EU's 'New Approach' to product safety (to which the AI Act also belongs) extending,Karen Yeung,2025,journalArticle,ssrn,keep_queue
KNSA4Q3I,Towards streamlining auditing for compliance with requirements in open-source software at nasa,"generated records are analyzed using a repository mining software tool to quantify process compliance.Method: We perform a case study in the NASA-funded Copilot / We define four software compliance metrics based on the Copilot's requirements, and analyze their impact on source code quality.Results: Our work / mining-software-repositories, software-process, code-quality",Carlos Paradis; Ivan Perez Dominguez; Misty Davies,2023,journalArticle,ssrn,maybe_queue
QXTPQ4UL,"Copyright thickness, thinness, and a mannion test for images produced by generative artificial intelligence applications","As for other areas of nexus between generative AI and copyright, existing law is largely adequate to properly deny copyright protection to the outputs / of generative AI. / Copyright, artificial intelligence, authorship, originality",Molly Stech,2024,journalArticle,ssrn,maybe_queue
399HN438,Turbocharging pull request reviews: exploring generative AI for code review,"This paper examines the application of generative AI in automating pull request (PR) reviews, focusing on large-scale pre-trained models . The study highlights the potential of AI-driven tools to generate comprehensive PR descriptions, identify code issues, and enhance developer productivity . Early results indicate that these tools, such as CodeEvaluator, can streamline the review process, reducing the time spent on routine tasks and improving the consistency of code quality checks . Despite the benefits, challenges such as the accuracy of AI-generated content and the necessity for human oversight are discussed, emphasizing the need for balanced integration of AI in software development workflows. © The Author(s), under exclusive license to Springer Nature Switzerland AG 2025.",Dutta; Sharma; Rajgor; Sharma A.; Rani R.,2025,conferencePaper,,keep_queue
AYGMC9Y4,"Analyzing the impact of prompt engineering on efficiency, code quality, and security in CRUD application development","This research evaluates the capabilities of Large Language Models (LLMs) in generating CRUD applications using Python Flask framework, focusing on code quality, security, and UI design. The study analyzes five prominent LLMs: Claude 3.5 Sonnet, Gemini, GitHub Copilot, GPT-4, and Perplexity, through automated static code review tools including Code Factor, Codacy, and Code Scene. The evaluation reveals consistently high performance across models, with GitHub Copilot and Gemini achieving superior code health metrics (9.5-10.0) and 100% green code ratings. While all models maintained Grade A ratings in Code Factor, common security vulnerabilities, particularly in Flask debug mode configuration, persisted across implementations. UI evaluation through professional interviews indicated that while generated interfaces were functionally complete, they lagged behind human-designed UIs in aesthetic appeal. The research demonstrates that LLMs can automate 60-90% of CRUD development tasks, though human intervention remains essential for environment setup and security configuration. The findings suggest a shift toward human-AI hybrid development approaches, where entry-level developers can effectively manage LLM-generated code while focusing on strategic implementation decisions.",K. A. Ashen Shanuka; J. Wijayanayake; K. Vidanage,2025,conferencePaper,ieee,keep_queue
