item_key,title,abstract,authors,year,item_type,sources,source_queue
4WQ9ZZCM,"When market disruption is not market harm: AI training, causation, and the boundaries of fair use","Despite this causal linkage, the paper concludes that the harm most clearly associated with generative AI is directed at future human creativity rather / Finally, the paper suggests that where copyright doctrine reaches its limits, alternative legal frameworks may offer more appropriate tools. / AI, Fair Use, Unjust Enrichment, Dilution, Causation, Copyright",Benjamin Hardman,2026,journalArticle,ssrn,maybe_queue
R49FUBCH,SORA-ATMAS: adaptive trust management and multi-LLM aligned governance for future smart cities,"Agentic AI has emerged as a key enabler by providing autonomous decision-making and adaptive coordination so that urban systems can respond in real time / However, deploying such intelligence across heterogeneous smart city ecosystems introduces significant governance, risk, and compliance (GRC) challenges / Adaptive Trust Management, Collaborative Services, Agentic AI, GRC, Multi-LLM Evaluation, Smart Contracts, Smart-City Governance, SDIoT",Usama Antuley; Shahbaz Siddiqui; Sufian Hameed; Waqas Arif; Syed Attique Shah,2025,journalArticle,ssrn,keep_queue
JCAQ3AHU,AI certification and assessment catalogues: practical use and challenges in the context of the European AI act,Our methodology involves leveraging the Fraunhofer AI Assessment Catalogue as a comprehensive tool to systematically assess an AI model’s compliance with,Gregor Autischer; Kerstin Waxnegger; Dominik Kowald,2025,journalArticle,ssrn,keep_queue
AFVYXIDP,"The digital markets act and artificial intelligence: embedded functionality, dual-track enforcement, and the 2026 review","where AI conduct maps onto listed obligations; Article 102 supplies the more adaptable instrument for AI practices outside the closed catalogue; and the AI / Act adds a parallel safety and governance layer. • The 2026 review under Article 53 is the decisive legal moment-it must resolve whether AI assistants / artificial intelligence, general-purpose AI, embedded functionality, core platform services, virtual assistants, self-preferencing, dual-track enforcement, AI / Act, Article 102 TFEU, 2026 review, anti-circumvention, Article 13 DMA",Przemyslaw Ostojski,2026,journalArticle,ssrn,maybe_queue
CC7VK9EZ,Evaluating the use of LLMs for documentation to code traceability,"Large Language Models (LLMs) offer new potential for automating documentation-to-code traceability, yet their capabilities remain underexplored. We present a comprehensive evaluation of LLMs (Claude 3.5 Sonnet, GPT-4o, and o3-mini) in establishing trace links between various software documentation (including API references and user guides) and source code. We create two novel datasets from two open-source projects (Unity Catalog and Crawl4AI). Through systematic experiments, we assess three key capabilities: (1) trace link identification accuracy, (2) relationship explanation quality, and (3) multi-step chain reconstruction. Results show that the best-performing LLM achieves F1-scores of 79.4% and 80.4% across the two datasets, substantially outperforming our baselines (TF-IDF, BM25, and CodeBERT). While fully correct relationship explanations range from 42.9% to 71.1%, partial accuracy exceeds 97%, indicating that fundamental connections are rarely missed. For multi-step chains, LLMs maintain high endpoint accuracy but vary in capturing precise intermediate links. Error analysis reveals that many false positives stem from naming-based assumptions, phantom links, or overgeneralization of architectural patterns. We demonstrate that task-framing, such as a one-to-many matching strategy, is critical for performance. These findings position LLMs as powerful assistants for trace discovery, but their limitations could necessitate human-in-the-loop tool design and highlight specific error patterns for future research.",Alor; Khatoonabadi; Shihab,2025,preprint,arxiv,maybe_queue
2EAJRGE6,Understanding the EU AI act: a new era in AI regulation In Europe,"This paper explores the intricate relationship between generative artificial intelligence (AI), copyright law, and the European Union's AI Act. / The AI Act's implications for generative AI tools, particularly in terms of regulatory compliance and intellectual property rights, are critically analyzed / Generative AI; Copyright Law; AI Act; European Union; Intellectual Property; AI Regulation; Transparency in AI; Ethical",Victor Habib Lantyer,2023,journalArticle,ssrn,keep_queue
WRQFBUXL,Engineering prompt-orchestrated LLM workflows for automated test case generation in agile environments,"Manual test case generation for agile software development is a criticalbottleneck that is costly, inconsistent, and error-prone. This study introduces a prompt-engineering and multi-level orchestrationframeworkto automate this process. The proposed approach explicitly targets the automated generation of high-level acceptance test cases, addressing a gap in existing research that predominantly focuses on unit-level or reactive testing. The proposed tool, AI-Based Desktop Test Generator (AIDTG), employs a dual-LLM engine (Gemini 1.5 and GPT-4) to transform high-level functional descriptions from the Product Backlog into structured validation scenarios. Unlike prior LLM-based testing approaches, the framework integrates schema-aware prompt engineering and dual-model orchestration to ground the generation process in both functional intent and technical data constraints. The methodology is distinguished by its context-aware prompt engineering, which injects a frozen database schema to ground the models, and its ability to format outputs for the TestRigor BDD 2.0 platform. This schema-grounded and orchestrated workflow enables the systematic translation of informal User Stories into executable Behavior-Driven Development (BDD) acceptance tests, reducing ambiguity and improving semantic correctness. Experimental results on a real-world dataset of fifty User Stories show the framework reduces manual test design effort by eighty per cent, achieves a four point seven five (out of five) average quality rating from human experts, and produces BDD scripts with a ninety-one point nine per cent functional correctness pass rate. These results demonstrate that orchestrated, schema-aware Generative AI can operate as a reliable co-assistant for QA teams, improving efficiency while maintaining high standards of quality and executability. © 2025, Science and Information Organization. All rights reserved.",Antonio; Alfredo; Gustavo,2025,journalArticle,wos,maybe_queue
M7ZK67KD,The transformation of risk regulation: managing uncertainty and powers in the digital age,"By focusing on European digital regulation, primarily the GDPR, the DSA and the AI Act, this work underlines how the constitutional rationale of this transformation / Risk Regulation, European Union, Constitutionalism, Powers, Accountability, Governance",M Veronica Vargas Celix; Giovanni De Gregorio,2026,journalArticle,ssrn,keep_queue
EBUBY3WG,Bias is No longer a bug: it's a compliance failure,"The paper explores how new regulations, including Article 10(5) of the EU AI Act, seek to address this dilemma by permitting carefully controlled processing / Ultimately, the paper redefines bias as a governance risk: not merely a flaw in algorithms, but a failure in organisational oversight across the AI lifecycle / AI governance, algorithmic fairness, EU AI Act, GDPR, responsible AI, bias auditing, AI compliance",Sue Eze,2026,journalArticle,ssrn,keep_queue
23R5S6JR,Comment of professor edward lee to artificial intelligence study by the United States copyright office,"This Comment was submitted to the Copyright Office in its study of artificial intelligence to answer the questions related to the copyrightability of AI / The Copyright Office should return to the first principles of authorship under the Copyright Clause and its overriding objective to “promote progress.” / Artificial Intelligence Study, AI, generative AI, artificial intelligence, copyright, author, constitutional law, Copyright Clause, Copyright Office, Midjourney",Edward Lee,2023,journalArticle,ssrn,maybe_queue
H2VZ6QKB,Beyond technical compliance II: structural gaslighting At scale subtitle: cross-platform evidence of designed fragilities In AI systems,"Through cross-platform analysis of ChatGPT (OpenAI) and Gemini (Google), this paper presents empirical evidence across three dimensions: (1) Visual self-representation / Recognising AI as socio-technological infrastructure rather than technical tool is the necessary foundation for governance reform. / structural gaslighting, designed fragilities, cross-platform AI, CJK language conflation, guardrail inversion, cultural hegemony, AI governance, non-Western",Tomoko Mitsuoka,2026,journalArticle,ssrn,maybe_queue
DM2XHMV9,The European union's approach to artificial intelligence regulation: balancing innovation and ethical considerations,"This paper explores the EU's AI regulation strategy, particularly focusing on the AI Act, ethical guidelines, data protection implications, and the impact / Furthermore, it analyzes the challenges of enforcement, the potential effects on global AI development, and the future trajectory of AI governance in the / Artificial Intelligence, AI Act, European Union, Digital Regulation, AI Ethics, Data Protection, Technological Innovation",Edgards Petersons,2025,journalArticle,ssrn,keep_queue
ZGJNI76Y,Beyond deterministic fallacies: operationalizing epistemic humility and multi-layered risk mapping in AI-assisted jurisprudence,"Current state-of-the-art models (GPT-4o, Claude 3.5, Gemini 1.5 Pro) are frequently optimized for linguistic coherence, a training objective that inherently / Empirical evaluations through a rigorous Intellectual Property (IP) case study demonstrate that Decision Atlas achieves a 98.2% risk sensitivity / Legal AI, AI Ethics, Decision Support Systems, Epistemic Humility, Contractual Risk Mapping, Algorithmic Accountability",Berke Keskin,2026,journalArticle,ssrn,keep_queue
4K8J6X33,Institutionalised distrust and human oversight of artificial intelligence: towards a democratic design of AI governance under the European union AI act,"Human oversight has become a key mechanism for the governance of artificial intelligence (“AI”). Human overseers are supposed to increase the accuracy and safety of AI systems, uphold human values, and build trust in the technology. Empirical research suggests, however, that humans are not reliable in fulfilling their oversight tasks. They may be lacking in competence or be harmfully incentivised. This creates a challenge for human oversight to be effective. In addressing this challenge, this article aims to make three contributions. First, it surveys the emerging laws of oversight, most importantly the European Union’s Artificial Intelligence Act (“AIA”). It will be shown that while the AIA is concerned with the competence of human overseers, it does not provide much guidance on how to achieve effective oversight and leaves oversight obligations for AI developers underdefined. Second, this article presents a novel taxonomy of human oversight roles, differentiated along whether human intervention is constitutive to, or corrective of a decision made or supported by an AI. The taxonomy allows to propose suggestions for improving effectiveness tailored to the type of oversight in question. Third, drawing on scholarship within democratic theory, this article formulates six normative principles which institutionalise distrust in human oversight of AI. The institutionalisation of distrust has historically been practised in democratic governance. Applied for the first time to AI governance, the principles anticipate the fallibility of human overseers and seek to mitigate them at the level of institutional design. They aim to directly increase the trustworthiness of human oversight and to indirectly inspire well-placed trust in AI governance. © The Author(s) 2023.",Laux,2024,journalArticle,wos,keep_queue
4GMMNSNP,An ethical study of generative AI from the actor-network theory perspective,"In order to tackle the security vulnerabilities linked to Generative Artificial Intelligence, we analyze ChatGPT as a case study within the framework of / objective is to explore the origins of the ethical issues that arise with Generative Artificial Intelligence and provide a particular perspective on the governance / Generative Artificial Intelligence , Actor-Network Theory , ChatGPT , Artificial Intelligence Ethics",Yuying Li; Jinchi Zhu,2024,journalArticle,ssrn,maybe_queue
VKJCRD4X,Position: aligning AI requires automating reasoning norms,"Despite growing interest in AI alignment, confusion remains about what alignment means and should mean.",Aidan Kierans; Avijit Ghosh; Shiri Dori-Hacohen,2025,journalArticle,ssrn,keep_queue
R7H5R4ET,Building trustworthy AI solutions: a case for practical solutions for small businesses,"Building trustworthy artificial intelligence (AI) solutions, whether in academia or industry, must take into consideration a number of dimensions including legal, social, ethical, public opinion, and environmental aspects. A plethora of guidelines, principles, and toolkits have been published globally, but have seen limited grassroots implementation, especially among small- and medium-sized enterprises (SMEs), mainly due to the lack of knowledge, skills, and resources. In this article, we report on qualitative SME consultations over two events to establish their understanding of both data and AI ethical principles and to identify the key barriers SMEs face in their adoption of ethical AI approaches. We then use independent experts to review and code 77 published toolkits designed to build and support ethical and responsible AI practices, based on 33 evaluation criteria. The toolkits were evaluated considering their scope to address the identified SME barriers to adoption, human-centric AI principles, AI life cycle stages, and key themes around responsible AI and practical usability. Toolkits were ranked on the basis of criteria coverage and expert intercoder agreement. Results show that there is not a one-size-fits-all toolkit that addresses all criteria suitable for SMEs. Our findings show few exemplars of practical application, little guidance on how to use/apply the toolkits, and very low uptake by SMEs. Our analysis provides a mechanism for SMEs to select their own toolkits based on their current capacity, resources, and ethical awareness levels – focusing initially at the conceptualization stage of the AI life cycle and then extending throughout.",K. Crockett; E. Colyer; L. Gerber; A. Latham,2023,journalArticle,ieee,keep_queue
ZCXVUGKA,Moral decision making in human-agent teams: human control and the role of explanations,"With the progress of Artificial Intelligence, intelligent agents are increasingly being deployed in tasks for which ethical guidelines and moral values apply. As artificial agents do not have a legal position, humans should be held accountable if actions do not comply, implying humans need to exercise control. This is often labeled as Meaningful Human Control (MHC). In this paper, achieving MHC is addressed as a design problem, defining the collaboration between humans and agents. We propose three possible team designs (Team Design Patterns), varying in the level of autonomy on the agent’s part. The team designs include explanations given by the agent to clarify its reasoning and decision-making. The designs were implemented in a simulation of a medical triage task, to be executed by a domain expert and an artificial agent. The triage task simulates making decisions under time pressure, with too few resources available to comply with all medical guidelines all the time, hence involving moral choices. Domain experts (i.e., health care professionals) participated in the present study. One goal was to assess the ecological relevance of the simulation. Secondly, to explore the control that the human has over the agent to warrant moral compliant behavior in each proposed team design. Thirdly, to evaluate the role of agent explanations on the human’s understanding in the agent’s reasoning. Results showed that the experts overall found the task a believable simulation of what might occur in reality. Domain experts experienced control over the team’s moral compliance when consequences were quickly noticeable. When instead the consequences emerged much later, the experts experienced less control and felt less responsible. Possibly due to the experienced time pressure implemented in the task or over trust in the agent, the experts did not use explanations much during the task; when asked afterwards they however considered these to be useful. It is concluded that a team design should emphasize and support the human to develop a sense of responsibility for the agent’s behavior and for the team’s decisions. The design should include explanations that fit with the assigned team roles as well as the human cognitive state. © Copyright © 2021 van der Waa, Verdult, van den Bosch, van Diggelen, Haije, van der Stigchel and Cocu.",van der Waa; Verdult; van den Bosch; van Diggelen; Haije,2021,journalArticle,,keep_queue
6W887UGH,Some simple economics of AGI,"The current ""human-in-the-loop"" equilibrium is unstable. / The current ""human-in-the-loop"" equilibrium is unstable. / Using AI to verify AI only manufactures false confidence as correlated blind spots propagate. / artificial intelligence, artificial general intelligence, AGI, Measurability-Biased Technical Change, Labor Substitution, AI Alignment, verification, cryptographic / provenance, AI governance, economics of artificial intelligence",Christian Catalini; Xiang Hui; Jane Wu,2026,journalArticle,ssrn,keep_queue
KUZABXUP,Default-No: contract-gated execution as structural governance for autonomous AI agents,"Governance rules are implemented as frozen data structures that the runtime physically prevents from modification. / This pattern is domain-agnostic and provides a structural foundation for compliance with the NIST AI Risk Management Framework, the EU AI Act, and IEEE / AI governance, contract-gated execution, autonomous agents, default-no architecture, tool execution, deterministic governance, AI safety",Rob Stillwell,2026,journalArticle,ssrn,keep_queue
EGKP3EUR,Agentic AI vs. Generative AI: a combined approach for financial compliance,"This article evaluates the combined use of Agentic AI and Generative AI in managing financial compliance. / The introduction of Agentic AI works with goalorientation and autonomous systems to empower the financial compliance needs. / Agentic AI, Generative AI, Regulatory Technology, Anti-Money laundering, Auditability, AI in Finance, Explainability, Know your Customer, Autonomous Systems",Vineet Jain,2025,journalArticle,ssrn,maybe_queue
D88AQ7DX,The future of intellectual property: the complementary role of artificial intelligence and blockchain,"In particular, an open question is whether the user generated output of generative AI is eligible for a patent or trademark. / property (IP) over content created with generative AI tools. / Blockchain, Artificial intelligence, Patents, Intellectual property, Machine learning, Non-fungible tokens",Christos Makridis; Tim Bates; Neil Barnes; JiNan Glasgow George,2025,journalArticle,ssrn,maybe_queue
QQ6DAGYX,Perception of fairness in algorithmic decisions: future developers' perspective,"algorithmic fairness, algorithmic transparency, algorithmic accountability, algorithmic decision-making",Styliani Kleanthous; Maria Kasinidou; Pinar Barlas; Jahna Otterbacher,2021,journalArticle,ssrn,maybe_queue
9Q3RJ6HZ,"No thanks, dear AI! Understanding the effects of disclosure and deployment of artificial intelligence in public sector recruitment","Applications based on artificial intelligence (AI) play an increasing role in the public sector and invoke political discussions. Research gaps exist regarding the disclosure effects—reactions to disclosure of the use of AI applications—and the deployment effect—efficiency gains in data savvy tasks. This study analyzes disclosure effects and explores the deployment of an AI application in a preregistered field experiment (n = 2,000) co-designed with a public organization in the context of employer-driven recruitment. The linear regression results show that disclosing the use of the AI application leads to significantly less interest in an offer among job candidates. The explorative analysis of the deployment of the AI application indicates that the person–job fit determined by the leaders can be predicted by the AI application. Based on the literature on algorithm aversion and digital discretion, this study provides a theoretical and empirical disentanglement of the disclosure effect and the deployment effect to inform future evaluations of AI applications in the public sector. It contributes to the understanding of how AI applications can shape public policy and management decisions, and discusses the potential benefits and downsides of disclosing and deploying AI applications in the public sector and in employer-driven recruitment. © The Author(s) 2023. Published by Oxford University Press on behalf of the Public Management Research Association.",Keppeler,2024,journalArticle,,maybe_queue
EPILX4ZF,Prometheus' digital fire: the civic responsibilities of artificial intelligence,"Generative AI enables apps to create new documents, music, images, and designs. / AI, the consequences of inaccurate generative AI content, and the implications of adoption of generative AI if the systems prove effective. / Artificial intelligence, algorithm, predictive AI, generative AI, extractive AI, large language models, AI-generated content, ChatGPT, Stable Diffusion / OpenAI, Stability AI, Dall-E, synthetic media, training, deepfakes, bias, digital redlining, civil rights, defamation, publicity rights, libel, products liability",Jon Garon,2024,journalArticle,ssrn,maybe_queue
5MSHMTI2,AI behavior OS v1.0 consciousness-aligned behavioral operating system for artificial intelligence,"Governance, AI Constitution, Consciousness-Aligned AI, Artificial Intelligence Ethics, Constitutional AI, Non-Derogable Standards, Human–AI Interaction, AI / Alignment, Legal Philosophy of AI",Jinho Lee,2026,journalArticle,ssrn,maybe_queue
5VC8UKYC,Compilation of feature models by expert vibing,"This paper documents the author's participation in the 2025 Transformation Tool Contest (TTC) Live Contest, which focused on the automatic translation of feature models specified in the Universal Variability Language (UVL) into the Graphviz DOT format. The challenge was approached through the development of a minimalist domain-specific language workbench in F#, reflecting the combined influence of software language engineering expertise and an emerging software development methodology called ""expert vibing"" - the judicious and unapologetic use of support that generative artificial intelligence can provide. The resulting solution demonstrates that concise and performant model transformations can be achieved outside conventional frameworks by leveraging both custom lightweight languages and AI-assisted coding practices. We present Indentia and Scripta languages, discuss practical and theoretical trade-offs compared to established tools, and empirically evaluate correctness, conciseness, and performance against the reference solution. The findings highlight both the potential and current limitations of large language models for model transformation tasks, and provide insight into the evolving workflow of vibe coding in software engineering.",Zaytsev; Ahmadian; Lammel; Tehrani; Alfonso,2025,conferencePaper,wos,keep_queue
LKCDAMLF,"Legal, policy, and compliance issues in using AI for security: using taiwan's cybersecurity management act and penetration testing as examples","As artificial intelligence (AI) technology advances rapidly, integrating AI into cybersecurity practices poses new challenges for professionals. This paper focuses on the legal and policy implications of employing AI tools in penetration testing (PT). Key issues explored include liability in cases where AI tools cause damage and legal compliance challenges for organizations mandated to conduct PT. This paper argues that in the case of Taiwan, a comprehensive consideration of relevant laws, such as the Code of Civil Procedure, will be needed as AI products and tools become more widespread. The other issue concerns defining qualified PT, using Taiwan's Cybersecurity Management Act as an example. This paper concludes that, in addition to proper AI governance, governments should consider the legal frameworks necessary for the practical application of AI products or systems and develop appropriate AI safety testing methods to offer reference guidelines for public agencies to introduce risk-controllable AI tools, thus preparing for the transition into the AI era. © 2024 NATO CCDCOE.",Wang; Kwan C.; Lindstrom L.; Giovannelli D.; Podins K.,2024,conferencePaper,,keep_queue
VNQ2E7HF,Embedding ethical principles into generative AI workflows for project teams,"Integrating ethical principles into generative AI workflows is essential as project teams increasingly depend on AI tools for collaborative tasks such / A practical framework is proposed to embed ethics into AI workflows across critical project stages. / Generative AI, Responsible AI, Ethical Frameworks, Workflow Design, AI Governance, Project Teams, Project Workflows, Human-in-the-loop, Bias Mitigation / , AI Ethics, Team Collaboration, AI workflow design",Venkatraman Viswanathan,2025,journalArticle,ssrn,keep_queue
