item_key,title,abstract,authors,year,item_type,sources,source_queue
P6RKQM33,The free content illusion,"Academics and other commentators widely argued that robust forms of intellectual property rights had been rendered largely obsolete in a digital environment / immunized platforms against liability for user infringement and consistently favored content aggregators over originators. / Copyright, Artificial Intelligence, Generative AI, Intellectual Property, Fair Use, DMCA",Jonathan Barnett,2025,journalArticle,ssrn,maybe_queue
EF7ITJ5S,Cognitive digital twins for smart cities: an agentic AI approach,"meaningful and policy-relevant emergent patterns, highlighting trade-offs between travel efficiency, energy consumption, and user utility under different governance",Elio Masciari; Enea Vincenzo Napolitano,2026,journalArticle,ssrn,maybe_queue
7AWJFRQ6,Forget me not: memorisation in generative sequence models trained on open source licensed code,"In some extreme cases, these ‘memories’ may contain verbatim and potentially infringing reproductions of works protected by copyright. / These reproductions have included not only functional code, but also original, expressive code plausibly protected by copyright. / generative AI, memorisation, copyright, open source, text and data mining, artificial intelligence, machine learning",Ivo Emanuilov; Thomas Margoni,2024,journalArticle,ssrn,keep_queue
5R7EHXXM,ChatGPT for coding: user insights and challenges in program generation,"This research delves into the impact of AI code generation tools, focusing on ChatGPT, programmers, and developers. Through interviews with 32 participants from diverse programming backgrounds, the study explores various aspects such as experience levels, language preferences, task complexities, completion speeds, prompt usage, output quality, ease of use, benefits, challenges, user scenarios, and feedback. The findings highlight a notable engagement with AI tools, particularly among those with several months of experience. Python emerges as the most used language alongside ChatGPT. While AI tools excel in more straightforward tasks and offer quick responses, challenges arise in complex coding scenarios where correctness may be compromised. Frequent prompts are favored for accuracy, yet output quality varies based on query clarity. Overall, AI tools are perceived as user-friendly, though complexities exist. Users appreciate their efficiency but caution against overreliance, especially for beginners. Recommendations include continuous enhancement for handling complex tasks. This study provides valuable insights for integrating AI tools into programming workflows responsibly.",M. A. Talib; A. M. Bettayeb; A. Z. Sobhe Altayasinah; F. Dakalbab,2025,conferencePaper,ieee|scopus,keep_queue
V9BVZXU5,"Unbundling 17 U.S.C. §1202: construing the law's scope in light of its text, purpose, and remedies","Statutory damages available for §1202 violations far exceed those available for actual copyright infringement. / Copyright infringement need not be alleged, let alone found, for liability under §1202 to attach. / copyright law, generative AI, DMCA, section 1202, copyright management information, CMI, identicality, statutory damages, Doe v. GitHub",Pamela Samuelson; Erik Stallman; Jennifer M. Urban,2025,journalArticle,ssrn,maybe_queue
WQE84Z3C,"The algorithmic invisible hand: friction, trust, and the repricing of human capital in the agent economy","This paper argues that the emergence of Agentic AI, symbolically dated from the public release of ChatGPT in November 2022, constitutes a qualitative rupture / reconceptualization of human cognitive latency not as market inefficiency, but as a systemic damping mechanism whose removal increases volatility and collapse risk",Ali Sadhik Shaik,2026,journalArticle,ssrn,maybe_queue
48A4LRHQ,Artificial intelligence act: a policy prototyping experiment: operationalizing the requirements for AI systems – part I,"This report presents the findings and recommendations of the first part of the Open Loop’s policy prototyping program on the European Artificial Intelligence / Therefore, it is important to ensure that the future workforce contains enough qualified workers, in particular when it comes to human oversight of AI / Artificial Intelligence, European Union, AI companies, Artificial Intelligence Act, AI Act, AI governance, AI regulation, policy prototyping, regulatory / sandboxes, risk assessment, AI transparency, AI risk management, human oversight, AI standards, experimental regulation, data quality",Norberto Nuno Gomes de Andrade; Antonella Zarra,2023,journalArticle,ssrn,keep_queue
95JDBG8F,Designing incident reporting systems for harms from general-purpose AI,"AI incidents, AI governance, AI policy, AI regulation, Incident reporting, AI safety, Information sharing",Kevin Wei; Lennart Heim,2025,journalArticle,ssrn,maybe_queue
BAWCBT9R,Bias in the loop: auditing LLM-as-a-judge for software engineering,"Large Language Models are increasingly used as judges to evaluate code artifacts when exhaustive human review or executable test coverage is unavailable. LLM-judge is increasingly relevant in agentic software engineering workflows, where it can help rank candidate solutions and guide patch selection. While attractive for scale, current practice lacks a principled account of reliability and bias: repeated evaluations of the same case can disagree; small prompt edits can swing outcomes; and seemingly semantics-preserving, human-equivalent perturbations may elicit divergent verdicts. This paper studies LLM-as-a-Judge for code through a measurement-first lens. We analyze two pointwise judging regimes across code generation, code repair task, and test generation, and we systematically probe prompt-induced biases. Our study considers difficulty levels for repeated runs and controlled prompt interventions that isolate one presentation cue at a time, and it evaluates judges using consistency and sensitivity to bias. We find that judge decisions are highly sensitive to prompt biases even when the underlying code snippet is unchanged. Across all three tasks, several biases systematically shift preferences toward the option favored by the prompt, improving accuracy when that option aligns with the gold answer but substantially reducing it otherwise. In some settings, these effects are large enough to change task-level conclusions and alter relative model rankings. These findings show that reported judge performance may reflect prompt artifacts rather than stable assessment ability, posing a direct threat to the validity and reproducibility of code evaluation. We therefore argue that LLM-as-a-Judge studies should report bias sensitivity alongside accuracy and incorporate explicit controls to support more trustworthy model comparison in software engineering.",Zhao; Esmaeili; Fard,2026,preprint,arxiv,keep_queue
3DPZK2P7,AI governance as safety management: a pre execution control architecture for AI safety and autonomous systems,"The architecture incorporates enforceable human oversight conditions, immutable audit records / The architecture incorporates enforceable human oversight conditions, immutable audit records / from passive oversight to active control. / AI governance, safety management systems, execution risk, pre-execution control, EU AI Act, NIST AI RMF, authorization architecture, human oversight, EU / AI Act",Dr. Bryan McCaa,2026,journalArticle,ssrn,keep_queue
PBF7LWPC,Cognitive policy engine: AI-driven policy-to-rule transformation for social benefit eligibility systems,"This paper introduces a Cognitive Policy Engine (CPE) that utilizes advanced AI technologies to automatically read and analyze social program policies / with human-in-the-loop governance. / Cognitive Policy Engine, Rules-as-Code, Eligibility Systems, Social Programs, Integrated Eligibility System (IES), AI-driven Policy Automation, Google",Kamini Sahu,2026,journalArticle,ssrn,maybe_queue
FIJA6GRP,Decisionalizing the problem of reliance on expert and machine evidence,"Machine evidence is broadly understood here as the result of computational approaches, with or without a human-in-the-loop, applied to the analysis and / The originality of this analysis lies in its divergence from mainstream approaches that rely on standard, aggregate performance metrics for expert and AI / machine evidence, AI output, normative decision structures, decision theory, fingerprints",Alex Biedermann; Timothy Lau,2025,journalArticle,ssrn,maybe_queue
PCWV493W,Toward agentic software project management: a vision and roadmap,"With the advent of agentic AI, Software Engineering is transforming to a new era dubbed Software Engineering 3.0. Software project management (SPM) must also evolve with such transformations to boost successful project completion, while keeping humans at the heart of it. Building on our preliminary ideas of ""agentic SPM"", and supporting literature, we present our vision of an ""Agentic Project Manager (PM)"" as a multi-agent system for SPM 3.0. They will work like a “junior project manager”, or an “intern project manager” collaboratively with software teams. We introduce four working modes, with varying autonomy levels to choose from, based on the SPM task. This addresses concerns with ethics, accountability, and trust related to agentic PMs. We also share insights on human PM role evolution and new skill requirements as a “strategic leader” and a “coach” for humans and agents. While creating the foundation for agentic SPM research, we present a research agenda for the wider research community.",Assalaarachchi; Masood; Hoda; Grundy,May ,conferencePaper,acm,keep_queue
9V2RFB2U,A study on the development of ethical guidelines for generative AI stakeholders,,이정환,2025,journalArticle,wos,maybe_queue
F8EA7L9L,"ZenoTrust™: the world’s first zero-knowledge AI compliance framework for edge-optimized, multi-regulatory governance a cryptographic architecture for privacy-preserving, auditable, AI compliance at scale","The platform delivers <25ms audit latency, 75% compliance cost savings, and tamper-proof cryptographic assurance, with full alignment to the EU AI Act / , NIST AI RMF, GDPR, and emerging global standards. / , EU AI Act, NIST AI Risk Management Framework, OECD AI Principles, GDPR Compliance, Responsible AI, Ethical AI Regulation, AI Regulation Enforcement, / China AI Regulation, Machine Learning Model Auditing, Secure Model Certification, Privacy-Preserving AI Governance, , AI Regulatory Architecture, Algorithmic",Rohan Sharma,2025,journalArticle,ssrn,maybe_queue
2NRJ4FXR,One developer is all you need: a case study of an AI-augmented one-person squad in a brownfield enterprise,"AI tools are enabling engineers to absorb roles previously distributed across cross-functional squads, yet there is little structured evidence on how to design or evaluate such a one-person squad in a regulated enterprise setting. Without that evidence, organizations adopting this model lack guidance on which design decisions make it viable and which conditions cause it to break down. We report a case study in which a single staff engineer, supported by four AI agents under a Spec-Driven Development workflow, delivered a brownfield product initiative scoped for a four-person squad in half the planned time, with 90\% acceptance of AI-generated code on first review, full integration test pass rates, and an above-85\% reduction in direct staffing cost. The results indicate that AI does not replace team members it multiplies the throughput of the experienced engineer who remains, making specification quality and institutional knowledge, not model capability, the binding constraints on one-person squad success.",Boas; Pinto; Monteiro; Carida; Ribeiro,2026,preprint,arxiv,keep_queue
BQ4JPKM7,"Return on AI: a decision framework for customers, firms, and society","Its numerator includes traditional sources of value-revenue lift, cost relief, and risk reduction, alongside dynamic mechanisms such as synergies, scale / Without disciplined thresholds and clear Go/No-Go criteria, firms risk mistaking hype for returns. / Artificial Intelligence, RoI, Digital Transformation, AI Risk Metrics, Normalization Lenses, Go/No-Go Criteria, Agentic AI, AGI, Societal RoAI",Adithya Pattabhiramaiah; Shrihari Sridhar; Vamsi Kanuri,2025,journalArticle,ssrn,maybe_queue
A6H77P8D,Understanding the impact of human oversight on discriminatory outcomes in AI-supported decision-making,"This large-scale study assesses the impact of human oversight on countering discrimination in AI-aided decision-making for sensitive tasks. / Human oversight does not prevent discrimination by the generic AI. Fair AI reduces gender bias but not nationality bias. / AI, bias, fairness, oversight, discrimination, artificial intelligence, decision support systems",Alexia Gaudeul; Ottla Arrigoni; Vicky Charisi; Marina Escobar-Planas; Isabelle Hupont,2025,journalArticle,ssrn,keep_queue
Y7ZWF7GT,How regulated financial institutions will tame agentic AI through architectural determinism,"This white paper introduces CRAGE (Context-Regulated Agentic Governance Engine), a novel reference architecture and operational framework that resolves / Engine), a compliance-native persistent memory architecture with tamper-evident decision ledgers and hallucination anchoring; the Context Compliance Manifest / AI, Deterministic Sandwich, Reasoning Augmented Retrieval, Agentic Memory, Context Engineering, Context Windows, Shadow Autonomy, Statelessness in AI, EU / AI Act, Memory Anchored Governance Engine, Hallucination Anchoring, Access Control for Agents, Attribute Based Access Control, Safe Deployment Architecture",Aman Mahapatra,2026,journalArticle,ssrn,maybe_queue
PQK3T4XZ,Is human oversight to AI systems still possible?,"The rapid proliferation of artificial intelligence (AI) systems across diverse domains raises critical questions about the feasibility of meaningful human oversight, particularly in high-stakes domains such as new biotechnology. As AI systems grow increasingly complex, opaque, and autonomous, ensuring responsible use becomes a formidable challenge. During our editorial work for the special issue “Artificial Intelligence for Life Sciences”, we placed increasing emphasis on the topic of “human oversight”. Consequently, in this editorial we briefly discuss the evolving role of human oversight in AI governance, focusing on the practical, technical, and ethical dimensions of maintaining control. It examines how the complexity of contemporary AI architectures, such as large-scale neural networks and generative AI applications, undermine human understanding and decision-making capabilities. Furthermore, it evaluates emerging approaches—such as explainable AI (XAI), human-in-the-loop systems, and regulatory frameworks—that aim to enable oversight while acknowledging their limitations. Through a comprehensive analysis, the picture emerged while complete oversight may no longer be viable in certain contexts, strategic interventions leveraging human-AI collaboration and trustworthy AI design principles can preserve accountability and safety. The discussion highlights the urgent need for interdisciplinary efforts to rethink oversight mechanisms in an era where AI may outpace human comprehension.",Holzinger; Zatloukal; Müller,2025,journalArticle,coursework,keep_queue
7H6W3SZU,From managerial cognition to hybrid intelligence reconceptualizing dynamic capabilities in the era of agentic AI,"This paper advances dynamic capabilities (DC) theory by updating its micro-foundations for the era of Agentic AI—autonomous systems that independently / Architectonic Cognition (AC) is defined as the managerial skill required for governance in such systems. / Dynamic capabilities, Agentic AI, Architectonic Cognition, Structural Liquidity, Algorithmic Governance",ANJANA DIKSHIT,2026,journalArticle,ssrn,maybe_queue
R2QMVNXI,Coding with AI: from a reflection on industrial practices to future computer science and software engineering education,"Recent advances in large language models (LLMs) have introduced new paradigms in software development, including vibe coding, AI-assisted coding, and agentic coding, fundamentally reshaping how software is designed, implemented, and maintained. Prior research has primarily examined AI-based coding at the individual level or in educational settings, leaving industrial practitioners' perspectives underexplored. This paper addresses this gap by investigating how LLM coding tools are used in professional practice, the associated concerns and risks, and the resulting transformations in development workflows, with particular attention to implications for computing education. We conducted a qualitative analysis of 57 curated YouTube videos published between late 2024 and 2025, capturing reflections and experiences shared by practitioners. Following a filtering and quality assessment process, the selected sources were analyzed to compare LLM-based and traditional programming, identify emerging risks, and characterize evolving workflows. Our findings reveal definitions of AI-based coding practices, notable productivity gains, and lowered barriers to entry. Practitioners also report a shift in development bottlenecks toward code review and concerns regarding code quality, maintainability, security vulnerabilities, ethical issues, erosion of foundational problem-solving skills, and insufficient preparation of entry-level engineers. Building on these insights, we discuss implications for computer science and software engineering education and argue for curricular shifts toward problem-solving, architectural thinking, code review, and early project-based learning that integrates LLM tools. This study offers an industry-grounded perspective on AI-based coding and provides guidance for aligning educational practices with rapidly evolving professional realities.",Chang; Shirazi; Cao; Mobasser,2025,preprint,arxiv,keep_queue
I42CBYKZ,"Deepfake threats and EU law: navigating disinformation, cyber violence, and the risks of digital manipulation 1","track, or to recreate a person's voice or face with lifelike subtlety. creating the illusion of staged actions by someone else. 3 Earlier versions of generative / AI required coding capabilities and technical proficiency; today, anyone with internet access is constrained only creativity is required. 4 The goal of / image-based sexual abuse, Deepfake, cyber harassment, EU policy on AI accountability, Disinformation",MARIAM MAKHNIASHVILI,2026,journalArticle,ssrn,maybe_queue
NAS4ZSWE,A modular code generation method for industrial automation systems based on large-language models,"This paper presents a three-stage approach for transforming industrial requirement documents into executable control models using large language models (LLMs). The method consists of component extraction, system behavior structuring, and execution flow construction, each guided by prompt-based LLM reasoning. Instead of generating code directly, the large language model produces a structured representation with components, operations, and assumption-guarantee pairs that define logical dependencies. This intermediate model supports human-in-the-loop correction and is translated into control code using rule-based mapping. A case study on a signal-driven production line shows the approach achieves over 90% accuracy across all modeling stages with minimal manual intervention, demonstrating its potential for safe and efficient industrial automation modeling. © 2025 IEEE.",Chu; Zhou; Zhang; Dai,2025,conferencePaper,wos,keep_queue
D5S6J3FF,The principle of governance relativity: frame-invariant AI governance across domains,"ai governance, ai safety, ai regulation, pre-execution governance, human authority verification, volitional verification, integrated governance architecture / , authorization integrity, behavioral divergence, governance architecture, recursive governance",Jonathan Lai,2026,journalArticle,ssrn,keep_queue
9SJ236JF,Cognitive technological intermediation (CTI): toward a new legal theory of artificial intelligence,"In the following pages, I delineate three generational stages-CTI 1.0 (Consultative AI), CTI 2.0 (Agentic AI), and CTI 3.0 (Multi-Agent Ecosystems)-to / Cognitive Technological Intermediation, Artificial Intelligence Law, Algorithmic Liability, Agentic AI, Multi-Agent Systems, Legal Theory, Comparative",Julio Tellez Valdes,2026,journalArticle,ssrn,keep_queue
BD83WAWV,"Risk, ambiguity, and infinity: behavioral signatures of modern large language models","behavioral economics, risk aversion, ambiguity aversion, uncertainty reasoning, persona intervention, financial automation, Large Language Models (LLMs), AI / Alignment, Decision-making under Uncertainty, AI Safety and Governance, Behavioral Signatures of AI, AI Behavior Evaluation, Financial Decision-Making",Mohammadreza Ghafouri; Nazanin Yousefi; Arian Akbari; Reza Tavakoli; Farbod Davoodi,2025,journalArticle,ssrn,keep_queue
KDHJ5VAA,ISO 37XXX draft: purpose-aligned governance for organizations. A pre-standard conceptual framework,"the framework positions organizational purpose—as defined by ownership—as the governing anchor for all decisions, delegations, and actions within an organization / The model introduces two core governance parameters that are frequently absent in existing standards: (1) positive outcomes an organization must achieve / Alignment, Delegation Parameters, Accountability, Organizational Purpose, Governance Drift, Purpose Hijacking, Parasitonomics, Enlightened Selfinterest, AI / Governance, Focus Governance, Governance Integrity, Ownership as Rightsholders, Organizational Systems",Albert Errington,2025,journalArticle,ssrn,maybe_queue
I2NZYEL4,Talkin' 'bout AI generation: copyright and the generative-AI supply chain (the short version),"“Does generative AI infringe copyright?” is an urgent question. It is also a difficult question, for two reasons. / Second, copyright law is notoriously complicated, and generative-AI systems manage to touch on a great many corners of it. / copyright, generative AI",Katherine Lee; A. Feder Cooper; James Grimmelmann,2024,journalArticle,ssrn,maybe_queue
427J7PFG,Data governance and compliance for GenAI in azure cloud platforms,"In general, the research finds that although Azure offers scalable and flexible solutions to GenAI governance, the organization should have well-organized / lessons can offer real-life tips to cloud designers, AI engineers, and compliance managers who want to implement GenAI in a responsible manner in the enterprise-scale / Generative AI, Azure Cloud, Data Governance, Compliance Frameworks, Cloud Security, Multi-Cloud Environments, AI Risk Management",Rahul Modi,2026,journalArticle,ssrn,keep_queue
SX4UKRCH,"ARTIFICIAL INTELLIGENCE IN ESG, SUSTAINABILITY REPORTING, AND GREENWASHING DETECTION a systematic literature review","Artificial Intelligence, ESG Reporting, Greenwashing Detection, Sustainable Finance, Machine Learning, Algorithmic Accountability, Corporate Governance",shirin shirin,2026,journalArticle,ssrn,maybe_queue
VV8YEIJV,: AI governance in the UK,"The UK has had a chequered and difficult history in determining its style of AI governance. / AI governance, AI regulation, UK law, EU AI Act, GDPR, copyright, soft law, pro-innovation",Lilian Edwards,2025,journalArticle,ssrn,keep_queue
DERTW8NL,"Agentic AI security: threats, defenses, evaluation, and open challenges","Agentic AI systems powered by Large Language Models (LLMs) and endowed with planning, tool use, memory, and autonomy are emerging as powerful and flexible platforms for automation. Their ability to autonomously execute tasks across web, software, and physical environments creates new and amplified security risks, distinct from both traditional AI safety and conventional software security. This survey outlines a taxonomy of threats specific to agentic AI, reviews recent benchmarks and evaluation methodologies, and discusses defense strategies from both technical and governance perspectives. We synthesize current research and highlight open challenges, aiming to support the development of secure-by-design agent systems.",A. Chhabra; S. Datta; S. K. Nahin; P. Mohapatra,2026,journalArticle,ieee,keep_queue
