item_key,title,abstract,authors,year,item_type,sources,source_queue
X3W5WKB5,Agentic AI and hallucinations,"accuracy concerns, implying that hallucination-sensitive sectors, such as law and medicine, endogenously lead to more serious verification efforts in agentic / AI markets. / Artificial Intelligence, Hallucination Risk, Large Language Models, Agentic AI",Engin Iyidogan; Ali I. Ozkes,2025,journalArticle,ssrn,keep_queue
JS854A62,Press publishers’ right and artificial intelligence,"Overall, human oversight and involvement is required, as in many situations conditions of protection and copyright exceptions are difficult to meet with / press publishers’ right, copyright and related rights, artificial intelligence, news industry, DSM Directive, InfoSoc Directive",Juha Vesala,2021,journalArticle,ssrn,maybe_queue
QMKQC7SC,LLMs corrupt your documents when you delegate,"Large Language Models (LLMs) are poised to disrupt knowledge work, with the emergence of delegated work as a new interaction paradigm (e.g., vibe coding). Delegation requires trust - the expectation that the LLM will faithfully execute the task without introducing errors into documents. We introduce DELEGATE-52 to study the readiness of AI systems in delegated workflows. DELEGATE-52 simulates long delegated workflows that require in-depth document editing across 52 professional domains, such as coding, crystallography, and music notation. Our large-scale experiment with 19 LLMs reveals that current models degrade documents during delegation: even frontier models (Gemini 3.1 Pro, Claude 4.6 Opus, GPT 5.4) corrupt an average of 25% of document content by the end of long workflows, with other models failing more severely. Additional experiments reveal that agentic tool use does not improve performance on DELEGATE-52, and that degradation severity is exacerbated by document size, length of interaction, or presence of distractor files. Our analysis shows that current LLMs are unreliable delegates: they introduce sparse but severe errors that silently corrupt documents, compounding over long interaction.",Laban; Schnabel; Neville,2026,preprint,arxiv,keep_queue
HK7SEYUU,Human factors considerations in satellite operations human-computer interaction technologies: a review of current applications and theory,"Circadian rhythms, crew resource management, and shift work dynamics may exacerbate complacency-driven automation bias and social loafing errors in satellite / The human-in-the-loop commonality enables human factors lessons to be passed to satellite operations from unrelated sectors to mitigate catastrophic human / Complacency, Human-in-the-Loop, Remotely Piloted Aircraft, Satellite Operations, Shift Work",David G. I. Heinrich,2021,journalArticle,ssrn,maybe_queue
R3M89VGJ,The rise of agentic AI: autonomous systems in a digitalized world,"Drawing on literature from AI ethics, robotics, platform economics, and governance studies, we identify key patterns in the rise of agentic AI, including / We propose a framework linking autonomy, adaptability, and accountability as the core pillars for sustainable agentic AI deployment. / Agentic AI, Autonomous Systems, Digitalization, Governance, Ethics, Platform Ecosystems, Automation",Ilze Balodis,2025,journalArticle,ssrn,keep_queue
US2VKS5W,Exploring the legal and ethical implications of copyright in the age of artificial intelligence,"In the rapidly evolving age of Artificial intelligence (AI), the convergence of technology and
copyright law, presents numerous intricate / In the rapidly evolving age of Artificial intelligence (AI), the convergence of technology and / copyright law, presents numerous intricate / This Project delves deep into the changing landscape of Copyright law as it concerns
and relates to Artificial Intelligence, focusing on / and relates to Artificial Intelligence, focusing on / Artificial Intelligence, Generative AI, ChatGPT, Copyright, Ethical, Copyright Law, Intellectual Property, Legal, Authorship, Attribution, Plagiarism,",,2025,journalArticle,ssrn,maybe_queue
G59P3GA2,Regulatory sandboxes: one decade on,"It is becoming increasingly clear that simply scaling up generative AI will not solve its limitations, just as it is becoming increasingly clear that generative / AI tools have significant negative impacts on privacy, intellectual property rights, and our environment (among other things).",Hilary J. Allen,2025,journalArticle,ssrn,keep_queue
D34TMC7P,"Artificial intelligence, unemployment and mental health: a legal framework for brazilian labor and data protection law","This article examines, from a constitutional and statutory perspective, the tensions raised by the diffusion of artificial intelligence (AI) in employment / It concludes that sound algorithmic governance-supported by prior impact assessments and meaningful human review-is a legal condition for AI to promote",Delfino Lagrotta Advocacia,2025,journalArticle,ssrn,maybe_queue
7VXQ4CPI,Towards a catalog of prompt patterns to enhance the discipline of prompt engineering,"The rapid advent of Large Language Models (LLMs), such as ChatGPT and Claude, is revolutionizing various fields, from education and healthcare to the engineering of reliable software systems. These LLMs operate through ""prompts,"" which are natural language inputs that users employ to query and leverage the models' capabilities. Given the novelty of LLMs, the understanding of how to effectively use prompts remains largely anecdotal, based on isolated use cases. This fragmented approach limits the reliability and utility of LLMs, especially when they are applied in mission-critical software environments. To harness the full potential of LLMs in such crucial contexts, therefore, we need a systematic, disciplined approach to ""prompt engineering"" that guides interactions with and evaluations of these LLMs.",Schmidt; Spencer-Smith; Fu; White,June,journalArticle,acm,maybe_queue
M6SUF8M6,From firewall to membrane: why agentic AI requires a new class of governance architecture,"governance and UUID-stamped audit documentation. / The paper applies the OSHA Hierarchy of Controls to classify Firewall governance as an Administrative Control and Membrane governance as an Engineering / agentic AI governance, constitutional AI architecture, AI safety frameworks, Governance API, AI decision-layer auditing, Membrane Architecture, Firewall",Paul Pantera,2026,journalArticle,ssrn,keep_queue
XKEY3YYF,Evaluating human-language model interaction,"Many real-world applications of language models (LMs), such as writing assistance and code autocomplete, involve human-LM interaction. However, most benchmarks are non-interactive in that a model produces output without human involvement. To evaluate human-LM interaction, we develop a new framework, Human-AI Language-based Interaction Evaluation (HALIE), that defines the components of interactive systems and dimensions to consider when designing evaluation metrics. Compared to standard, non-interactive evaluation, HALIE captures (i) the interactive process, not only the final output; (ii) the first-person subjective experience, not just a third-party assessment; and (iii) notions of preference beyond quality (e.g., enjoyment and ownership). We then design five tasks to cover different forms of interaction: social dialogue, question answering, crossword puzzles, summarization, and metaphor generation. With four state-of-the-art LMs (three variants of OpenAI's GPT-3 and AI21 Labs' Jurassic-1), we find that better non-interactive performance does not always translate to better human-LM interaction. In particular, we highlight three cases where the results from non-interactive and interactive metrics diverge and underscore the importance of human-LM interaction for LM evaluation.",Lee; Srivastava; Hardy; Thickstun; Durmus,2024,preprint,cao,keep_queue
6ZWQGJFT,Large language models as tax attorneys: a case study in legal capabilities emergence,"Artificial Intelligence, Large Language Models, Machine Learning, Natural Language Processing, Retrieval Augmented Generation, Computational Law, AI Alignment",John Nay; David Karamardian; Sarah B. Lawsky; Wenting Tao; Meghana Bhat,2023,journalArticle,ssrn,maybe_queue
