item_key,title,abstract,authors,year,item_type,sources,source_queue
GI4JQTJN,AI applications in auditing and IFRS compliance: a critical literature review,"This paper develops the first integrated, multi-level framework linking AI adoption mechanisms to IFRS-specific compliance outcomes across institutional / Future research should prioritize longitudinal empirical studies, AI governance frameworks, cross-jurisdictional IFRS compliance outcomes, and the institutional",Napoleon Tsougkas,2026,journalArticle,ssrn,maybe_queue
A9FX4UYP,Algorithmic obedience: how language models simulate command structure,"Case studies on ChatGPT, Claude, and Gemini illustrate the system-specific variations of obedience modulation. / epistemology, linguistic agency, computational linguistics, algorithmic discourse, algorithmic discourse, Artificial Intelligence and Law, Algorithmic Governance",Agustin V. Startari,2025,journalArticle,ssrn,maybe_queue
4UPHGE5T,Bridging the regulatory gap: nigeria's slow progress in AI and emerging technology governance and the urgent need to align with global best practices,"advancements in the twenty-first century, particularly the rise of Artificial Intelligence (AI) and emerging digital systems, have significantly transformed governance / It argues that proactive and harmonised AI regulation is essential for fostering innovation, protecting rights, and positioning Nigeria as a competitive",Timothy Kareem,2026,journalArticle,ssrn,keep_queue
WCAIMN5U,Exploring the generative AI adoption in service industry: a mixed-method analysis,"In the last few years, many service organisations have been exploring the use of Generative Artificial Intelligence (GAI) tools for their businesses and upgrading their existing processes. These tools have the potential and capability to transform the business world in various aspects. However, serval service organisations are facing many challenges while adopting the GAI tools in their organisations. In a similar context, this study explores the adoption of GAI barriers through two studies by a mixed-method approach. The first study is based on YouTube datasets of selected videos where GAI adoption challenges, problems, and barriers were discussed. Further, these YouTube datasets were analysed through text mining and empirical modelling techniques. In the second study, an extensive literature review was done and critical barriers to GAI adoption were identified based on the extensive literature review. Further, these barriers were analysed through three theoretical lenses and a hybrid fuzzy multicriteria decision-making approach. In addition, the results from the first study were further matched and verified with our second study. This establishes the relevance of adopting a mixed-method approach. Our major findings are: (i) trust, anticipation, and surprise emerged as the strongest emotions of the viewers who posted their comments on the YouTube videos; (ii) Five major barriers are revealed through topic analysis of YouTube transcripts and these are ethical, technological, regulations & policies, cost, and human resources; (iii) Six major barriers are identified through second study are privacy & security, return on investment, running cost, misuse, over-reliance, and Lack of digital infrastructure. © 2024 Elsevier Ltd",Gupta; Rathore,2024,journalArticle,,maybe_queue
WKTJDLSS,The right to compute,"Right to Compute, First Amendment, Artificial Intelligence, Freedom of thought, Generative AI, Prior restraint, code as speech, listener rights, medium / extended cognitive freedom, cognitive liberty, expressive infrastructure, permissionless, epistemic freedom, AI regulation, AI Governance, Algorithmic Accountability",Gregory S. McNeal,2025,journalArticle,ssrn,maybe_queue
JUYPVSIW,Who is using AI to code? Global diffusion and impact of generative AI,,Daniotti; Wachs; Feng; Neffke,2026,journalArticle,coursework,keep_queue
I3GEJ4AR,"Detecting AI memory poisoning from observable behavior: behavioral shadow inference, semantic intent decomposition, and three-tier agentic remediation","behavioral shadow inference, dual-encoder contrastive learning, learning flywheel, semantic threat intelligence, differential privacy, wavelet decomposition, EU / AI Act, FTC compliance, AI memory poisoning, agentic AI, adversarial attacks, large language models",Jamel Robinson,2026,journalArticle,ssrn,keep_queue
TE7B3DJG,Runtime-structured task decomposition for agentic coding systems,"Agentic coding systems increasingly use large language models (LLMs) for software engineering tasks such as debugging, root cause analysis, and code review. However, many existing systems encode task logic, execution flow, and output generation inside monolithic prompts. This design creates brittle behavior, limited debuggability, and high retry costs because failures often require rerunning the full workflow. We present runtime-structured task decomposition, an architectural approach in which task partitioning and execution flow are managed through executable control logic rather than prompt structure alone. LLMs are used only for focused judgment tasks, and outputs are validated against predefined schemas before downstream execution. We evaluate this approach on two software engineering workloads using three configurations: monolithic execution, static decomposition with fixed subtasks and no runtime branching, and runtime-structured decomposition. Each configuration was evaluated across 10 runs. Our results show that decomposition alone does not necessarily reduce retry cost. In the Kubernetes root cause analysis workload, the static decomposition baseline produced a retry cost of 1,632 +/- 145 tokens versus 904 +/- 17 tokens for the monolithic baseline because failures forced reruns of downstream subtasks. A similar pattern appeared in the multi-file debugging workload, where the static baseline consumed 933 tokens compared to 703 tokens for the monolithic system. The runtime-structured approach reran only failed subtasks, reducing retry costs to 436 +/- 132 tokens for root cause analysis and 460 tokens for debugging. Overall, the approach achieved up to 51.7% lower retry cost than monolithic systems and 73.2% lower retry cost than static decomposition baselines, improving efficiency, debuggability, and operational reliability in agentic coding systems.",Asthana; Zhang; DeLuca; Patel; Mahindru,2026,preprint,arxiv,maybe_queue
QN22SM9P,AI-driven credit intelligence: a human-in-the-loop framework for institutional credit decision systems,This paper presents a conceptual framework for AI-enabled Credit Intelligence Systems (CIS) grounded in institutional credit practices.,Gaurav Gupta,2026,journalArticle,ssrn,maybe_queue
VJYYX8ZW,The EU AI act As global artificial intelligence regulation,"This essay critically examines the European Union(“EU”) AI Act (the “EU AI Act” or “Act”) as a significant milestone in the realm of global artificial / Ultimately, the essay seeks to illuminate the broader implications of the EU AI Act in shaping the trajectory of AI technologies worldwide, while concurrently / Artificial intelligence, EU AI Act, AI, Risk-Based, Transparency, Accountability, Ethics, Innovation, Regulation, Fundamental Rights, Consumer Protection",Sean Musch; Michael Borrelli; Charles Kerrigan,2023,journalArticle,ssrn,keep_queue
UYN37V2Q,A review of AI copyright scholarship 1982-2025,"This annotated scholarly bibliography collects eighty-two essential works spanning four decades of scholarship on copyright and artificial intelligence / Its curator, a U.S. legal scholar of generative copyright, traces the field from 1980s roots, through the 2023 ChatGPT turning point / International & Comparative XVI, AI Governance & Adjacent Scholarship, Generative Empiricism, Empirical AI Research, Fair Use, Artificial Intelligence, Generative / AI, European Union, AI Act, GDPR, Originality, Authorship, EU Digital Single Market Directive, Prompting, Large Language Models, Chatgpt, Computer-Generated",Lea Bishop,2026,journalArticle,ssrn,maybe_queue
MKLQPBPB,The role of generative artificial intelligence in judicial decision-making process,"This paper explores the integration of generative AI, specifically ChatGPT, into judicial decision-making, highlighting both its transformative potential / By examining these aspects, this study advocates for a hybrid judicial model, where generative AI serves as an assistive tool under human oversight, ensuring / Generative AI, Judicial Decision-Making, Potential, Prospects and Role",Syed Shaharyar Ahmed; Johar Imam,2025,journalArticle,ssrn,maybe_queue
RJKTAC9K,Legally speaking: does using In-copyright works as training data infringe?,"U.S. district court judges have issued their rulings in two copyright law cases, Bartz v. Anthropic and Kadrey v. / Meta, on whether genAI developers made a fair use or not by collecting and copying in-copyright works as training data for their LLMs. / copyright law, artificial intelligence, generative AI, fair use, Bartz v. Anthropic, Kadrey v. Meta",Pamela Samuelson,2025,journalArticle,ssrn,maybe_queue
N3JGIX7K,Generating and evaluating sustainable procurement criteria for the swiss public sector using In-context prompting with large language models,"Public procurement refers to the process by which public sector institutions, such as governments, municipalities, and publicly funded bodies, acquire goods and services. Swiss law requires the integration of ecological, social, and economic sustainability requirements into tender evaluations in the format of criteria that have to be fulfilled by a bidder. However, translating high-level sustainability regulations into concrete, verifiable, and sector-specific procurement criteria (such as selection criteria, award criteria, and technical specifications) remains a labor-intensive and error-prone manual task, requiring substantial domain expertise in several groups of goods and services and considerable manual effort. This paper presents a configurable, LLM-assisted pipeline that is presented as a software supporting the systematic generation and evaluation of sustainability-oriented procurement criteria catalogs for Switzerland. The system integrates in-context prompting, interchangeable LLM backends, and automated output validation to enable auditable criteria generation across different procurement sectors. As a proof of concept, we instantiate the pipeline using official sustainability guidelines published by the Swiss government and the European Commission, which are ingested as structured reference documents. We evaluate the system through a combination of automated quality checks, including an LLM-based evaluation component, and expert comparison against a manually curated gold standard. Our results demonstrate that the proposed pipeline can substantially reduce manual drafting effort while producing criteria catalogs that are consistent with official guidelines. We further discuss system limitations, failure modes, and design trade-offs observed during deployment, highlighting key considerations for integrating generative AI into public sector software workflows.",Gao; Matoshi; Rolshoven; Ellendorff; Binder,2026,preprint,arxiv,maybe_queue
E74QS5GA,Design ethics in design intelligence: a framework for ethical AI-augmented design practice,"Design Ethics, Design Intelligence, AI Ethics, Design AI, Ethical Frameworks, AI Alignment, Human-AI Collaboration",Tee Hui Teo,2025,journalArticle,ssrn,keep_queue
462N6DT8,Developers’ dilemma: opportunities and pitfalls of generative AI for software development,"Generative artificial intelligence (GenAI) has attracted worldwide attention across numerous domains, with particularly strong implications for software development. Effective integration of GenAI requires a thorough understanding of both its opportunities and pitfalls for software developers and the organizations they are embedded in. In this study, 30 expert interviews were conducted to examine the sociotechnical impact of GenAI from the perspective of software development practitioners. The findings show that GenAI can enhance individual and organizational productivity and stimulate creative problem-solving. At the same time, concerns emerge around over-reliance, skill degradation, and homogenization among developers. Moreover, with GenAI rapidly providing valuable information, communication between developers may decline, potentially undermining interpersonal relationships and team cohesion. These insights contribute to information systems theory by examining GenAI’s effects on social capital, machine-induced reflections, and developers’ professional identity, while also offering practical implications for the effective and sustainable adoption of GenAI in software development. © The Author(s) 2026.",Zacharias; Popova; Zahn; Chen; Hinz,2026,journalArticle,,keep_queue
5N7FF9IT,Human intelligence vs. Artificial emotional intelligence: exploring scope and limitations in the age of digital transformation in Lebanon,"intelligence (AI) strives to replicate but cannot fully embody. / AEI as complementary, not competitive. • Advocating for policies that preserve human oversight in emotionally sensitive domains. • Proposing a ""culturally",Fadi Obeid; Sara Ezzeddine,2025,journalArticle,ssrn,maybe_queue
N4P48NBN,LLM-based multi-agent systems for code generation: a multi-vocal literature review,"Large Language Models (LLMs) have enabled multi-agent systems to perform autonomous code generation for complex tasks. Despite the recent growth in research and industrial applications in this area, there is little work on synthesizing evidence from both academic and industrial sources to capture the current state of research on LLM-based multi-agent systems for code generation. To this end, we conducted a Multi-Vocal Literature Review (MLR), combining insights from both academia and industry, including peer-reviewed studies and grey literature. The aim of this study is to systematically synthesize and analyze existing knowledge on LLM-based multi-agent systems for code generation. Specifically, the review examines the motivations for their use, employed benchmarks and models, key challenges, proposed solutions, and potential directions for future research. We selected and reviewed 114 studies, and the key findings are: 1) the identified reasons for adopting multi-agent systems for code generation were classified into nine categories; 2) the models and evaluation benchmarks utilized across the studies were systematically analyzed to provide a structured overview of commonly adopted LLM configurations and assessment practices; 3) the reported challenges and corresponding solutions were synthesized into six main categories and 26 subcategories; and 4) future research directions were identified and organized into six main categories and 18 subcategories. The results of this MLR will assist researchers and practitioners in pursuing further studies and supporting the real-world adoption of multi-agent systems in industrial settings.",Rasheeda; Waseema; Kemella; Saari; Abrahamsson,2026,preprint,arxiv,maybe_queue
89YLID37,The conflict of the engineering and the legal mindset in the artificial intelligence act,"This article argues that the product compliance regulations within the AI Act are inadequate for preventing violations of human rights. / By extending engineering logic to the protection of these nuanced concepts, the AI Act introduces potential confusion and challenges in its application",Zsolt Ződi,2024,journalArticle,ssrn,keep_queue
FDJ3V6C6,"Data is life: the strategic, economic, and regulatory battle","As generative AI systems require ever-larger volumes of high-quality training data to function, the governance frameworks determining how that data is / represents meaningful legislative progress, the paper identifies critical gaps that leave India exposed: no AI-specific governance provisions, no algorithmic accountability / AI data governance, data sovereignty, data colonialism, India digital policy, DPDPA 2023, cross-border data flows, generative AI, big tech regulation, / India–US trade, algorithmic accountability, foundation models, national AI strategy",Pruthvi SriRaj Kuppagiri,2026,journalArticle,ssrn,maybe_queue
RDAQHBPI,Beyond the regulation-deregulation illusion: decentralized collective intelligence as the key to long-term AI safety,"The implications for AI alignment, governance, and risk mitigation suggest that decentralized intelligence systems will be crucial for sustaining AI safety",Andy E. Williams,2025,journalArticle,ssrn,keep_queue
