item_key,title,abstract,authors,year,item_type,sources,source_queue
XZK6TTQP,AI service system design (ASSD): a service-system-oriented framework for organizational AI adoption,"practical observations indicate that most organizations continue to apply traditional information system deployment or process automation mindsets to AI adoption / This paper argues that the essence of the organizational AI adoption dilemma is not merely a technical adjustment or process optimization issue, but fundamentally / AI Service System Design, Service Systems, Organizational AI Adoption, Agentic AI, Human-AI Collaboration, AI Governance",Ren-Dar Yang,2026,journalArticle,ssrn,keep_queue
N3C6GQ7F,The role of financial regulators in the governance of algorithmic credit scoring,"The paper introduces the Dynamic Oversight and Ex Post Accountability (DOXA) Model as a normative framework for financial regulators seeking to govern / As techniques such as machine learning, deep learning, and generative AI become more autonomous and opaque, the need for dynamic and ex-post institutionally",Nydia Remolina,2022,journalArticle,ssrn,maybe_queue
QZIJERMG,Bias and fairness in AI algorithms: legal standards and ethical guidelines,"Through a comprehensive review of key legal frameworks, notably the European Union's AI Act, and ethical recommendations, such as UNESCO's Recommendation / For example, the AI Act requires providers to implement quality management systems and ensure human oversight.",Dr. Rahul Kailas Bharati,2025,journalArticle,ssrn,keep_queue
P98IH47I,Impact of artificial intelligence on the strategic decision making of multinational companies,"Artificial Intelligence (AI) is increasingly being leveraged into strategic decisionmaking processes across multinational companies, reshaping global industries. The rapid development and adoption led by multinational companies raises various questions on the actual capabilities and limitations of AI, what specific tasks can effectively be improved and associated risks to consider. This chapter focuses on the impacts of AI on global industries through a comparative case study examining four multinational corporations, comparing their unique implementation of AI across five criteria.The findings support the ability for AI to fundamentally address inherent decision-making challenges related to accuracy and timeliness of data, automation, while also highlighting areas sensitive to over-reliance on these automated processes. The conclusion provides a framework for businesses and policymakers to responsibly implement AI, including recommendations for improving AI governance, investing in employee upskilling, and ensuring ethical AI deployment to enhance long-term strategic outcomes. © 2026 by IGI Global Scientific Publishing. All rights reserved.",Macleod; Pugalia,2025,journalArticle,,maybe_queue
3DPMH9VL,HARVIS: a digital assistant based on cognitive computing for non-stabilized approaches in single pilot operations,"With Single Pilot Operations, the work that was shared between crew members in the past will be assumed by one pilot. To maintain an adequate level of safety and support the single pilots' performance and decision-making in complex situations, we investigated a concept of cognitive computing algorithms and adaptive automation implemented in a digital assistant. The aim of the present work was to assess if an Artificial Intelligence (AI) assistant could support pilots' decision-making during a Non-Stabilized Approach (NSA). Method: A NSA assistant prototype based on pilots expertise and eye-tracking data was developed. We performed a human in the loop session with 7 professional pilots on ENAC A320 simulator and analyzed the impact of the assistant on operations, human performance and the safety feeling of pilots. Results: Generally, the assistant was appreciated and trusted by pilots. The system improved pilots' decision-making in order to perform a go-around. Aspects like trust, complacency, usability and pilots' physiological data monitoring were dominant discussion points. Discussion and conclusion: There were no evidence that the assistant reduced pilots' workload, but it helped pilots focusing a bit more on the 'wider picture' since part of the monitoring task could be delegated to the assistant. Understanding the reason of a go-around alert appeared to be a key point for pilots to build trust.  © 2022 The Authors.",Duchevet; Imbert; Hogue; Ferreira; Moens,2022,conferencePaper,,maybe_queue
RHDN5JQ3,"SGLF: structure-governed learning framework why machines should learn from governing structure, not biological incentives","structure-governed learning, reward hacking, reward over-optimization, AI alignment, machine learning safety, reinforcement learning, physics-informed",Anand Casavaraju,2026,journalArticle,ssrn,maybe_queue
QQSEGEUB,AI ethics and governance in practice: an introduction - guidance brief,"To manage these impacts responsibly and direct the development of AI systems toward optimal public benefit, considerations of AI ethics and governance / In this workbook, we introduce and describe our PBG Framework, a multi-tiered governance model that enables project teams to integrate ethical / artificial intelligence, AI Ethics, AI Governance, AI Policy, AI systems, AI regulation",David Leslie; Cami Rincon; Morgan Briggs; Antonella Perini; Smera Jayadeva,2024,journalArticle,ssrn,keep_queue
Y45IBT5Q,A systematic literature review on generative ai and digital authenticity via blockchain,"integration of Blockchain Technology with Generative Artificial Intelligence (GAI) presents a promising approach to enhancing trust, transparency and accountability / focusing on GAI's opaque decision-making processes and the potential of Blockchain's decentralized ledger to address issues related to transparency and accountability",Thomas Zwachte,2025,journalArticle,ssrn,maybe_queue
63R44352,A comprehensive review of artificial intelligence regulation: weighing ethical principles and innovation,"We present a comprehensive review of Artificial Intelligence (AI) regulation, addressing the challenges and needs associated with governing rapidly evolving / regulation.",Daniel O. Cajueiro; Victor Rafael Rezende Celestino,2024,journalArticle,ssrn,keep_queue
5WVXZ6H5,Building humane advances and institutions: a critical look at recent news about artificial intelligence,"AI, natural language processing, autonomous systems, and governance. / property. / Artificial Intelligence, AI Ethics, Human Dignity, BHAI Framework, Institutional Governance, Intellectual Property Rights, Transparency, Inclusion, Ethical",Arvind Ashta,2025,journalArticle,ssrn,maybe_queue
MJDUMWUX,"Passporting compliance for AI: operationalising governance via a clause-level crosswalk across EU, ISO/IEC, NIST, and CoE frameworks","of compliance artefacts, produced under one governance framework, to satisfy functionally equivalent obligations in another, subject to verification by / High alignment in risk management, transparency, and human oversight creates an immediate evidence-reuse corridor. / Compliance Passporting, AI governance interoperability, EU AI Act, NIST AI RMF, ISO/IEC 42001, Brussels Effect, Legal–Standards Entanglement",Albara Y. Alhazaileh,2026,journalArticle,ssrn,keep_queue
TI4RF68X,Towards the integration of large language models into the software development life cycle: a systematic literature review,"Models (LLMs) are reshaping the Software Development Life Cycle (SDLC) by introducing new levels of automation and intelligent assistance across core phases, including requirements engineering, design, testing, and maintenance. Previous works have examined the adoption of LLM in these areas, but have overlooked its influence on traditional practices in SDLC. Therefore, this paper builds upon this foundation and investigates, from a phase-level perspective, how LLMs interact with the SDLC as a whole and whether their presence necessitates rethinking of conventional methodologies. To achieve this objective, this article reviews the state of the field using a systematic literature review method. Peer-reviewed studies published between 2019 and 2025, examining the integration, benefits, and limitations of LLM within SDLC are analyzed. The findings indicate that LLMs are most commonly applied in implementation and testing, where they improve productivity through code generation, test automation, and fault localisation. However, their adoption also introduces challenges related to model hallucination, contextual misalignment, computational overhead, and ethical risks such as bias and opacity. Therefore, we synthesise several LLM integration patterns and stress various risk mitigation strategies that can be adopted to enhance the integration of LLMs into software engineering practices. The study concludes by outlining practical implications for software teams and proposing future research directions to improve LLM’s integration with agile, DevOps and CI/CD workflows.",M. Madani; K. Neumann; A. Nahhas; M. Chernigovskaya; D. S. Walia,2025,conferencePaper,ieee,keep_queue
CCPX4XZ9,"Exposing generative AI: human-dependent, legally uncertain, environmentally unsustainable","• The governance framework of GPAI models is still ‘under construction’. / • The governance framework of GPAI models is still ‘under construction’. / The European Union’s (EU) 2024 Artificial Intelligence (AI) Act provides a general framework, but more governance measures are planned: harmonised standards / artificial intelligence, human capital, regulation, data protection, sustainable development, EU governance, EU countries",Aida Ponce,2024,journalArticle,ssrn,keep_queue
A8FUW44D,Human-AI collaboration in software engineering: lessons learned from a hands-on workshop,"This paper investigates the dynamics of human-AI collaboration in software engineering, focusing on the use of ChatGPT. Through a thematic analysis of a hands-on workshop in which 22 professional software engineers collaborated for three hours with ChatGPT, we explore the transition of AI from a mere tool to a collaborative partner. The study identifies key themes such as the evolving nature of human-AI interaction, the capabilities of AI in software engineering tasks, and the challenges and limitations of integrating AI in this domain. The findings show that while AI, particularly ChatGPT, improves the efficiency of code generation and optimization, human oversight remains crucial, especially in areas requiring complex problem-solving and security considerations. This research contributes to the theoretical understanding of human-Al collaboration in software engineering and provides practical insights for effectively integrating AI tools into development processes. It highlights the need for clear role allocation, effective communication, and balanced AI-human collaboration to realize the full potential of AI in software engineering.",Hamza; Siemon; Akbar; Rahman; ASSOC COMPUTING MACHINERY,2024,conferencePaper,wos,keep_queue
NEAJDBWA,How should the law treat future AI systems? Fictional legal personhood versus legal identity,"A major, and underexplored, risk of agentic AI is the threat it poses to the coherence of laws and legal system.",Heather Alexander; Jonathan Simon; Frédéric Pinard,2026,journalArticle,ssrn,maybe_queue
VIFISPV4,Anti-imbalance structural management theory: a five-layer governance framework for organizational stability,"Anti-Imbalance Structural Management Theory (AISMT) proposes that organizational stability depends on the balance among multiple structural layers within an enterprise / In the context of the digital economy, AI governance platforms provide new tools for observing operational indicators and supporting adaptive decision / Organizational Stability, AI Governance Platform, Structural Balance, Dynamic Equilibrium",,2026,journalArticle,ssrn,maybe_queue
9WXT2ID6,The AI act: normativity and (constitutional) governance,"This presentation examines the European Union’s AI Act, focusing on its normative framework and constitutional implications for regulating artificial / It explores the Act’s risk-based approach, which categorizes AI systems into prohibited, high-risk, and minimal/no-risk applications, imposing varying compliance",Arne P. Wegner,2025,journalArticle,ssrn,keep_queue
MCLBW4ZR,Towards agentic smart design: an industrial large model-driven human-in-the-loop agentic workflow for geometric modelling,"Agentic workflows, powered by Industrial Large Models (ILMs), represent a significant development emphasizing collaboration between humans and intelligent systems. This paper presents a structured perspective on the role of agentic workflows for smart design and manufacturing, grounded in integrating ILMs. We define an agentic workflow as a labeled Activity-on-Vertex (AOV) graph, where each node represents a functionally closed subtask and is executed by an ILM-based agent, a human operator, or an automated system. This formalism supports analyzable, modular, and hybrid execution, offering a foundation for modeling complex, mixed-initiative processes in manufacturing environments. To support real-world deployment, we introduce a set of reusable agentic workflow patterns that describe how ILM agents perceive, plan, and act in coordination with other components. Besides, a proof-of-concept case study illustrates the practical application of the human-in-the-loop framework through the agentic generation of CAD models. The study covers task decomposition, workflow implementation, and benchmarking, providing evidence for the feasibility of agentic workflows. Building upon these findings, this work contributes to advancing the development and application of agentic workflows in smart manufacturing contexts.",Zheng; Zhong; Su; Leng; Liu,2025,journalArticle,wos,maybe_queue
PPTEB7TI,How AI-AI assurance assemblages reshape trust and erode human judgment,"This study examines the AI-AI auditability assemblage, defined as configurations in which artificial intelligence systems generate and assess evaluative / signals about other artificial intelligence systems.",Khoi Nguyen,2026,journalArticle,ssrn,keep_queue
L9XSU8JH,On the need for digital regulators,"considers two senses of the term “digital regulators”: one of these refers to regulators of digital technology; the other refers to how any regulatory organization / regulation, digital technology, telecommunications, artificial intelligence, machine learning, regulatory performance, AI governance",Cary Coglianese,2025,journalArticle,ssrn,keep_queue
ERTAIL7R,Notification and permission-based approaches for generative AI platforms,"This article explores the regulatory frameworks governing generative AI platforms, focusing on two primary models: notification-based systems, exemplified / property protection. / Generative AI, notification-based approach, permission-based approach, Digital Millennium Copyright Act (DMCA), EU AI Act, copyright infringement, intellectual / datasets, intermediary liability, innovation and regulation, fair use, intellectual property law, generative AI copyright, data curation",Daryl Lim,2025,journalArticle,ssrn,maybe_queue
QQTVPFWE,AI is like… a literature review of AI metaphors and why they matter for policy,"This report reviews why and how metaphors matter to both the study and practice of AI governance, in order to contribute to more productive dialogue / regulation—but rather to facilitate more reflective and productive conversations on these timely challenges. / Artificial intelligence, AI governance",Matthijs M. Maas,2023,journalArticle,ssrn,maybe_queue
VH7JAZ5E,Persistent influence theory: a hierarchical framework for structural persuasion and information fidelity,"Every major AI governance framework audits models-their training data, weight distributions, and fairness metrics. / With the Colorado AI Act (SB 24-205) mandating bias detection and audit documentation for high-risk AI systems by June 2026, and the EU AI Act imposing / information fidelity, structural persuasion, text governance, AI governance, bias detection, cognitive dissonance, echo chambers, epistemic hierarchies / , algorithmic bias, computational rhetoric, regulatory compliance",Bradley Slimp,2026,journalArticle,ssrn,maybe_queue
KAIALY7B,The governance gauntlet: strategic risk management when algorithms become your customers,The emergence of agentic commerce—where AI systems possess delegated authority to make purchasing decisions with limited human oversight—fundamentally,Paul F. Accornero,2025,journalArticle,ssrn,keep_queue
M8S5W77R,Rules for radical AI: a counter-framework for algorithmic contestation,"Radical AI, Algorithmic Contestation, Algorithmic Accountability, AI Ethics, Participatory AI, Democratic AI, AI Governance",Victor Frimpong,2025,journalArticle,ssrn,maybe_queue
ZNHBKYGV,Copyright and the expression engine: idea and expression in AI-assisted creations,"This essay explores AI-assisted content creation in light of EU and U.S. copyright law. / The essay revisits a 2020 study commissioned by the European Commission, which was written before the surge of generative AI. / Copyright, Generative AI, Idea expression dichotomy, AI-assisted creation, Work of authorship, Conceptual art",P. Bernt Hugenholtz,2024,journalArticle,ssrn,maybe_queue
SUY5T39G,"Past precedent, future proof: toward a new legal and commercial framework for AI-generated music","This article takes the position that if copyright law, case law evolution, and public policy do not evolve to accommodate the structural changes posed / Generative AI in Music, Music Copyright Law, AI Copyright Litigation, Creative Economy Governance, Copyright Settlements, Licensing Frameworks",Charles Goldstuck,2025,journalArticle,ssrn,maybe_queue
EDQYSVF4,Epistemic and emotional harms of generative AI: towards human-centered first amendment,"To mitigate these harms, regulations should mandate GenAI system designers to render opaque systems more comprehensible and accountable through risk detection / Freedom of Thought, Generative AI, Artificial Intelligence, ChatGPT, First Amendment, Large Language Models, Transparency, Compelled Speech, Cognitive",Inyoung Cheong,2025,journalArticle,ssrn,maybe_queue
Z73A5LTJ,The compression-absorption framework: a stability condition for labor-compressing AI,"While institutional lag theory recognizes that technology can outpace social adaptation, existing AI governance models focus primarily on model-level risk / The Compression–Absorption Framework reframes AI governance as equilibrium management in the face of acceleration asymmetry, preserving institutional",Iftikhar Mahmud Abdul Majid,2026,journalArticle,ssrn,keep_queue
DXJUZYDX,Support for small and medium-sized enterprises (SMEs) - help for smaller AI developers.,"Recognizing the importance of SMEs in the AI landscape, the EU has introduced the Artificial Intelligence Act (AI Act), a comprehensive legal framework / This article delves into the various support measures embedded within the AI Act aimed at assisting SMEs in developing and deploying AI solutions responsibly / EU AI Act, AI, AI Regulation",Michael Borrelli; Markus Krebsz; Sean Musch,2025,journalArticle,ssrn,maybe_queue
WBD54YA5,Unlocking the dual benefits of enterprise AI governance: a hybrid three-stage approach,"This study investigates the critical role of AI governance in fostering sustainable enterprise development. / Grounded in dynamic capability theory, a multidimensional AI governance framework is developed to analyze its impact on performance and resilience. / AI governance, Old-new technology collaborative governance, AI-empowered dynamic capability, Enterprise performance, Enterprise Resilience, Dynamic Capability",Ping Li; Lin Jia; Zhijun Yan; Ao Shen,2025,journalArticle,ssrn,keep_queue
PD6DQ9TG,"Normative constraints, transferable knowledge generation, and sustainable equilibrium in multi-agent systems (reinstated text + full figures)","Artificial Intelligence, Multi-Agent Systems, Normative Constraints, Transferable Knowledge, AI Alignment, Complex Systems, Sustainability, Agent-Based",William da Silva,2026,journalArticle,ssrn,maybe_queue
J2LP5JRB,"Large language models for environmental modeling: framework, capabilities, constraints","Environmental modeling faces growing complexity, yet practical pathways for integrating Large Language Models (LLMs) remained limited. We introduce two practical, reproducible frameworks that embed LLMs into core modeling workflows: a human-AI collaborative “Copilot” and an LLM-driven automation “Autopilot”. Using the Rainfall–Runoff–Inundation (RRI) model in Japan's Kuzuryu River basin, we evaluate both frameworks on parameter calibration and real-time correction. Copilot framework demonstrated robust performance, leveraging prompt engineering to guide LLMs in algorithm comprehension and code generation. It implemented advanced optimization and correction algorithms, achieving strong performance in parameter calibration (Nash-Sutcliffe Efficiency of 0.91 for calibration and 0.81 for validation) and delivering stable real-time correction. Autopilot framework showed competence in physics-constrained parameter calibration but failed in the long-sequence, data-intensive task of real-time correction, revealing instability caused by “attention decay”. This stark contrast underscores the importance of strategic task design and human oversight. Our findings highlight that LLMs currently excel as powerful knowledge engines and coding assistants within human-supervised workflows (Copilot), whereas full automation (Autopilot) remains constrained by context window limitations and inherent weaknesses in processing long numerical sequences. This study provides a methodological framework, practical implementation guidance, and design principles (task decomposition, physics constraints, oversight checkpoints) to support generalizable deployment of LLMs in environmental modeling, and we outline testable directions for improving robustness, scalability, and reproducibility. © 2025 Elsevier Ltd",Nie; Liu,2026,journalArticle,wos,maybe_queue
WYL7N9W9,Struggling for creativity and the beauty of human error - copyright authorship meets generative AI and neuroscience,"This paper explores the fundamental role of human struggle in the context of copyright-protectable works and sophisticated generative AI (genAI / imperfection, frustration, and emotional complexity are central to the human creative process and over time could become the hallmark for authorship under copyright / authorship, copyright, originality, human, neuroscience",Alina Trapova,2025,journalArticle,ssrn,maybe_queue
8EEKFTQL,Is your machine better than you? You may never know,"Artificial intelligence systems are increasingly demonstrating their capacity to make better predictions than human experts. Yet recent studies suggest that professionals sometimes doubt the quality of these systems and overrule machine-based prescriptions. This paper explores the extent to which a decision maker (DM) supervising a machine to make high-stakes decisions can properly assess whether the machine produces better recommendations. To that end, we study a setup in which a machine performs repeated decision tasks (e.g., whether to perform a biopsy) under the DM’s supervision. Because stakes are high, the DM primarily focuses on making the best choice for the task at hand. Nonetheless, as the DM observes the correctness of the machine’s prescriptions across tasks, the DM updates the DM’s belief about the machine. However, the DM is subject to a so-called verification bias such that the DM verifies the machine’s correctness and updates the DM’s belief accordingly only if the DM ultimately decides to act on the task. In this setup, we characterize the evolution of the DM’s belief and overruling decisions over time. We identify situations under which the DM hesitates forever whether the machine is better; that is, the DM never fully ignores but regularly overrules it. Moreover, the DM sometimes wrongly believes with positive probability that the machine is better. We fully characterize the conditions under which these learning failures occur and explore how mistrusting the machine affects them. These findings provide a novel explanation for human–machine complementarity and suggest guidelines on the decision to fully adopt or reject a machine. © 2023 INFORMS",de Véricourt; Gurkan,2023,journalArticle,,keep_queue
FNYHYWT2,"Open (for business): big tech, concentrated power, and the political economy of open AI",regulation. / regulation.,David Gray Widder; Sarah West; Meredith Whittaker,2023,journalArticle,ssrn,maybe_queue
884ERQST,Responsibility for generative AI services – from aspiration to achievement,"This paper discusses the responsibility of the actors – developer, deployer and user – in the generative AI services supply chain from three perspectives / AI might achieve them;

The allocation of responsibility by generative AI service providers, as set out in their terms of service and Acceptable / AI, Responsibility, Liability, Ethics, Terms and conditions, Acceptable use policies",Chris Reed; Keri Grieman,2025,journalArticle,ssrn,keep_queue
27Y3TEGE,Artificial fiduciaries,"Currently, there is little scholarship discussing the intersection of AI and corporate governance. / It also explores the “human in the loop” option in the context of artificial fiduciaries. / Corporate Governance; Fiduciary Duty; AI Directors; Law and Tech",Zhaoyi Li,2023,journalArticle,ssrn,keep_queue
