item_key,title,abstract,authors,year,item_type,sources,source_queue
9ULXNM2A,Dataset assessment tools for the AI act compliance of high-risk AI systems,"The European Union's Artificial Intelligence Act (AI Act), effective as of August 2024, introduces stringent data governance requirements for high-risk / This paper provides a socio-legal and technical analysis of data governance under the AI Act, advocating for a shift toward embedded ethical oversight / AI Act, Compliance Tools, Dataset, Fairness, Data Fairness, Bias",Chiara Gallese; Elena Falletti,2025,journalArticle,ssrn,keep_queue
G6F7D5VT,Simulated justice: how AI alignment replaces conflict with coherence,"In doing so, the paper cautions against the growing role of generative AI as a source of normative authority, not because it gets law wrong / Generative AI, Large Language Models (LLMs), AI Alignment, Law and Technology, Legal Theory, Algorithmic Accountability, AI Ethics, Legal Value Alignment",Ruoxi Li; Sirui Han; Yi-Ke Guo,2026,journalArticle,ssrn,maybe_queue
S7CS7UWE,Harmful prompt classification for large language models,"Over the last few years, using LLM chatbots like ClaudeAI, Co-pilot and ChatGPT for text generation has become a regular habit for many, with over 100 million weekly users flocking to ChatGPT alone. One side effect of such vast usage of these models is undesirable prompts being submitted to the model. This not only risks data and model poisoning if done repeatedly but also causes harm to society through the responses provided by the models, which are then in turn trained on such models. It is the onus of the model creators and company to address these undesirable prompts based on the type of harm present. To this end, model developers have started conducting Red-teaming of LLMs, a form of evaluation that elicits model vulnerabilities potentially leading to such undesirable behaviours. There are existing classifiers that detect whether a prompt is harmful and censor the models' responses for safe user access. However, for developers, more metadata on the category of danger that a prompt presents equips them with a capability to prepare for such attacks on the model based on the frequency and type of harm. Additionally, in cases where further investigation is required, companies can report problematic user behaviour to the authorities. Hence the importance of categorising harmful prompts. We propose a sub-category based prompt classifier that identifies the specific type of harm that a damaging prompt is addressing to help content moderators and governance functions take further actions. Using explainable AI methods, we focused on both black-box and white-box testing of models and explored Linear SVM, KNN and BERT for further sub-classifying harmful prompts, and obtained accuracies of 92%, 85% and 87% respectively. © 2024 Copyright held by the owner/author(s).",Gupta; De La Cuadra Lozano; Busalim; R Jaiswal; Quille,2024,conferencePaper,wos,maybe_queue
Q8MRTLU4,"Data sovereignties in the GenAI economics: from data-opolies to data cooperatives, trust, and geopolitical governance","The monopolistic power of Big Tech platforms—so-called data-opolies—undermines democratic accountability, reshapes political agency, and destabilizes institutional / directly in technical domains, ranging from cybersecurity protocols and interoperable cloud architectures to federated learning systems and algorithmic accountability / Data Sovereignties, Data Cooperatives, Generative AI, Innovation Systems, Digital Sovereignty, Geopolitics, Trust",Igor Calzada,2025,journalArticle,ssrn,maybe_queue
7KSFJWDE,An ontological framework for cognitive digital twins in human-centered aviation safety,"OntoFLYNET enables explainable, context-aware reasoning through OWL and SWRL rules and supports human-in-the-loop analysis via SPARQL-based queries. / This work contributes to Industry 5.0 by bridging empirical data, formal semantics, and human cognition toward trustworthy and explainable AI. / Cognitive Digital Twin, Aviation Safety, Ontology Engineering, Explainable AI, Human-in-the-Loop Reasoning, Industry 5.0",Raymond HOUE NGOUNA; Justin Moskolaï Ngossaha; Cédrick Béler; Laurent Geneste,2025,journalArticle,ssrn,maybe_queue
LWAKMVVM,IBCI POLICY REPORT 01/2026 - regulation of digital platforms in latin america: challenges and perspectives,"and the institutional reconfiguration they may entail, could have far-reaching regulatory, economic, and strategic implications for Brazil’s digital governance / While multiple stakeholders share an interest in legal certainty and effective oversight, perspectives diverge on CADE’s prospective role and on how lessons / Regulation, Digital Platforms, AI regulation, Brazil, Competition Law, Antitrust",Juliana Oliveira Domingues; Eduardo Molan Gaban; Vinicius Klein; Lorenzo Bittencourt Nicoletti,2026,journalArticle,ssrn,maybe_queue
DYYFCXQD,Text and data mining of computer programs in the current EU copyright framework,"The proliferation of generative AI has steered the discussion about text and data mining (TDM) in copyright law towards the problem of generative models / However, generative AI is not the only case for TDM. / TDM, copyright, computer programs, AI, text and data mining, software",Bohdan Widła,2025,journalArticle,ssrn,maybe_queue
685XDDE9,Pioneering ethical AI integration in enterprise workflows: a framework for scalable team governance,"Generative AI is transforming enterprise workflows at a rapid pace. / This paper proposes a framework to embed ethical principles—such as bias mitigation, explainability, and responsible automation—into generative AI workflows / Generative AI, AI Ethics, Responsible AI, Project Management, Ethical Frameworks, Explainability, Bias Mitigation, AI Governance",Venkatraman Viswanathan,2025,journalArticle,ssrn,keep_queue
ZIZEXNWD,"Mitigating ""epistemic debt"" in generative AI-scaffolded novice programming using metacognitive scripts","The democratization of Large Language Models has given rise to vibe coding, where novice programmers prioritize semantic intent over syntactic implementation. Without pedagogical guardrails, we argue this is fundamentally misaligned with cognitive skill acquisition. Drawing on Kirschner's distinction between cognitive offloading and outsourcing, unrestricted AI encourages novices to outsource the intrinsic cognitive load required for schema formation rather than merely offloading extraneous load. This accumulation of epistemic debt creates fragile experts: developers whose high functional utility masks critically low corrective competence. To quantify and mitigate this debt, we conducted a between-subjects experiment (N=78) using a custom Cursor IDE plugin backed by Claude 3.5 Sonnet. Participants were recruited via Prolific and UserInterviews.com to represent AI-native learners. We compared three conditions: manual (control), unrestricted AI (outsourcing), and scaffolded AI (offloading). The scaffolded condition employed a novel Explanation Gate -- a real-time LLM-as-a-Judge framework enforcing a teach-back protocol before generated code could be integrated. Results reveal a collapse of competence: both AI groups significantly outperformed the manual control on functional utility (p < .001) and did not differ from each other (p = .64), yet unrestricted AI users suffered a 77% failure rate on a subsequent 30-minute AI-blackout maintenance task, vs. only 39% in the scaffolded group. Qualitative analysis suggests successful vibe coders naturally self-scaffold, treating AI as a consultant rather than a contractor. We discuss implications for AI-generated software maintainability and propose that future learning systems must enforce metacognitive friction to prevent mass production of unmaintainable code. Replication package: https://github.com/sreecharansankaranarayanan/vibecheck",Sankaranarayanan,2026,preprint,arxiv,maybe_queue
ABKGDVQA,Aligned with whom? Direct and social goals for AI systems,"As artificial intelligence (AI) becomes more powerful and widespread, the AI alignment problem—how to ensure that AI systems pursue the goals that we want",Anton Korinek; Avital Balwit,2022,journalArticle,ssrn,keep_queue
BUU97YES,Why freedom of speech in the EU is not equivalent to the freedom of online platforms to be irresponsible and unaccountable,"The EU's regulatory initiativesmost notably the DSA, Digital Markets Act (DMA), the Artificial Intelligence Act (AI Act), and the European Democracy Shieldsignal / Tech, who often frame regulatory oversight as a threat to freedom of expression while avoiding obligations to democratic norms.",Mariya Yurukova,2025,journalArticle,ssrn,maybe_queue
3TK9MHAD,The codex of authority,"From automated drafts of the EU’s AI Act to blockchain smart contracts, institutional norms emerge as self-sufficient codices where legitimacy resides / Obedience without Command, Silent Authority, Syntactic Authority, Regla Compilada, Soberano Ejecutable, Structural Obedience, Predictive Systems, Algorithmic Governance",Agustin V. Startari,2025,journalArticle,ssrn,keep_queue
