item_key,title,abstract,authors,year,item_type,sources,source_queue
7FEBKCIR,Balancing autonomy and ethics in AI-empowered software engineering by addressing user-centred requirements tension: keynote,"In the rapidly advancing field of Artificial Intelligence (AI) and AI-empowered software engineering, a fundamental tension exists between the autonomy of AI systems and the ethical imperatives that govern their development and application. This keynote addresses this tension by exploring how user-centered approaches can effectively reconcile AI autonomy with user needs and ethical integrity. As AI systems become more autonomous, ensuring that they adhere to ethical guidelines while meeting diverse user requirements presents a complex and significant challenge in software engineering. A critical research issue involves “translating” high-level ethical principles into concrete, actionable technical specifications that guide the entire software development lifecycle. This translation is complex, as ethical guidelines are often abstract and must be operationalized across all aspects of AI functionality, including data governance, privacy safeguards, user interface design, and decision-making algorithms. This challenge is particularly significant because traditional software engineering emphasizes reliability and accuracy, whereas AI components generate predictive hypotheses that may not always be accurate. Additionally, AI algorithms are trained on data, which makes their behavior dependent on the training data, further complicating the prediction of an AI-enabled system's precise functionality in all conditions. Through the application of theoretical frameworks and supported by practical case studies drawn from prior research, this keynote examines how these tensions impact the design and functionality of AI-empowered software. It explores the ethical implications of algorithmic decision-making, particularly where the complexity of AI processes can obstruct transparency and accountability. Additionally, it considers the user experience in interacting with autonomous systems, where ensuring trust and managing the balance between AI autonomy and human oversight are critical. These challenges are especially pronounced in domains where AI systems handle sensitive information, highlighting the need for strong ethical guidelines and technical solutions to ensure that AI autonomy aligns with societal values and operational transparency. © The Author(s), under exclusive license to Springer Nature Switzerland AG 2025.",Virvou,2025,journalArticle,,keep_queue
Z7M4Q73A,Frontier AI regulation: what form should it take?,"The study advocates for a structured regulatory framework that integrates security-first governance models, proactive compliance mechanisms, and coordinated / global oversight to mitigate AI-driven threats. / Frontier AI Regulation, AI Security Threats, Adversarial Risk, Cryptographic Governance, Compliance Enforcement, Legal Accountability, Regulatory Harmonisation / , Algorithmic Oversight",Petar Radanliev,2025,journalArticle,ssrn,keep_queue
HLRKHWRL,Copyright data improvement for AI licensing – the role of content moderation and text and data mining rules,"If information stemming from these metadata engines is pooled in a central European copyright data repository, the accumulation of copyright data could / to foster copyright data improvement projects. / copyright metatdata, generative AI, training data, harmonization, interoperability, standardization, transparency, TDM, content moderation, prohibition",Martin Senftleben,2024,journalArticle,ssrn,maybe_queue
2IYKM87Y,ChatGPT as the marketplace of ideas: should truth-seeking be the goal of AI content governance?,"Here, a pivotal issue is: should truth-seeking be set as the goal of AI content governance? / Given the unattainability of the absolute truth-seeking goal, I argue against adopting zero-risk policies. / Marketplace of Ideas, ChatGPT, AI Policy, Bias, Knowledge-Based Approach, AI content risks, Truth-Seeking Obligations, Large Language Models, Generative",Jiawei Zhang,2024,journalArticle,ssrn,maybe_queue
YFR3REDU,"Responsible AI governance roadmap in investment firms from zero AI to scalable, regulated, real-world adoption","This framework enables investment firms to transition from fragmented, opaque automation practices to a transparent, supervised, and regulator-compliant / The framework integrates governance architecture, human-in-the-loop supervision, data lineage standards, model-risk management, ethical oversight mechanisms / Responsible AI, EU AI Act, MiFID II, Investment Management, Model Risk, Explainability (XAI), Human-in-the-Loop, Governance, Financial Regulation / , K·A·B Framework, Portfolio Risk, Data Lineage, Institutional AI, Ethical AI, Supervisory Technology",Nikolaos Akkizidis,2025,journalArticle,ssrn,maybe_queue
9NBPCDWR,Generalizable secure code generation framework for robust software development practices,"The large language models, and AI-assisted programming tools have made software development easier, particularly through the rapid growth of automated code generation, however, have also presented a significant security risk simultaneously. The code generated by such systems is more likely to be functional correctness and overlook certain vital protection against vulnerability (such as injection attacks, memory corruption and unsafe use of libraries). In order to address this gap, the present paper proposes a universal framework of producing secure codes with the objective of facilitating valid principles of software development. The architecture is a union of security aware training policies, multistage pipelines of code generated and automated vulnerability detection algorithms, such that the generated code adheres to the specified guidelines of security. It has been demonstrated by the benchmark testing of different programming languages and a wide array of datasets that the framework has the capacity to extrapolate beyond the small scale and the insecurity rates of insecure code pattern is reduced significantly with both correctness and efficiency maintained. The publication will be one of the steps to achieving the balance between the productivity gained through the assistance of AI-based coding and the necessity to possess the trustful and secure software engineering.",S. K. A; S. Shanmugasundaram; J. Mouriya; J. Sanjeeth,2025,conferencePaper,ieee,keep_queue
BNE59DKI,Using natural language prompts with AI models for low-cost assistive software design: exploratory comparative evaluation,"Background: This study investigates the capacity of 7 artificial intelligence (AI) models, 5 free and 2 paid, to generate functional software for designing low-cost, personalized assistive products. Objective: The objective was to determine which models are most effective, accessible, and consistent in supporting nontechnical professionals in developing inclusive digital solutions and to assess the capabilities of commercially available and easy-to-access AI models to generate code from natural language interactions in the shape of a nontechnical assistive Methods: Each AI model was prompted using natural language, without any technical input, to create a Python program that converts an arcade gamepad into an adapted mouse-like controller. Sixteen progressively complex functions were requested through standardized prompts, delivered without additional feedback or correction. Model performance was evaluated based on the number of successfully implemented functions and the average number of prompts required. Results: Paid models demonstrated markedly superior performance. Gemini Pro (Google) successfully implemented 14 of 16 requested functions with an average of 1.25 (SD 0.45) prompts, while ChatGPT Plus (GPT-5) achieved 11 functions with an average of 1.31 (SD 0.48) prompts. In contrast, free models produced between 0 and 4 functional outcomes, with DeepSeek and Gemini Free ranking the highest within their category. The enhanced outcomes of paid models were linked to improved contextual understanding, greater tolerance for natural language, and reduced conversational drift. Conclusions: Paid AI models, particularly Gemini Pro and ChatGPT Plus, exhibit strong potential as tools for bridging the gap between health or education professionals and software development. They enable the creation of affordable, user-centered assistive technology without requiring advanced programming skills. Nevertheless, human oversight and foundational literacy in prompt design remain crucial to guarantee functionality, reliability, and ethical use.",Banuls-Lapuerta; Marti-Miralles; Gonzalez-Garcia; Martinez-Rico,2026,journalArticle,wos,maybe_queue
MUWGLY93,Generative AI as digital media,"The hype surrounding Generative AI paints it as revolutionary and potentially apocalyptic and calls for equally novel regulation. / Regulation must foster accountability, transparency, and environments that inspire public confidence towards generative AI platforms. / Generative AI Regulation, AI Regulation, Digital Platforms, AI and Trust, Algorithmic Media, AI governance approaches, AI Act",Gilad Abiri,2024,journalArticle,ssrn,maybe_queue
9GUSRYDX,Knowledge management perspective of generative artificial intelligence (GenAI),"In terms of knowledge application, GenAI is seen as a tool to boost productivity and innovation, but issues like knowledge misapplication, intellectual / property, and ethical considerations are critical. / Generative AI (GenAI), knowledge management (KM), large language models (LLMs), knowledge workers",Maryam Alavi; Dorothy Leidner; Reza Mousavi,2024,journalArticle,ssrn,maybe_queue
VZ8BPAV7,Can AI standards have politics?,"It thereby exposes an inconvenient truth for AI governance: Standards have politics, and yet recognizing that standards are crafted by actors who make / AI Governance, AI Regulation, AI Ethics, Soft Law, Technology and Law",Alicia Solow-Niederman,2024,journalArticle,ssrn,keep_queue
VLY55FLI,Tracing bias origin and predicting bias emergence across AI platforms via cryptographic provenance graphs and neural granger causal consensus,"This paper presents a unified architecture addressing these provenance, prediction, and governance gaps through four technically distinct contributions / International bias provenance, causal attribution, directed acyclic graph, Granger causality, neural Granger, transfer entropy, blockchain, Shapley attribution, EU / AI Act, bias emergence prediction, proactive alert, remediation playbook, focal loss, sequential probability ratio test, spatiotemporal clustering, event",Jamel Robinson,2026,journalArticle,ssrn,maybe_queue
QLNV4HS8,How AI models are optimized through Web3 governance,"This proposed framework supports decentralized, dynamic, evolutionary, and participatory AI governance, crucial for handling the complex ethical and operational / The proposed web3-driven AI governance model paves the way for AI systems that are adaptable, ethical, and efficiently managed, meeting the rapid evolution / Learning, Deep Learning Models, Transformer AI, Reinforcement Learning from Human Feedback, Reputation Systems, Governance, Decentralized Autonomous Organization",Wulf A. Kaal,2024,journalArticle,ssrn,maybe_queue
DSVV4PSX,"Dark patterns, enforcement, and the emerging digital design acquis: manipulation beneath the interface","Accordingly, this article analyses the appropriateness of regulatory oversight of designers and platforms that deploy dark patterns inside digital technologies / The Digital Markets Act and Digital Services Act, the proposals for a new Data Act and AI Act, are critiqued for suitability of regulating deceptive design / digital design acquis, regulation, law, user interface, data protection, consumer protection, HCI, Digital Services Act, Digital Markets Act, data act, AI / Act,",M.R. Leiser; Cristiana Santos,2023,journalArticle,ssrn,maybe_queue
JJ6GGBPY,Can large language models implement agent-based models? An ODD-based replication study,"Large language models (LLMs) can now synthesize non-trivial executable code from textual descriptions, raising an important question: can LLMs reliably implement agent-based models from standardized specifications in a way that supports replication, verification, and validation? We address this question by evaluating 17 contemporary LLMs on a controlled ODD-to-code translation task, using the PPHPC predator–prey model as a fully specified reference. Generated Python implementations are assessed through staged executability checks, model-independent statistical comparison against a validated NetLogo baseline, and quantitative measures of runtime efficiency and maintainability. Results show that behaviorally faithful implementations are achievable but not guaranteed, and that executability alone is insufficient for scientific use. GPT-4.1 consistently produces statistically valid and efficient implementations, with Claude 3.7 Sonnet performing well but less reliably. Overall, the findings clarify both the promise and current limitations of LLMs as model engineering tools, with implications for reproducible agent-based and ecological modeling. © 2026 Elsevier B.V. All rights are reserved, including those for text and data mining, AI training, and similar technologies.",Fachada; Fernandes; Fernandes; Matos-Carvalho,2026,journalArticle,arxiv|scopus,maybe_queue
ZS389TYW,Strategic permissiveness: how china's open-source AI licensing transforms global governance,"of derivatives from Chinese base models use permissive licenses enabling unrestricted reuse, only 12% provide basic training data disclosure, creating compliance / challenges under frameworks like the EU AI Act. / AI Governance, Open-source AI, License-transparency Decoupling, Strategic permissiveness, China, Technology Diffusion",Jiwei Qian,2025,journalArticle,ssrn,keep_queue
L7E3YTUT,Generative artificial intelligence under german copyright law (part 1),"Part 2: With adequate human instruction and oversight, intellectual property rights to AI-generated results belong to the user; otherwise they are in the / Developers of generative AI must observe third-party copyrights when procuring and using training texts.",Arnold J. F. Lukas,2023,journalArticle,ssrn,keep_queue
9B2RUW73,A human–LLM collaborative problem-solving framework for complex industrial problems,"Under a human-in-the-loop risk control setting, this study provides an operational framework for collaborative human–AI problem solving in complex industrial / Human–LLM collaboration, large language model, complex industrial problems, root-cause diagnosis, human-in-the-loop, knowledge retention",Longjie Jia; Wulong Luo; Baochun Xu; Nanyang Deng; Lingjun Yang,2026,journalArticle,ssrn,maybe_queue
