seq,item_key,title,authors,year,item_type,abstract,bin,centrality,reason_code,rationale
39,LKCDAMLF,"Legal, policy, and compliance issues in using AI for security: using taiwan's cybersecurity management act and penetration testing as examples",Wang,2024,conferencePaper,"As artificial intelligence (AI) technology advances rapidly, integrating AI into cybersecurity practices poses new challenges for professionals. This paper focuses on the legal and policy implications of employing AI tools in penetration testing (PT). Key issues explored include liability in cases where AI tools cause damage and legal compliance challenges for organizations mandated to conduct PT. This paper argues that in the case of Taiwan, a comprehensive consideration of relevant laws, such as the Code of Civil Procedure, will be needed as AI products and tools become more widespread. The other issue concerns defining qualified PT, using Taiwan's Cybersecurity Management Act as an example. This paper concludes that, in addition to proper AI governance, governments should consider the legal frameworks necessary for the practical application of AI products or systems and develop appropriate AI safety testing methods to offer reference guidelines for public agencies to introduce risk-controllable AI tools, thus preparing for the transition into the AI era. © 2024 NATO CCDCOE.",discard,20,wrong-level,Not related.
40,JKLSQ57B,No skin in the game: why agentic AI requires principal-agent governance,Martin Prause,2026,journalArticle,"The deployment of Agentic AI creates governance challenges that existing frameworks cannot adequately address. / The training pipeline of large language model-based Agentic AI produces these asymmetries: The pretraining process optimizes prediction over truth. / Agentic AI, AI Agents, AI Governance, LLM vulnerability, Principal-Agent Theory",discard,20,quality-threshold-not-met,LLM focus.
41,XXRRYDKZ,"AI will replace functions, not persons: a function-level framework for AI integration in knowledge work",Javier Rayon Encinas,2026,journalArticle,"Developer, and Financial Analyst—and provide technology-agnostic architectural principles for deploying function specific AI agents with appropriate human / oversight. / Artificial Intelligence, Future of Work, Human-AI Collaboration, Task Automation, Knowledge Work, Organizational Design",context,40,,May cover human oversight in other domains.
42,D5RXSP2P,AutoDev: automated AI-driven development,Tufano; Agarwal; Jang et al.,2024,preprint,"The landscape of software development has witnessed a paradigm shift with the advent of AI-powered assistants, exemplified by GitHub Copilot. However, existing solutions are not leveraging all the potential capabilities available in an IDE such as building, testing, executing code, git operations, etc. Therefore, they are constrained by their limited capabilities, primarily focusing on suggesting code snippets and file manipulation within a chat-based interface. To fill this gap, we present AutoDev, a fully automated AI-driven software development framework, designed for autonomous planning and execution of intricate software engineering tasks. AutoDev enables users to define complex software engineering objectives, which are assigned to AutoDev's autonomous AI Agents to achieve. These AI agents can perform diverse operations on a codebase, including file editing, retrieval, build processes, execution, testing, and git operations. They also have access to files, compiler output, build and testing logs, static analysis tools, and more. This enables the AI Agents to execute tasks in a fully automated manner with a comprehensive understanding of the contextual information required. Furthermore, AutoDev establishes a secure development environment by confining all operations within Docker containers. This framework incorporates guardrails to ensure user privacy and file security, allowing users to define specific permitted or restricted commands and operations within AutoDev. In our evaluation, we tested AutoDev on the HumanEval dataset, obtaining promising results with 91.5% and 87.8% of Pass@1 for code generation and test generation respectively, demonstrating its effectiveness in automating software engineering tasks while maintaining a secure and user-controlled development environment.",context,60,,Covers agentic system with adversarial agents.
43,2NRJ4FXR,One developer is all you need: a case study of an AI-augmented one-person squad in a brownfield enterprise,Boas; Pinto; Monteiro et al.,2026,preprint,"AI tools are enabling engineers to absorb roles previously distributed across cross-functional squads, yet there is little structured evidence on how to design or evaluate such a one-person squad in a regulated enterprise setting. Without that evidence, organizations adopting this model lack guidance on which design decisions make it viable and which conditions cause it to break down. We report a case study in which a single staff engineer, supported by four AI agents under a Spec-Driven Development workflow, delivered a brownfield product initiative scoped for a four-person squad in half the planned time, with 90\% acceptance of AI-generated code on first review, full integration test pass rates, and an above-85\% reduction in direct staffing cost. The results indicate that AI does not replace team members it multiplies the throughput of the experienced engineer who remains, making specification quality and institutional knowledge, not model capability, the binding constraints on one-person squad success.",context,40,,productivity study
44,N8HSZ7BC,Licoeval: evaluating LLMs on license compliance in code generation,W. Xu; K. Gao; H. He et al.,2025,conferencePaper,"Recent advances in Large Language Models (LLMs) have revolutionized code generation, leading to widespread adoption of AI coding tools by developers. However, LLMs can generate license-protected code without providing the necessary license information, leading to potential intellectual property violations during software production. This paper addresses the critical, yet underexplored, issue of license compliance in LLM-generated code by establishing a benchmark to evaluate the ability of LLMs to provide accurate license information for their generated code. To establish this benchmark, we conduct an empirical study to identify a reasonable standard for “striking similarity” that excludes the possibility of independent creation, indicating a copy relationship between the LLM output and certain opensource code. Based on this standard, we propose LiCoEval, to evaluate the license compliance capabilities of LLMs, i.e., the ability to provide accurate license or copyright information when they generate code with striking similarity to already existing copyrighted code. Using LiCoEval, we evaluate 14 popular LLMs, finding that even top-performing LLMs produce a non-negligible proportion (0.88 % to 2.01 %) of code strikingly similar to existing open-source implementations. Notably, most LLMs fail to provide accurate license information, particularly for code under copyleft licenses. These findings underscore the urgent need to enhance LLM compliance capabilities in code generation tasks. Our study provides a foundation for future research and development to improve license compliance in AIassisted software development, contributing to both the protection of open-source software copyrights and the mitigation of legal risks for LLM users.",context,60,,Potential scanner to include in pipeline. Doesn't address huamn oversight.
45,CI93QRUH,HiLDE: intentional code generation via human-in-the-loop decoding,E. A. González; R. Rothkopf; S. Lerner et al.,2025,conferencePaper,"While AI programming tools hold the promise of increasing programmers’ capabilities and productivity to a remarkable degree, they often exclude users from essential decisionmaking processes, causing many to effectively “turn off their brains” and over-rely on solutions provided by these systems. These behaviors can have severe consequences in critical domains, like software security. We propose Human-in-the-Loop Decoding, a novel interaction technique that allows users to observe and directly influence LLM decisions during code generation, in order to align the model’s output with their personal requirements. We implement this technique in HiLDE, a code completion assistant that highlights critical decisions made by the LLM and provides local alternatives for the user to explore. In a within-subjects study ($\mathrm{N}=18$) on security-related tasks, we found that HiLDE led participants to generate significantly fewer vulnerabilities and better align code generation with their goals compared to a traditional code completion assistant.",core,80,,A means for highlighting what humans should look at.
46,5IZXVQS6,Biased AI improves human decision-making but reduces trust,Lai; Kim; Kunievsky et al.,2025,preprint,"Current AI systems minimize risk by enforcing ideological neutrality, yet this may introduce automation bias by suppressing cognitive engagement in human decision-making. We conducted randomized trials with 2,500 participants to test whether culturally biased AI enhances human decision-making. Participants interacted with politically diverse GPT-4o variants on information evaluation tasks. Partisan AI assistants enhanced human performance, increased engagement, and reduced evaluative bias compared to non-biased counterparts, with amplified benefits when participants encountered opposing views. These gains carried a trust penalty: participants underappreciated biased AI and overcredited neutral systems. Exposing participants to two AIs whose biases flanked human perspectives closed the perception-performance gap. These findings complicate conventional wisdom about AI neutrality, suggesting that strategic integration of diverse cultural biases may foster improved and resilient human decision-making.",discard,20,out-of-scope,Focused on bias of LLMs
47,QYT8RRWL,Methods and techniques of agentic software engineering: a systematic literature review,N. Otoum; N. Elkhalili,2026,journalArticle,"The development of agentic software engineering (ASE) is shifting the software development process, specifically by adopting autonomous agents into the fundamental software development process, where autonomous agents using large language models (LLMs) and artificial intelligence (AI) make decisions, write code, and collaborate across the entire software development lifecycle. The systematic review is a summary of literature on the agentic software engineering methodologies, frameworks, and techniques published in 2022-2025. We identify and compare methods based on autonomous coding, multi-agent systems, iterative refinement, and human-agent collaboration, drawing on 61 high-quality studies. We find that LLM-based agents show substantial potential in automated software engineering and that recent work is exploring new trends in agent cooperation, reasoning systems, and tool integration. We recognize such key challenges as the coordination procedures, reliability, explainability, and the ethical issues. This review characterizes the emerging role of agentic software engineering in improving the productivity of developers, the quality of their code, and the automation of their processes, and it offers a structured roadmap for future research. With the rapid evolution of the field, agentic approaches will tend to transform the conception, creation, and maintenance of software and provide more autonomous, adaptive, and intelligent systems.",core,80,,"Agentic coding, including human collab.Oversight should fit in."
48,SVPFXI3P,From replication to redesign: exploring pairwise comparisons for LLM-based peer review,Zhang; Zhang; Ji et al.,2025,preprint,"The advent of large language models (LLMs) offers unprecedented opportunities to reimagine peer review beyond the constraints of traditional workflows. Despite these opportunities, prior efforts have largely focused on replicating traditional review workflows with LLMs serving as direct substitutes for human reviewers, while limited attention has been given to exploring new paradigms that fundamentally rethink how LLMs can participate in the academic review process. In this paper, we introduce and explore a novel mechanism that employs LLM agents to perform pairwise comparisons among manuscripts instead of individual scoring. By aggregating outcomes from substantial pairwise evaluations, this approach enables a more accurate and robust measure of relative manuscript quality. Our experiments demonstrate that this comparative approach significantly outperforms traditional rating-based methods in identifying high-impact papers. However, our analysis also reveals emergent biases in the selection process, notably a reduced novelty in research topics and an increased institutional imbalance. These findings highlight both the transformative potential of rethinking peer review with LLMs and critical challenges that future systems must address to ensure equity and diversity.",context,40,,Unrelated.
49,X7S3ELFB,Decision-agent fit in business intelligence: a governance-first framework for agentic AI,Rupesh Ghosh,2026,journalArticle,"Findings Human-in-the-loop and rule-based agents enhance governance and reliability; conversational agents improve speed and user acceptance; autonomous / Practical implications The DAF framework enables BI leaders to balance automation benefits with governance and cost objectives through risk-based agent / Business intelligence, Decision intelligence, Agentic AI, Decision-agent fit (DAF), Governance, Decision support systems",discard,10,out-of-scope,Unrelated.
50,462N6DT8,Developers’ dilemma: opportunities and pitfalls of generative AI for software development,Zacharias; Popova; Zahn et al.,2026,journalArticle,"Generative artificial intelligence (GenAI) has attracted worldwide attention across numerous domains, with particularly strong implications for software development. Effective integration of GenAI requires a thorough understanding of both its opportunities and pitfalls for software developers and the organizations they are embedded in. In this study, 30 expert interviews were conducted to examine the sociotechnical impact of GenAI from the perspective of software development practitioners. The findings show that GenAI can enhance individual and organizational productivity and stimulate creative problem-solving. At the same time, concerns emerge around over-reliance, skill degradation, and homogenization among developers. Moreover, with GenAI rapidly providing valuable information, communication between developers may decline, potentially undermining interpersonal relationships and team cohesion. These insights contribute to information systems theory by examining GenAI’s effects on social capital, machine-induced reflections, and developers’ professional identity, while also offering practical implications for the effective and sustainable adoption of GenAI in software development. © The Author(s) 2026.",context,50,,Not directly related ot human oversight