seq,item_key,title,authors,year,item_type,abstract,bin,centrality,reason_code,rationale
18,DY2Y5QE3,"Rogue AI agents won't be testifying-you will: agentic AI, IP and liability risks, and a path forward",Justin Pierce; Heather West; Brandon Phemester,2026,journalArticle,"systems act beyond intended bounds, interact with restricted systems, accept terms, access protected data, or make external representations on behalf of an organization / For companies operating in IP-intensive and regulated environments, agentic AI governance must be treated not as a technical afterthought but as a core",discard,25,quality-threshold-not-met,"Abstract very lightweight, seems not related."
19,5I2W8IC6,Mapping the trust terrain: LLMs in software engineering - insights and perspectives,Khati; Liu; Palacio et al.,2025,journalArticle,"The application of Large Language Models (LLMs) in Software Engineering (SE) continues to grow rapidly across both industry and academia. As these models become integral to critical SE processes, ensuring their reliability and trustworthiness becomes essential. Achieving this requires a balanced approach to trust: excessive trust can introduce security vulnerabilities, while insufficient trust may hinder innovation. However, the conceptual landscape of trust in LLMs for SE(LLM4SE) remains unclear. Key concepts such as trust, distrust, and trustworthiness lack precise definitions, factors that shape trust formation remain underexplored, and metrics for trust in LLMs remain undeveloped. To clarify the current research landscape and identify future directions, we conducted a comprehensive review of (88) articles: a systematic review of (18) studies on LLMs in SE, supplemented by an analysis of (70) articles from the broader trust literature. Furthermore, we surveyed (25) domain experts to gather practitioners’ perspectives on trust and identify gaps between their experiences and the existing literature. Our findings provide a structured overview of trust-related concepts in LLM4SE, outlining key areas for future research. This study contributes to building more trustworthy LLM-assisted software engineering processes, ultimately supporting safer and more effective adoption of LLMs in SE.",core,80,,"inspection of what constitutes ""trust."" Escalation for hurman review is the inverse, so could yield insight."
20,4YKMK4ZI,On the impossibility of observability-based authorization: a formal impossibility result for ex-ante AI governance,Edward Meyman,2026,journalArticle,"compliance evidence remain underdeveloped. / Implications for procurement, audit, and regulatory oversight are discussed, along with limitations and directions for empirical benchmarking. / AI governance, governance laundering, policy theater, compliance architecture, failure modes, anti-laundering tests, deterministic governance, evidence-grade / governance, AI regulation, regulatory compliance, audit methodology, independent verification, algorithmic accountability, evidentiary standards",context,50,,"Abstract truncated, but seems related."
21,XKEY3YYF,Evaluating human-language model interaction,Lee; Srivastava; Hardy et al.,2024,preprint,"Many real-world applications of language models (LMs), such as writing assistance and code autocomplete, involve human-LM interaction. However, most benchmarks are non-interactive in that a model produces output without human involvement. To evaluate human-LM interaction, we develop a new framework, Human-AI Language-based Interaction Evaluation (HALIE), that defines the components of interactive systems and dimensions to consider when designing evaluation metrics. Compared to standard, non-interactive evaluation, HALIE captures (i) the interactive process, not only the final output; (ii) the first-person subjective experience, not just a third-party assessment; and (iii) notions of preference beyond quality (e.g., enjoyment and ownership). We then design five tasks to cover different forms of interaction: social dialogue, question answering, crossword puzzles, summarization, and metaphor generation. With four state-of-the-art LMs (three variants of OpenAI's GPT-3 and AI21 Labs' Jurassic-1), we find that better non-interactive performance does not always translate to better human-LM interaction. In particular, we highlight three cases where the results from non-interactive and interactive metrics diverge and underscore the importance of human-LM interaction for LM evaluation.",context,40,,Measurement of effectiveness of human engagement.
22,VEEEW3K9,Generative AI-assisted framework for secure and autonomous software development lifecycle optimization,P. Srinivas; A. Rahmath Mohammad; T. Neelima et al.,2026,conferencePaper,"The rapid evolution of software development demands innovative approaches to enhance security, efficiency, and automation throughout the Software Development Lifecycle (SDLC). This paper presents a comprehensive Generative AI-assisted framework that integrates large language models and machine learning techniques to optimize and secure the SDLC. The proposed framework leverages generative AI capabilities across multiple phases including requirements analysis, code generation, vulnerability detection, automated testing, and deployment optimization. By incorporating AI-driven threat modeling and continuous security assessment, the framework addresses critical challenges in identifying vulnerabilities early in development while maintaining code quality and reducing time-to-market. The system employs advanced prompt engineering techniques and context-aware code analysis to generate secure code patterns, detect security anomalies, and suggest remediation strategies in real-time. Experimental validation demonstrates significant improvements in vulnerability detection rates, code quality metrics, and development efficiency compared to traditional SDLC approaches. The framework achieves automated security scanning with minimal false positives while maintaining developer productivity. This research contributes to the emerging field of AI-assisted software engineering by providing a practical, scalable solution for organizations seeking to modernize their development processes while prioritizing security and autonomy.",context,50,,"Focus on AI agents for coding, but doesn't seem to include risk identification, scoring, escalation to humans"
23,CAXNTRJF,Machine learning solutions to automated governance and code analysis to compliance,A. A. Paul; H. T.V; U. Maheswari,2025,conferencePaper,"The GRC Analyser is a new AI product aimed at closing the software development and the Governance, Risk, and compliance (GRC) standards (ISO 27001, GDPR and SOC 2) gap. In contemporary organizations, programmers tend to develop software without profound knowledge of these complicated regulatory and security provisions, and potentially vulnerable and compliant problems may occur. The suggested system takes advantage of the concept of the Machine Learning (ML) models trained with the use of the secure code directions and industry standards and helps to examine uploaded code modules automatically. It determines the vulnerabilities like poor data management, lack of proper input validation and lack of encryption tools, which are among the main causes of security threats. The GRC Analyser provides clear and practical advice to developers when the flaws are identified through recommendations after identifying potential risks. This does not only enhance the security of the code but also makes sure that it is matched to compliance requirements at their initial development phases. The tool will enable organizations to minimize the human error, cost of auditing, and regulatory readiness by incorporating AI-based security auditing within the software lifecycle. Finally, it is observed that the GRC Analyser encourages the creation of resilient, secure, and legal applications and empowers developers to make a proactive stance on governance and cybersecurity.",context,40,,About making engineers more aware of compliance concerns.
24,C2K75UGE,The vicious circles of skill erosion: a case study of cognitive automation,Rinta-Kahila; Penttinen; Salovaara et al.,2023,journalArticle,"Cognitive automation powered by advanced intelligent technologies is increasingly enabling organizations to automate more of their knowledge work tasks. Although this often offers higher efficiency and lower costs, cognitive automation exacerbates the erosion of human skill and expertise in automated tasks. Accepting the erosion of obsolete skills is necessary to reap the benefits of technology—however, the erosion of essential human expertise is problematic if workers remain accountable for tasks for which they lack sufficient understanding, rendering them incapable of responding if the automation fails. Though the phenomenon is widely acknowledged, the dynamics behind such undesired skill erosion are poorly understood. Thus, taking the perspective of sociotechnical systems, we conducted a case study of an accounting firm that had experienced skill erosion over a number of years due to reliance on their software’s automated functions. We synthesized our findings using causal loop modeling based on system dynamics. The resulting dynamic model explains skill erosion via an interplay between humans’ automation reliance, complacency, and mindful conduction. It shows how increasing reliance on automation fosters complacency at both individual and organizational levels, weakening workers’ mindfulness across three work task facets (activity awareness, competence maintenance, and output assessment), resulting in skill erosion. Such skill erosion may remain obscure, acknowledged by neither workers nor managers. We conclude by discussing the implications for theory and practice and identifying directions for future research. © 2023, Association for Information Systems. All rights reserved.",context,60,,Addresses skill erosion in related area.
25,TLJPGLK9,AI CHAOS! 2nd workshop on the challenges for human oversight of AI systems,Khadar; Cecil; Van Der Neut et al.,2026,conferencePaper,"As AI systems are increasingly adopted in high-stakes domains such as healthcare, autonomous driving, and criminal justice, their failures may threaten human safety and rights. Human oversight of AI systems is therefore critically important as a potential safeguard to prevent harmful consequences in high-risk AI applications. The global regulatory and policy landscape for AI governance remains understandably fragmented and diverse. While frameworks like the European AI Act require human oversight for high-risk AI systems, there is currently a lack of well-defined methodologies and conceptual clarity to operationalize such oversight effectively. Independent of policy and regulation, poorly designed oversight can create dangerous illusions of safety while obscuring accountability. This interdisciplinary workshop aims to bring together researchers from various disciplines, including AI, HCI, psychology, law, and policy, to address this critical gap. We will explore the following questions: (1) What are the greatest challenges to achieving effective human oversight of AI systems? (2) How can we design AI systems that enable meaningful human oversight? (3) How do we assign responsibilities to and support the various stakeholders involved in oversight? Through talks and interactive group discussions, participants will identify oversight challenges; examine stakeholder roles; discuss supporting tools, methods, and regulatory frameworks; and establish a collaborative research agenda. Our central goal is to further a roadmap that enables effective human oversight for the responsible deployment of AI in society.",core,80,,"Define and understand how human oversight operates, including when needed."
26,76DYS6RI,Model-assisted and human-guided: perceptions and practices of software professionals using LLMs for coding,I. Santos; C. Magalhaes; R. De Souza Santos,2025,conferencePaper,"Large Language Models (LLMs) have quickly become a central component of modern software development workflows, and software practitioners are increasingly integrating LLMs into various stages of the software development lifecycle. Despite the growing presence of LLMs, there is still limited understanding of how these tools are actually used in practice and how professionals perceive their benefits and limitations. This paper presents preliminary findings from a global survey of 131 software practitioners. Our results reveal how LLMs are utilized for various coding-specific tasks. Software professionals report benefits such as increased productivity, reduced cognitive load, and faster learning, but also raise concerns about LLMs' inaccurate outputs, limited context awareness, and associated ethical risks. Most developers treat LLMs as assistive tools rather than standalone solutions, reflecting a cautious yet practical approach to their integration. Our findings provide an early, practitioner-focused perspective on LLM adoption, highlighting key considerations for future research and responsible use in software engineering.",discard,20,wrong-level,Generic LLM in software study. No oversight focus.
27,7GE63LDE,Repairing infrastructure-as-code using large language models,Low; Cheh; Chen,2024,conferencePaper,"Infrastructure-as-Code (IaC) is the practice of provisioning and managing cloud resources using machine-readable code. IaC is seeing increased adoption because it enhances transparency and reliability of infrastructure operations. However, as any software code, IaC can also contain misconfigurations, which can lead to insecure infrastructure, which may result in data breaches. Existing IaC scanning tools are able to detect common misconfigurations in IaC but they require IaC developers to manually repair the code. Recent advances in Large Language Models (LLMs) have led to promising results in applying LLMs to Automatic Program Repair (APR) tasks for code written in different languages. In this work, we propose an LLM-based approach to fix misconfigurations in IaC code. After misconfigurations in IaC code are identified by scanning tools, we feed the LLMs with the IaC code, details about the misconfigurations, and additional context provided by a human-in-the-loop and prompt the LLM to generate the repaired IaC code. We tested our approach on several vulnerable IaC repositories and found that the GPT-4 model from OpenAI suggests fixes that reduce up to 84.7% of the misconfiguration alarms produced by the scanners and our two-pass solution significantly improves the performance over a one-pass only approach. However, of the fixes suggested, we manually determined that only 79.6% actually solve the problem, while the remaining 20.4% are hallucinated fixes. Specifically, LLM hallucinations in the generated outputs pass checks for misconfigurations but fail other syntax and schema validation checks or do not address the underlying security issue. We propose a few potential approaches to tackle this challenge.  © 2024 IEEE.",context,50,,Focus on infrastructure as code and human guidance
28,PMPV54J9,From tools to teammates: a framework for integrating AI agents into organizational structures,Mikhail Karpov,2026,journalArticle,"Customer‑facing scenarios introduce distinct challenges around trust, brand voice, and liability compared to internal use cases. / AI agents, organizational structure, human-AI collaboration, agentic AI, hybrid teams, team dynamics, workforce transformation",discard,20,quality-threshold-not-met,Abstract truncated. Not strongly related.
29,35GIS9BQ,Design patterns for machine learning-based systems with humans in the loop,Andersen; Maalej,2024,journalArticle,Human involvement in machine learning (ML) is a promising paradigm to overcome the limitations of purely automated predictions and improve the applicability of ML. We compile a catalog of design patterns to guide developers to select and implement human-in-the-loop solutions. OOP PATTERNS,context,60,,Unrelated.
30,GFCB367T,"AI - integrated DevSecOps for scalable, secure, and modern cloud architectures",R. K. Mahimalur; V. G. Kolla; C. D. Tank et al.,2026,conferencePaper,"Software delivery pipelines now need to be more secure, scalable, and robust due to the rapid use of cloud-native architectures. Security bottlenecks and lengthy release cycles are caused by traditional DevSecOps frameworks' high false positive rates, vulnerability to slow vulnerability alerts, and lack of automation. In order to solve these problems, this paper offers an AI-Integrated DevSecOps paradigm which integrates automation, intelligence, and continuous compliance into an already-existing CI/CD pipeline. The framework was developed through a design science research approach by combining reference architecture design, policy-as-code enforcement, artificial intelligence (AI) model integration and a controlled experiment. Fine-tuning of large language models for secure code review, risk-based vulnerability prioritisation based on machine learning, and a time-series anomaly detection model to track runtime telemetry were developed. Red team simulations and a production-scale cloud testbed with seeded controlled vulnerabilities were utilized to assess the system. With a mean time to detect of 4.5 minutes, a mean time to remediate of 12 minutes, a false positive rate of 3.2, and an F1-score of 97.5—much better than five state-of-the-art methods—the quantitative results are also encouraging. The findings demonstrate that the AI Integrated DevSecOps can provide software releases that are safe, quick, and dependable, which will aid in bridging the gap between security assurance and delivery agility after the tasks are carried out.",context,50,,Productivity by integrating AI into DevOps
31,L65X78ML,Reflections on the data protection compliance of AI systems under the EU AI act,Hohmann; Kollár,2025,journalArticle,"The European Union’s Artificial Intelligence Act (AI Act) establishes a novel regulatory framework for AI systems, with far-reaching implications for data protection compliance. This study critically analyses the regulatory environment created by the Act and its interaction with the General Data Protection Regulation (GDPR), addressing whether it provides clearer compliance pathways or introduces additional burdens for developers. Using comparative legal analysis, the research finds that the AI Act supplements the GDPR through a risk-based approach that subjects high-risk AI systems to specific obligations. Key concerns include algorithmic opacity, bias, and legal uncertainty in profiling and automated decision-making. The analysis shows that the AI Act attempts to mitigate these risks by strengthening requirements on risk assessment, human oversight, and data governance. While the Act broadly aligns with GDPR principles such as transparency, fairness, and accountability, it also introduces new procedural and documentation duties that may increase compliance complexity. Overall, the study concludes that the AI Act constitutes a complementary yet stricter regulatory layer for AI-driven data processing, balancing innovation with fundamental rights protection and requiring joint interpretation with the GDPR to ensure coherent application. © 2025 University of Pécs. Published by Informa UK Limited, trading as Taylor & Francis Group.",context,40,,Goverance focus
32,MHK56HCY,Agentic AI as assurance infrastructure: design principles for a continuous second line,Roni van der Fehr,2026,journalArticle,"The first paper in this series established that episodic gateway review is constitutively mismatched to the risk dynamics of complex adaptive / systems, and that continuous assurance represents structural reform of oversight practice rather than a marginal efficiency gain. / agentic AI, multi-agent systems, governance primitive, continuous assurance, second line of defence, evidence-first design, human accountability, responsible / AI, design principles, AI governance",context,40,,Not related to coding / human oversight
33,DQM82F3L,Research vision for Co-designing responsible AI,Daniele Quercia,2026,journalArticle,"Responsible AI principles are everywhere, but implementation is stuck between box-ticking compliance / Responsible AI principles are everywhere, but implementation is stuck between box-ticking compliance / Responsible AI principles are everywhere, but implementation is stuck between box-ticking compliance / Responsible AI principles are everywhere, but implementation is stuck between box-ticking compliance / Responsible AI principles are everywhere, but implementation is stuck between box-ticking compliance / Responsible AI principles are everywhere, but implementation is stuck between box-ticking compliance / Responsible AI principles are everywhere, but implementation is stuck between box-ticking compliance / AI Act–aligned risks, and NLP Guard to reduce harmful reliance on protected attributes after launch.",discard,10,out-of-scope,Abstract mangled. No clear relevance
34,M74M3RFJ,Developing assurance cases for adversarial robustness and regulatory compliance in LLMs,T. B. Momcilovic; D. Balta; B. Buesser et al.,2024,conferencePaper,"This paper presents an approach to developing assurance cases for adversarial robustness and regulatory compliance in large language models (LLMs). Focusing on both natural and code language tasks, we explore the vulnerabilities these models face, including adversarial attacks based on jailbreaking, heuristics, and randomization. We propose a layered framework incorporating guardrails at various stages of LLM deployment, aimed at mitigating these attacks and ensuring compliance with the EU AI Act. Our approach includes a meta-layer for dynamic risk management and reasoning, crucial for addressing the evolving nature of LLM vulnerabilities. We illustrate our method with two exemplary assurance cases, highlighting how different contexts demand tailored strategies to ensure robust and compliant AI systems.",core,80,,"Not directly coding, but discussion of risk assessment and human oversight"
35,6UQMFSB8,Contract-coding: towards repo-level generation via structured symbolic paradigm,Lin; Zhao; Shi,2026,preprint,"The shift toward intent-driven software engineering (often termed ""Vibe Coding"") exposes a critical Context-Fidelity Trade-off: vague user intents overwhelm linear reasoning chains, leading to architectural collapse in complex repo-level generation. We propose Contract-Coding, a structured symbolic paradigm that bridges unstructured intent and executable code via Autonomous Symbolic Grounding. By projecting ambiguous intents into a formal Language Contract, our framework serves as a Single Source of Truth (SSOT) that enforces topological independence, effectively isolating inter-module implementation details, decreasing topological execution depth and unlocking Architectural Parallelism. Empirically, while state-of-the-art agents suffer from different hallucinations on the Greenfield-5 benchmark, Contract-Coding achieves 47\% functional success while maintaining near-perfect structural integrity. Our work marks a critical step towards repository-scale autonomous engineering: transitioning from strict ""specification-following"" to robust, intent-driven architecture synthesis. Our code is available at https://github.com/imliinyi/Contract-Coding.",context,40,,Focus on improving vibe coding quality.
36,WEWQ9NTT,Verified adversarial reasoning intelligence (VARI): multi-agent adversarial verification for regulated AI decision-making,Eric Swidey,2026,journalArticle,"We previously demonstrated VARI as a reference architecture for EU AI Act Article 14 compliance in employment AI (Swidey, 2025). / The regulatory trajectory, including Article 14 of the EU AI Act, the Colorado AI Act (effective June 30, 2026), and the NAIC Model Bulletin, demands both / AI Governance, Adversarial Verification, Multi-Agent Systems, Legal AI, Insurance AI, Hallucination Detection, Algorithmic Discrimination, Per-Decision / Verification, EU AI Act Article 14",discard,10,out-of-scope,Not related.
37,PMSYQJQQ,"Towards just-In-time, inclusive clone refactoring",P. Roy,2025,conferencePaper,"Code clones are a well-known source of technical debt, often degrading software maintainability. Modern AI coding assistants can unintentionally introduce clones or even licenseincompatible code, posing maintenance and legal challenges. This research proposes a Large Language Model (LLM)-powered clone refactoring assistant that proactively detects duplicative code during development and suggests high-level refactorings. By bridging traditional clone detection with LLM-driven code generation or transformation, the approach aims to remove redundancies early while ensuring changes remain behavior preserving and legally compliant. The assistant will integrate into development workflows to prevent clone propagation, flag potential intellectual property risks, and incorporate developer feedback for explainable, trustworthy operation. We will evaluate its impact on code quality and developer productivity, and assess how AI enhancements influence long-term maintenance efforts.",context,40,,May be relevant as a method for identifying use of a risk pattern.
38,ML88MC4H,"A taxonomy of AI governance approaches: distinguishing visibility, alignment, and authorization",Edward Meyman,2026,journalArticle,"The term ""AI governance"" has become semantically overloaded. / The goal is to provide enterprise buyers, regulators, researchers, and auditors a shared vocabulary for evaluating AI governance claims against the requirements / AI governance, deterministic governance, proof-carrying decisions, regulatory compliance, enterprise AI, authorization layer, GRC, AI accountability, algorithmic",discard,10,out-of-scope,Not related.
