item_key,bin,centrality,reason_code,rationale,in_human_50,title,authors,year,item_type,source,has_pdf,doi,arxiv_id,abstract
2Z4PZABF,core,78,,Systematic pillar-by-pillar analysis of whether model-risk-management and SDLC controls can govern AI-driven CODE transformation—directly on org governance of AI-generated code.,no,Regulatory gap: why model risk management is structurally ill-suited to govern AI-driven code transformation,Alex Li,2026,journalArticle,ssrn,no,,,"Where prior work has observed that SR 11-7 ""strains"" under agentic AI, we contribute, to the best of our knowledge, the first systematic pillar-by-pillar / We consider whether overlapping regulatory frameworks—operational risk management, FFIEC IT governance, and existing software development lifecycle controls—fill / SR 11-7, OCC 2011-12, AI code transformation, COBOL modernization, governance framework, TPRM, transformation risk, functional equivalence"
NKY6T5G9,context,35,,Liability/negligence framing of enterprise input governance; transferable governance-duty angle but off-code-core.,no,Negligent poisoned environments: how cumulative input negligence undermines enterprise AI,Matthan Bird,2026,journalArticle,ssrn,no,,,"negligence: duty, breach, causation, and damages to the enterprise context, arguing that organizations may bear liability for failing to implement reasonable governance / This contribution fills a critical gap in AI governance literature by elevating input quality from a technical concern to a legal and strategic imperative / AI Governance, Data Quality, Data Governance, AI Liability, Negligence, Enterprise AI, Technical Debt, Regulatory Compliance, EU AI Act Article 10, Enterprise / Risk Management, RLHF Contamination, RAG Systems, Data Poisoning, Tort Liability, AI Act, NIST AI RMF"
BISE8375,core,72,,Industrial case study on scaling agentic test automation with mandatory human review and explicit governance for human-AI teaming.,no,Human-AI collaboration for scaling agile regression testing: an agentic-AI teammate from manual to automated testing,Outmani; Shenoy; Hatahet et al.,2026,preprint,arxiv,yes,,2603.08190,"Automated regression testing is essential for maintaining rapid, high-quality delivery in Agile and Scrum organizations. Many teams, including Hacon (a Siemens company), face a persistent gap: validated test specifications accumulate faster than they are automated, limiting regression coverage and increasing manual work. This paper reports an exploratory industrial case study of the Hacon Test Automation Copilot, an agentic AI system that generates system-level regression test scripts from validated specifications using retrieval-augmented generation and a multi-agent workflow. Integrated with Hacon's CI pipelines, the Copilot operates asynchronously as a ""silent AI teammate"", producing candidate scripts for human review. Mixed-method evaluation shows the AI accelerates script authoring and increases throughput, with 30-50% code reuse. However, human review remains necessary for maintainability and correct domain interpretation. Clear specifications, explicit governance, and ongoing human-AI collaboration are critical. We conclude with lessons for scaling regression automation and enabling effective human-AI teaming in Agile settings."
MVWFAXDW,context,40,,Automated prompt-rectification tool mitigates insecure AI-generated code but is a technical fix without human-oversight or governance framing.,no,Securing AI code generation - a prompt rectification approach for mitigating cyber risks,J. Dong; Z. Ni; N. Sun et al.,2025,conferencePaper,ieee,no,10.1109/Trustcom66490.2025.00106,,"The past decade has witnessed the wide adoption of AI code generators, such as GitHub Copilot, AskCodi, and OpenAI Codex. They offer intelligent solution code for code completion to achieve faster development, cleaner code, and a significant boost in overall productivity. However, such significant productivity advantages also inadvertently lead to the generation of insecure solution code because most AI code generators derive their knowledge from existing projects, which typically prioritize functionality over security. Although numerous tools have been developed to integrate with the code generators for identifying vulnerabilities, the inconsistency in syntactic features and variability in coding rules make the detection task challenging across different programming languages. To address the challenges, we devise a prompt-enhancing approach, PECKER. It examines textual prompts provided by users to identify risky prompts that could lead to insecure code generation. Given the risky prompts, PECKER conducts security-centric rewriting to strengthen the ""potentially insecure"" descriptions, thereby guiding AI code generators in mitigating vulnerabilities during code generation. We integrated PECKER with one of the most prevalent AI code generators, GitHub Copilot for evaluation. Among 509 risky prompts, PECKER successfully identified and rectified 471 risky prompts."
L28YKLVD,context,44,,AI supply-chain artifact authenticity (SLSA/in-toto/Sigstore) is a concrete software-integrity governance mechanism plausibly transferable to AI-code provenance.,no,Artifact authenticity governance,Christopher Ermis,2026,journalArticle,ssrn,no,,,"Current AI governance frameworks — including the EU AI Act, NIST AI RMF, and ISO/IEC 42001 — establish documentation requirements for high-risk AI systems / but provide no technical mechanism for verifying that compliance records correspond to production deployments. / Integrity Gap, Integrity Debt, Audit Decoupling, model revocation, AI supply chain security, EU AI Act, SLSA, NIST AI RMF, in-toto, Sigstore"
QMKQC7SC,context,54,,"Empirical benchmark showing LLMs silently corrupt delegated work (incl. coding) informs over-reliance risk, but spans 52 domains rather than code oversight specifically.",no,LLMs corrupt your documents when you delegate,Laban; Schnabel; Neville,2026,preprint,arxiv,yes,,2604.15597,"Large Language Models (LLMs) are poised to disrupt knowledge work, with the emergence of delegated work as a new interaction paradigm (e.g., vibe coding). Delegation requires trust - the expectation that the LLM will faithfully execute the task without introducing errors into documents. We introduce DELEGATE-52 to study the readiness of AI systems in delegated workflows. DELEGATE-52 simulates long delegated workflows that require in-depth document editing across 52 professional domains, such as coding, crystallography, and music notation. Our large-scale experiment with 19 LLMs reveals that current models degrade documents during delegation: even frontier models (Gemini 3.1 Pro, Claude 4.6 Opus, GPT 5.4) corrupt an average of 25% of document content by the end of long workflows, with other models failing more severely. Additional experiments reveal that agentic tool use does not improve performance on DELEGATE-52, and that degradation severity is exacerbated by document size, length of interaction, or presence of distractor files. Our analysis shows that current LLMs are unreliable delegates: they introduce sparse but severe errors that silently corrupt documents, compounding over long interaction."
VEEEW3K9,context,40,,Generic AI-assisted secure-SDLC framework with claimed validation; adjacent to org secure-development but autonomous/automated rather than human oversight.,yes,Generative AI-assisted framework for secure and autonomous software development lifecycle optimization,P. Srinivas; A. Rahmath Mohammad; T. Neelima et al.,2026,conferencePaper,ieee,no,10.1109/ICIPCN67432.2026.11438791,,"The rapid evolution of software development demands innovative approaches to enhance security, efficiency, and automation throughout the Software Development Lifecycle (SDLC). This paper presents a comprehensive Generative AI-assisted framework that integrates large language models and machine learning techniques to optimize and secure the SDLC. The proposed framework leverages generative AI capabilities across multiple phases including requirements analysis, code generation, vulnerability detection, automated testing, and deployment optimization. By incorporating AI-driven threat modeling and continuous security assessment, the framework addresses critical challenges in identifying vulnerabilities early in development while maintaining code quality and reducing time-to-market. The system employs advanced prompt engineering techniques and context-aware code analysis to generate secure code patterns, detect security anomalies, and suggest remediation strategies in real-time. Experimental validation demonstrates significant improvements in vulnerability detection rates, code quality metrics, and development efficiency compared to traditional SDLC approaches. The framework achieves automated security scanning with minimal false positives while maintaining developer productivity. This research contributes to the emerging field of AI-assisted software engineering by providing a practical, scalable solution for organizations seeking to modernize their development processes while prioritizing security and autonomy."
CAXNTRJF,context,48,,"AI governance/compliance code-analysis tool embedding automated auditing in the SDLC; relevant governance framing but product-descriptive, thin evidence.",yes,Machine learning solutions to automated governance and code analysis to compliance,A. A. Paul; H. T.V; U. Maheswari,2025,conferencePaper,ieee,no,10.1109/ICAAIC64647.2025.11331106,,"The GRC Analyser is a new AI product aimed at closing the software development and the Governance, Risk, and compliance (GRC) standards (ISO 27001, GDPR and SOC 2) gap. In contemporary organizations, programmers tend to develop software without profound knowledge of these complicated regulatory and security provisions, and potentially vulnerable and compliant problems may occur. The suggested system takes advantage of the concept of the Machine Learning (ML) models trained with the use of the secure code directions and industry standards and helps to examine uploaded code modules automatically. It determines the vulnerabilities like poor data management, lack of proper input validation and lack of encryption tools, which are among the main causes of security threats. The GRC Analyser provides clear and practical advice to developers when the flaws are identified through recommendations after identifying potential risks. This does not only enhance the security of the code but also makes sure that it is matched to compliance requirements at their initial development phases. The tool will enable organizations to minimize the human error, cost of auditing, and regulatory readiness by incorporating AI-based security auditing within the software lifecycle. Finally, it is observed that the GRC Analyser encourages the creation of resilient, secure, and legal applications and empowers developers to make a proactive stance on governance and cybersecurity."
C2K75UGE,context,52,,"Case study of automation reliance, complacency and skill erosion; automation-bias dynamics transfer to over-reliance on AI-generated code.",yes,The vicious circles of skill erosion: a case study of cognitive automation,Rinta-Kahila; Penttinen; Salovaara et al.,2023,journalArticle,scopus,no,10.17705/1jais.00829,,"Cognitive automation powered by advanced intelligent technologies is increasingly enabling organizations to automate more of their knowledge work tasks. Although this often offers higher efficiency and lower costs, cognitive automation exacerbates the erosion of human skill and expertise in automated tasks. Accepting the erosion of obsolete skills is necessary to reap the benefits of technology—however, the erosion of essential human expertise is problematic if workers remain accountable for tasks for which they lack sufficient understanding, rendering them incapable of responding if the automation fails. Though the phenomenon is widely acknowledged, the dynamics behind such undesired skill erosion are poorly understood. Thus, taking the perspective of sociotechnical systems, we conducted a case study of an accounting firm that had experienced skill erosion over a number of years due to reliance on their software’s automated functions. We synthesized our findings using causal loop modeling based on system dynamics. The resulting dynamic model explains skill erosion via an interplay between humans’ automation reliance, complacency, and mindful conduction. It shows how increasing reliance on automation fosters complacency at both individual and organizational levels, weakening workers’ mindfulness across three work task facets (activity awareness, competence maintenance, and output assessment), resulting in skill erosion. Such skill erosion may remain obscure, acknowledged by neither workers nor managers. We conclude by discussing the implications for theory and practice and identifying directions for future research. © 2023, Association for Information Systems. All rights reserved."
8PPIW9Q5,discard,24,out-of-scope,"SLR of prompt-engineering methods for SE tasks; human-in-the-loop is only a minor proposed element, no oversight/governance focus.",no,Unlocking the potential of the prompt engineering paradigm in software engineering: a systematic literature review,Syahputri; Budiardjo; Putra,2025,journalArticle,"scopus,wos",no,10.3390/ai6090206,,"Prompt engineering (PE) has emerged as a transformative paradigm in software engineering (SE), leveraging large language models (LLMs) to support a wide range of SE tasks, including code generation, bug detection, and software traceability. This study conducts a systematic literature review (SLR) combined with a co-citation network analysis of 42 peer-reviewed journal articles to map key research themes, commonly applied PE methods, and evaluation metrics in the SE domain. The results reveal four prominent research clusters: manual prompt crafting, retrieval-augmented generation, chain-of-thought prompting, and automated prompt tuning. These approaches demonstrate notable progress, often matching or surpassing traditional fine-tuning methods in terms of adaptability and computational efficiency. Interdisciplinary collaboration among experts in AI, machine learning, and software engineering is identified as a key driver of innovation. However, several research gaps remain, including the absence of standardized evaluation protocols, sensitivity to prompt brittleness, and challenges in scalability across diverse SE applications. To address these issues, a modular prompt engineering framework is proposed, integrating human-in-the-loop design, automated prompt optimization, and version control mechanisms. Additionally, a conceptual pipeline is introduced to support domain adaptation and cross-domain generalization. Finally, a strategic research roadmap is presented, emphasizing future work on interpretability, fairness, and collaborative development platforms. This study offers a comprehensive foundation and practical insights to advance prompt engineering research tailored to the complex and evolving needs of software engineering. © 2025 by the authors."
TLJPGLK9,context,50,,"Workshop on operationalizing human oversight of high-risk AI under frameworks like the EU AI Act, transferable governance framing but not code-specific and no evidence base.",yes,AI CHAOS! 2nd workshop on the challenges for human oversight of AI systems,Khadar; Cecil; Van Der Neut et al.,2026,conferencePaper,acm,yes,10.1145/3772363.3778736,2363.37787,"As AI systems are increasingly adopted in high-stakes domains such as healthcare, autonomous driving, and criminal justice, their failures may threaten human safety and rights. Human oversight of AI systems is therefore critically important as a potential safeguard to prevent harmful consequences in high-risk AI applications. The global regulatory and policy landscape for AI governance remains understandably fragmented and diverse. While frameworks like the European AI Act require human oversight for high-risk AI systems, there is currently a lack of well-defined methodologies and conceptual clarity to operationalize such oversight effectively. Independent of policy and regulation, poorly designed oversight can create dangerous illusions of safety while obscuring accountability. This interdisciplinary workshop aims to bring together researchers from various disciplines, including AI, HCI, psychology, law, and policy, to address this critical gap. We will explore the following questions: (1) What are the greatest challenges to achieving effective human oversight of AI systems? (2) How can we design AI systems that enable meaningful human oversight? (3) How do we assign responsibilities to and support the various stakeholders involved in oversight? Through talks and interactive group discussions, participants will identify oversight challenges; examine stakeholder roles; discuss supporting tools, methods, and regulatory frameworks; and establish a collaborative research agenda. Our central goal is to further a roadmap that enables effective human oversight for the responsible deployment of AI in society."
PQ9JED2I,context,44,,"Ten-pillar mitigation framework plus regulatory landscape for AI-driven code vulnerability/exposure risk, code-relevant but offensive-security oriented.",no,"Risks of AI-driven vulnerability identification, exploitation, and code exposure",Khanim Avsuvarova,2026,journalArticle,ssrn,no,,,"mitigation framework organized around ten pillars and discusses the regulatory landscape, including the EU AI Act (enforceable August 2026), the NIST AI / Risk Management Framework, and ISO/IEC 42001."
C67AT7ZP,context,36,,"'Build fast, fix later' compliance-debt argument echoes vibe-coding shortcuts but is opinion-leaning and not code-oversight-specific.",no,"The hidden cost of AI compliance: why ""build fast, fix later"" can become a financial catastrophe",Sung Woo Shon,2026,journalArticle,ssrn,no,,,"As regulatory and assurance frameworks such as the European Union’s AI Act, SOC 2 Type II, ISO/IEC 42001, and the NIST AI Risk Management Framework / AI Act, and the business consequences of cyber uninsurability, this paper argues that retrofitting compliance onto a legacy, undocumented “black box”"
GQ5E7RPF,discard,18,out-of-scope,Blockchain+AI provenance framework—known false-positive class with only nominal HITL mention and no code-oversight angle.,no,"Blockchain and AI framework for provenance, semantics, and compliance",Tara Saric,2026,journalArticle,ssrn,no,,,"Crucially, the framework incorporates human-in-the-loop governance, positioning AI as a decision-support mechanism rather than an autonomous authority. / articulating a system-level architecture for provenance that is verifiable, interpretable, and audit-ready, without introducing custodial dependencies or opaque automation"
3QUL87JY,context,40,,"Enterprise governance framework for action-taking agentic AI, concrete but broad and somewhat practitioner-oriented, not code-focused.",no,"Responsible AI In the agentic world governance for AI that acts, not just answers",Sukanya P,2026,journalArticle,ssrn,no,,,"Agentic AI systems that autonomously execute actions across enterprise tools, databases, and APIs introduce a fundamentally different risk profile from / The framework is designed for  Enterprise AI Heads, governance leads, security architects, and engineers responsible for deploying agentic AI in regulated"
NVE5885K,context,48,,On-core topic (governing vibe coding) but an opinion webpage lacking an evidence base or operationalizable mechanism.,no,"Vibe coding: don't kill the vibe, govern it",Pa,2025,webpage,coursework,no,,,"GlobalLogic's ShanShan Pa explains vibe coding, a developer and coding-focused AI that work together like two programmers talking back and forth to build software."
LAKYKVTB,discard,22,out-of-scope,"Assessment of training-data memorization/secret-disclosure risk in code LLMs, a data-supply-chain concern outside code-oversight scope.",no,Malicious and unintentional disclosure risks in large language models for code generation,R. Rabin; S. McGregor; N. Judd,2025,conferencePaper,ieee,no,10.1109/SANER-C66551.2025.00016,,"This paper explores the risk that a large language model (LLM) trained for code generation on data mined from software repositories will generate content that discloses sensitive information included in its training data. We decompose this risk, known in the literature as ""unintended memorization,"" into two components: unintentional disclosure (where an LLM presents secrets to users without the user seeking them out) and malicious disclosure (where an LLM presents secrets to an attacker equipped with partial knowledge of the training data). We observe that while existing work mostly anticipates malicious disclosure, unintentional disclosure is also a concern. We describe methods to assess unintentional and malicious disclosure risks side-by-side across different releases of training datasets and models. We demonstrate these methods through an independent assessment of the Open Language Model (OLMo) family of models and its Dolma training datasets. Our results show, first, that changes in data source and processing are associated with substantial changes in unintended memorization risk; second, that the same set of operational changes may increase one risk while mitigating another; and, third, that the risk of disclosing sensitive information varies not only by prompt strategies or test datasets but also by the types of sensitive information. These contributions rely on data mining to enable greater privacy and security testing required for the LLM training data supply chain."
76DYS6RI,core,63,,Practitioner survey on how professionals cautiously integrate/oversee LLMs as assistive-not-standalone tools—empirical evidence on oversight practices.,yes,Model-assisted and human-guided: perceptions and practices of software professionals using LLMs for coding,I. Santos; C. Magalhaes; R. De Souza Santos,2025,conferencePaper,ieee,no,10.1109/AIware69974.2025.00019,,"Large Language Models (LLMs) have quickly become a central component of modern software development workflows, and software practitioners are increasingly integrating LLMs into various stages of the software development lifecycle. Despite the growing presence of LLMs, there is still limited understanding of how these tools are actually used in practice and how professionals perceive their benefits and limitations. This paper presents preliminary findings from a global survey of 131 software practitioners. Our results reveal how LLMs are utilized for various coding-specific tasks. Software professionals report benefits such as increased productivity, reduced cognitive load, and faster learning, but also raise concerns about LLMs' inaccurate outputs, limited context awareness, and associated ethical risks. Most developers treat LLMs as assistive tools rather than standalone solutions, reflecting a cautious yet practical approach to their integration. Our findings provide an early, practitioner-focused perspective on LLM adoption, highlighting key considerations for future research and responsible use in software engineering."
FYU7H5WR,context,58,,"Interview-plus-simulation study of AI-coding hidden costs (technical debt, atrophy) evidences the risk problem but does not directly address oversight mechanisms.",no,Beyond productivity: evaluating the hidden costs of generative AI in software development,Edward Anderson; Geoffrey Parker; Burcu Tan,2025,journalArticle,ssrn,no,,,"AI-assisted programming tools are increasingly adopted to enhance developer productivity by automating routine tasks and accelerating software development / Drawing on interviews with software engineers and insights from the literature, we build a dynamic simulation model to examine the long-term impacts of AI-assisted / Human-AI Interaction, AI-Assisted Coding, Software Development, Technical Debt, System Atrophy, Dynamics, Software Supply Chains"
N3WU6PFG,context,36,,Code-smell measurement of LLM code is a transferable quality/risk metric but has no human-oversight or governance angle.,no,Investigating the smells of LLM generated Code1,Debalina Ghosh Paul; Hong Zhu; Ian Bayley,2025,journalArticle,ssrn,no,,,"code to identify the weakest scenarios in which the quality of LLM generated code should be improved.MethodsThe method measures code smells, an important / However, the quality of LLM generated code is ntoicablly poorer than human written code. / machine learning, Large language models, performance evaluation, Code Generation, Code quality, Usability, Code smell"
FCSXBE4I,context,40,,"Reliability/governance maturity framework for production agent deployment; concrete capability model, transferable but not code-oversight specific.",no,Agent reliability maturity model (ARMM) a capabiility framework for production-ready AI agent deployment - moving from 'can we build it' to 'are we ready to run it',Ant Newman,2026,journalArticle,ssrn,no,,,"The primary barrier cited by practitioners is not governance or capability, but reliability: will it work when it matters? / structures (governance maturity). / Capability Maturity Model, Systems Engineering, Artificial Intelligence, AI Agents, Agentic AI"
