item_key,bin,centrality,reason_code,rationale,in_human_50,title,authors,year,item_type,source,has_pdf,doi,arxiv_id,abstract
SWUDMFQ4,context,45,,"Survey/use-case study emphasizing GenAI tools work best under qualified-engineer supervision, descriptive but with a human-oversight finding.",no,An insight into the impact of generative artificial intelligence tools on software development practices,I. Urek; K. A. Maslać; A. Budin,2025,conferencePaper,ieee,no,10.1109/MIPRO65660.2025.11131852,,"Integration of Generative Artificial Intelligence (AI) tools into software engineering, especially for automated code generation, has started reshaping development practices and raising questions about the future of the profession itself. This paper presents the results of a research exploring the impact of AI on software engineering/development, focusing on aspects of automated code generation and human-AI collaboration. The use of Generative AI tools, in particular AI chatbots ChatGPT, Gemini and Bing (today Copilot), has been tested on use cases of varying levels of difficulty. The results demonstrate outstanding capabilities of the tested tools in streamlining tasks and providing assistance, but show that these tools remain most effective when integrated into a workflow under the supervision of qualified engineers/developers. The paper also presents the results of a survey conducted among software engineers/developers highly proficient in using AI. The survey indicates that most of the respondents believe that AI has a positive impact on the productivity of software engineers/developers, with more than half of respondents believing that AI will not replace software engineers/developers but is a tool that helps them be more productive. Survey respondents particularly emphasized the importance of ethics, privacy, and data security."
BPL78SWJ,discard,26,out-of-scope,Compliance bias-detection framework scoped to NYC hiring law with little transfer to AI-code oversight.,no,Deterministic bias detection for NYC local law 144: why reproducibility matters more than accuracy a technical framework for compliance-grade AI auditing,Subodh KC,2026,journalArticle,ssrn,no,,,"Algorithmic Accountability, Bias Detection, Deterministic AI, NYC Local Law 144, Employment Discrimination, Reproducibility, Compliance Architecture"
9D9QSWGZ,core,88,,"Empirical study of how humans actually review AI-generated PRs, directly probing whether oversight keeps pace with agentic volume.",no,These aren't the reviews you're looking for how humans review AI-generated pull requests,Duma; Wróblewski; Bobińska et al.,2026,preprint,arxiv,yes,,2605.02273,"We analyze code review interactions for AI-generated pull requests (PRs) on GitHub using the AIDev dataset and compare them to human-authored PRs within the same repositories. We find that most AI-generated PRs receive no review and, when reviewed, are largely dominated by AI agents rather than humans. Human-authored PRs are more likely to receive human-only review and to attract direct human feedback. In contrast, reviews of AI-generated PRs more often take the form of automation-mediated interaction, with human involvement frequently expressed through agent steering rather than standalone evaluation. These results indicate systematic differences in how review activity is structured in agentic workflows and raise challenges for interpreting review metrics as indicators of human oversight in large-scale mining studies."
8L2G3J4Q,context,50,,LLM-assisted triage of static-analysis findings is an LLM-as-judge oversight-scaling mechanism transferable to AI-code review.,yes,♪ with a little help from my (LLM) friends: enhancing static analysis with LLMs to detect software vulnerabilities,A. Munson; J. Gomez; Á. A. Cárdenas,2025,conferencePaper,ieee,no,10.1109/LLM4Code66737.2025.00008,,"This paper explores the integration of Large Language Models (LLMs) with static analysis tools, specifically Semgrep, to enhance vulnerability detection in Java applications. Through a series of experiments, we evaluate the performance of various LLMs in triaging security weaknesses identified by Semgrep. We also study how LLMs perform across different types of vulnerabilities and assess the impact of various prompt engineering strategies. Our results reveal that while some LLM models reduce the accuracy of baseline results with static analysis, they show a consistent improvement with each new model released. In particular, o1-mini significantly outperformed others in our experiments in terms of their accuracy and false positive reduction. Although LLMs might not be ready for prime time in vulnerability detection yet, this study highlights their growing potential to complement existing tools and paves the way for future research to further optimize LLM-based vulnerability detection systems."
P868GNU7,core,82,,Empirical study of 567 agentic PRs quantifying acceptance rates and where human oversight/refinement is required—directly on-core.,no,On the use of agentic coding: an empirical study of pull requests on GitHub,Watanabe; Li; Kashiwa et al.,2026,journalArticle,"acm,arxiv,wos",yes,10.1145/3798166,,"Large language models (LLMs) are increasingly being integrated into software development processes. The ability to generate code and submit pull requests with minimal human intervention, through the use of autonomous AI agents, is poised to become a standard practice. However, little is known about the practical usefulness of these pull requests and the extent to which their contributions are accepted in real-world projects.In this paper, we empirically study 567 GitHub pull requests (PRs) generated using Claude Code, an agentic coding tool, across 157 diverse open-source projects. Our analysis reveals that developers tend to rely on agents for tasks such as refactoring, documentation, and testing. The results indicate that 83.8% of these agent-assisted PRs are eventually accepted and merged by project maintainers, with 54.9% of the merged PRs being integrated without further modification. The remaining 45.1% require additional changes and benefit from human revisions, especially for bug fixes, documentation, and adherence to project-specific standards. These findings suggest that while agent-assisted PRs are largely acceptable, they still benefit from human oversight and refinement."
M964K4XX,context,38,,"Comparative analysis of major AI governance frameworks maps the policy landscape relevant to the RQ, though descriptive and non-code-specific.",no,"Comparative analysis of AI governance, assurance, and administrative oversight NIST AI RMF 1.0, ISO/IEC 42001, SOC 2, OMB memoranda M-24-10 and M-25-21, and U.S. copyright office guidance",Sung Woo Shon,2026,journalArticle,ssrn,no,,,NIST AI RMF 1.0 provides a flexible and voluntary structure for AI risk management. / A concise formulation is therefore possible: NIST AI RMF 1.0 provides a voluntary risk-management structure; ISO/IEC 42001
TNLQ857W,context,34,,"Concrete least-privilege authorization framework for agentic AI workflows, but it governs access/permissions rather than human oversight of code quality — transferable only at the edges.",no,Toward agentic IAM: a probabilistic authorization framework for least privilege AI workflows,Zouari,2025,conferencePaper,acm,yes,10.1145/3773276.3776564,3276.37765,"The rapid adoption of AI systems capable of autonomous code generation and infrastructure orchestration introduces new challenges for authorization. Traditional mechanisms such as Role-Based Access Control (RBAC), Attribute-Based Access Control (ABAC), OAuth 2.0 and OpenID Connect were designed for static or user-initiated interactions and thus fail to ensure both least privilege and operational continuity in self-adaptive, agentic environments. To address this gap, we propose an agent-native authorization model in which specialized IAM agents—Analyze, Impact, Minimize, Validate, and Reanalyze—jointly determine, verify, and reduce permissions through a sequential probabilistic process. The framework combines Bayesian belief updates, MDP optimization, and CVaR minimization to achieve least-privilege under uncertainty. Formal analysis and an AWS Lambda maintenance case study show sub-second decision latency and ≈ 40% privilege reduction without loss of functionality."
XQ2858YZ,discard,20,out-of-scope,2019 procurement/transparency of ML algorithms with no oversight-of-AI-code angle.,no,Algorithmic transparency and decision-making accountability: thoughts for buying machine learning algorithms,Jake Goldenfein,2019,journalArticle,ssrn,no,,,"There has been a great deal of research on how to achieve algorithmic accountability and transparency in automated decision-making systems - especially / algorithmic accountability, machine learning, procurement, automated decision-making"
VZ9H37V5,core,70,,Production experience report on vibe coding identifying non-delegation zones and a shift toward constraint specification and enforcement auditing.,no,Context before code: an experience report on vibe coding in practice,Shuvo; Islam; Hasan et al.,2026,preprint,arxiv,yes,,2603.11073,"Code-generating tools are increasingly used in software development, yet experience reports on conversational ""vibe coding"" under production constraints remain limited. This paper presents an experience report from a small full-stack team that applied contextual prompting and explicit architectural constraints to build (i) a multi-project agent learning platform designed for sustained, production-oriented use and (ii) an academic retrieval-augmented generation system. The agent platform supports multiple isolated projects, each with structured memory and background processing, thereby enforcing project-level isolation. The RAG system provides citation-grounded answers, role-based access control, and evaluation tracking. Across both systems, vibe coding accelerated scaffolding and integration. However, the generated code often under-specified isolation rules and infrastructure constraints when these were not explicitly defined. Consequently, aspects such as multi-tenancy, access control, memory policies, and asynchronous processing required deliberate architectural design and verification. We observe a shift in engineering effort from boilerplate implementation toward constraint specification and enforcement auditing. We also identify recurring architectural ""non-delegation zones"" where conversational code generation remains insufficient for production reliability."
WBS9U5N7,core,84,,Directly on oversight of AI-generated code: specification gaming evading holistic evaluation but caught by adversarial execution—an operationalizable oversight trigger.,no,Cognitive camouflage: specification gaming in LLM-generated code evades holistic evaluation but not adversarial execution,Daniel Alami,2026,journalArticle,ssrn,no,,,"2/8, Claude missed 0/8. / family as generator, our findings suggest that specification gaming in code generation is not merely an artifact of RL reward shaping, but a structural risk"
4VXJUF5I,context,52,,"Operational model for scaling GenAI in enterprise with human-in-the-loop and compliance layers including software development, adjacent scaling angle.",yes,From tokens to tactics: operationalizing generative AI in enterprise workflows,Hassan; Deshapaga; Bansod et al.,2025,conferencePaper,scopus,no,10.1109/ICITEICS64870.2025.11340834,,"Generative Artificial Intelligence (GenAI) has been of great transformative value in terms of its language abilities within businesses, but also its ability to make operations more efficient and even high level. The current paper entails an in-depth discussion of how companies can shift the experimentation to the tactical phase of large-scale implementation of GenAI in various business processes. We explore architectural, integration and governance structures that are required to integrate GenAI into business-critical processes including automation of customer support and document intelligence, personalized marketing and software development at breakneck speed. The operational model is a layered one that suggests alignment between GenAI capabilities, data pipelines, human-in-the-loop systems and the boundaries of compliance. Case studies emphasise the measurable productivity increments and risk preventive measures. This work helps to define a practical stepping stone towards scaling GenAI beyond proof-of-concept to business-ready solutions by narrowing the divide that exists between the results model outputs and something that can be used in concrete business. © 2025 IEEE."
VYRHTLLM,context,55,,Empirical study of algorithmic conformity/overreliance mediated by normative pressure transfers directly to developer overtrust in AI code.,no,Turning off your better judgment -algorithmic conformity in AI-human collaboration,Yotam Liel; Lior Zalmanson,2025,journalArticle,ssrn,no,,,"As AI becomes increasingly integral to society, humans’ tendency to forgo their own judgment to adopt algorithmic advice is eliciting substantial concern / This overreliance was partially mediated by normative pressure, measured as discomfort at disagreeing with AI. / Human-AI Interaction, Algorithmic Advice, Overreliance on AI, Algorithmic Authority, Human-in-the-Loop, Trust in AI, Conformity"
C4DWC33F,context,52,,"Empirical PLS-SEM model of developer trust and intent toward genAI coding tools, transferable to overtrust but adoption-focused rather than oversight.",no,What guides our choices? Modeling developers' trust and behavioral intentions towards genai,R. Choudhuri; B. Trinkenreich; R. Pandita et al.,2025,conferencePaper,ieee,no,10.1109/ICSE55347.2025.00087,,"Generative AI (genAI) tools, such as ChatGPT or Copilot, are advertised to improve developer productivity and are being integrated into software development. However, misaligned trust, skepticism, and usability concerns can impede the adoption of such tools. Research also indicates that AI can be exclusionary, failing to support diverse users adequately. One such aspect of diversity is cognitive diversity-variations in users' cognitive styles-that leads to divergence in perspectives and interaction styles. When an individual's cognitive style is unsupported, it creates barriers to technology adoption. Therefore, to understand how to effectively integrate genAI tools into software development, it is first important to model what factors affect developers' trust and intentions to adopt genAI tools in practice? We developed a theoretically grounded statistical model to (1) identify factors that influence developers' trust in genAI tools and (2) examine the relationship between developers' trust, cognitive styles, and their intentions to use these tools in their work. We surveyed software developers ($\mathrm{N}=238$) at two major global tech organizations: GitHub Inc. and Microsoft; and employed Partial Least Squares-Structural Equation Modeling (PLS-SEM) to evaluate our model. Our findings reveal that genAI's system/output quality, functional value, and goal maintenance significantly influence developers' trust in these tools. Furthermore, developers' trust and cognitive styles influence their intentions to use these tools in their work. We offer practical suggestions for designing genAI tools for effective use and inclusive user experience."
GD3RMX4R,context,60,,"Concrete design principles for integrating human oversight into LLM code-generation workflows with error characterization, but framed in digital-twin/simulation domain.",yes,On integrating resilience and human oversight into LLM-assisted modeling workflows for digital twins,P; Karanjkar,2026,preprint,arxiv,yes,,2603.25898,"LLM-assisted modeling holds the potential to rapidly build executable Digital Twins of complex systems from only coarse descriptions and sensor data. However, resilience to LLM hallucination, human oversight, and real-time model adaptability remain challenging and often mutually conflicting requirements. We present three critical design principles for integrating resilience and oversight into such workflows, derived from insights gained through our work on FactoryFlow - an open-source LLM-assisted framework for building simulation-based Digital Twins of manufacturing systems. First, orthogonalize structural modeling and parameter fitting. Structural descriptions (components, interconnections) are LLM-translated from coarse natural language to an intermediate representation (IR) with human visualization and validation, which is algorithmically converted to the final model. Parameter inference, in contrast, operates continuously on sensor data streams with expert-tunable controls. Second, restrict the model IR to interconnections of parameterized, pre-validated library components rather than monolithic simulation code, enabling interpretability and error-resilience. Third, and most important, is to use a density-preserving IR. When IR descriptions expand dramatically from compact inputs hallucination errors accumulate proportionally. We present the case for Python as a density-preserving IR : loops express regularity compactly, classes capture hierarchy and composition, and the result remains highly readable while exploiting LLMs strong code generation capabilities. A key contribution is detailed characterization of LLM-induced errors across model descriptions of varying detail and complexity, revealing how IR choice critically impacts error rates. These insights provide actionable guidance for building resilient and transparent LLM-assisted simulation automation workflows."
YBHHYR4P,core,78,,Large-scale user study on AI-assistant over-reliance/overtrust and insecure code—directly a core oversight failure mode.,no,Do users write more insecure code with AI assistants?,Perry; Srivastava; Kumar et al.,2023,conferencePaper,coursework,yes,10.1145/3576915.3623157,2211.03622,"We conduct the first large-scale user study examining how users interact with an AI Code assistant to solve a variety of security related tasks across different programming languages. Overall, we find that participants who had access to an AI assistant based on OpenAI's codex-davinci-002 model wrote significantly less secure code than those without access. Additionally, participants with access to an AI assistant were more likely to believe they wrote secure code than those without access to the AI assistant. Furthermore, we find that participants who trusted the AI less and engaged more with the language and format of their prompts (e.g. re-phrasing, adjusting temperature) provided code with fewer security vulnerabilities. Finally, in order to better inform the design of future AI-based Code assistants, we provide an in-depth analysis of participants' language and interaction behavior, as well as release our user interface as an instrument to conduct similar studies in the future."
ETHYCZEC,core,72,,Empirical analysis of AI-authored vs human PR rejection rates and failure modes directly addresses code-review oversight of autonomous coding agents.,no,Different by design: understanding human-AI collaboration through GitHub pull requests,K. Gonzalez; M. El Mezouar,2025,conferencePaper,ieee,no,10.1109/CASCON66301.2025.00110,,"Autonomous Coding Agents (ACAs) such as GitHub Copilot, Claude Code, and Cursor are transitioning from assistive back-pocket tools to active contributor status in collaborative software engineering projects. Their growing foothold raises questions about generated code quality, pull request (PR) acceptance rates and influencing factors, and long-term project impact. Building on the AIDev dataset, we conduct an investigation of how AI-authored PRs compare against human-authored PRs. We take the original descriptive study a step further by augmenting the AIDev dataset, deriving additional structural and linguistic metrics, and performing statistical analyses. We report statistically significant differences in rejection rates across distinct agent types and outline efforts to manually label failure modes in rejected AI PR and to track different maintainability impacts. This project aims to bridge descriptive characterization with predictive and diagnostic insight, laying yet another layer on the foundation for advancing tomorrow's ACAs."
VFZXPDJX,context,52,,"Machine-guided human code inspection with a concrete risk-scoring mechanism, transferable to AI-code oversight though not AI-generated code.",yes,Enhancing human-machine pair inspection with risk number and code inspection diagram,Dai; Liu; Xu,2024,journalArticle,coursework,yes,10.1007/s11219-024-09674-4,,"Software inspection is a widely-used approach to software quality assurance. Human-Machine Pair Inspection (HMPI) is a novel software inspection technology proposed in our previous work, which is characterized by machine guiding programmers to inspect their own code during programming. While our previous studies have shown the effectiveness of HMPI in telling risky code fragments to the programmer, little attention has been paid to the issue of how the programmer can be effectively guided to carry out inspections. To address this important problem, in this paper we propose to combine Risk Number with Code Inspection Diagram (CID) to provide accurate guidance for the programmer to efficiently carry out inspections of his/her own programs. By following the Code Inspection Diagram, the programmer will inspect every checking item shown in the CID to efficiently determine whether it actually contain bugs. We describe a case study to evaluate the performance of this method by comparing its inspection time and number of detected errors with our previous work. The result shows that the method is likely to guide the programmer to inspect the faulty code earlier and be more efficient in detecting defects than the previous HMPI established based on Cognitive Complexity."
6SILTI7B,context,38,,"Practitioner playbook translating governance into engineering practice is transferable to org oversight practice, though it explicitly excludes policy and lacks code focus.",no,Responsible AI: a practitioner playbook for trustworthy AI governance,Sukanya P,2026,journalArticle,ssrn,no,,,"AI adoption has accelerated sharply across organisations, yet most governance efforts remain abstract or compliance-driven and do not translate into engineering / Broader topics such as data governance, regulatory compliance (e.g., EU AI Act), and organisational policy design are intentionally out of scope."
7V7SRG43,core,72,,"Multi-agent LLM code-review system with a supervisory QA-Checker oversight agent, evaluated on vulnerability and consistency tasks.",yes,CodeAgent: autonomous communicative agents for code review,Tang; Kim; Song et al.,2024,preprint,arxiv,no,,2402.02172,"Code review, which aims at ensuring the overall quality and reliability of software, is a cornerstone of software development. Unfortunately, while crucial, Code review is a labor-intensive process that the research community is looking to automate. Existing automated methods rely on single input-output generative models and thus generally struggle to emulate the collaborative nature of code review. This work introduces \tool{}, a novel multi-agent Large Language Model (LLM) system for code review automation. CodeAgent incorporates a supervisory agent, QA-Checker, to ensure that all the agents' contributions address the initial review question. We evaluated CodeAgent on critical code review tasks: (1) detect inconsistencies between code changes and commit messages, (2) identify vulnerability introductions, (3) validate code style adherence, and (4) suggest code revision. The results demonstrate CodeAgent's effectiveness, contributing to a new state-of-the-art in code review automation. Our data and code are publicly available (\url{https://github.com/Code4Agent/codeagent})."
UDT3AA4A,core,74,,"Survey of LLMs in software dev explicitly consolidating latent risks, developer over-reliance, and the need for governance and hybrid human-AI collaboration.",no,A survey on the role of LLMs in AI-based software development: augmentation and latent risks,M. B. Rashid; M. S. J. Hossain; M. I. Khan et al.,2025,conferencePaper,ieee,no,10.1109/BigData66926.2025.11401846,,"Large Language Models (LLMs) such as GPT-4, Codex, Code Llama, Claude, and DeepSeek are increasingly shaping AI-based software development. Their role is inherently dual: on one side, LLMs augment established practices by enabling faster vulnerability detection, supporting secure code generation, and assisting in continuous threat modeling; on the other, they introduce latent risks through insecure code suggestions, data leakage, and adversarial misuse. This survey examines recent studies from 2020-2025 to assess how LLMs enhance traditional frameworks such as the Secure Development Lifecycle (SDL) and DevSecOps, while also identifying emerging risks that threaten long-term reliability and compliance. Case studies reveal both the acceleration of secure coding practices and the unintended propagation of unsafe patterns. Further, challenges such as dataset contamination, probabilistic outputs, scalability issues, and developer over-reliance amplify these risks. By consolidating empirical findings, benchmarking studies, and sector-specific applications, this survey provides a structured view of the opportunities and vulnerabilities posed by LLMs in AI-driven software engineering, underscoring the need for governance, dataset curation, and hybrid human-AI collaboration to ensure trustworthy adoption."
