item_key,bin,centrality,reason_code,rationale,in_human_50,title,authors,year,item_type,source,has_pdf,doi,arxiv_id,abstract
Q5RS3ZXV,context,48,,"AACT framework empirically reduces over-reliance on AI in human-AI decisions, transferable oversight mechanism but non-code task.",no,Understanding the effects of AI-assisted critical thinking on human-AI decision making,Tian; Amin; Yin,2026,preprint,arxiv,yes,,2602.10222,"Despite the growing prevalence of human-AI decision making, the human-AI team's decision performance often remains suboptimal, partially due to insufficient examination of humans' own reasoning. In this paper, we explore designing AI systems that directly analyze humans' decision rationales and encourage critical reflection of their own decisions. We introduce the AI-Assisted Critical Thinking (AACT) framework, which leverages a domain-specific AI model's counterfactual analysis of human decision to help decision-makers identify potential flaws in their decision argument and support the correction of them. Through a case study on house price prediction, we find that AACT outperforms traditional AI-based decision-support in reducing over-reliance on AI, though also triggering higher cognitive load. Subgroup analysis reveals AACT can be particularly beneficial for some decision-makers such as those very familiar with AI technologies. We conclude by discussing the practical implications of our findings, use cases and design choices of AACT, and considerations for using AI to facilitate critical thinking."
M74M3RFJ,context,55,,"Layered guardrail/assurance-case framework for LLM adversarial robustness and EU AI Act compliance (incl. code tasks) is a concrete, transferable governance framework.",yes,Developing assurance cases for adversarial robustness and regulatory compliance in LLMs,T. B. Momcilovic; D. Balta; B. Buesser et al.,2024,conferencePaper,ieee,no,10.1109/ISSREW63542.2024.00081,,"This paper presents an approach to developing assurance cases for adversarial robustness and regulatory compliance in large language models (LLMs). Focusing on both natural and code language tasks, we explore the vulnerabilities these models face, including adversarial attacks based on jailbreaking, heuristics, and randomization. We propose a layered framework incorporating guardrails at various stages of LLM deployment, aimed at mitigating these attacks and ensuring compliance with the EU AI Act. Our approach includes a meta-layer for dynamic risk management and reasoning, crucial for addressing the evolving nature of LLM vulnerabilities. We illustrate our method with two exemplary assurance cases, highlighting how different contexts demand tailored strategies to ensure robust and compliant AI systems."
5GB3K5C2,context,50,,"Runtime containment/policy-as-code oversight framework for autonomous AI actions is a transferable oversight mechanism, though not code-specific.",no,TRACE: a governance-first execution framework providing architectural assurance for autonomous AI operations,Elias Calboreanu,2026,journalArticle,ssrn,no,,,"Autonomous AI agents increasingly take actions against external systems in environments where mistakes are costly and where post-hoc logs are insufficient for governance / We introduce TRACE (Trusted Runtime for Autonomous Containment and Evidence), a governance-first execution framework that treats the execution agent as / autonomous agents, runtime containment, decision provenance, cryptographic evidence, formal verification, AI governance, reference monitor, policy-as-code / , NIST AI RMF"
62S6DFXY,context,45,,"Computable joint optimization of permission boundaries and monitoring thresholds is a concrete, transferable oversight-tuning mechanism, though for proxy AI not code.",no,"Computable design space exploration via governance frameworks: joint optimisation of permission boundaries, monitoring thresholds and user transparency policies (for proxy AI)",Wei Meng,2026,journalArticle,ssrn,no,,,"To support reproducible and auditable evaluation, this paper constructs a NIST-grade trajectorylevel hyper-simulation data protocol aligned with the NIST / AI RMF and GenAI Profile's 'governance-measurement-management' closed loop. / Proxy Artificial Intelligence, Constrained Bayesian Optimisation, Compliance Risk Control, Distribution Shift, Cognitive Graphs"
TQGFG8YC,context,33,,"Benchmarking framework that evaluates AI-generated code with reproducible metrics is transferable evaluation infra, but domain-specific and lacks a governance/oversight link.",no,AutoDFBench 1.0: a benchmarking framework for digital forensic tool testing and generated code evaluation,Wickramasekara; Mihiranga; Withanage et al.,2026,journalArticle,"arxiv,scopus",no,10.1016/j.fsidi.2026.302055,,"The National Institute of Standards and Technology (NIST) Computer Forensic Tool Testing (CFTT) programme has become the de facto standard for providing digital forensic tool testing and validation. However to date, no comprehensive framework exists to automate benchmarking across the diverse forensic tasks included in the programme. This gap results in inconsistent validation, challenges in comparing tools, and limited validation reproducibility. This paper introduces AutoDFBench 1.0, a modular benchmarking framework that supports the evaluation of both conventional DF tools and scripts, as well as AI-generated code and agentic approaches. The framework integrates five areas defined by the CFTT programme: string search, deleted file recovery, file carving, Windows registry recovery, and SQLite data recovery. AutoDFBench 1.0 includes ground truth data comprising of 63 test cases and 10,968 unique test scenarios, and execute evaluations through a RESTful API that produces structured JSON outputs with standardised metrics, including precision, recall, and F1 score for each test case, and the average of these F1 scores becomes the AutoDFBench Score. The benchmarking framework is validated against CFTT's datasets. The framework enables fair and reproducible comparison across tools and forensic scripts, establishing the first unified, automated, and extensible benchmarking framework for digital forensic tool testing and validation. AutoDFBench 1.0 supports tool vendors, researchers, practitioners, and standardisation bodies by facilitating transparent, reproducible, and comparable assessments of DF technologies. © 2026"
6UQMFSB8,discard,22,out-of-scope,A code-generation architecture/benchmark method for repo-level synthesis with no human-oversight or governance angle.,yes,Contract-coding: towards repo-level generation via structured symbolic paradigm,Lin; Zhao; Shi,2026,preprint,arxiv,yes,,2604.13100,"The shift toward intent-driven software engineering (often termed ""Vibe Coding"") exposes a critical Context-Fidelity Trade-off: vague user intents overwhelm linear reasoning chains, leading to architectural collapse in complex repo-level generation. We propose Contract-Coding, a structured symbolic paradigm that bridges unstructured intent and executable code via Autonomous Symbolic Grounding. By projecting ambiguous intents into a formal Language Contract, our framework serves as a Single Source of Truth (SSOT) that enforces topological independence, effectively isolating inter-module implementation details, decreasing topological execution depth and unlocking Architectural Parallelism. Empirically, while state-of-the-art agents suffer from different hallucinations on the Greenfield-5 benchmark, Contract-Coding achieves 47\% functional success while maintaining near-perfect structural integrity. Our work marks a critical step towards repository-scale autonomous engineering: transitioning from strict ""specification-following"" to robust, intent-driven architecture synthesis. Our code is available at https://github.com/imliinyi/Contract-Coding."
T72TU8B5,core,86,,"Directly about calibrating oversight/autonomy of coding agents based on developer trust, with a formative survey and system.",no,Hedwig: dynamic autonomy for coding agents under local oversight,Shukla; Feng; Wang et al.,2026,preprint,arxiv,yes,,2605.11495,"Despite coding agents' advances in handling increasingly complex tasks, their continued tendency to introduce unintended edits, subtle bugs, and scope drift that slip past code review means developers must still decide how much autonomy to grant them. However, existing approaches for setting an agent's level of autonomy, such as static permission settings or instruction files, cannot account for how developers' preferences for agent autonomy can shift across tasks and over time. We conducted a formative survey with 21 software engineers who use coding agents and found that they experience frustration with calibrating autonomy and have evolving preferences for level of oversight. Building on these insights, we present Hedwig, a CLI coding agent that dynamically adjusts its autonomy level based on developer-agent interactions across sessions. Rather than operating on a global, fixed autonomy configuration, Hedwig learns an evolving set of behavioral guidelines from developer decisions and feedback, reducing friction on work for which the agent has earned trust, while tightening oversight when the agent operates outside familiar territory. Hedwig demonstrates the potential of a new paradigm where agents intelligently adapt their level of autonomy based on user trust through active, longitudinal collaboration."
I8R2LX86,discard,30,quality-threshold-not-met,Conceptual sociotechnical essay on legitimacy of human participation with no operationalizable or empirical angle.,no,The geometry of human participation: the structural conditions of legitimacy in AI-mediated systems,Matthew Agustin,2026,journalArticle,ssrn,no,,,"Contemporary debates about artificial intelligence often focus on preserving ""uniquely human"" traits such as creativity, empathy, or judgment. human participation, role drift, responsibility allocation, algorithmic decisionmaking, sociotechnical systems, institutional legitimacy, human oversight"
WZXSSGRL,context,37,,"SLR+survey on GenAI for SDLC cybersecurity that flags reliability risks of AI outputs but centers on using GenAI for security, not oversight of AI-generated code.",no,Exploring the role of generative AI in enhancing cybersecurity in software development life cycle,Al-Hashimi; Khan; Alwageed et al.,2025,journalArticle,scopus,no,10.1016/j.array.2025.100509,,"Context: The rapid integration of Generative AI (GenAI) technologies in various sectors has introduced new opportunities and challenges. One of the areas where GenAI is gaining prominence is cybersecurity, particularly within the Software Development Life Cycle (SDLC). As cyber threats evolve, there is a growing need to explore innovative solutions to mitigate vulnerabilities during software development. Objectives: This study investigates the role of GenAI in enhancing cybersecurity in the SDLC. It examines current security practices, recent advancements in AI-driven security solutions, and the potential of GenAI to strengthen threat detection, vulnerability management, and risk mitigation. Additionally, the research identifies key opportunities and challenges associated with integrating GenAI into SDLC processes, highlighting its implications for secure software development and future industry practices. Methods: This research employs a mixed-methods approach to investigate the role of GenAI in cybersecurity. Specifically, it combines a Systematic Literature Review (SLR) with questionnaire-based data collection targeting software development and cyber defense experts. The SLR aims to identify prevailing themes and gaps, while the questionnaire gathers insights from IT professionals about their experiences and perspectives on GenAI systems. Results: Our research shows that GenAI technology enhances SDLC security by supporting development through vulnerability detection, threat modeling, secure coding practices, and incident response. However, our review shows that AI adoption introduces ethical risks alongside reliability issues with AI-created results and challenges to integrate it into standard development methods. Conclusion: The integration of GenAI into the SDLC offers significant potential for enhancing cybersecurity. While challenges such as algorithm transparency and the need for skilled professionals remain, the benefits of AI in proactive threat detection and response make it a promising tool for future cybersecurity strategies in software development. © 2025 The Authors"
MJDUMWUX,context,37,,Cross-framework compliance crosswalk (including human oversight clauses) maps the governance landscape but is not code-specific.,no,"Passporting compliance for AI: operationalising governance via a clause-level crosswalk across EU, ISO/IEC, NIST, and CoE frameworks",Albara Y. Alhazaileh,2026,journalArticle,ssrn,no,,,"of compliance artefacts, produced under one governance framework, to satisfy functionally equivalent obligations in another, subject to verification by / High alignment in risk management, transparency, and human oversight creates an immediate evidence-reuse corridor. / Compliance Passporting, AI governance interoperability, EU AI Act, NIST AI RMF, ISO/IEC 42001, Brussels Effect, Legal–Standards Entanglement"
VQTXS6R4,core,64,,"Agent-based automated review-comment generation is an operationalizable oversight-scaling mechanism, though evaluated mainly via text-similarity metrics.",no,Issue-oriented agent-based framework for automated review comment generation,Li; Wang; Thongtanunam et al.,2025,preprint,arxiv,yes,,2511.00517,"Code review (CR) is a crucial practice for ensuring software quality. Various automated review comment generation techniques have been proposed to streamline the labor-intensive process. However, existing approaches heavily rely on a single model to identify various issues within the code, limiting the model's ability to handle the diverse, issue-specific nature of code changes and leading to non-informative comments, especially in complex scenarios such as bug fixes. To address these limitations, we propose RevAgent, a novel agent-based issue-oriented framework, decomposes the task into three stages: (1) Generation Stage, where five category-specific commentator agents analyze code changes from distinct issue perspectives and generate candidate comments; (2) Discrimination Stage, where a critic agent selects the most appropriate issue-comment pair; and (3) Training Stage, where all agents are fine-tuned on curated, category-specific data to enhance task specialization. Evaluation results show that RevAgent significantly outperforms state-of-the-art PLM- and LLM-based baselines, with improvements of 12.90\%, 10.87\%, 6.32\%, and 8.57\% on BLEU, ROUGE-L, METEOR, and SBERT, respectively. It also achieves relatively higher accuracy in issue-category identification, particularly for challenging scenarios. Human evaluations further validate the practicality of RevAgent in generating accurate, readable, and context-aware review comments. Moreover, RevAgent delivers a favorable trade-off between performance and efficiency."
SI9LR7W3,context,42,,"Empirical finding that interpretability can lower human decision performance transfers to over-reliance/oversight limitations, though not code-specific.",no,"Why providing humans with interpretable algorithms may, counterintuitively, lead to lower decision-making performance",Timothy DeStefano; Katherine Kellogg; Michael Menietti et al.,2022,journalArticle,ssrn,no,,,"Interpretable AI, Artificial Intelligence, Machine Learning, Algorithm Aversion, AI Adoption, Firm Productivity, AI and Strategy, Human-in-the-loop Decision"
58FAJ59D,discard,22,out-of-scope,"Agentic attack/identity security with blockchain verification, off-core and a known false-positive class.",no,The infrastructure gap: why platform security cannot protect against agentic attacks,Tim Williams; James Lee; John Cosgrove et al.,2026,journalArticle,ssrn,no,,,"The November 2025 disclosure by Anthropic of a state-sponsored cyber espionage campaign using Claude Code as an autonomous attack orchestrator has sparked / The incident highlights the accelerating need for interoperable identity and trust mechanisms aligned with emerging global governance frameworks under / AI Agent Security, Agent Identity, Trust Infrastructure, Autonomous Systems, Behavioural Monitoring, Blockchain Verification, AI Governance, Smart Policy"
98A3UITB,context,52,,SLR on GenAI in enterprise architecture with concrete risk mapping and adaptive-governance/oversight findings transferable to AI-code oversight.,no,Impact and implications of generative AI for enterprise architects in agile environments: a systematic literature review,Kooy; Piest; Bemthuis,2025,preprint,arxiv,yes,,2510.22003,"Generative AI (GenAI) is reshaping enterprise architecture work in agile software organizations, yet evidence on its effects remains scattered. We report a systematic literature review (SLR), following established SLR protocols of Kitchenham and PRISMA, of 1,697 records, yielding 33 studies across enterprise, solution, domain, business, and IT architect roles. GenAI most consistently supports (i) design ideation and trade-off exploration; (ii) rapid creation and refinement of artifacts (e.g., code, models, documentation); and (iii) architectural decision support and knowledge retrieval. Reported risks include opacity and bias, contextually incorrect outputs leading to rework, privacy and compliance concerns, and social loafing. We also identify emerging skills and competencies, including prompt engineering, model evaluation, and professional oversight, and organizational enablers around readiness and adaptive governance. The review contributes with (1) a mapping of GenAI use cases and risks in agile architecting, (2) implications for capability building and governance, and (3) an initial research agenda on human-AI collaboration in architecture. Overall, the findings inform responsible adoption of GenAI that accelerates digital transformation while safeguarding architectural integrity."
PD297DUM,core,80,,"Survey of developers' security perceptions of gen-AI code, quantifying overreliance and added security-review effort.",no,My code is less secure with gen AI: surveying developers' perceptions of the impact of code generation tools on security,Kudriavtseva; Hotak; Gadyatskaya,2025,conferencePaper,scopus,yes,10.1145/3672608.3707778,,"Background: Generative AI (GAI) tools like GitHub Copilot and ChatGPT are transforming software development by automating code generation and enhancing developers' productivity. However, since these tools are often trained on open-source repositories, they may inadvertently reproduce vulnerable code, raising concerns about the security of AI-generated outputs. Aims: In this paper, we aim to investigate how developers perceive code security when using GAI tools. Method: We conducted a survey with 105 software developers with diverse experience levels to gather their perceptions regarding the security of generated code and their suggestions for improving it. Results: While developers reported increased development speed when using GAI tools, many spend additional time on security reviews and documentation of the generated code, and they are worried about the overreliance on AI and vulnerabilities in the code. Only about a quarter of the developers expressed confidence in the code generated by AI, and, moreover, experienced developers perceive that their proficiency in secure coding decreases when using GAI tools. Our results provide organizations with a better understanding of the risks associated with GAI tools and help improve their software security programs. Copyright © 2025 held by the owner/author(s)."
RLCF33SM,context,38,,"Machine-readable deployment-authorization governance with concrete risk/control/auditability dimensions, transferable to high-risk AI-code governance.",no,AI deployment authorisation: a global standard for machine-readable governance of high-risk artificial intelligence,Daniel Djan Saparning,2026,journalArticle,ssrn,no,,,"legally and economically grounded dimensions: Risk, Alignment, Externality, Control, and Auditability, derived from safety engineering, alignment theory, algorithmic / accountability, and liability economics. / Artificial intelligence governance, algorithmic accountability, AI safety certification, deployment authorisation, insurance-based regulation, safety-critical"
WEWQ9NTT,context,56,,"Multi-agent adversarial verification for human oversight (EU AI Act Art.14) matches a core oversight-mechanism type but is applied to employment/insurance AI, not code.",yes,Verified adversarial reasoning intelligence (VARI): multi-agent adversarial verification for regulated AI decision-making,Eric Swidey,2026,journalArticle,ssrn,no,,,"We previously demonstrated VARI as a reference architecture for EU AI Act Article 14 compliance in employment AI (Swidey, 2025). / The regulatory trajectory, including Article 14 of the EU AI Act, the Colorado AI Act (effective June 30, 2026), and the NAIC Model Bulletin, demands both / AI Governance, Adversarial Verification, Multi-Agent Systems, Legal AI, Insurance AI, Hallucination Detection, Algorithmic Discrimination, Per-Decision / Verification, EU AI Act Article 14"
EB9PFYBS,context,42,,Regulatory framing of human oversight in the EU AI Act (from weapons/international law) is a transferable governance concept but not code-specific.,no,From 'human control' in international law to 'human oversight' in the new EU act on artificial intelligence,Juliane Beck; Thomas Burri,2022,journalArticle,ssrn,no,,,"autonomous systems and ""human oversight"" of artificial intelligence in the light of the international legal discussions and the EU’s recent proposal for an AI / It also identifies some weaknesses of the draft EU AI Act and proposes ways of improving it. / Autonomous systems, Autonomous weapons, CCW, Artificial Intelligence, Machine Learning, EU Commission, Meaningful Human Control, Human Oversight, International"
PMSYQJQQ,discard,25,out-of-scope,"LLM clone-refactoring assistant vision focused on maintainability and IP risk, off-core with no human-oversight scaling angle.",yes,"Towards just-In-time, inclusive clone refactoring",P. Roy,2025,conferencePaper,ieee,no,10.1109/ICSME64153.2025.00099,,"Code clones are a well-known source of technical debt, often degrading software maintainability. Modern AI coding assistants can unintentionally introduce clones or even licenseincompatible code, posing maintenance and legal challenges. This research proposes a Large Language Model (LLM)-powered clone refactoring assistant that proactively detects duplicative code during development and suggests high-level refactorings. By bridging traditional clone detection with LLM-driven code generation or transformation, the approach aims to remove redundancies early while ensuring changes remain behavior preserving and legally compliant. The assistant will integrate into development workflows to prevent clone propagation, flag potential intellectual property risks, and incorporate developer feedback for explainable, trustworthy operation. We will evaluate its impact on code quality and developer productivity, and assess how AI enhancements influence long-term maintenance efforts."
GMU2V4QQ,discard,14,out-of-scope,"Prompt/component optimization for LLM program repair, purely technical with no oversight or governance dimension.",no,An empirical analysis of ESLint information components and their interactions in LLM-based program repair,S. Kang; J. Heo; E. Lee,2025,conferencePaper,ieee,no,10.1109/APSEC66846.2025.00084,,"Static analysis tools like ESLint are widely used for code quality assurance, yet optimizing their integration with LLM-based Automated Program Repair remains underexplored. While existing approaches typically use complete static analysis reports, the impact of individual information components and their interactions has received limited attention. This paper presents an empirical analysis of 12 ESLint information components’ impact on GPT-4 Turbo’s repair performance. Through experiments on the complete TFix test dataset (10,504 cases), we find: (1) Concise components (e.g., linter messages) show high performance per token, while verbose components show diminishing returns in combination. (2) Components exhibit interaction effects; some components with low individual performance show high importance in combinations. (3) Strategic component selection based on interaction analysis can achieve comparable performance to using all components while reducing token usage. Our findings suggest that prompt optimization for LLM-based APR can benefit from analyzing both individual component contributions and their interactions."
SMHWVB9J,context,55,,Robust experiments (N=970) on overreliance and automation shirking directly inform oversight-erosion mechanisms transferable to AI-code review.,no,"Designing human-automation redundancy: overreliance, automation shirking, and the operator’s dilemma",Doron Cohen; Yefim Roth; Jörg Rieskamp et al.,2025,journalArticle,ssrn,no,,,"In some cases, these systems might encourage automation shirking, a form of overreliance in which operators deliberately reduce monitoring and checking / Across three studies (N = 970), Serial increased automation shirking and accident risk. / Automation bias, Human in the loop, Decisions from experience, Human computer interaction, Underweighting of rare events, Socio-technical systems, Behavioral"
