item_key,bin,centrality,reason_code,rationale,in_human_50,title,authors,year,item_type,source,has_pdf,doi,arxiv_id,abstract
2ATF53D2,discard,20,out-of-scope,Pure capability benchmark comparing LLM vs human code quality with no oversight or governance link.,no,Can LLMs generate higher quality code than humans? An empirical study,M. T. Jamil; S. Abid; S. Shamail,2025,conferencePaper,ieee,no,10.1109/MSR66628.2025.00081,,"Large Language Models are being extensively used for AI-assisted programming and code generation. The challenge is to ensure that the generated code is not only functionally correct but also safe, reliable and trustworthy. In this direction, we conduct a comprehensive empirical analysis of AI-generated code to assess whether large language models (LLMs) can produce correct and higher-quality code than humans. We evaluate the code quality of 984 code samples generated by GPT-3.5-Turbo and GPT-4 using various prompt types (simple, instructional, and enhanced) against input queries from the HumanEval dataset. We also enhance the HumanEval benchmark by calculating code quality metrics for the human-written code it contains. Code quality metrics are calculated using established tools like Radon, Bandit, Pylint, and Complexipy, with human-written code serving as a baseline for comparison. To quantify performance, we employ the TOPSIS method to rank the models and human code by their proximity to ideal and anti-ideal code quality metrics. Our results demonstrate that GPT-4, when used with advanced prompts, produces code closest to the ideal solution, outperforming human-written code in several key metrics. Our work provides evidence that LLMs, when properly guided, can surpass human developers in generating high-quality code. Our code and datasets are available online."
9S7TPW3X,context,54,,"Empirically evaluates Copilot as an oversight mechanism for API misuse, surfacing strengths/limits of AI coding assistants but no org governance.",no,Can we trust the AI pair programmer? Copilot for API misuse detection and correction,S. Mondal; C. K. Roy; H. Wang et al.,2025,conferencePaper,ieee,no,10.1109/CASCON66301.2025.00025,,"API misuse introduces security vulnerabilities, system failures, and increases maintenance costs, all of which remain critical challenges in software development. Existing detection approaches rely on static analysis or machine learning-based tools that operate post-development, which delays defect resolution. Delayed defect resolution can significantly increase the cost and complexity of maintenance and negatively impact software reliability and user trust. AI-powered code assistants, such as GitHub Copilot, offer the potential for real-time API misuse detection within development environments. This study evaluates GitHub Copilot's effectiveness in identifying and correcting API misuse using MUBench, which provides a curated benchmark of misuse cases. We construct 740 misuse examples, manually and via AI-assisted variants, using correct usage patterns and misuse specifications. These examples and 147 correct usage cases are analyzed using Copilot integrated in Visual Studio Code. Copilot achieved a detection accuracy of 86.2 %, precision of $\mathbf{9 1. 2 \%}$, and recall of $\mathbf{9 2. 4 \%}$. It performed strongly on common misuse types (e.g., missing/call, null_check) but struggled with compound or context-sensitive cases. Notably, Copilot successfully fixed over 95% of the misuses it identified. These findings highlight both the strengths and limitations of AI-driven coding assistants, positioning Copilot as a promising tool for real-time pair programming and detecting and fixing API misuses during software development."
TLLPXSB5,context,57,,"Action-design-research security assessment framework addressing GenAI risks in software development with empirical evaluation, transferable governance angle.",no,Enhancing cloud security assessment frameworks for the generative AI era: an action design research approach,Pourbehzadi; Huong; Javidi et al.,2025,conferencePaper,scopus,no,,,"This study addresses how cloud security assessment frameworks can evolve to counter risks introduced by Generative AI (GAI) in software development. Using Action Design Research, we identify gaps between the Cloud Security Alliance's Consensus Assessments Initiative Questionnaire (CAIQ) and NIST's Secure Software Development Framework (SSDF), focusing on AI-specific security considerations. We developed enhanced assessment questions addressing both traditional and AI-specific vulnerabilities, then evaluated their effectiveness by analyzing cybersecurity disclosures in 50 cloud vendors' 10-K filings using GPT-40. Results reveal that while organizations implement traditional security measures, AI-specific practices-including model governance, adversarial testing, and incident response-remain underdeveloped. We contribute theoretical insights into evolving security frameworks and practical recommendations for strengthening cybersecurity in AI-driven cloud environments. © AMCIS 2025.All rights reserved."
UU8XQFGB,context,48,,"Tool for visualizing/annotating agent trajectories to enable human feedback and oversight, an oversight mechanism but demo-level and not code-focused.",no,Agent trajectory explorer: visualizing and providing feedback on agent trajectories,Desmond; Lee; Ibrahim et al.,2025,conferencePaper,scopus,yes,10.1609/aaai.v39i28.35350,,"Agentic systems interleave large language model (LLM) reasoning, tool usage, and tool observations over multiple iterations to tackle complex tasks. The raw data from an agent's problem-solving process (the agents' trajectory) is not an ideal format for human analysis and oversight. There is a need for tooling that converts this primary data into an easily navigable and understandable visual format for better human feedback. To address this opportunity, we developed the Agent Trajectory Explorer, a tool designed to help AI developers and researchers visualize, annotate, and demonstrate agent behavior. Copyright © 2025, Association for the Advancement of Artificial Intelligence (www.aaai.org). All rights reserved."
5HT7MJV3,context,48,,"Novel risk taxonomy for agentic-workflow drift/subversion governance in financial services with control architecture, transferable but domain- and not code-specific.",no,Agentic workflow drift and agentic workflow subversion: a new risk taxonomy for the governance of agentic AI in financial services,Maureen Doyle-Spare,2026,journalArticle,ssrn,no,,,"As agentic AI moves into workflow orchestration, a new failure mode is emerging workflows that execute correctly against definitions that were never explicitly / author's knowledge, the first risk taxonomy developed specifically for the reasoning layer of agentic AI systems in financial services, reframing AI risk / Knowledge Graph, AI Governance, Operational Risk, Control Architecture, Banking Controls, Agentic AI, Model Risk Management, Financial Regulation, Workflow"
8IQR9PNB,context,63,,"Controlled empirical study of how increasing coding-agent autonomy shifts workflows, surfacing the over-reliance/understanding-agent-behavior oversight challenge.",no,Code with me or for me? How increasing AI automation transforms developer workflows,Chen; Talwalkar; Brennan et al.,2026,conferencePaper,acm,yes,10.1145/3772318.3790850,2318.37908,"Developers now have access to a growing array of increasingly autonomous AI tools for software development. While many studies examine copilots that provide chat assistance or code completions, evaluations of coding agents—which can automatically write files and run code—still rely on static benchmarks. We present the first controlled study of developer interactions with coding agents, characterizing how more autonomous AI tools affect productivity and experience. We evaluate two leading copilot and agentic coding assistants, recruiting participants who regularly use the former. Our results show agents can assist developers in ways that surpass copilots (e.g., completing tasks humans may not have accomplished) and reduce the effort required to finish tasks. Yet challenges remain for broader adoption, including ensuring users adequately understand agent behaviors. Our findings reveal how workflows shift with coding agents and how interactions differ from copilots, motivating recommendations for researchers and highlighting challenges in adopting agentic systems."
XBK7KB3E,context,45,,"Concrete human-in-the-loop evaluation/oversight pipeline for generative AI, transferable but not code-specific.",no,From annotation to oversight: a pipeline approach to generative AI evaluation,Hyein Ko; Yuehong Cassandra Tai; Nora Webb Williams,2025,journalArticle,ssrn,no,,,"Evaluation-testing whether performance holds across different prompts, models, and contexts; (4) Rationale and Oversight-auditing model explanations and requiring human-in-the-loop / We emphasize transparency throughout: researchers should report multiple validation metrics and incorporate human review against gold-standard data. / Generative AI, Evaluation Metrics, Large Language Models, Data Generation"
MQ5KZQTX,core,72,,"Interview study of how engineers perceive/trust/adopt LLM-assisted code review vs peers, directly on human engagement and over-reliance in oversight.",yes,Human and machine: how software engineers perceive and engage with AI-assisted code reviews compared to their peers,A. Alami; N. Ernst,2025,conferencePaper,ieee,no,10.1109/CHASE66643.2025.00016,,"The integration of artificial intelligence (AI) continues to increase and evolve, including in software engineering (SE). This integration involves processes traditionally entrusted to humans, such as coding. However, the impact on sociotechnical processes like code review remains underexplored. In this interview-based study (20 interviewees), we investigate how software engineers perceive and engage with Large Language Model (LLM)-assisted code reviews compared to human peerled reviews. In this inherently human-centric process, we aim to understand how software engineers navigate the introduction of AI into collaborative workflows. We found that engagement in code review is multi-dimensional, spanning cognitive, emotional, and behavioral dimensions. The introduction of LLM-assisted review impacts some of these attributes. For example, there is less need for emotional regulation and coping mechanisms when dealing with an LLM compared to peers. However, the cognitive load sometimes is higher in dealing with LLM-generated feedback due to its excessive details. Software engineers use a similar sense-making process to evaluate and adopt feedback suggestions from their peers and the LLM. However, the LLM feedback adoption is constrained by trust and lack of context in the review. Our findings contribute to a deeper understanding of how AI tools are impacting SE socio-technical processes and provide insights into the future of AI-human collaboration in SE practices."
HDVEI6LK,discard,10,out-of-scope,Benchmark data-leakage/memorization methodology with no governance or human-oversight angle.,no,Are large language models memorizing bug benchmarks?,D. Ramos; C. Mamede; K. Jain et al.,2025,conferencePaper,ieee,no,10.1109/LLM4Code66737.2025.00005,,"Large Language Models (LLMs) have become integral to various software engineering tasks, including code generation, bug detection, and repair. To evaluate model performance in these domains, numerous bug benchmarks containing real-world bugs from software projects have been developed. However, a growing concern within the software engineering community is that these benchmarks may not reliably reflect true LLM performance due to the risk of data leakage. Despite this concern, limited research has been conducted to quantify the impact of potential leakage.In this paper, we systematically evaluate popular LLMs to assess their susceptibility to data leakage from widely used bug benchmarks. To identify potential leakage, we use multiple metrics, including a study of benchmark membership within commonly used training datasets, as well as analyses of negative log-likelihood and 5-gram accuracy. Our findings show that certain models, in particular codegen-multi, exhibit significant evidence of memorization in widely used benchmarks like Defects4J, while newer models trained on larger datasets like LLaMa 3.1 exhibit limited signs of leakage. These results highlight the need for careful benchmark selection and the adoption of robust metrics to adequately assess models capabilities."
SHAIEC8U,discard,26,out-of-scope,"Transformer benchmark comparison for generating review comments, a capability study with no governance or human-oversight link.",yes,Transformer models for code review comment generation: a performance comparison on GitHub data,Y. Gogri; A. Panchal; Y. Khatri et al.,2025,conferencePaper,ieee,no,10.1109/AIMV66517.2025.11203699,,"Automated code review is an essential aspect of modern software development, enhancing code quality and maintainability. In this study, the performance of four pre-trained transformer based models T5-Small, CodeT5-Base, CodeBERT, and T5-Base for generating review comments on Python code changes were compared. A custom dataset gathered from GitHub pull request reviews is used to fine-tune each model on structured metadata, encompassing filenames, diff hunks, code modifications, and developer feedback. Evaluation metrics using BLEU score, ROUGE score, and human assessment shows that T5-Small achieves strong results despite its smaller size, generating contextually relevant and readable comments. CodeT5-Base also performs well, leveraging its code-specific pretraining, while CodeBERT excels in representing code, but struggles with fluent text generation. T5-Base, despite being larger, does not significantly outperform the smaller models. These findings highlight the efficiency of lightweight models like T5-Small in automated code review while underscoring the trade-offs between model size, fluency, and domain-specific performance."
HCQSZWZR,discard,27,out-of-scope,"SOC/SOAR security-incident automation where AI-generated code is incidental and the oversight is over incident response, not over AI code in a dev pipeline.",yes,Toward robust security orchestration and automated response in security operations centers with a hyper-automation approach using agentic artificial intelligence,Kurnia; Brata; Nelistiani et al.,2025,journalArticle,"arxiv,scopus",no,10.3390/info16050365,,"The evolving landscape of cybersecurity threats demands the modernization of Security Operations Centers (SOCs) to enhance threat detection, response, and mitigation. Security Orchestration, Automation, and Response (SOAR) platforms play a crucial role in addressing operational inefficiencies; however, traditional no-code SOAR solutions face significant limitations, including restricted flexibility, scalability challenges, inadequate support for advanced logic, and difficulties in managing large playbooks. These constraints hinder effective automation, reduce adaptability, and underutilize analysts’ technical expertise, underscoring the need for more sophisticated solutions. To address these challenges, we propose a hyper-automation SOAR platform powered by agentic-LLM, leveraging Large Language Models (LLMs) to optimize automation workflows. This approach shifts from rigid no-code playbooks to AI-generated code, providing a more flexible and scalable alternative while reducing operational complexity. Additionally, we introduce the IVAM framework, comprising three critical stages: (1) Investigation, structuring incident response into actionable steps based on tailored recommendations, (2) Validation, ensuring the accuracy and effectiveness of executed actions, (3) Active Monitoring, providing continuous oversight. By integrating AI-driven automation with the IVAM framework, our solution enhances investigation quality, improves response accuracy, and increases SOC efficiency in addressing modern cybersecurity threats. © 2025 by the authors."
5Q4G4CQB,core,76,,Empirically examines LLM-automated code review in CI with explicit findings on the need for human supervision to manage risks at scale.,no,AI-driven continuous integration: automating code review and deployment with LLMs,D. O. Salem; Y. Alahmed; R. Fnich et al.,2025,conferencePaper,"ieee,scopus,wos",no,10.1109/FMEC65595.2025.11119365,,"The integration of a Large Language Models (LLMs) into Continuous Integration (CI) pipelines greatly enhances the efficiency of the software development process. AI-based CI improves code quality by decreasing integration failure rates by 30 % and deployment time by 40 %. These models help in identifying bugs, enforcing coding standards, writing unit tests, and optimizing release management. But AIdriven CI comes with risks of security vulnerabilities, model bias and the need for human supervision. This paper uses case studies, surveys, and interviews to explore the effects of AI on CI/CD pipelines and identifies the pros and cons. The results of this search show that the use of AI in CI improves effectiveness, but it needs better oversight to avoid risks and improve model performance."
YJLK5FPA,discard,29,wrong-type,Constitutional/policy argument with a proposed enforcement layer but largely position-based with no evidence base or code relevance.,no,Ethics for oversight and protection the constitutional case for AI governance infrastructure,Basil Puglisi,2026,journalArticle,ssrn,no,,,"This paper makes the constitutional case for AI governance infrastructure, arguing that the American public does not need more AI regulation but rather / The paper introduces a three-tier distinction between Ethical AI, Responsible AI, and AI Governance, proposes GOPEL (Governance Orchestrator Policy Enforcement / AI Governance, Constitutional Oversight, Provider Plurality, GOPEL, Non-Cognitive Agent, Public Policy, AI Infrastructure, Automation Bias, Democratic"
EVIRWHTD,context,60,,"Formalizes vibe coding with a reference architecture and reviews security/maintainability risks, but oversight mechanism is largely conceptual.",no,Vibe coding: toward an AI-native paradigm for semantic and intent-driven programming,Bamil,2025,preprint,arxiv,no,,2510.17842,"Recent advances in large language models have enabled developers to generate software by conversing with artificial intelligence systems rather than writing code directly. This paper introduces vibe coding, an emerging AI-native programming paradigm in which a developer specifies high-level functional intent along with qualitative descriptors of the desired ""vibe"" (tone, style, or emotional resonance). An intelligent agent then transforms those specifications into executable software. We formalize the definition of vibe coding and propose a reference architecture that includes an intent parser, a semantic embedding engine, an agentic code generator, and an interactive feedback loop. A hypothetical implementation is described. We compare vibe coding with declarative, functional, and prompt-based programming, and we discuss its implications for software engineering, human-AI collaboration, and responsible AI practice. Finally, we examine reported productivity gains and democratizing effects, review recent studies that highlight vulnerabilities and potential slowdowns, identify key challenges such as alignment, reproducibility, bias, explainability, maintainability, and security, and outline future directions and open research questions."
YXKHSW6S,context,43,,Meaningful human control for algorithmic error detection is a transferable oversight concept but legal/general rather than code-focused.,no,Meaningful human control to detect algorithmic errors,Winston Maxwell,2023,journalArticle,ssrn,no,,,"to the October 6, 2020 ruling of the CJEU, many other statutes and court decisions require human control over algorithmic decisions: the EU’s proposed AI / I will not discuss in this article the other objectives linked to human control, including its role in allocating liability and in demonstrating compliance / human control, AI, artificial intelligence, explainability, meaningful human control, GDPR, AI Act, human rights, error detection, Ligue des droits humains"
KGAV77U3,context,42,,"Capability benchmark, but its evidence that LLM self-diagnosis/repair fails is a transferable limitation of automated (self-)oversight.",yes,VIBEPASS: can vibe coders really pass the vibe check?,Bansal; Fangkai; Zhou et al.,2026,preprint,arxiv,no,,2603.15921,"As Large Language Models shift the programming toward human-guided ''vibe coding'', agentic coding tools increasingly rely on models to self-diagnose and repair their own subtle faults -- a capability central to autonomous software engineering yet never systematically evaluated. We present \name{}, the first empirical decomposition that jointly evaluates two coupled tasks: \emph{Fault-Triggering Test Generation (FT-Test)} constructing a discriminative witness that exposes a latent bug, and \emph{Fault-targeted Program Repair (FPR)}, repairing it under varying diagnostic conditions. \name{} pairs competitive programming problems with LLM-generated solutions that pass partial test suites but fail on semantic edge cases, enabling controlled identification of where the diagnostic chain breaks down. Evaluating 12 frontier LLMs, we find that fault-targeted reasoning does not scale with general coding ability. Models produce syntactically valid test inputs at near-ceiling rates yet collapse on discriminative generation, with fault hypothesis generation -- not output validation -- as the dominant bottleneck. Test-guided repair reveals a complementary insight: when self-generated tests successfully witness a fault, the resulting repair matches or outperforms repair guided by externally provided tests, but tests that fail to witness the fault actively degrade repair below unguided baselines. Together, these results reframe the challenge of autonomous debugging: the binding bottleneck is not code synthesis or test validity but fault-target reasoning, a capability that remains deficient across all frontier models. As Large Language Models shift the programming toward human-guided ''vibe coding'', agentic coding tools increasingly rely on models to self-diagnose and repair their own subtle faults -- a capability central to autonomous software engineering yet never systematically evaluated."
QNHBEIHD,context,48,,"Large-scale measurement of vulnerabilities in LLM-generated code, evidencing the AI-code risk problem but no oversight mechanism.",no,LLMs in web development: evaluating LLM-generated PHP code unveiling vulnerabilities and limitations,Tóth; Bisztray; Erdődi,2024,conferencePaper,scopus,no,10.1007/978-3-031-68738-9_34,,"This study evaluates the security of web application code generated by Large Language Models, analyzing 2,500 GPT-4 generated PHP websites. These were deployed in Docker containers and tested for vulnerabilities using a hybrid approach of Burp Suite active scanning, static analysis, and manual review. Our investigation focuses on identifying Insecure File Upload, SQL Injection, Stored XSS, and Reflected XSS in GPT-4 generated PHP code. This analysis highlights potential security risks and the implications of deploying such code in real-world scenarios. Overall, our analysis found 2,440 vulnerable parameters. According to Burp’s Scan, 11.56% of the sites can be straight out compromised. Adding static scan results, 26% had at least one vulnerability that can be exploited through web interaction. Certain coding scenarios, like file upload functionality, are insecure 78% of the time, underscoring significant risks to software safety and security. The main contribution of our research is the creation of a methodology, that allows benchmarking LLMs for deployable PHP code generation, where the investigated property is secure code generation. We have made the source codes and a detailed vulnerability record for each GPT-4 generated sample publicly available to support further research: https://github.com/Beckyntosh/ChatPHP. This study emphasizes the crucial need for thorough testing and evaluation if generative AI technologies are used in software development. © The Author(s), under exclusive license to Springer Nature Switzerland AG 2024."
TJH7QFAX,core,70,,Proposes a code-health metric to identify where AI edits are lower risk versus where additional human oversight is warranted at scale.,no,"Code for machines, not just humans: quantifying AI-friendliness with code health metrics",Borg; Hagatulah; Tornhill et al.,2026,preprint,arxiv,yes,,2601.02200,"We are entering a hybrid era in which human developers and AI coding agents work in the same codebases. While industry practice has long optimized code for human comprehension, it is increasingly important to ensure that LLMs with different capabilities can edit code reliably. In this study, we investigate the concept of ``AI-friendly code'' via LLM-based refactoring on a dataset of 5,000 Python files from competitive programming. We find a meaningful association between CodeHealth, a quality metric calibrated for human comprehension, and semantic preservation after AI refactoring. Our findings confirm that human-friendly code is also more compatible with AI tooling. These results suggest that organizations can use CodeHealth to guide where AI interventions are lower risk and where additional human oversight is warranted. Investing in maintainability not only helps humans; it also prepares for large-scale AI adoption."
