item_key,title,authors,year,item_type,abstract
KKSWIRKC,Perfecting AI agent frameworks through unified design principles,Lopez; Ramos; Arranz,2026,conferencePaper,"Large language model (LLM) agents now power applications ranging from code generation to enterprise knowledge orchestration, yet available frameworks remain polarized. Research prototypes deliver transparent reasoning loops and pedagogical clarity, whereas production toolkits emphasize operational resilience, safety, and deployment tooling. This paper synthesizes these perspectives into a unified architecture that balances theory and practice. We articulate design principles centered on modularity, explainability, safety-by-default, and observability-first execution. Building on these principles, we propose a layered stack covering deliberation policies, orchestration engines, model abstraction, tool and service ecosystems, execution environments, and monitoring/governance planes. We illustrate how interoperable interfaces support cross-language implementations, how context propagation enables rich tool use and grounding, and how guardrails, evaluation pipelines, and deployment workflows can be embedded from the outset. The result is a pedagogical yet production-ready blueprint that educators, students, and developers can leverage to construct resilient agentic systems. We conclude with open research directions spanning evaluation benchmarks, self-improving policies, and multimodal orchestration, positioning the unified framework as a foundation for responsible innovation in the agent era. © 2026 by SCITEPRESS-Science and Technology Publications, Lda."
Z3P3I6A9,"Open source, hidden costs: a systematic literature review on OSS license management",Li; Liu; Fan et al.,2025,journalArticle,"Integrating third-party software components is a common practice in modern software development, offering significant advantages in terms of efficiency and innovation. However, this practice is fraught with risks related to software licensing. A lack of understanding may lead to disputes, which can pose serious legal and operational challenges. To these ends, both academia and industry have conducted various investigations and proposed solutions and tools to deal with these challenges. However, significant limitations still remain. Moreover, the rapid evolution of open-source software (OSS) licenses, as well as the rapidly incorporated generative software engineering techniques, such as large language models for code (CodeLLMs), are placing greater demands on the systematic management of software license risks. To unveil the severe challenges and explore possible future directions, we conduct the first systematic literature review (SLR) on 80 carefully selected OSS license-related papers, classifying existing research into three key categories, i.e., license identification, license risk assessment, and license risk mitigation. Based on these, we discuss challenges in existing solutions, conclude the opportunities to shed light on future research directions and offer practical recommendations for practitioners. We hope this thorough review will help bridge the gaps between academia and industry and accelerate the ecosystem-wide governance of legitimate software risks within the software engineering community. © 1976-2012 IEEE."
PD297DUM,My code is less secure with gen AI: surveying developers' perceptions of the impact of code generation tools on security,Kudriavtseva; Hotak; Gadyatskaya,2025,conferencePaper,"Background: Generative AI (GAI) tools like GitHub Copilot and ChatGPT are transforming software development by automating code generation and enhancing developers' productivity. However, since these tools are often trained on open-source repositories, they may inadvertently reproduce vulnerable code, raising concerns about the security of AI-generated outputs. Aims: In this paper, we aim to investigate how developers perceive code security when using GAI tools. Method: We conducted a survey with 105 software developers with diverse experience levels to gather their perceptions regarding the security of generated code and their suggestions for improving it. Results: While developers reported increased development speed when using GAI tools, many spend additional time on security reviews and documentation of the generated code, and they are worried about the overreliance on AI and vulnerabilities in the code. Only about a quarter of the developers expressed confidence in the code generated by AI, and, moreover, experienced developers perceive that their proficiency in secure coding decreases when using GAI tools. Our results provide organizations with a better understanding of the risks associated with GAI tools and help improve their software security programs. Copyright © 2025 held by the owner/author(s)."
P837LJWE,Modernization of enterprise payment infrastructure: a case study on LLM-assisted migration of legacy distributed systems,Bhatnagar,2026,journalArticle,"Context: Modernizing mission-critical financial infrastructure is often impeded by the compounding technical debt and architectural inertia of decade-old frameworks. In high-volume environments, these legacy C# implementations pose significant obstacles to cloud-native scalability and PCI compliance. Objectives: This study explores a resource-efficient modernization strategy that utilizes Large Language Models (LLMs) as strategic “thinking partners.” The research specifically investigates the redesign of intricate session management and deeply coupled dependencies, prioritizing low-risk operational continuity over a volatile system replacement. Methods: Employing an industrial case study methodology following Runeson and Höst guidelines, the research details the transition of a legacy distributed system to a cloud-native architecture (GCP Cloud Run/AdonisJS). The migration was governed by a Human-in-the-Loop (HITL) framework, in which AI-driven proposals were rigorously manually validated and refined using constraints. Performance was evaluated across 10 independent test cycles (N=100), mirroring peak-load production volume. Results: The HITL-governed workflow achieved 50% compression of the development lifecycle (change lead time) compared to traditional benchmarks. Post-migration metrics indicated a successful decoupling of monolithic components, resulting in a 67% normalized reduction in anomalous runtime events and a statistically significant 57% reduction in mean response latency (p < 0.001) during peak-load simulations. Conclusion: This research demonstrates that LLMs can substantially mitigate the fiscal and operational overhead of legacy migration when integrated into a structured HITL framework. This acceleration suggests a fundamental evolution in the Senior Software Engineer's mandate—pivoting from manual implementation toward strategic architectural orchestration and high-fidelity validation. © 2026 The Author"
K356ZE43,Mitigating bias in generative AI: a comprehensive framework for governance and accountability,Tang; Zhu,2024,journalArticle,"The pervasive risk of bias in generative artificial intelligence (AI) systems necessitates robust measures to protect public rights and enhance regulatory effectiveness. Addressing bias across the lifecycle of AI products—from data collection and training to modeling and application—requires legal and technical strategies tailored to each layer of potential bias. Current regulatory frameworks, such as China's “Interim Measures for the Administration of Generative AI Service,” lack specific guidelines to mitigate bias in AI decision-making. Global regulatory frameworks are still developing, underscoring the need for a comprehensive governance structure that defines the scope of regulation, implements layered measures to address bias, and allocates liability among platform developers. © 2024 by the authors."
QNHBEIHD,LLMs in web development: evaluating LLM-generated PHP code unveiling vulnerabilities and limitations,Tóth; Bisztray; Erdődi,2024,conferencePaper,"This study evaluates the security of web application code generated by Large Language Models, analyzing 2,500 GPT-4 generated PHP websites. These were deployed in Docker containers and tested for vulnerabilities using a hybrid approach of Burp Suite active scanning, static analysis, and manual review. Our investigation focuses on identifying Insecure File Upload, SQL Injection, Stored XSS, and Reflected XSS in GPT-4 generated PHP code. This analysis highlights potential security risks and the implications of deploying such code in real-world scenarios. Overall, our analysis found 2,440 vulnerable parameters. According to Burp’s Scan, 11.56% of the sites can be straight out compromised. Adding static scan results, 26% had at least one vulnerability that can be exploited through web interaction. Certain coding scenarios, like file upload functionality, are insecure 78% of the time, underscoring significant risks to software safety and security. The main contribution of our research is the creation of a methodology, that allows benchmarking LLMs for deployable PHP code generation, where the investigated property is secure code generation. We have made the source codes and a detailed vulnerability record for each GPT-4 generated sample publicly available to support further research: https://github.com/Beckyntosh/ChatPHP. This study emphasizes the crucial need for thorough testing and evaluation if generative AI technologies are used in software development. © The Author(s), under exclusive license to Springer Nature Switzerland AG 2024."
735ZR4IY,LLMs in coding and their impact on the commercial software engineering landscape,Belozerov; Barclay; Sami,2026,conferencePaper,"Large language model coding tools are now mainstream in software engineering. But as these same tools move human effort up the development stack, they present fresh dangers: 10% of real-world prompts leak private data, 42% of generated snippets hide security flaws, and the models can even ""agree"" with wrong ideas, a trait called sycophancy. We argue that firms must tag and review every AI-generated line of code, keep prompts and outputs within private or on-premises deployments, obey emerging safety regulations, and add tests that catch sycophantic answers - so we can gain speed without losing security and accuracy."
