item_key,title,abstract,authors,year,item_type,sources,source_queue
HS7XQ5E6,"New legal paradigms regulating of artificial intelligence in healthcare: the advances, deficits and pitfalls of laws in the United States and the European union","The early responses toward AI regulation prioritised explorations of how to adapt existing laws to overcome the unique challenges posed by AI. / Digital exceptionalism reflects how novel laws are being devised to deal with those challenges, such as the EU's Artificial Intelligence Act (AI Act), / AI, Healthcare, Digital Exceptionalism, EU, US, AI Act, Law, Ethics",Barry Solaiman,2024,journalArticle,ssrn,maybe_queue
RX5DWQM9,Unveiling the enigma of shadow: ethical difficulties in the field of AI,"AI in the workplace is a double-edged sword. It’s powerful for progress but also risky. Well-managed Shadow AI, with a positive outlook, can unlock new levels of productivity, knowledge and a competitive risk associated with all AI outside strict IT rules is Shadow AI. Shadow AI often starts with well-meaning employees who just want to solve problems and work better with the help of AI technology. They’re not trying to break the rules, just find solutions. The potential benefits and risks of Shadow AI usage in organisations and their data privacy along with the data classification for secure Generative AI (GenAI) use were discussed with extensive review of literature and suggestions given. Shadow AI, the unauthorised use of AI tools within organisations, presents both opportunities and challenges. This work proposes a conceptual framework to help organisations navigate this complex landscape. The framework emphasises the importance of shadow AI for secure GenAI use, the development of an AI acceptable use policy and the implementation of employee training programs on responsible AI practices. Additionally, it highlights the need for robust security measures to monitor and control AI usage. By adopting this framework, organisations can mitigate the risks associated with Shadow AI, such as data breaches, legal issues and wasted resources while unlocking its potential benefits like enhanced decision-making, increased productivity and fostered innovation. The framework contributes to a future where AI adoption aligns with ethical principles, transparency and the greater good. © 2025 Babita Singla, Kumar Shalender and Nripendra Singh.",Catherine; Suresh; Mangaiyarkarasi; Jenefa,2025,journalArticle,,keep_queue
5T4I8VCK,The delegation dilemma:  why agentic AI requires organizational redesign,"This whitepaper argues that the central challenge of agentic AI adoption is organizational rather than technical. / By reframing agentic AI adoption as an organizational design problem, this paper explains why many initiatives stall after experimentation and clarifies / Organizational Redesign, Workflow Management, Agentic AI",Alok Khatri; Anisha Gyawali,2026,journalArticle,ssrn,keep_queue
S9THGNAU,Iterative proof-driven development LLM prompt,"This paper introduces Iterative Proof-Driven Development, a novel prompt engineering method designed to take advantage of GPT-4 level models that are able to follow detailed instructions. Iterative Proof-Driven Development is a structured prompt that outlines a test-driven process for solving complex mathematics and programming tasks. The prompt provides an LLM with instructions to decompose a problem into sub-problems, generate test cases, verify results, and integrate sub-solutions. While Chain of Thought (CoT) reasoning remains central to individual steps, the structured process ensures consistency and reliability. This method takes advantage of embedded code interpreters within chatbot user interfaces, enabling immediate execution, debugging, and iterative refinement without external tools. We demonstrate this prompting technique by guiding an LLM through the development of a small CSV processing library, illustrating each step and highlighting how the method ensures well-tested, logically consistent, and reliable outputs. Finally, we explore potential use cases, future directions for automation with agent-based systems (e.g., Langgraph), and the broader implications of prompt engineering for larger software development projects.",Bakharia,May ,conferencePaper,acm,maybe_queue
VCI88UZD,Human-certified module repositories for the AI age,"Human-Certified Module Repositories (HCMRs) are introduced in this work as a new architectural model for constructing trustworthy software in the era of AI-assisted development. As large language models increasingly participate in code generation, configuration synthesis, and multi-component integration, the reliability of AI-assembled systems will depend critically on the trustworthiness of the building blocks they use. Today's software supply-chain incidents and modular development ecosystems highlight the risks of relying on components with unclear provenance, insufficient review, or unpredictable composition behavior. We argue that future AI-driven development workflows require repositories of reusable modules that are curated, security-reviewed, provenance-rich, and equipped with explicit interface contracts. To this end, we propose HCMRs, a framework that blends human oversight with automated analysis to certify modules and support safe, predictable assembly by both humans and AI agents. We present a reference architecture for HCMRs, outline a certification and provenance workflow, analyze threat surfaces relevant to modular ecosystems, and extract lessons from recent failures. We further discuss implications for governance, scalability, and AI accountability, positioning HCMRs as a foundational substrate for reliable and auditable AI-constructed software systems.",Enyedi,2026,preprint,arxiv,keep_queue
JAFZYPX9,Understanding transparency in algorithmic accountability,"AI, Algorithmic Accountability, GDPR",Margot E. Kaminski,2020,journalArticle,ssrn,maybe_queue
KENBQV5P,EDA-aware RTL generation with large language models,"Large Language Models (LLMs) have become increasingly popular for generating RTL code. However, producing error-free RTL code in a zero-shot setting remains highly challenging even for state-of-the-art LLMs, often leading to issues that require manual, iterative refinement. This additional debugging process can dramatically increase the verification workload, underscoring the need for robust, automated correction mechanisms to ensure code correctness from the start. In this work, we introduce AIVRIL2, a self-verifying, LLM-agnostic agentic framework aimed at enhancing RTL code generation through iterative corrections of both syntax and functional errors. Our approach leverages a collaborative multi-agent system that incorporates feedback from error logs generated by EDA tools to automatically identify and resolve design flaws. Experimental results, conducted on the VerilogEval-Human benchmark suite, demonstrate that our framework significantly improves code quality, achieving nearly a 3.4× enhancement over prior methods. In the best-case scenario, functional pass rates of 77% for Verilog and 66% for VHDL were obtained, thus substantially improving the reliability of LLM-driven RTL code generation.",M. ul Islam; H. Sami; P. -E. Gaillardon; V. Tenace,31 M,conferencePaper,arxiv|ieee|scopus,maybe_queue
DW3Z57VW,Governing the machine: the case for artificial intelligence regulation in the United States,"Artificial intelligence has become governing infrastructure, shaping economic activity, political communication, and public decision-making. / It contends that a distinctly American regulatory framework-grounded in transparency, accountability, human oversight, and constitutional principles-is / Artificial Intelligence, AI Regulation, Technology Governance, Administrative State, Democratic Accountability, Federalism, Algorithmic Accountability, / Comparative Regulation, European Union Artificial Intelligence Act, U.S.",John Bougiamas,2026,journalArticle,ssrn,keep_queue
QDE6D4T2,"AI's new frontier: transforming entrepreneurship through acquisition, small, and micro businesses","Artificial intelligence (“AI”) is rapidly redefining the operational and competitive landscape for Entrepreneurship Through Acquisition (“ETA” / This paper advocates for a strategic, phased approach to AI adoption, emphasizing gradual implementation, robust human oversight, and leveraging AI as",Patrick Saul,2025,journalArticle,ssrn,maybe_queue
2V6BI2A7,"Governing ai In welfare delivery efficiency, exclusion and constitutional accountability","As governments increasingly deploy artificial intelligence (AI) in welfare delivery, efficiency gains are reshaping social protection systems worldwide / It proposes a constitutional-by-design framework anchored in five pillars: mandatory algorithmic impact assessments, human-in-the-loop safeguards, rights",Parneet Kaur,2026,journalArticle,ssrn,maybe_queue
GSZ94QNV,CORE: automating review recommendation for code changes,"Code review is a common process that is used by developers, in which a reviewer provides useful comments or points out defects in the submitted source code changes via pull request. Code review has been widely used for both industry and open-source projects due to its capacity in early defect identification, project maintenance, and code improvement. With rapid updates on project developments, code review becomes a non-trivial and labor-intensive task for reviewers. Thus, an automated code review engine can be beneficial and useful for project development in practice. Although there exist prior studies on automating the code review process by adopting static analysis tools or deep learning techniques, they often require external sources such as partial or full source code for accurate review suggestion. In this paper, we aim at automating the code review process only based on code changes and the corresponding reviews but with better performance. The hinge of accurate code review suggestion is to learn good representations for both code changes and reviews. To achieve this with limited source, we design a multi-level embedding (i.e., word embedding and character embedding) approachto represent the semantics provided by code changes and reviews. The embeddings are then well trained through a proposed attentional deep learning model, as a whole named CORE. We evaluate the effectiveness of CORE on code changes and reviews collected from 19 popular Java projects hosted on Github. Experimental results show that our model CORE can achieve significantly better performance than the state-of-the-art model (DeepMem), with an increase of 131.03% in terms of Recall@10 and 150.69% in terms of Mean Reciprocal Rank. Qualitative general word analysis among project developers also demonstrates the performance of CORE in automating code review.",J. K. Siow; C. Gao; L. Fan; S. Chen; Y. Liu,2020,conferencePaper,ieee,keep_queue
VZ27QUPQ,Identifying and mitigating API misuse in large language models,"API misuse in code generated by large language models (LLMs) presents a serious and growing challenge in software development. While LLMs demonstrate impressive code generation capabilities, their interactions with complex library APIs are often error-prone, potentially leading to software failures and vulnerabilities. In this paper, we conduct a large-scale study of API misuse patterns in LLM-generated code, analyzing both method selection and parameter usage across Python and Java, using three representative LLMs (StarCoder-7B, Qwen2.5-Coder-7B, and GitHub Copilot). Based on extensive manual annotation of 3,209 method-level and 3,492 parameter-level misuses, we identify and categorize four recurring misuse types by building on and refining prior API misuse taxonomies. Our evaluation of three widely used LLMs, StarCoder-7B, Qwen2.5-Coder-7B, and GitHub Copilot, reveals persistent challenges in API usage, particularly hallucination and intent misalignment. To address these issues, we propose Dr.Fix, an LLM-based automatic repair approach guided by our taxonomy. Dr.Fix improves repair accuracy compared to baseline prompting and existing repair methods, with gains of up to 38.4 BLEU and 40% in exact match on benchmark datasets. This work offers important insights into the current limitations of LLMs in API usage and provides insights into current limitations and points to directions for improving automated misuse repair in code generation systems.",T. Y. Zhuo; J. He; J. Sun; Z. Xing; D. Lo,2026,journalArticle,ieee,keep_queue
R29ICVM3,AI and auditing,"This literature review examines how artificial intelligence (AI) is transforming the auditing profession by reshaping its methods, ethics, and / Furthermore, the review discusses how explainable AI and ethics-based auditing frameworks can ensure fairness and auditability in AI systems. / Artificial Intelligence, Auditing, Explainable AI, Audit Quality, Ethical Governance, Algorithm Aversion, Continuous Assurance",Max Salaja,2025,journalArticle,ssrn,keep_queue
P7G4S8HG,AI and patents: the role of inventorship,"Although this remains a debated topic, patent law is more adaptable to AI use in crea:on compared to copyright law. / The rise of Generative AI, which assists inventors broadly, highlights these issues.",Herbert Zech,2024,journalArticle,ssrn,maybe_queue
2RF6C7QX,"Artificial intelligence, copyright and the public interest","To achieve a balance between rightsholders and the public in the age of generative AI (GenAI), it is necessary to redefine the concept of public / interest in copyright law. / Artificial Intelligence, Innovation, Creativity, Copyright, Public Interest",Artha Dermawan,2024,journalArticle,ssrn,maybe_queue
WDAHJR8T,Silent drift: how extended AI conversations systematically degrade in quality -and why users can't tell,"large language models, generative AI, ChatGPT, human-AI interaction, sycophancy, cognitive offloading, automation bias, AI decision-making, human oversight / , AI governance, market failure, epistemic trust, conversational AI JEL Codes: D83 (Search, Learning, Information and Knowledge), D82 (Asymmetric and Private",Michael Brogan,2026,journalArticle,ssrn,keep_queue
AHSCD698,The end of editorial scarcity: AI-collaborative authorship and the structural disruption of traditional publishing,"AI-collaborative authorship, publishing disruption, editorial scarcity, generative AI, large language models, copyright, Christensen, Benkler, self-publishing",Ivan Del Valle,2026,journalArticle,ssrn,maybe_queue
798K3IDW,A responsible & sustainable RAG (retrieval-augmented generation) validation pipeline,"believe that RS-RAG provides a Framework for deploying RAG Systems that are Intelligent, Reliable, Environmentally Responsible and Compliant with Emerging AI / Governance Standards. / RAG, Retrieval-Augmented Generation, Responsible AI, Sustainable AI, Model Validation, Grounding Evaluation, Knowledge Retrieval, Auditability, Carbon-Efficient",Gayathri Surianarayanan; Srikanth Singireddy; Abinaya Mettupatti Sivagnanam,2026,journalArticle,ssrn,maybe_queue
JZ64WDLQ,The fluid triad: a decision-first organizational model for human-agent teams,"AI tools (Anthropic Claude) were used for literature synthesis assistance, drafting support, and structural organization. / agentic AI, organizational design, human-agent teams, governance, selforganization, requisite variety, decision architecture, EU AI Act, multi-agent systems / , principal-agent alignment, Bayesian governance, sociotechnical systems, humanautonomy teaming, decision provenance JEL Codes: M10, O33, L20",Ioannis Stavridis,2026,journalArticle,ssrn,keep_queue
EAI9R74T,"Ethical implications of AI adoption in business strategy: a framework for responsible use in decision-making, hiring, marketing, and automation","AI Framework for Business. / The results have indicated the necessity of organizations to increase their AI adoption in line with the emerging ethical practices to build the trust / ethical AI, responsible AI, algorithmic bias, ethical recruiting, AI in targeting, ethics of automation",SHIEK MD ANWAR HUSSAIN MIZAN,2025,journalArticle,ssrn,maybe_queue
RBQZMXWT,Does pass rate tell the whole story? Evaluating design constraint compliance in LLM-based issue resolution,"Repository-level issue resolution benchmarks have become a standard testbed for evaluating LLM-based agents, yet success is still predominantly measured by test pass rates. In practice, however, acceptable patches must also comply with project-specific design constraints, such as architectural conventions, error-handling policies, and maintainability requirements, which are rarely encoded in tests and are often documented only implicitly in code review discussions. This paper introduces \textit{design-aware issue resolution} and presents \bench{}, a benchmark that makes such implicit design constraints explicit and measurable. \bench{} is constructed by mining and validating design constraints from real-world pull requests, linking them to issue instances, and automatically checking patch compliance using an LLM-based verifier, yielding 495 issues and 1,787 validated constraints across six repositories, aligned with SWE-bench-Verified and SWE-bench-Pro. Experiments with state-of-the-art agents show that test-based correctness substantially overestimates patch quality: fewer than half of resolved issues are fully design-satisfying, design violations are widespread, and functional correctness exhibits negligible statistical association with design satisfaction. While providing issue-specific design guidance reduces violations, substantial non-compliance remains, highlighting a fundamental gap in current agent capabilities and motivating design-aware evaluation beyond functional correctness.",Yu; Zhou; Zeng; Wang; Du,2026,preprint,arxiv,keep_queue
B8UB2KMJ,Artificial intelligence in clinical practice,"Findings indicate a lack of standardized guidelines, human oversight protocols, and provider training. / Artificial Intelligence, Nursing Informatics, Clinical Practice, Policy",Lauren M. Blanchette; Jane Carrington,2025,journalArticle,ssrn,maybe_queue
K7CBTSHL,Introduction to the foundations and regulation of generative AI,"Handbook of the Foundations and Regulation of Generative AI, outlining the key themes and questions surrounding the technical development, regulatory governance / Furthermore, the chapter extensively surveys both emerging and established regulatory frameworks, including the EU AI Act, the GDPR, privacy and personality / Generative AI, Artificial Intelligence Regulation, Large Language Models (LLMs), AI Governance, Algorithmic Transparency, AI Ethics, Foundation Models, / AI Act, GDPR, Copyright",Philipp Hacker; Andreas Engel; Sarah Hammer; Brent Mittelstadt,2025,journalArticle,ssrn,keep_queue
DG6LWQJU,Exploring the effects of urgency and reputation in code review an eye-tracking study,"The Pull-Based development model, a fundamental mechanism of collaboration in modern software engineering (SE), initiates the code review process when a contributor submits pull requests (PRs) for evaluation. Although the decision to approve or decline PRs is often perceived as grounded in their technical quality, prior research presents a more intricate narrative where both non technical factors-beyond the code itself and technical factors influence the acceptance. This study, uniquely integrating cues of urgency (represented by code priority level) and reputation (represented by the experience level of the code’s author), delves into these biases, leveraging eye-tracking technology to illuminate the cognitive processes underpinning the evaluation of PRs.In an experimentally-controlled study involving 37 participants reviewing Java code PRs, we found that perceived priority level of a PR impacted both the time spent on tasks and the associated cognitive load. Moreover, while participants’ behaviors reflected the influence of the priority level and the author’s experience, they remained largely unaware of these effects on their decision-making, highlighting the critical importance of understanding these implicit biases in code reviews. Interestingly, despite variations in attention when reviewing contributions from novice versus senior authors, there was no discernible difference in acceptance outcomes based on the author’s experience. This study takes the next step toward a better understanding of urgency and reputation in SE and may inform future research about code review platforms and guidelines, code reuse, and automated code generation.CCS CONCEPTS• Software and its engineering $\rightarrow$ Software creation and management.",S. Yabesi; M. Amini; J. Ristic; Z. Sharafi,2024,conferencePaper,ieee,keep_queue
7VSWYP64,Jigsaw: large language models meet program synthesis,"Large pre-trained language models such as GPT-3 [10], Codex [11], and Coogle's language model [7] are now capable of generating code from natural language specifications of programmer intent. We view these developments with a mixture of optimism and caution. On the optimistic side, such large language models have the potential to improve productivity by providing an automated AI pair programmer for every programmer in the world. On the cautionary side, since these large language models do not understand program semantics, they offer no guarantees about quality of the suggested code. In this paper, we present an approach to augment these large language models with post-processing steps based on program analysis and synthesis techniques, that understand the syntax and semantics of programs. Further, we show that such techniques can make use of user feedback and improve with usage. We present our experiences from building and evaluating such a tool Jigsaw, targeted at synthesizing code for using Python Pandas API using multi-modal inputs. Our experience suggests that as these large language models evolve for synthesizing code from intent, Jigsaw has an important role to play in improving the accuracy of the systems.",N. Jain; S. Vaidyanath; A. Iyer; N. Natarajan; S. Parthasarathy,2022,conferencePaper,ieee,keep_queue
