item_key,title,abstract,authors,year,item_type,sources,source_queue
ADV5GQEV,RegOps as an agile response to regulatory pressure,"Widely-applied Agile practices accelerate delivery but offer limited consideration of regulatory compliance. / Within the tension between agility and compliance, the concept of RegOps emerged from the strictly regulated industry, yet it remains underexplored in / RegOps, Regulatory Compliance, Agile, Complex Adaptive Systems Theory, EU AI Act",Nan Yang; Ali Mehraj; Xiaofeng Wang; David H¨astbacka; Kari Systä,2025,journalArticle,ssrn,keep_queue
FQZWY343,"Automated program repair with the GPT family, including GPT-2, GPT-3 and CodeX","Automated Program Repair (APR) is a promising approach for addressing software defects and improving software reliability. There are various approaches to APR, including using Machine Learning (ML) techniques such as neural networks and evolutionary algorithms, as well as more traditional methods such as static analysis and symbolic execution. In recent years, there has been growing interest in using ML techniques for APR, including the use of large language models such as GPT-2 and GPT-3. These models have the ability to generate human-like text and code, making them well-suited for tasks such as generating repair patches for defective programs. In this paper, we explore the use of the GPT family (including GPT-2, GPT-J-6B, GPT-3 and Codex) for APR of JavaScript programs and evaluate their performance in terms of the number and quality of repair patches generated. Our results show that these state-of-the-art language models are able to generate repair patches that successfully fix the defects in the JavaScript programs, with Codex performing slightly better overall. To be precise, in our self-assembled dataset, Codex was able to generate 108 repair patches that are exactly the same as the developer fix for the first try. If we consider multiple patch generations, up to 201 buggy programs are being repaired automatically from the 1559 evaluation dataset (12.89%).",M. Lajkó; V. Csuvik; T. Gyimothy; L. Vidács,2024,conferencePaper,ieee,maybe_queue
IIECQWIK,"Revolutionizing defect recognition in hard metal industry through AI explainability, human-in-the-loop approaches and cognitive mechanisms","Defect detection is one of the main areas that Industry 4.0 concepts like automation, IoT, digitization and AI aimed to provide solutions. In this work, a platform that extends the aforementioned concepts with ones coming from Industry 5.0 like reconciliation and collaboration between humans and machines is introduced. The proposed platform provides defect detection and localization services for hard metal industry by extending current AI solutions with exponentially growing technologies such as interpretable and explainable AI (XAI), human-in-the-loop (HITL) approaches and cognitive retraining mechanisms. In particular, the platform, that is built on a micro-service architecture to enable its software sustainability, is powered by machine and deep learning models for defect detection and localization. These models are able to recognize the defects, locate them with high precision and present them to end users so to maximize resiliency in quality inspection processes. Alongside the state-of-the-art AI algorithms that are utilized by the platform, the human in the loop mechanisms and interfaces that enable human experts to inject their knowledge for AI models training are considered as key innovative aspects of this work. To enhance further the human and AI collaboration, XAI mechanisms are included in the platform,to enable the experts to gain useful insights regarding the operation of the AI models in order to be able to provide further feedback that can trigger on-the-fly platform's cognition mechanisms to improve models' accuracy and performance.",Kotsiopoulos; Papakostas; Vafeiadis; Dimitriadis; Nizamis,2024,journalArticle,wos,maybe_queue
SN8B7PN8,Governing at a distance: the EU AI act and GDPR as pillars of global privacy and corporate governance,"defining feature of the AI Act is its extraterritorial scope, mirroring the reach of the General Data Protection Regulation (GDPR). / benchmark for AI regulation. / Artificial Intelligence, Privacy, Corporate Governance, GDPR, Compliance, European AI Act",Maria de Lourdes Haynes,2025,journalArticle,ssrn,keep_queue
I9A3AE35,"Mechanistic interpretability for large language model alignment: progress, challenges, and future directions","how interpretability insights have informed alignment strategies including reinforcement learning from human feedback (RLHF), constitutional AI, and scalable / oversight.",Usman Naseem,2026,journalArticle,ssrn,keep_queue
F5R9YQG3,Accountants and generative AI: hype or help?,"Findings-Generative AI is found to supports performance of key accounting functions including financial reporting, strategic decision-making (management accounting), risk / Thus, a cautious approach, with human oversight, is recommended for its use in accounting to ensure accuracy and accounting information reliability, confidentiality / Artificial Intelligence, ChatGPT Benefits and Risks, Accounting Information Risk, AI Adoption in Accounting Practice",Jude Edeigba,2025,journalArticle,ssrn,maybe_queue
2SRQ7Z6N,The “code” of ethics: a holistic audit of AI code generators,"AI-powered programming language generation (PLG) models have gained increasing attention due to their ability to generate source code of programs in a few seconds with a plain program description. Despite their remarkable performance, many concerns are raised over the potential risks of their development and deployment, such as legal issues of copyright infringement induced by training usage of licensed code, and malicious consequences due to the unregulated use of these models. In this article, we present the first-of-its-kind study to systematically investigate the accountability of PLG models from the perspectives of both model development and deployment. In particular, we develop a holistic framework not only to audit the training data usage of PLG models, but also to identify neural code generated by PLG models as well as determine its attribution to a source model. To this end, we propose using membership inference to audit whether a code snippet used is in the PLG model's training data. In addition, we propose a learning-based method to distinguish between human-written code and neural code. In neural code attribution, through both empirical and theoretical analysis, we show that it is impossible to reliably attribute the generation of one code snippet to one model. We then propose two feasible alternative methods: one is to attribute one neural code snippet to one of the candidate PLG models, and the other is to verify whether a set of neural code snippets can be attributed to a given PLG model. The proposed framework thoroughly examines the accountability of PLG models which are verified by extensive experiments. The implementations of our proposed framework are also encapsulated into a new artifact, named CodeForensic, to foster further research.",W. Ma; Y. Song; M. Xue; S. Wen; Y. Xiang,2024,journalArticle,ieee,keep_queue
QC3ANMVE,CISA roadmap for artificial intelligence,,Cybersecurity Infrastructure And Security Agency,2023,document,coursework,keep_queue
9SU5JRE2,"The files are in the computer: on copyright, memorization, and generative AI","The New York Times’s copyright lawsuit against OpenAI and Microsoft alleges that OpenAI’s GPT models have “memorized” Times articles. / First, not all learning is memorization: much of what generative-AI models do involves generalizing from large amounts of training data, not just memorizing / copyright, generative AI, memorization",A. Feder Cooper; James Grimmelmann,2024,journalArticle,ssrn,maybe_queue
TN2MR8S8,Assertion-aware test code summarization with large language models,"Unit tests often lack concise summaries that convey test intent, especially in auto-generated or poorly documented codebases. Large Language Models (LLMs) offer a promising solution, but their effectiveness depends heavily on how they are prompted. Unlike generic code summarization, test-code summarization poses distinct challenges because test methods validate expected behavior through assertions rather than implementing functionality. This paper presents a new benchmark of 91 real-world Java test cases paired with developer-written summaries and conducts a controlled ablation study to investigate how test code-related components-such as the method under test (MUT), assertion messages, and assertion semantics-affect the performance of LLM-generated test summaries. We evaluate four code LLMs (Codex, Codestral, DeepSeek, and Qwen-Coder) across seven prompt configurations using n-gram metrics (BLEU, ROUGE-L, METEOR), semantic similarity (BERTScore), and LLM-based evaluation. Results show that prompting with assertion semantics improves summary quality by an average of 0.10 points (2.3 %) over full MUT context (4.45 vs. 4.35) while requiring fewer input tokens. Codex and Qwen-Coder achieve the highest alignment with human-written summaries, while DeepSeek underperforms despite high lexical overlap. The replication package is publicly available at https://doi.org/10.5281/zenodo.17067550",A. H. Mollah; A. Aljohani; H. Do,2025,conferencePaper,ieee,maybe_queue
8D7KQ4N4,Artificial intelligence in IT recruitment: an empirical study of modern hiring practices,"This paper investigates the role of artificial intelligence (AI) in modernizing IT recruitment, with a focus on machine learning (ML), natural language / Results confirm that AI-driven tools substantially reduce manual workload and accelerate screening pipelines, yet human oversight remains indispensable / artificial intelligence, recruitment automation, IT talent acquisition, machine learning, algorithmic bias, HR analytics, predictive hiring",Abhishek Samuel Guntur,2026,journalArticle,ssrn,maybe_queue
EPIZ2QCL,The constitution and artificial intelligence: the future of rights and governance in India,"Since the state infuses the values of the constitution into the AI regulation mechanism, India shall essentially promote innovation in an environment that / The future of governance will depend not only on how AI is made but on how it is restrained by law. / Artificial Intelligence Governance, Constitutional Rights and AI, Algorithmic Bias and Accountability, AI Regulation in India, Ethical AI and Legal Oversight",Sneha Singh; Kashika Mittal,2025,journalArticle,ssrn,keep_queue
UEUU5SAU,Generative AI and legal aid: results from a field study and 100 use cases to bridge the access to justice gap,"While concerns remained, pilot participants were able to manage risks by focusing on lower-risk applications like document summarization, confirmatory / artificial intelligence, AI, generative AI, ChatGPT, Access to Justice, Automation, Legal Profession, Empirical Studies",Colleen V. Chien; Miriam Kim,2024,journalArticle,ssrn,maybe_queue
M7NRUSDC,Authorship in the age of artificial intelligence: a civil law approach,"Thanks to applications that fall under what mainstream is calling “generative AI”, it is now possible to generate images from mere descriptions or to construct / Artificial Intelligence, Copyright, French Law, Generative AI, Automated-Creations, Originality, Training Data, Imprint of the Data, Legal Personality",Efraín Fandiño López,2023,journalArticle,ssrn,maybe_queue
CXEL968T,The aegis of AI,"This paper proposes the beginnings of a legislative liability framework to regulate Artificial Intelligence (“AI”), particularly in the space of Generative / AI.",Timothy T. Hsieh,2024,journalArticle,ssrn,keep_queue
Y3FIWH34,RECOVER: toward requirements generation from stakeholders conversations,"Stakeholders' conversations requirements elicitation meetings hold valuable insights into system and client needs. However, manually extracting requirements is time-consuming, labor-intensive, and prone to errors and biases. While current state-of-the-art methods assist in summarizing stakeholder conversations and classifying requirements based on their nature, there is a noticeable lack of approaches capable of both identifying requirements within these conversations and generating corresponding system requirements. These approaches would assist requirement identification, reducing engineers' workload, time, and effort. They would also enhance accuracy and consistency in documentation, providing a reliable foundation for further analysis. To address this gap, this paper introduces RECOVER (Requirements EliCitation frOm conVERsations), a novel conversational requirements engineering approach that leverages natural language processing and large language models (LLMs) to support practitioners in automatically extracting system requirements from stakeholder interactions by analyzing individual conversation turns. The approach is evaluated using a mixed-method research design that combines statistical performance analysis with a user study involving requirements engineers, targeting two levels of granularity. First, at the conversation turn level, the evaluation measures RECOVER's accuracy in identifying requirements-relevant dialogue and the quality of generated requirements in terms of correctness, completeness, and actionability. Second, at the entire conversation level, the evaluation assesses the overall usefulness and effectiveness of RECOVER in synthesizing comprehensive system requirements from full stakeholder discussions. Empirical evaluation of RECOVER shows promising performance, with generated requirements demonstrating satisfactory correctness, completeness, and actionability. The results also highlight the potential of automating requirements elicitation from conversations as an aid that enhances efficiency while maintaining human oversight.",Voria; Casillo; Gravino; Catolino; Palomba,2025,journalArticle,wos,maybe_queue
RBKZILQD,Insuring AI: the role of insurance in artificial intelligence regulation,regulation. / This Article offers a framework for stakeholders and scholars working on AI regulation to take advantage of the current robust insurance system. / AI Regulation; Insurance Law; Liability Insurance; Artificial Intelligence Policy; Law and Technology; Insuring Emerging Technologies,Anat Lior,2022,journalArticle,ssrn,keep_queue
2TJGY5E5,Bespoke regulation of artificial intelligence,"Part III introduces the legislative carve-out as a potential instrument in AI governance. / Using the 21st Century Cures Act's exclusion of certain low-risk Clinical Decision Support (CDS) software from FDA oversight as a case study, it evaluates / artificial intelligence, AI, regulation, CDS, medical device, governance, FDA, policy, technology, equity, privacy, Clinical Decision Support, software",Brenda M. Simon,2025,journalArticle,ssrn,keep_queue
YZQ2CPSB,"AEON - a decentralized ethics framework for resonant superintelligence: a proposal for the next generation of non-power-based, self-limiting AI systems","AEON, artificial intelligence ethics, AI alignment, superintelligence, resonance-based AI, self-limiting AI, decentralized AI governance, emergent ethics",Gion Mario Pedrazzini,2025,journalArticle,ssrn,maybe_queue
XLZVTNUC,Cyber law and AI liability: focus on legal challenges of decision-making in court with real examples from European law (and a look at Iran),"In the evolving field of cyber law, AI governance frameworks often appear robust on paper, but practical implementation in courts reveals significant gaps / Drawing on European regulations such as the EU AI Act and the Product Liability Directive, it analyzes five key axes that influence AI-related lawsuits / AI liability, cyber law, EU AI Act, human oversight, transparency, accountability, post-deployment monitoring, European case law",Reza Parsa,2026,journalArticle,ssrn,keep_queue
MI9UAA73,Advanced prompt engineering for large language models in interventional radiology: practical strategies and future perspectives.,"As large language models (LLMs) become increasingly integrated into clinical workflows, advanced prompting strategies offer new opportunities and challenges for their application in interventional radiology (IR). This Clinical Perspective presents a structured guide to five advanced prompting approaches: chain of verification, chain of density, reasoning and acting, generated knowledge prompting, and retrieval-augmented generation. Each approach is illustrated with practical IR-specific use cases that show how prompts can guide LLMs to produce transparent, patient-tailored, and evidence-grounded responses. We also outline technical requirements for implementation, clinical considerations for combining strategies, and key limitations, including the risk of adversarial prompting whereby manipulative inputs may bypass guardrails or distort outputs. Finally, we explore emerging directions using agentic workflows and emphasize the need for radiology-specific benchmarks, human-in-the-loop design, and regulatory standards. Together, these insights provide a practical foundation for the safe and effective integration of LLMs into high-stakes IR workflows, offering value to clinicians, investigators, and developers alike.",Dietrich; Bradbury; Loh,2026,journalArticle,wos,maybe_queue
LMRTCI4P,The right to contest AI,"AI, algorithms, algorithmic accountability, due process, privacy, big data",Margot E. Kaminski; Jennifer M. Urban,2021,journalArticle,ssrn,keep_queue
R2L4V4HL,"ClauseMiner: prompt-engineered LLaMA-70B for accurate, scalable legal clause extraction","Further, human-in-the-loop validation on 15 random legal agreements was also executed. / Finally, it is the first step in the groundwork for future developments in multilingual legal AI systems.",Puneet Puneet; Neelesh S. Upadhye,2025,journalArticle,ssrn,maybe_queue
RP9I5P8F,"The great anxiety: will AI be our greatest adversary, assistant, or just another annoyance?","widespread anxiety and polarized discourse surrounding generative artificial intelligence (AI), especially since the advent of large language models like ChatGPT / and ethical oversight.",Raffaele Ciriello,2025,journalArticle,ssrn,maybe_queue
STYN9TZV,Explainable retrieval and graph augmented code vulnerability repair recommendations,"Common Weakness Enumerations (CWEs), Common Vulnerabilities and Exposures (CVEs), and associated code examples from vulnerability datasets represent a rich corpus of structured knowledge for software vulnerability repair. While Large Language Models (LLMs) have shown promise in vulnerability repair, existing methods often lack transparency in how retrieved context informs generated recommendations. This paper presents a graph-based retrieval framework that leverages taxonomic relationships in the CWE hierarchy and CVE associations to guide LLMs in generating repair recommendations. Following XAI principles, we study the impact of graph retrieval strategies from different categories, including the K-Nearest Neighbors Graph Retrieval (KNN), the Metapath Graph Retrieval, and the PageRank Graph Retrieval strategies. These strategies retrieve relevant vulnerability data based on augmented examples representing the relations among CWE and CVE artifacts. Each retrieval result is augmented into the LLM input to improve the code repair recommendation quality. Evaluations across both the BigVul and CVEFixes datasets show consistent gains, with static analysis repair success rates improving from 28% to 63% on BigVul and from 58% to 85% on CVEFixes. To complement SOTA metrics, we incorporate an LLM-as-a-Judge evaluation using five predefined criteria, which include Relevance, Completeness, Correctness, Identification of Vulnerable Code, and Code Guidance. Compared with prior SOTA repair models, our framework achieves higher performance on CodeBLEU, as well as LLM-as-a-Judge evaluations, yielding 0.34 to 0.56 point improvements on all LLM metrics. All models and datasets are open-source, offering a reproducible and extensible framework for future exploration of relationshipaware retrieval and vulnerability repair.",A. A. Amoah; Y. Liu,2025,conferencePaper,ieee,keep_queue
7CPZ358P,On the purpose of meaningful human control of AI,"Meaningful human control over AI is exalted as a key tool for assuring safety, dignity, and responsibility for AI and automated decision-systems. / This paper argues that discussions regarding meaningful human control commonly fail to identify the purpose behind the call for meaningful human control / meaningful human control, AI, AI weapons systems,",Jovana Davidovic,2022,journalArticle,ssrn,keep_queue
U73NN84B,Copyright policy options for generative artificial intelligence,"This paper examines this issue from an economic perspective and analyses how different copyright regimes for generative AI will impact the quality of content / A key factor is whether generative AI models are small (with content providers capable of negotiations with AI providers) or large (where negotiations / artificial intelligence, copyright, fair use, generative AI, large language models",Joshua S. Gans,2024,journalArticle,ssrn,maybe_queue
B8VW8VSF,"Copyright protection during the training stage of generative AI: industry-oriented U.S. law, rights-oriented EU law, and fair remuneration rights for generative AI training under the UN's international governance regime for AI","Training generative AI models carries the risk of copyright infringement. / How can we balance the development of generative AI technology with copyright protection during the training stage of these models? / Generative AI, Copyright, Training, Data content, Fair use, Comparative study",Hong Wu,2024,journalArticle,ssrn,maybe_queue
QB7MGVK4,ECONOMICS OF AUTHORITY EoA #8 federated authority and inter-organizational AI execution the unsolved boundary problem and a dual-authorization mechanism,"Authority framework described in EoA #7 establishes a durable, enforceable, predetermined authority layer that governs autonomous execution within a single organization / AI governance, federated systems, cross-organizational AI, AI accountability, enterprise AI, AI regulation, data sovereignty, interoperability",Kevin Fenske,2026,journalArticle,ssrn,keep_queue
AH6X7K6Q,Toward a certification framework for AI governance in education: design principles for a sector-appropriate standard AI governance in education series memorandum No. 6,"Education has nothing equivalent for AI, despite deploying AI systems that affect millions of students and facing regulatory deadlines beginning in mid / framework, ISO 42001, SOC 2, education accreditation, insurance underwriting, AI assurance, EdTech procurement, student data protection, algorithmic bias, human / oversight, risk assessment, K-12 education, regulatory compliance, AI policy, child safety, assessor credentialing, governance certification, standards",Ryan James Purdy,2026,journalArticle,ssrn,maybe_queue
Z6I9JDFX,Auditing accountability; assessing AI audits and AI legal frameworks through the lens of accountability,"It assesses five leading AI audit and legal frameworks—the EU AI Act, NYC Local Law 144, Colorado Senate Bill 21-169, the UK Information Commissioner’s / bias in the court of law; (5) Sector-specific and limited legal scope enables evasion of accountability; and (6) There is a lack of independent audit governance",Lenka Molins,2026,journalArticle,ssrn,keep_queue
3QF9DPKJ,"Should we ban generative AI, incentivise it or make it a medium for inclusive creativity?","A pressing question emerges regarding the future of generative AI and Large Language Models (LLMs) – and, consequently, the future of copyright policy: / On the other hand, the chapter will explore potential effects of Generative AI on the market for creativity in order assess policy options. / ChatGTP, Dall-E, OpenAI, Stability AI, Generative AI, Artificial Intelligence, Regulation, Law, Copyright, Policy Reform, Inclusivity",Giancarlo Frosio,2023,journalArticle,ssrn,maybe_queue
FTICIPDY,Interpretive sovereignty failure: an interaction-level safety risk in human–AI systems,"Interpretive Sovereignty, Human–AI Interaction, AI Governance, AI Auditing, Alignment Evaluation",Hillary Segeren,2026,journalArticle,ssrn,keep_queue
HTZUBZN3,Towards a vendor-agnostic AI adoption framework for small and medium-sized businesses,"This paper introduces an AI Adoption Framework (AIAF) for SMBs. / This paper introduces an AI Adoption Framework (AIAF) for SMBs. / It also aligns with the NIST AI Risk Management Framework (RMF) and follows Agile principles to ensure safe, iterative implementation. / Small Business, AI Adoption, Artificial Intelligence, Cloud Computing, AWS, Google Cloud, Microsoft Azure, NIST RMF, Responsible AI",Thomas Eveland,2025,journalArticle,ssrn,keep_queue
VBIITW5Z,Ethical AI and data engineering: building transparent and accountable systems - a systematic review,"Data-centric Ethics, AI Transparency, Algorithmic Accountability, Ethical Data Engineering, Fairness Metrics",Prateik Mahendra,2025,journalArticle,ssrn,maybe_queue
