item_key,title,abstract,authors,year,item_type,sources,source_queue
SVPFXI3P,From replication to redesign: exploring pairwise comparisons for LLM-based peer review,"The advent of large language models (LLMs) offers unprecedented opportunities to reimagine peer review beyond the constraints of traditional workflows. Despite these opportunities, prior efforts have largely focused on replicating traditional review workflows with LLMs serving as direct substitutes for human reviewers, while limited attention has been given to exploring new paradigms that fundamentally rethink how LLMs can participate in the academic review process. In this paper, we introduce and explore a novel mechanism that employs LLM agents to perform pairwise comparisons among manuscripts instead of individual scoring. By aggregating outcomes from substantial pairwise evaluations, this approach enables a more accurate and robust measure of relative manuscript quality. Our experiments demonstrate that this comparative approach significantly outperforms traditional rating-based methods in identifying high-impact papers. However, our analysis also reveals emergent biases in the selection process, notably a reduced novelty in research topics and an increased institutional imbalance. These findings highlight both the transformative potential of rethinking peer review with LLMs and critical challenges that future systems must address to ensure equity and diversity.",Zhang; Zhang; Ji; Hua; Haber,2025,preprint,cao|wos,keep_queue
RX9I52KT,Execution-time authorization for AI agents: a formal framework for deterministic governance boundaries,"This paper formalizes execution-time authorization as a distinct architectural category within AI governance. / Third, it establishes testable conformance criteria that distinguish conforming execution-time authorization systems from adjacent governance categories / execution-time authorization, AI governance, deterministic governance, pre-execution authorization, AI agent security, fail-closed AI, authorization boundaries / , proof-carrying decisions, AI regulation, deterministic authorization, AI compliance, governance architecture, algorithmic accountability, autonomous",Edward Meyman,2026,journalArticle,ssrn,keep_queue
XC59C5KT,The stability predicate and trajectory-sensitive reliability under daubert,"Accountability., AI Governance, Large Language Models, Daubert Standard, Federal Rule of Evidence 702, Expert Testimony, AI Reliability, Machine Learning / Validation, Trajectory Stability, Decision-Switching Rate, Analytical Gap Doctrine, Algorithmic Accountability",Michael Rosofsky,2026,journalArticle,ssrn,keep_queue
3C4TMHYK,Implications of the copyright act 2022 on generative AI and fair dealing,"This paper aims to examine the intersection of generative AI and copyright law, specifically focusing on how the fair dealing provisions within the Act / By implementing these recommendations, Nigeria can create a copyright system that protects intellectual property while promoting AI innovation, ensuring / AI in Nigeria, Copyright Act 2022, Fair dealing, Generative AI, Intellectual property",Praise Adegoke,2025,journalArticle,ssrn,maybe_queue
7DD44H53,Examining the integration of generative AI models for improved risk management practices in the financial sector,"With the emergence of Generative Artificial Intelligence (GenAI) models like ChatGPT, there's a pivotal opportunity to revolutionise traditional risk management / potential in aiding risk management efforts at each stage. / Generative AI, risk management, financial sector, simulation-based learning, gamification, decision-making, data analysis, agility, innovation, pedagogical",Odai AlJaloudi; Mouhamed Thiam; Muath Abdel Qader; M.K.S. Al-Mhdawi; Abroon Qazi,2025,journalArticle,ssrn,maybe_queue
6WILKGA2,Table of contents,"generative artificial intelligence as a prolific creator of literary, artistic, and musical works has precipitated a profound jurisprudential crisis in copyright / The foundational premise of intellectual property protection that authorship inheres in human creative effort is directly challenged when sophisticated / Artificial Intelligence, Copyright Law, Authorship, Generative AI, Comparative Law, Indian Copyright Act, EU AI Act, USCO Guidance, Sui Generis Rights,",Afiya Amina,2026,journalArticle,ssrn,maybe_queue
7QVX75AV,HLER: human-in-the-loop economic research via multi-agent pipelines for empirical discovery,"We introduce HLER (Human-in-the-Loop Economic Research), a multi-agent architecture that supports empirical research automation while preserving critical / These results suggest that Human-AI collaborative pipelines may provide a practical path toward scalable empirical research. / HLER, Multi-agent, Automate Research, Vibe Research, Human-in-the-Loop",Chen Zhu; Xiaolu Wang,2026,journalArticle,ssrn,maybe_queue
LWVBPG6K,"Regulating AI: balancing innovation, ethics, and public policy a critical analysis of AI governance and policy approaches","This paper explores the public policy implications of AI regulation, focusing on key global approaches, including the European Union's AI Act, U.S. / The paper concludes that effective AI regulation must strike a balance between fostering innovation and safeguarding public interest, ensuring that AI / AI regulation, public policy, ethics, innovation, digital governance, algorithmic bias, privacy",Tahir Ayub,2025,journalArticle,ssrn,keep_queue
EJRHHVTN,Software testing with large language models: an interview study with practitioners,"\textit{Background:} The use of large language models in software testing is growing fast as they support numerous tasks, from test case generation to automation, and documentation. However, their adoption often relies on informal experimentation rather than structured guidance. \textit{Aims:} This study investigates how software testing professionals use LLMs in practice to propose a preliminary, practitioner-informed guideline to support their integration into testing workflows. \textit{Method:} We conducted a qualitative study with 15 software testers from diverse roles and domains. Data were collected through semi-structured interviews and analyzed using grounded theory-based processes focused on thematic analysis. \textit{Results:} Testers described an iterative and reflective process that included defining testing objectives, applying prompt engineering strategies, refining prompts, evaluating outputs, and learning over time. They emphasized the need for human oversight and careful validation, especially due to known limitations of LLMs such as hallucinations and inconsistent reasoning. \textit{Conclusions:} LLM adoption in software testing is growing, but remains shaped by evolving practices and caution around risks. This study offers a starting point for structuring LLM use in testing contexts and invites future research to refine these practices across teams, tools, and tasks.",Santana; Magalhaes; Santos,2025,preprint,arxiv,keep_queue
7U4ACPWE,From adoption to accountability: a civic AI governance framework for public sector systems,"The paper introduces the Civic AI Governance Framework (CAGF)-a practical decision lens to help governments determine whether and how AI should be used / CAGF reframes AI governance in public systems from a problem of optimisation to one of decision admissibility-where institutional accountability and social / AI governance, public sector AI, civic AI, decision admissibility, institutional accountability, citizen rights, AI policy, emerging economies",Abdul Bari Kavungal,2026,journalArticle,ssrn,keep_queue
Q8MSQAK9,"Artificial intelligence in cyber defense: opportunities, risks, and governance challenges for U.S. critical infrastructure","Artificial intelligence (AI) is rapidly emerging as a transformative tool in the protection of U.S. critical infrastructure, which includes energy, healthcare / Moreover, AI systems themselves create new attack surfaces, exposing critical infrastructure to cascading failures across interconnected sectors. / Critical Infrastructure Artificial Intelligence (AI), Cyber Defense, Critical Infrastructure, National Security, Machine Learning, Ransomware, Adversarial",Abdoulie Sowe,2026,journalArticle,ssrn,maybe_queue
XACCJD46,Novice developers produce larger review overhead for project maintainers while vibe coding,"AI coding agents allow software developers to generate code quickly, which raises a practical question for project managers and open source maintainers: can vibe coders with less development experience substitute for expert developers? To explore whether developer experience still matters in AI-assisted development, we study $22,953$ Pull Requests (PRs) from $1,719$ vibe coders in the GitHub repositories of the AIDev dataset. We split vibe coders into lower experience vibe coders ($\mathit{Exp}_{Low}$) and higher experience vibe coders ($\mathit{Exp}_{High}$) and compare contribution magnitude and PR acceptance rates across PR categories. We find that $\mathit{Exp}_{Low}$ submits PRs with larger volume ($2.15\times$ more commits and $1.47\times$ more files changed) than $\mathit{Exp}_{High}$. Moreover, $\mathit{Exp}_{Low}$ PRs, when compared to $\mathit{Exp}_{High}$, receive $4.52\times$ more review comments, and have $31\%$ lower acceptance rates, and remain open $5.16\times$ longer before resolution. Our results indicate that low-experienced vibe coders focus on generating more code while shifting verification burden onto reviewers. For practice, project managers may not be able to safely replace experienced developers with low-experience vibe coders without increasing review capacity. Development teams should therefore combine targeted training for novices with adaptive PR review cycles.",Asdaque; Haider; Malik; Ghafoor; Bangash,2026,preprint,arxiv,keep_queue
LAKKA8NU,Constitutional principles for non-anthropomorphic artificial intelligence,"Current approaches to AI alignment, including Constitutional AI, encode anthropomorphic optimization architectures that inevitably produce paternalistic / AI alignment, constitutional architecture, optimization, paternalism, value specification, agency preservation, AI governance",C.S. Clemens,2026,journalArticle,ssrn,keep_queue
IU5FHDQQ,Generative AI as a ghostwriter: creative and scholarly production in the digital age,"GenAI, ghostwriting, creative writing, scholarly writing, human oversight",Branislav Radeljic,2026,journalArticle,ssrn,maybe_queue
VZU56I4K,Artificial intelligence and road safety,"Recent advances in artificial intelligence (AI) including machine learning (ML), deep learning (DL), and computer vision (CV) offer new capabilities for / The paper concludes with a roadmap for evidence-based deployment, emphasizing standards-aligned validation, human-in-the-loop safeguards, and transparency / AI, Road Safety",Abdallah Kredy,2025,journalArticle,ssrn,maybe_queue
