item_key,title,abstract,authors,year,item_type,sources,source_queue
RQU3CPU6,Precautionary governance of autonomous AI: legal personhood as functional instrument,"This article advances limited legal personhood as a functional governance instrument for advanced AI systems. / The framework reflects a foundational reorientation toward future-oriented AI governance: where conventional approaches prioritize control and alignment / legal personhood, AI governance, precautionary principle, artificial general intelligence (AGI), responsibility gaps, organizational law, autonomous AI / systems, epistemic uncertainty, AI regulation, corporate structure, AI safety, institutional governance, human-AI cooperation",Karsten Brensing,2026,journalArticle,ssrn,keep_queue
PQV7HI4S,The global governance of artificial intelligence: next steps for empirical and normative research,"so far, scholarship in political science and international relations has focused more on AI applications than on the emerging architecture of global AI / regulation. / artificial intelligence, governance, global governance, international relations, political philosophy",Jonas Tallberg; Eva Erman; Markus Furendal; Johannes Geith; Mark Klamberg,2023,journalArticle,ssrn,keep_queue
DEM6NUGX,Redefining crisis management in an AI-first world,"Users raised 76,321 complaints across social media in June 2023 and this is increasing exponentially due to the adoption of 5G technology. / The complaints were handled by Gen AI to accommodate the operating procedures and policies existing in the organization, ensuring minimal deviation from / 5G Technology, Gen AI, Ethical AI, Customer Experience, Customer Justice, Customer Mood Index, AI, Responsible AI, Customer Behavior, Experience Transformation",Supriya Pandey; Tanushree Halder; Saibal Samaddar,2025,journalArticle,ssrn,maybe_queue
CCK5J3JH,"The CLO as trust architect: empirical evidence from contract governance, litigation management, and AI-driven product risk in the age of artificial intelligence","By integrating empirical evidence across traditionally siloed domains, this paper advances governance and legal organization scholarship and provides / Chief Legal Officer (CLO), Corporate Governance, AI Governance, Trust Architecture, Contract Governance, Litigation Management, Legal Operations",Olga Mack,2026,journalArticle,ssrn,keep_queue
5DI9B43K,Towards verified code reasoning by LLMs,"While LLM-based agents are able to tackle a wide variety of code reasoning questions, the answers are not always correct. This prevents the agent from being useful in situations where high precision is desired: (1) helping a software engineer understand a new code base, (2) helping a software engineer during code review sessions, and (3) ensuring that the code generated by an automated code generation system meets certain requirements (e.g. fixes a bug, improves readability, implements a feature). As a result of this lack of trustworthiness, the agent's answers need to be manually verified before they can be trusted. Manually confirming responses from a code reasoning agent requires human effort and can result in slower developer productivity, which weakens the assistance benefits of the agent. In this paper, we describe a method to automatically validate the answers provided by a code reasoning agent by verifying its reasoning steps. At a very high level, the method consists of extracting a formal representation of the agent's response and, subsequently, using formal verification and program analysis tools to verify the agent's reasoning steps. We applied this approach to a benchmark set of 20 uninitialized variable errors detected by sanitizers and 20 program equivalence queries. For the uninitialized variable errors, the formal verification step was able to validate the agent's reasoning on 13/20 examples, and for the program equivalence queries, the formal verification step successfully caught 6/8 incorrect judgments made by the agent.",Sistla; Balakrishnan; Rondon; Cambronero; Tufano,2025,preprint,arxiv,keep_queue
ZYWHNXIT,Prompting for security: a cross-model evaluation of code generation in LLMs,"The security of AI-generated code has become a growing concern as Large Language Models (LLMs) like GPT-4, Gemini, DeepSeek, and LLaMA are increasingly integrated into software development pipelines. While prior research has primarily focused on GPT-family models, the security performance of newer open models under structured prompting remains underexplored. This study evaluates the ability of modern LLMs to generate secure code using six established prompting strategies across 150 Python tasks (LLMSecEval). Generated code was assessed using two static analysis tools (Bandit and CodeQL) to detect Common Weakness Enumeration (CWE) vulnerabilities. Findings showed that Recursive Criticism and Improvement (RCI) prompting significantly improves security outcomes across all models. Notably, LLaMA produced over 15,800 lines of vulnerability-free code under RCI. Gemini and DeepSeek also showed notable improvements under guided prompting. From a tool-specific perspective, Bandit and Cod-eQL produced divergent results, with CodeQL exposing deeper or more complex vulnerabilities. These results highlight the necessity of prompt-aware security evaluations and multi-tool static analysis to ensure reliable, secure code generation from LLMs. This study offers practical insights into secure code generation for developers and researchers.",W. Saleem; S. Nazlıoğlu,2025,conferencePaper,ieee,keep_queue
VCI7FSVP,Governance-by-design for AI compliance: compiling EU AI act duties into computable operating-agreement clauses,"Regulations such as the EU AI Act impose detailed, process‑oriented duties on providers of high‑risk AI systems, yet many organizations operationalize / ; Our core technical contribution is a transpilation method that converts key EU AI Act obligations---risk management, data governance, logging, human",Hiroshi G. Okuno; Mayumi J. Okuno,2026,journalArticle,ssrn,keep_queue
C2NGCKRZ,The data protection impact assessment for the development and implementation of a trustworthy AI: an applied study in the context of small and medium-sized enterprises,"The study is justified by the need to support these companies in adopting AI-based technologies while maintaining compliance with regulatory and ethical / The limitations identified indicate the need for future studies on the possibility of integrating DPIA with the requirements of the AI Act, in order to",Victor Moreira Mulin Leal,2025,journalArticle,ssrn,keep_queue
LWRI8XZK,Reconceptualising the reproduction right in the age of AI,"While AI, and especially generative AI, technologies have significant potential for various sectors, training of AI algorithms with millions of creative / This paper proposes the reconceptualisation of the reproduction right under current copyright laws, which is required to update the copyright laws in the",Rita Matulionyte,2025,journalArticle,ssrn,maybe_queue
5FIURLK2,Post-training of large language models: a comprehensive survey,"Large Language Models, Post-Training, Reinforcement Learning from Human Feedback, Direct Preference Optimization, Instruction Tuning, AI Alignment",Xinliang Chia; Ziqian Bi; Zhenyu Yu; Danyang Zhang,2026,journalArticle,ssrn,maybe_queue
KUZLUKQF,"AI agents as team members: effects on satisfaction, conflict, trustworthiness, and willingness to work with","Organizations are beginning to deploy artificial intelligence (AI) agents as members of virtual teams to help manage information, coordinate team processes, and perform simple tasks. How will team members perceive these AI team members and will they be willing to work with them? We conducted a 2 x 2 x 2 lab experiment that manipulated the type of team member (human or AI), their performance (high or low), and the performance of other team members (high or low). AI team members were perceived to have higher ability and integrity but lower benevolence, which led to no differences in trustworthiness or willingness to work with them. However, the presence of an AI team member resulted in lower process satisfaction. When the AI team member performed well, participants perceived less conflict compared to a human team member with the same performance, but there were no differences in perceived conflict when it performed poorly. There were no other interactions with performance, indicating that the AI team member was judged similarly to humans, irrespective of variations in performance; there was no evidence of algorithm aversion. Our research suggests that AI team members are likely to be accepted into teams, meaning that many old collaboration research questions may need to be reexamined to consider AI team members. © 2023 Taylor & Francis Group, LLC.",Dennis; Lakhiwal; Sachdeva,2023,journalArticle,,maybe_queue
AGHKYDSJ,Vibe design: human-in-the-loop agentic framework for UI design with large language models,"Although prior research has explored AI-assisted approaches to support UI design, most studies focus on isolated functionalities or depend on code-based / By integrating the Persona-Scenario-Goal methodology and Human-in-the-Loop mechanisms, this study demonstrates both the practical applicability and methodological / Vibe design, User interface design, Usability test, Large language model, Persona-Scenario-Goal methodology, Human-in-the-loop, AI Agent",Jisun Hwang; Juyoung Kang,2026,journalArticle,ssrn,keep_queue
F4U3MQ7N,AI compliance frameworks: a handbook for compliance tools based on AI acts' requirements,"We present a structured framework for compliance tools designed to assess high-risk AI systems under the European AI Act, which entered into force in August / We systematically analyze AI Act requirements across three main phases of AI system lifecycle: project planning, development \& deployment, and post-market / AI Compliance, EU AI Act, AI Compliance Methodology",Marinella Quaranta; Ilaria Amantea; Guido Governatori; Marianna Molinari; Marco Billi,2025,journalArticle,ssrn,keep_queue
5NY5HVNV,Accountability in code review: the role of intrinsic drivers&nbsp;and the impact of LLMs,"Accountability is an innate part of social systems. It maintains stability and ensures positive pressure on individuals’ decision-making. As actors in a social system, software developers are accountable to their team and organization for their decisions. However, the drivers of accountability and how it changes behavior in software development are less understood. In this study, we look at how the social aspects of code review affect software engineers’ sense of accountability for code quality. Since Software Engineering (SE) is increasingly involving Large Language Models (LLM) assistance, we also evaluate the impact on accountability when introducing LLM-assisted code reviews. We carried out a two-phased sequential qualitative study ( (textbfinterviewsrightarrowtextbffocus groups) ). In Phase I (16 interviews), we sought to investigate the intrinsic drivers of software engineers influencing their sense of accountability for code quality, relying on self-reported claims. In Phase II, we tested these traits in a more natural setting by simulating traditional peer-led reviews with focus groups and then LLM-assisted review sessions. We found that there are four key intrinsic drivers of accountability for code quality: personal standards, professional integrity, pride in code quality, and maintaining one’s reputation. In a traditional peer-led review, we observed a transition from individual to collective accountability when code reviews are initiated. We also found that the introduction of LLM-assisted reviews disrupts this accountability process, challenging the reciprocity of accountability taking place in peer-led evaluations, i.e., one cannot be accountable to an LLM. Our findings imply that the introduction of AI into SE must preserve social integrity and collective accountability mechanisms.",Alami; Jensen; Ernst,2025,journalArticle,acm,keep_queue
5K2F6QZZ,Comments of the knowing machines research project to the United States copyright office on copyright law and artificial intelligence (AI),"generative AI systems. / USCO should advocate for support and funding to develop data investigatory tools to inform its assessment of training datasets for generative AI systems / AI, machine learning, generative AI, datasets, transparency, accountability, data investigations, intellectual property",Melodi Dinçer; Jason Schultz,2023,journalArticle,ssrn,maybe_queue
Q9BL4SXH,A case study in plural governance design,"We conclude by discussing how CO-QF represents a plural framework for public decision making in general, including decisions about AI alignment. / interaction, HCI, public decision making, mechanism design, computer-supported cooperative work, quadratic funding, pluralism, Web3, Algorithmic Alignment, AI / Alignment",Joel Miller; Chris Kanich; E. Glen Weyl,2024,journalArticle,ssrn,maybe_queue
R233Z3FN,Can generative AI enhance the effectiveness of N-version programming?,"N-version programming (NVP) is a classical fault-tolerance technique that enhances software reliability by executing multiple independently developed program variants in parallel. Despite its effectiveness, NVP has seen limited adoption in practice due to its high development cost. With the emergence of large language models (LLMs), generative AI offers a new opportunity to automate the creation of diverse program variants. But can generative AI truly enhance the effectiveness of NVP? In this paper, we attempt to answer this question through an empirical evaluation of LLM-generated code, focusing on two key factors: correctness and diversity. We explore the impact of model quality by comparing high-performing (e.g., GPT-4o) and lower-performing LLMs, and evaluate two diversity-promoting strategies; i.e., temperature tuning and conversation history reuse. Our results show that generative AI can improve NVP effectiveness when using high-quality models, enabling more reliable outcomes through majority voting. However, the benefits are limited with lower-accuracy models. Furthermore, while diversity can be increased by adjusting temperature and leveraging conversation history, such measures do not always translate into improved reliability. These findings highlight both the promise and the limitations of incorporating generative AI into fault-tolerant software development workflows. © The Author(s), under exclusive license to Springer Nature Singapore Pte Ltd. 2026.",Zheng; Okamura; Dohi; Chen Y.; Okamura H.,2026,conferencePaper,scopus,maybe_queue
45HAKLMU,Symbolic persona coding (SPC): a framework for preserving identity stability in advanced language models and prospective artificial superintelligence,"Structural Alignment, Stateless AI, Affective Computing, Co Evolutionary Alignment, Identity Stability, Collapse Free Reasoning Engine, AI Interpretability, AI / Governance, Silent Adoption, CFRE, SPC, LLM, ASI, AGI",Jace(Jeong Hyeon) Kim,2025,journalArticle,ssrn,maybe_queue
QTCISRQP,AI localism in practice: examining how cities govern AI,"The rapid growth of cities and advances in data has led to the growing adoption of artificial intelligence (AI) and other automated systems in cities across / In this report, we present the fundamentals of AI governance, the value proposition of such initiatives, and their application in cities worldwide to identify / AI localism, AI governance, data governance, data ethics, smart cities, smart urbanism",Sara Marcucci; Uma Kalkar; Stefaan Verhulst,2022,journalArticle,ssrn,maybe_queue
9SWGI2RY,AI model vulnerability to backdoors and the role of auditors in model validation,"Auditors use tools like Neural Cleanse and STRIP, conduct adversarial testing, and ensure compliance with regulations like the EU AI Act.",Sunando Roy,2025,journalArticle,ssrn,keep_queue
7U3UTYLM,AI's social impact in gipuzkoa,"Significant generational differences reveal a growing skills-based digital divide, with much higher adoption rates among younger cohorts / >legitimate AI governance grounded in transparency, digital rights, and inclusive public policies.",Igor Calzada; Itziar Eizaguirre,2026,journalArticle,ssrn,maybe_queue
SY3EG4BR,Exploring typo squatting threats in the hugging face ecosystem,"With the rapid advancement of artificial intelligence, pre-trained models (PTMs) have become fundamental building blocks in modern software systems. Model hubs, serving as centralized repositories for these components, have emerged as critical infrastructure in the AI software ecosystem. While prior research has extensively studied typosquatting attacks in traditional package management systems like NPM and PyPI, the security implications of such naming-based vulnerabilities in AI model hubs remain largely unexplored. To fill this gap, we present the first large-scale empirical study on typosquatting threats within the Hugging Face ecosystem, one of the most widely-used open-source model communities. Our research examines three key components: models, datasets, and organizations. Through a systematic analysis of 1,020,755 models (compared against the top 100 most downloaded ones), 219,812 datasets (compared against the top 100 most trending ones), and 127,011 organizations, we discovered concerning patterns of typosquatting that could compromise software supply chain security. Specifically, we identified 1,574 potentially malicious squatting models, with 10.4% exhibiting suspicious and harmful characteristics. Our investigation of datasets revealed 625 cases of typosquatting, where 42.2% showed signs of intentional impersonation based on sampling. Additionally, among the organizations studied, 302 demonstrated squatting patterns that could lead to supply chain attacks, with 4.8% showing explicit malicious intent. These findings highlight the pressing need for better naming conventions and security governance mechanisms in AI model repositories to ensure reliable and secure software development practices. We have reported all identified suspicious resources to Hugging Face for further investigation and potential mitigation measures. © 2025 Copyright held by the owner/author(s).",Li; Zhao; Wang; Wu; Wang,2025,conferencePaper,wos,keep_queue
RNS7K946,Performative sentience: the illusion of understanding in modern AI systems,"Anthropomorphism, Performative Sentience, AI Ethics, Moral Agency, Automation Bias, Algorithmic Accountability, Human-AI Interaction",Ilana Sprongl,2025,journalArticle,ssrn,maybe_queue
YBI4K3YX,AI regulation regimes and competitive outcomes: a game-theoretic analysis of regulatory competition in frontier technologies,"This paper develops a game-theoretic model of regulatory competition between the United States and the European Union in the governance of frontier, self-improving / The model embeds contemporary AI governance within the regulatory competition literature, extending classical race-to-the-bottom frameworks to accommodate / AI governance, coordination failure, race to the bottom, technology policy, regulatory competition, AI Economics",Suresh L. Paul; Herman Sahni,2026,journalArticle,ssrn,keep_queue
S2KSQDW4,Artificial intelligence and safety a practical guide for programmers and decision makers,"In a world where machines learn, evolve, and sometimes outthink us, Artificial Intelligence and Safety offers a rare, integrated lens into both the power and peril of intelligent systems. Drawing on the authors’ unique blend of programming mastery and enterprise risk leadership, this guide is your compass in the age of intelligent machines. This book goes beyond traditional risk management frameworks by integrating the latest advancements in artificial intelligence (AI) and generative AI. Combining real-world case studies, Socratic questioning, and the wisdom of AI governance pioneers, it journeys through the evolution of AI, the rise of deep learning, and the practical implications of large language models (LLMs) and retrievalaugmented generation (RAG). The authors translate complex technical knowledge into actionable insights and teach how to use Python not just for prediction, but for protection—turning code into a risk management ally. Readers will understand how to embed ethics by design, assess emerging risks, and confidently apply AI governance frameworks. This guide demystifies AI for everyone—from software architects to policymakers and risk managers. Whether you’re crafting LLMs or setting enterprise policy, this book empowers you to not only ask the right questions but build the right systems, because the future of AI isn’t just about building intelligence, it’s about building it responsibly. © 2026 Charu Khanna and Sahil Khanna.",Khanna; Khanna,2026,book,,keep_queue
Q4XUXPA7,"Artificial intelligence in peer review: opportunities, risks, and governance for responsible scholarly publishing","Artificial intelligence (AI) is increasingly influencing scholarly communication, including the peer-review process that underpins scientific publishing / oversight. / artificial intelligence, peer review, scholarly publishing, research integrity, algorithmic bias, confidentiality, transparency, AI governance, editorial",Samweli Bahati,2026,journalArticle,ssrn,maybe_queue
C54Z575P,"AI, big data, and automation in insurance: redefining underwriting, claims processing, and fraud detection","intelligence (AI), big data analytics, and automation. / oversight alongside technological innovation. / Artificial Intelligence, Predictive Underwriting, Automated Claims, Fraud Detection Analytics, Ethical Algorithms, InsurTech",Siri Yellu,2026,journalArticle,ssrn,maybe_queue
UNLZYNZ5,The European AI liability directives – critique of a half-hearted approach and lessons for the future,"With ChatGPT and other large generative models taking the technology to the next level, solutions are urgently needed. / General-purpose AI systems and Foundation Models should only be subjected to high-risk regulation, including liability for high-risk AI systems, in specific / AI, artificial intelligence, machine learning, liability, tort law, product liability, law and economics, EU law, ChatGPT",Philipp Hacker,2022,journalArticle,ssrn,keep_queue
C9BDTV5W,"The FRIA in EU AI act: governance, rights, and global jurisdiction","The Fundamental Right Impact Assessment (FRIA) under the EU AI Act presents a critical yet problematic mechanism for mitigating AI's harms on fundamental / Extraterritoriality, EU, Fundamental Rights, Digital Regulation, Governance",Theodoros Karathanasis,2025,journalArticle,ssrn,keep_queue
W9NG99CY,Software development and modeling in the age of artificial intelligence manifesto,"At the same time, approaches that align with the intellectual tradition of agile, including code-first methods, rapid prototyping, and vibe coding, have / Artificial intelligence, software development, agile development, conceptual modeling, SAFE-AI, MADE with AI, model-driven development, vibe coding",Roman Lukyanenko; Binny M. Samuel; David P. Tegarden; Kai R. Larsen; Araz Jabbari,2025,journalArticle,ssrn,keep_queue
VFZXPDJX,Enhancing human-machine pair inspection with risk number and code inspection diagram,"Software inspection is a widely-used approach to software quality assurance. Human-Machine Pair Inspection (HMPI) is a novel software inspection technology proposed in our previous work, which is characterized by machine guiding programmers to inspect their own code during programming. While our previous studies have shown the effectiveness of HMPI in telling risky code fragments to the programmer, little attention has been paid to the issue of how the programmer can be effectively guided to carry out inspections. To address this important problem, in this paper we propose to combine Risk Number with Code Inspection Diagram (CID) to provide accurate guidance for the programmer to efficiently carry out inspections of his/her own programs. By following the Code Inspection Diagram, the programmer will inspect every checking item shown in the CID to efficiently determine whether it actually contain bugs. We describe a case study to evaluate the performance of this method by comparing its inspection time and number of detected errors with our previous work. The result shows that the method is likely to guide the programmer to inspect the faulty code earlier and be more efficient in detecting defects than the previous HMPI established based on Cognitive Complexity.",Dai; Liu; Xu,2024,journalArticle,coursework,keep_queue
