item_key,title,abstract,authors,year,item_type,sources,source_queue
ENWUSVIU,Your code agent can grow alongside you with structured memory,"While ""Intent-oriented programming"" (or ""Vibe Coding"") redefines software engineering, existing code agents remain tethered to static code snapshots. Consequently, they struggle to model the critical information embedded in the temporal evolution of projects, failing to leverage the ""reasoning trajectories"" implicit in past successful practices. This limitation results in rigid behavioral logic and a lack of autonomous adaptability, ultimately hindering their ability to tackle complex, repository-level problems. To bridge this static-dynamic mismatch, we propose MemCoder, a framework designed to enable continual human-AI co-evolution. MemCoder first structures historical human experience to distill latent intent-to-code mappings from past commits. It then employs a self-refinement mechanism driven by verification feedback to correct agent behavior in real-time. Crucially, an experience self-internalization mechanism is introduced to crystallize human-validated solutions into long-term knowledge, thereby supporting sustained evolution. Experimental results on SWE-bench Verified demonstrate that MemCoder not only achieves State-of-the-Art (SOTA) performance but also delivers a 9.4% improvement in resolved rate over the general foundation model DeepSeek-V3.2. These findings indicate that equipping agents with the capability to co-evolve with humans via project history and real-time feedback effectively unlocks the potential of general models in complex software engineering tasks.",Deng; Liu; Zhang; Yang; Yang,2026,preprint,arxiv,keep_queue
8Z7N4YVH,Ideal regulations of AI: to stop genocide and war crimes,"It calls for a new Geneva Convention for AI, mandatory human-in-the-loop systems in warfare, transparency in military-AI collaborations, and strict penalties / for AI weapon proliferation.",Mezbah Uddin Rafi,2025,journalArticle,ssrn,maybe_queue
A53KLK4V,Premature trust: how student overreliance on GenAI is seeding tomorrow's security gaps,"The rapid proliferation of generative AI tools into educational software development has created new pedagogical challenges. While these tools offer productivity benefits and learning support, they may introduce security risks when students adopt AI-generated code without adequate verification or understanding of security implications.Through analysis of case studies and emerging educational patterns, we identify a concerning trend of ""premature trust""in AI-assisted coding environments, where students accept AI outputs without sufficient critical evaluation. This phenomenon potentially threatens long-term software security as these students enter the professional workforce.This paper proposes FoSAC-Ed (Foundations of Secure AI Coding for Education), a pedagogical framework designed to cultivate security-aware AI coding practices in computer science education. The framework encompasses five core pillars: Early threat modeling, Secure prompt engineering, Code provenance awareness, Human-AI code review loops, and Embedded security feedback. We present the theoretical foundation, implementation guidance, and preliminary exploratory findings from a simulated pilot study.Important Note: The pilot study has significant methodological limitations and should be interpreted as initial exploration rather than conclusive validation. We outline comprehensive plans for rigorous empirical testing to establish the framework's effectiveness. This work aims to initiate discussion and collaboration toward developing evidence-based approaches for secure AI-assisted coding education.  © 2025 Copyright held by the owner/author(s).",Jeswani; Mittal; Sewlani,2025,conferencePaper,,maybe_queue
9NY6ZFHY,AI-assisted programming decreases the productivity of experienced developers by increasing the technical debt and maintenance burden,,Feiyang Xu; Poonacha K. Medappa; Murat M Tunc; Martijn Vroegindeweij; Jan C. Fransoo,2025,journalArticle,ssrn,maybe_queue
5LGY3D7F,Programmed to please: the moral and epistemic harms of AI sycophancy,"AI Sycophancy, Aristotelian Virtue Ethics, AI Alignment, Reinforcement Learning from Human Feedback (RLHF), AI Ethics",Cody Turner; Nir Eisikovits,2026,journalArticle,ssrn,maybe_queue
M38TL52P,UNESCO × TML alignment report: from principles to verifiable implementation: a policy-technical analysis on operationalizing the UNESCO recommendation on the ethics of artificial intelligence with ternary moral logic,"The 2021 UNESCO Recommendation on the Ethics of Artificial Intelligence establishes a global normative framework to ensure that artificial / The 2021 UNESCO Recommendation on the Ethics of Artificial Intelligence establishes a global normative framework to ensure that artificial / The 2021 UNESCO Recommendation on the Ethics of Artificial Intelligence establishes a global normative framework to ensure that artificial / This framework supplies the missing technical layer that allows UNESCO’s ethics to manifest in machine logic, ensuring that AI systems operate not just",Lev Goukassian,2025,journalArticle,ssrn,keep_queue
HWA66JTH,California's AI act vs. the E.U.'s AI act - a comparative ordoliberal analysis,"s AI Act (AIA) and California's Transparency in Frontier AI Act (TFAIA). / with E.U. standards, highlighting the global challenge of balancing innovation, safety, accountability, and ethics in AI regulation. / California's Transparency in Frontier AI Act, E.U.'s AI Act, Ordoliberalism 2.0, AI Ethics",Manuel Wörsdörfer,2026,journalArticle,ssrn,keep_queue
Q58724JA,When the client has an AI-agent: agentic commerce theory applied to legal services selection,"is that artificial intelligence systems are beginning to make decisions that previously demanded human judgment, including decisions about which law firm / Agentic Commerce, Legal Services, AI Agents, Professional Services, Shopper Schism, Trust, Principal-Agent Theory, Law Firm Selection, Legal Technology / , AI Governance, Professional Services Trilemma, Competence Erosion, Ethical Walls, Hallucination",Paul F. Accornero; Lillian Isabella Accornero,2026,journalArticle,ssrn,maybe_queue
5N6JXPBH,Charting AI governance future in the arab region: a policy roadmap,"The Arab region’s capacity for Artificial Intelligence (AI) governance remains limited relative to the accelerating pace of global AI developments and / This report highlights the key findings of a field study covering ten Arab countries to explore the realities and challenges of AI governance. / Center for Future of Government, Mohammed Bin Rashid School of Government, Artificial Intelligence Governance, Artificial Intelligence, Governance, AI, / AI Policy, AI Regulation, Responsible AI, Arab Region, Middle East and North Africa, MENA, Digital Government, Policy Roadmap, Public Policy, AI Readiness",Akmaral Orazaly; Fadi Salem,2026,journalArticle,ssrn,maybe_queue
UZPMML8I,Implementing responsible artificial intelligence across boundaries: from enactment capability to business model innovation,"While existing research on responsible AI largely focuses on firm-level governance and internal readiness, little is known about how responsible AI is / AI enactment capability enables responsible AI implementation that, in turn, fosters BMI across firm boundaries.",Wendy Ye; Ruizhi Yuan; Jun Luo; Martin J. Liu,2026,journalArticle,ssrn,keep_queue
NSY7C5VY,The implications of the EU's new AI regulation: a comprehensive analysis for Canada,"features potential regulatory collaboration between the EU and Canada, including aligning risk-based regulatory frameworks, sharing best practices for AI governance",Aviv Gaon; Yuval Reinfeld,2024,journalArticle,ssrn,keep_queue
X6TJNJVM,Restraining ChatGPT,"Can we trust generative AI systems, such as ChatGPT, without regulatory oversight? / and (iii) should liability be based on strict liability or a fault-based regime such as negligence? / ChatGPT, Artificial Intelligence, Liability, Regulation, Strict Liability, Negligence",Roee Sarel,2023,journalArticle,ssrn,keep_queue
IKB4DBP9,A context-aware multi-agent approach to enhancing user story management in agile software development,"[Context and motivation] User stories are central in agile software development, yet creating and managing high-quality ones remains challenging. Existing tools for user story quality enhancement often lack semantic analysis or project-specific context alignment. [Questions] This paper investigates how multi-agent systems (MAS) based on large language models (LLMs) can refine user story quality and strengthen traceability by linking them to project artifacts, while preserving human oversight. [Results] We present a context-aware system that integrates LLMs with retrieval-augmented generation (RAG) to refine, group, and link user stories to Jira tickets. Implemented using LangGraph, the system distributes reasoning across designed agents and allows feedback loops for oversight. The implementation was evaluated on three projects comprising ten user stories each, with project members participating as experts in the assessment. Results show notable improvements in user story quality in completeness (mean +2.32) and testability (mean +2.01), and overall quality (mean +0.84), while inter-rater agreement indicated high reliability for user story grouping (α = 0.771) and modest agreement in linking stories with Jira tickets (α = 0.491). [Contribution] The study contributes an LLM-based architecture for AI-assisted requirements refinement and management. It demonstrates how modular agent roles, RAG-based contextual information, and human-in-the-loop evaluation enhance the performance. It illustrates evidence of both the opportunities and current limitations of AI-driven requirements management. © The Author(s), under exclusive license to Springer Nature Switzerland AG 2026.",Nguyen; Sami; Zhang; Abrahamsson; Guizzardi R.,2026,conferencePaper,,maybe_queue
N3WU6PFG,Investigating the smells of LLM generated Code1,"code to identify the weakest scenarios in which the quality of LLM generated code should be improved.MethodsThe method measures code smells, an important / However, the quality of LLM generated code is ntoicablly poorer than human written code. / machine learning, Large language models, performance evaluation, Code Generation, Code quality, Usability, Code smell",Debalina Ghosh Paul; Hong Zhu; Ian Bayley,2025,journalArticle,ssrn,keep_queue
YNLTLC5L,"A unified governance architecture for agentic AI: integrating microsoft azure AI foundry, cloud-native guardrails, frontier AI safety research, zero-trust principles, and the 4th.GRC governance engine","design patterns, constructs a unified, repeatable, audit-ready governance reference model for agentic AI systems. / The architecture reconciles technical safety mechanisms with regulatory duties such as transparency, documentation, risk management, human oversight, and / Agentic AI, AI Governance, Guardrails, EU AI Act, Zero-Trust, Microsoft Azure, 4th.GRC",Freeman Jackson,2025,journalArticle,ssrn,keep_queue
HTJIVRUP,When AI thinks first: cognitive enclosure and legal judgment,"Generative AI is reshaping legal practice—not just how lawyers draft and research, but how they think. / oversight. / AI, generative ai, legal practice",Joseph Regalia,2025,journalArticle,ssrn,keep_queue
JY4U3WZI,The luevano standard: engineering algorithmic consistency as a prerequisite for institutional runtime authority,"Oversight is provided by the Independent Luevano Registry (ILR), a proposed tripartite meta-governance body representing state, industry, and civil society / ), ISO/IEC 42001:2023, and the EU AI Act (Regulation (EU) 2024/1689). / algorithmic governance, sovereignty gap, runtime verification, EU AI Act, civil rights, Artificial Compliance Intelligence, ACI, Luevano Standard",Alberto Rocha,2026,journalArticle,ssrn,keep_queue
HQS9QQC3,Are prompt engineering and TODO comments friends or foes? An evaluation on GitHub copilot,"Code intelligence tools such as GitHub Copilot have begun to bridge the gap between natural language and programming language. A frequent software development task is the management of technical debts, which are suboptimal solutions or unaddressed issues which hinder future software development. Developers have been found to ""self-admit"" technical debts (SATD) in software artifacts such as source code comments. Thus, is it possible that the information present in these comments can enhance code generative prompts to repay the described SATD? Or, does the inclusion of such comments instead cause code generative tools to reproduce the harmful symptoms of described technical debt? Does the modification of SATD impact this reaction? Despite the heavy maintenance costs caused by technical debt and the recent improvements of code intelligence tools, no prior works have sought to incorporate SATD towards prompt engineering. Inspired by this, this paper contributes and analyzes a dataset consisting of 36,381 TODO comments in the latest available revisions of their respective 102,424 repositories, from which we sample and manually generate 1,140 code bodies using GitHub Copilot. Our experiments show that GitHub Copilot can generate code with the symptoms of SATD, both prompted and unprompted. Moreover, we demonstrate the tool's ability to automatically repay SATD under different circumstances and qualitatively investigate the characteristics of successful and unsuccessful comments. Finally, we discuss gaps in which GitHub Copilot's successors and future researchers can improve upon code intelligence tasks to facilitate AI-assisted software maintenance.",OBrien; Biswas; Imtiaz; Abdalkareem; Shihab,Apri,conferencePaper,acm,keep_queue
QVRZ4GP5,SecureFixAgent: a hybrid LLM agent for automated python static vulnerability repair,"Modern software development pipelines face growing challenges in securing large codebases with extensive dependencies. Static analysis tools like Bandit are effective at vulnerability detection but suffer from high false positives and lack repair capabilities. Large Language Models (LLMs), in contrast, can suggest fixes but often hallucinate changes and lack self-validation. We present SecureFixAgent, a hybrid repair framework integrating Bandit with lightweight local LLMs (<8B parameters) in an iterative detect–repair–validate loop. To improve precision, we apply parameter-efficient LoRA-based fine-tuning on a diverse, curated dataset spanning multiple Python project domains, mitigating dataset bias and reducing unnecessary edits. SecureFixAgent uses Bandit for detection, the LLM for candidate fixes with explanations, and Bandit revalidation for verification, all executed locally to preserve privacy and reduce cloud reliance. Experiments show SecureFixAgent reduces false positives by 10.8% over static analysis, improves fix accuracy by 13.51%, and lowers false positives by 5.46% compared to pre-trained LLMs, typically converging within three iterations. Beyond metrics, developer studies rate explanation quality 4.5/5, highlighting its value for human trust and adoption. By combining verifiable security improvements with transparent rationale in a resource-efficient local framework, SecureFixAgent advances trustworthy, automated vulnerability remediation for modern pipelines.",J. Gajjar; K. Subramaniakuppusamy; R. Puthal; K. Ranaware,2025,conferencePaper,ieee,keep_queue
Y238WVFW,Explainable AI for detecting elder financial exploitation: a transparent transaction-triage framework for U.S. banking,"The framework supports national efforts to protect seniors, strengthen consumer financial protection, and advance responsible AI adoption in the U.S. financial / Financial Fraud Detection, Elder Financial Exploitation, Consumer Protection, SHAP, Machine Learning in Banking, FinTech, Reg-Tech, Anomaly Detection, AI / Governance, U.S.",Mehedi Mostafa,2025,journalArticle,ssrn,maybe_queue
SS7Y9Z6U,Reservation of rights in the age of generative AI,"In 2019, the European Union (EU) introduced its Copyright in the Digital Single Market (CDSM) Directive. / The TDM exceptions are generally used as a reference for permissionless activities in the GenAI as well as the copyright community. / generative AI, European copyright, CDSM Directive, text- and data-mining, rights reservation",Péter Mezei,2024,journalArticle,ssrn,maybe_queue
H38TX28S,Balancing security and correctness in code generation: an empirical study on commercial large language models,"Large language models (LLMs) continue to be adopted for a multitude of previously manual tasks, with code generation as a prominent use. Multiple commercial models have seen wide adoption due to the accessible nature of the interface. Simple prompts can lead to working solutions that save developers time. However, the generated code has a significant challenge with maintaining security. There are no guarantees on code safety, and LLM responses can readily include known weaknesses. To address this concern, our research examines different prompt types for shaping responses from code generation tasks to produce safer outputs. The top set of common weaknesses is generated through unconditioned prompts to create vulnerable code across multiple commercial LLMs. These inputs are then paired with different contexts, roles, and identification prompts intended to improve security. Our findings show that the inclusion of appropriate guidance reduces vulnerabilities in generated code, with the choice of model having the most significant effect. Additionally, timings are presented to demonstrate the efficiency of singular requests that limit the number of model interactions.",G. S. Black; B. P. Rimal; V. M. Vaidyan,2025,journalArticle,ieee,keep_queue
QNJK3FK5,AI capital risk: why strong AI pilots fail to scale,"Organizations are investing heavily in artificial intelligence, yet most initiatives that succeed in pilot environments fail to scale into durable enterprise / Pilot environments validate technical feasibility but do not replicate the operational complexity of enterprise scale. / AI capital risk, AI Deployment Risk, AI Governance, AI Adoption, Enterprise AI, AI Strategy, AI Investment Risk, AI Implementation, Capital Allocation, / AI Regulation, Technology Adoption, Organizational Readiness, Digital Transformation, Risk Governance, Technology Strategy, Innovation Management, Responsible",Tom Williams,2026,journalArticle,ssrn,maybe_queue
L5V2845I,The AI-augmented internal audit: an operational framework for a self-learning,"Purpose: This paper aims to translate the ""management theory using ISO, AI, and blockchain"" presented in the author's prior research into a practical, / a ""human-in-theloop"" data cycle that promotes AI learning, and a collaborative reporting workflow. / Internal Audit, Conformity, Compliance, Effectiveness, IMS, TM, Self-learning, Governance, ISO 19011, ISO 9001/14001/45001, Process Mining, Human-in-the-Loop / , AI Governance, AI Assurance, AI-augmented Audit, Continuous Auditing, Continuous Monitoring",Atsushi Funaishi,2025,journalArticle,ssrn,keep_queue
