item_key,title,abstract,authors,year,item_type,sources,source_queue
4HXWDCQ6,"Artificial intelligence (AI) in human resource management (HRM): a systematic review of its dual impact on diversity, equity, and inclusion (DEI)","Artificial Intelligence (AI) is transforming human resource management (HRM), introducing new efficiencies in recruitment, evaluation, and decision-making. However, its effect on diversity, equity, and inclusion (DEI) remains debated. This systematic literature review (SLR) compiles findings from 43 peer-reviewed articles published between 2016 and 2024 to critically assess AI’s dual role in HRM as both a potential promoter of fairness and a source of embedded bias. Rooted in ethical principles like fairness and accountability, organizational viewpoints such as HRM implementation challenges and best practices, and technological factors including algorithmic transparency and data quality, this review highlights four main themes: (1) AI’s ability to improve standardization, objectivity, and accessibility in HR processes; (2) risks related to algorithms and data that could perpetuate systemic bias and lessen accountability; (3) the human, data, and algorithmic origins of these issues; and (4) strategies for mitigation including participatory design, explainability, human oversight, and ethical governance. Despite growing interest in AI integration within HRM, previous studies have mostly treated fairness and effectiveness as separate issues, providing limited insight into how AI simultaneously impacts DEI outcomes. Additionally, the current literature often neglects the practical difficulties of implementing ethical principles, leaving HR professionals with scattered guidance. This review addresses these gaps by providing a timely, interdisciplinary overview that connects academic discussions with the urgent need for ethically responsible AI use in real-world HR environments. Practical implications are provided for HR professionals, developers, and organizational leaders, highlighting the importance of transparent implementation and inclusive design. Additionally, the review highlights theoretical and methodological gaps, suggesting that future research should focus on employee perceptions, contextual moderators, and the long-term effects of AI in various organizational settings. By presenting a comprehensive, multidisciplinary synthesis, this study advances the ongoing discussion on the ethical integration of AI in HRM. It provides practical guidance on aligning technological progress with inclusive organizational values. JEL Codes: M12; O33; J71; M14 © The Author(s) 2026.",Naoum; Szakadáti; Balogh,2026,journalArticle,wos,maybe_queue
E6IT5NG4,"Comparative analysis of artificial intelligence regulatory approaches: the United States, european union, canada, china, kazakhstan, russia.","Recommendations for harmonizing global AI regulations include establishing international standards for risk assessment, promoting transparency and accountability / Artificial intelligence, European Union, AI Systems, Generative AI, EU AI Act, comparative analysis, AI regulation, innovation, liability, privacy, intellectual / property, cybersecurity, Maulen Alimkhanov",Maulen Alimkhanov,2024,journalArticle,ssrn,keep_queue
RGNB3BEL,"Framework for government policy on agentic and generative AI: governance, regulation, and risk management","Evaluating current governance frameworks-including ISO/IEC 42001 and the EU AI Act-we find significant gaps in addressing continuous monitoring, human-agent / Evaluating current governance frameworks-including ISO/IEC 42001 and the EU AI Act-we find significant gaps in addressing continuous monitoring, humanagent / Agentic AI, AI Governance, AI Risk Management, Autonomous Systems, AI Ethics, AI Safety, Regulatory Compliance, Multi-Agent Systems",Satyadhar Joshi,2025,journalArticle,ssrn,keep_queue
B9XME6V7,Software doping analysis for human oversight,"This article introduces a framework that is meant to assist in mitigating societal risks that software can pose. Concretely, this encompasses facets of software doping as well as unfairness and discrimination in high-risk decision-making systems. The term software doping refers to software that contains surreptitiously added functionality that is against the interest of the user. A prominent example of software doping are the tampered emission cleaning systems that were found in millions of cars around the world when the diesel emissions scandal surfaced. The first part of this article combines the formal foundations of software doping analysis with established probabilistic falsification techniques to arrive at a black-box analysis technique for identifying undesired effects of software. We apply this technique to emission cleaning systems in diesel cars but also to high-risk systems that evaluate humans in a possibly unfair or discriminating way. We demonstrate how our approach can assist humans-in-the-loop to make better informed and more responsible decisions. This is to promote effective human oversight, which will be a central requirement enforced by the European Union's upcoming AI Act. We complement our technical contribution with a juridically, philosophically, and psychologically informed perspective on the potential problems caused by such systems.",Biewer; Baum; Sterz; Hermanns; Hetmank,2025,journalArticle,wos,keep_queue
TZFN9PMG,AIVO evidentia: an operational evidence layer for external AI representations,"systems describe an enterprise at defined points in time and preserves those representations as immutable records suitable for later legal, audit, and governance / This note is descriptive, not normative, and should be read alongside the companion governance paper on evidentiary gaps arising from external AI representations / AIVO, Evidence Layer, LLM, External AI representations, AI governance, AIVO Evidentia, Litigation, Audit, Regulation, EU Ai act, SEC, ECB, Pharmacovigilence",Timothy de Rosen,2026,journalArticle,ssrn,keep_queue
LQWM9F3Y,El reglamento de inteligencia artificial de la UE: regulación de riesgos y sistemas de estandarización (the EU artificial intelligence act: risk regulation and standardization systems),"AI has been consolidated in recent years as a central line of action in the strategy of public administrations, and the AI Regulation approved by / development of technical standards that will determine the specific content of the obligations of the regulation,  and (3) the creation of a governance",Javier Miranzo Díaz,2024,journalArticle,ssrn,keep_queue
FU4XGTDK,When technology resists governance: material properties and herd behavior in IT governance formation,"After the 2023 AI regulatory surge, vocabulary convergence substantially outpaced substantive change, and few firms describe formal AI governance structures / despite near-universal risk vocabulary adoption. / IT artifact, AI governance, IT governance infrastructure, herd behavior, technology adoption, corporate disclosure, NLP",John Tripp,2026,journalArticle,ssrn,keep_queue
WDDEARKI,An uninterpretable right: legal and practical limits of the right to an explanation,"While explanations may assist in system auditing, they are insufficient as a legal foundation for algorithmic accountability. / automated decision making, explainable ai, algorithmic accountability, GDPR, AI Act, counterfactual explanation",Arnoud Engelfriet,2025,journalArticle,ssrn,keep_queue
RF4Z8MIE,The illusion of human oversight: a structural gap in the EU AI act,"In response, the European Union's AI Act establishes a comprehensive regulatory framework aimed at ensuring safety, accountability, and human oversight / While the regulation defines oversight as an obligation, it does not specify how oversight is to be enforced at the system level.",Hyunkeun Shin,2026,journalArticle,ssrn,keep_queue
QY9TB795,A perspective toward generative-AI policymaking (GAP),"In short, while sci-fi analogies are apparently sought regarding generative-AI and its capabilities, generative-AI responses merely about an AI-prompt / And, accordingly, this paper provides an introductory view toward both public and private policymaking toward generative-AI. / generative AI, neo-Trivium, neo-Quadrivium, Candide-quoits, unwitting-identification PorQ Logic, QARC Logic, LILA Logic, LOLA Logic, Lola Logic, model",Henry Wurts,2025,journalArticle,ssrn,maybe_queue
HDVEI6LK,Are large language models memorizing bug benchmarks?,"Large Language Models (LLMs) have become integral to various software engineering tasks, including code generation, bug detection, and repair. To evaluate model performance in these domains, numerous bug benchmarks containing real-world bugs from software projects have been developed. However, a growing concern within the software engineering community is that these benchmarks may not reliably reflect true LLM performance due to the risk of data leakage. Despite this concern, limited research has been conducted to quantify the impact of potential leakage.In this paper, we systematically evaluate popular LLMs to assess their susceptibility to data leakage from widely used bug benchmarks. To identify potential leakage, we use multiple metrics, including a study of benchmark membership within commonly used training datasets, as well as analyses of negative log-likelihood and 5-gram accuracy. Our findings show that certain models, in particular codegen-multi, exhibit significant evidence of memorization in widely used benchmarks like Defects4J, while newer models trained on larger datasets like LLaMa 3.1 exhibit limited signs of leakage. These results highlight the need for careful benchmark selection and the adoption of robust metrics to adequately assess models capabilities.",D. Ramos; C. Mamede; K. Jain; P. Canelas; C. Gamboa,2025,conferencePaper,ieee,keep_queue
LQVJ7XT6,State of the art of the security of code generated by LLMs: a systematic literature review,"AI -assisted programming has experienced a surge in popularity over the past few years, largely thanks to advancements in Large Language Model technologies. This has led to the emergence of tools like ChatGPT and GitHub Copilot. However, the use of AI models for code generation comes with a downside: the resulting code is susceptible to vulnerabilities, thus posing new challenges in the field of secure software development. In this study, we analyze the current state of research regarding the security of LLM generated code from the Software Engineering perspective. We conducted a Systematic Literature Review following the guidelines from Kitchenham et al. The search process included five sources: IEEE Xplore, ACM, Science Direct, Springer Link and Wiley Online Library. We also included an iteration of backward and forward snowballing. We obtained 3104 peer-reviewed studies though Quasi-Gold aided automated search and selected the most relevant ones through 5 stages. The final selection includes 15 primary studies from which we extracted and synthesized data. We identified seven different kinds of security vulnerability present in LLM generated code, six different mitigation strategies and practices, and four tools recommended by authors to use in conjunction with LLM code generation. Security related issues within LLM generated code have only just begun to be explored, initial research has already emphasized the significance of considering the inclusion of AI-powered code generation in software projects, as it carries the risk of introducing vulnerabilities at a higher rate than human-generated code. The vulnerabilities, practices and tools identified in this study, can potentially help developers to use LLM programming assistants more responsibly, making informed decisions when leveraging LLM technology.",L. C. Ramírez; X. Limón; Á. J. Sánchez-García; J. C. Pérez-Arriaga,2024,conferencePaper,ieee,keep_queue
BNRUD6KT,Legal and regulatory frameworks governing generative AI for enterprises,"This chapter provides a comprehensive analysis of the legal and regulatory frameworks shaping the deployment of generative AI (GenAI) in enterprise contexts. As GenAI rapidly transforms business operations by automating tasks, enhancing decision-making, and driving innovation, enterprises face mounting pressure to comply with a fragmented and evolving global regulatory landscape. The chapter opens with the significance of GenAI adoption, emphasizing that legal and regulatory compliance is foundational not only for mitigating risks but also for sustaining trust, fairness, and innovation. The chapter outlines the global landscape, beginning with the European Union’s AI Act—a pioneering, risk-based regulation that classifies AI systems into tiers from unacceptable to minimal risk, imposing transparency, human oversight, and conformity obligations. The GDPR’s provisions on privacy by design, lawful processing, and data subject rights are detailed, highlighting how they affect generative AI systems. In the United States, the absence of a federal AI law has led to a patchwork of state-level laws (e.g., in California and Colorado) and federal agency guidance from the FTC and FCC, with new executive orders driving infrastructure localization and AI safety standards. China enforces a dual-track regulatory model emphasizing sovereignty and accountability—requiring AI-generated content labeling and domestic data storage. India’s Digital Personal Data Protection (DPDP) Act and anticipated AI Governance Act focus on consent, bias prevention, and local data storage. India’s courts and policymakers are actively shaping IP law interpretations, with landmark cases like ANI v. OpenAI challenging unauthorized content use for training. Countries like the UAE and Saudi Arabia balance innovation and control through national AI strategies, AI regulatory sandboxes, and novel constructs like “data embassies.” The Asia-Pacific region presents diverse governance models: prescriptive in China and South Korea, principle-based in Japan and Australia, and co-regulatory in Singapore, where the Model AI Governance Framework for GenAI and the AI Verify toolkit offer adaptive oversight. These approaches reflect varying national priorities—data sovereignty, economic competitiveness, and human-centric AI values. Key global trends include increased emphasis on risk management, transparency, explainability, and data provenance. Enterprises are adopting grounding techniques, human-in-the-loop reviews, and automated reasoning to mitigate hallucinations and ensure factual integrity. Enforcement of policy-based guardrails—such as Amazon Bedrock Guardrails—at the training, inference, and deployment stages ensures ethical AI use across industries. On intellectual property (IP), the chapter explores the challenges enterprises face regarding AI-generated content. Most jurisdictions do not yet recognize machine-generated works under copyright or patent laws. Notable legal actions, such as Getty Images v. Stability AI, highlight the risks of unlicensed data use in training models. The chapter recommends hybrid IP strategies involving human authorship claims, watermarked outputs, and enhanced licensing practices. Liability issues are explored in depth, clarifying the responsibilities of developers, deployers, and users of AI systems. Recent legal developments, including the Garcia v. Character.AI case, suggest courts may increasingly treat AI tools as “products” subject to liability laws. Section 230 protections in the U.S. are also narrowing as courts distinguish between hosting and content generation. To mitigate legal exposure, enterprises must implement rigorous governance frameworks, transparency mechanisms, and ethical use policies. The chapter also presents open-source compliance tools for multi-jurisdictional data governance, including ARX and Microsoft Presidio for data anonymization and privacy-preserving AI. These tools help enterprises comply with regulations like GDPR, CCPA, and DPDP while maintaining auditability and scalability. In conclusion, the chapter underscores that enterprises deploying generative AI must proactively align with a dynamic legal environment. This involves not only understanding varied jurisdictional requirements but also embedding responsible, ethical practices across the AI lifecycle. Through adaptive governance, technical safeguards, and legal foresight, organizations can leverage GenAI’s transformative potential while upholding societal values and minimizing regulatory and reputational risks. © The Editor(s) (if applicable) and The Author(s), under exclusive license to Springer Nature Switzerland AG 2026.",Kumar,2026,journalArticle,,keep_queue
ZXZ76MEC,Artificial infringement,"In the past two years, copyright law has become one of the leading legal and policy battlegrounds for generative AI. / liability for what it terms artificial infringement, or infringing outputs created by generative AI systems. / AI, Artificial Intelligence, Copyright, Intellectual property, Liability, Causation, Volition, Infringing Outputs, AI Harms, Generative AI, Copyright Infringement / , Direct Liability, Secondary Liability, Netcom, Copyright Policy, AI Policy, Liability for AI Harms",Michael Goodyear,2025,journalArticle,ssrn,keep_queue
KMR2LFRZ,Unusual intelligence as frontier: cognitive singularity as the human response to redefined AI singularity,"This reframing transforms the AI alignment problem from one of control and containment to one of orientation toward planetary well-being. / alignment research, and economics. / Unusual Intelligence, Cognitive Singularity, AI Singularity, Ignorance Awareness Factor, Conscious Distraction, Meta-Learning, AI Alignment, Recursive",Kiran Vadagam,2026,journalArticle,ssrn,maybe_queue
3XUNAF9W,"The economics of AI foundation models: openness, competition, and governance","Likewise, government subsidies intended to spur adoption can be captured entirely by the incumbent through strategic price and openness adjustments, leaving / Generative AI, foundation models, AI value chain, model openness, fine-tuning, AI governance, Large Language Models, data flywheel",Fasheng Xu; Xiaoyu Wang; Wei Chen; Karen Xie,2024,journalArticle,ssrn,maybe_queue
BTZT9QKD,Temporal honesty in intelligence systems: a framework for non-erasure memory in institutional reasoning,"Intelligence, risk-assessment, and AI-assisted governance systems often claim to be auditable while quietly permitting the retrospective rewriting of past / review gates at epistemically critical junctures-such as hypothesis conflicts, tunneling dynamics, or high-impact confidence shifts-where meaning, not / temporal honesty, intelligence systems, institutional reasoning, non-erasure memory, epistemic accountability, append-only ledger, decision audit, AI governance",Ilias Konstantinidis,2026,journalArticle,ssrn,keep_queue
QLMUYYQ3,Explaining code risk in OSS: towards LLM-generated fault prediction interpretations,"Open Source Software (OSS) has become a very important and crucial infrastructure worldwide because of the value it provides. OSS typically depends on contributions from developers across diverse backgrounds and levels of experience. Making safe changes, such as fixing a bug or implementing a new feature, can be challenging, especially in object-oriented systems where components are interdependent. Static analysis and defect-prediction tools produce metrics (e.g., complexity, coupling) that flag potentially fault-prone components, but these signals are often hard for contributors new or unfamiliar with the codebase to interpret. Large Language Models (LLMs) have shown strong performance on software engineering tasks such as code summarization and documentation generation. Building on this progress, we investigate whether LLMs can translate faultprediction metrics into clear, human-readable risk explanations and actionable guidance to help OSS contributors plan and review code modifications. We outline explanation types that an LLM-generated assistant could provide (descriptive, contextual, and actionable explanations). We also outline our next steps to assess usefulness through a task-based study with OSS contributors, comparing metric-only baselines to LLM-generated explanations on decision quality, time-to-completion, and error rates.",E. K. Adejumo; B. Johnson,2025,conferencePaper,ieee,keep_queue
M28UDEKQ,Splitting user stories into tasks with AI - a foe or an ally?,"In agile software development, breaking down user stories into actionable tasks is a critical yet time-consuming process. This paper investigates the potential of Generative AI tools to assist in task splitting, aiming to enhance planning efficiency. We conducted a controlled experiment comparing traditional task-splitting methods with AI-assisted approaches using GitLab Duo. Our findings indicate that while current AI tools are not yet mature enough to replace developers, they can aid in generating more granular task lists and ensuring no important tasks are overlooked. Participants favored a hybrid approach, combining AI tools with conventional methods to maintain high accuracy in planning. This study highlights the potential benefits and limitations of integrating Generative AI into agile development processes, suggesting that AI tools can serve as valuable aids in task splitting, provided there is human oversight to filter out irrelevant tasks. © The Author(s), under exclusive license to Springer Nature Switzerland AG 2025.",Pavlič; Bernsteiner; Schlögl; Ploder; Uden L.,2025,conferencePaper,,maybe_queue
