item_key,title,abstract,authors,year,item_type,sources,source_queue
8KJEKBGT,Software vulnerability and functionality assessment using LLMs,"While code review is central to the software development process, it can be tedious and expensive to carry out. In this paper, we investigate whether and how Large Language Models (LLMs) can aid with code reviews. Our investigation focuses on two tasks that we argue are fundamental to good reviews: (i) flagging code with security vulnerabilities and (ii) performing software functionality validation, i.e., ensuring that code meets its intended functionality. To test performance on both tasks, we use zero-shot and chain-of-thought prompting to obtain final “approve or reject” recommendations. As data, we employ seminal code generation datasets (HumanEval and MBPP) along with expert-written code snippets with security vulnerabilities from the Common Weakness Enumeration (CWE). Our experiments consider a mixture of three proprietary models from OpenAI and smaller open-source LLMs. We find that the former outperforms the latter by a large margin. Motivated by promising results, we finally ask our models to provide detailed descriptions of security vulnerabilities. Results show that $36.7 \%$ of LLM-generated descriptions can be associated with true CWE vulnerabilities.CCS CONCEPTS• Software and its engineering → Software verification and validation; Software development techniques.",R. I. T. Jensen; V. Tawosi; S. Alamir,2024,conferencePaper,ieee,keep_queue
ZIRHZQLH,ET-LLM: an external pseudo-state interaction framework for stabilizing reasoning stance in stateless large language models,"Comparative analysis across three widely deployed LLM platforms (ChatGPT, Perplexity, and Claude) shows that externally supplied behavioral specifications / models, Human-AI interaction, Behavioral scaffolding, Prompt-based control, Reasoning stance, Model alignment, Epistemic rigor, Interaction design, AI governance",Roger Gale,2026,journalArticle,ssrn,maybe_queue
5EGEVAWY,Vibe-coding as a teaching competency in the use of artificial intelligence for medical education: a scoping review.,"Introduction: The emergence of Generative Artificial Intelligence has given rise to vibe-coding, a paradigm that allows educators without technical backgrounds to develop software using natural language. This advancement necessitates redefining the teaching competencies required to transition from users to creators of educational tools. Methods: A scoping review of the literature was conducted following PRISMA-ScR guidelines. Studies retrieved from Web of Science and Scopus databases addressing the use of vibe-coding by educators in higher and medical education were included. After the selection process, four publications from 2025 were included. A deductive reflexive thematic analysis was applied to classify findings according to the TPACK model dimensions (Technological, Pedagogical, and Content Knowledge). Results: Qualitative analysis reveals a reconfiguration of Technological Knowledge (TK), which dissociates from programming syntax to focus on structuring prompts and iterative dialogue with AI. The emergence of the ""clinician-developer"" role was identified, where Content Knowledge (CK) acts as an indispensable auditing mechanism to validate clinical accuracy and prevent hallucinations in generated algorithms. Technological-Pedagogical Knowledge (TPK) enabled educators to deconstruct complex logic into sequential steps to design simulators and personalized tools. Conclusions: Preliminary evidence suggests that vibe-coding democratizes educational software development, allowing educators to materialize complex pedagogical strategies without external technical dependence. This competency appears to demand robust disciplinary mastery to guarantee the safety and quality of the created resources. It is recommended to foster training in this emerging competency and conduct future empirical studies to evaluate the impact of these tools on student learning and teacher cognitive load.",Elizondo-Garcia,2026,journalArticle,wos,maybe_queue
IVV75ICH,Information law pluralism,"Information Law, Transparency, Regulation, Algorithmic Accountability, Impact Assessments, Artificial Intelligence, Privacy, Knowledge Production, Tech",Hannah Bloch-Wehba,2025,journalArticle,ssrn,maybe_queue
ZS3F6ZS7,QRS: a rule-synthesizing neuro-symbolic triad for autonomous vulnerability discovery,"Static Application Security Testing (SAST) tools are integral to modern DevSecOps pipelines, yet tools like CodeQL, Semgrep, and SonarQube remain fundamentally constrained: they require expert-crafted queries, generate excessive false positives, and detect only predefined vulnerability patterns. Recent work has explored augmenting SAST with Large Language Models (LLMs), but these approaches typically use LLMs to triage existing tool outputs rather than to reason about vulnerability semantics directly. We introduce QRS (Query, Review, Sanitize), a neuro-symbolic framework that inverts this paradigm. Rather than filtering results from static rules, QRS employs three autonomous agents that generate CodeQL queries from a structured schema definition and few-shot examples, then validate findings through semantic reasoning and automated exploit synthesis. This architecture enables QRS to discover vulnerability classes beyond predefined patterns while substantially reducing false positives. We evaluate QRS on full Python packages rather than isolated snippets. In 20 historical CVEs in popular PyPI libraries, QRS achieves 90.6% detection accuracy. Applied to the 100 most-downloaded PyPI packages, QRS identified 39 medium-to-high-severity vulnerabilities, 5 of which were assigned new CVEs, 5 received documentation updates, while the remaining 29 were independently discovered by concurrent researchers, validating both the severity and discoverability of these findings. QRS accomplishes this with low time overhead and manageable token costs, demonstrating that LLM-driven query synthesis and code review can complement manually curated rule sets and uncover vulnerability patterns that evade existing industry tools.",Tsigkourakos; Patsakis,2026,preprint,arxiv,maybe_queue
QIWGQWCY,Navigating the frontier of finance: a scoping review of generative AI applications and implications,"Recent technological advancements and intense competitive pressures have spurred the rapid integration of artificial intelligence (AI) into the financial sector. This trend is further amplified with the advent of generative AI (GAI), representing a significant advancement in AI technology with its wide-ranging applications in finance. This scoping review chapter delves into the evolution of GAI and its burgeoning role in financial analysis, management, and strategy. While GAI offers significant opportunities for business and financial entities, it also entails inherent risks that necessitate prudent consideration. These risks encompass embedded biases, outcome opacity, privacy concerns, performance robustness, unique cybersecurity threats, and the potential to create novel sources and transmission channels of systemic risks, which could impact financial sector stability. The chapter explores regulatory, ethical, and user-centric perspectives in AI-driven finance alongside technological innovations and applications. Methodologically, this review employs a structured approach to identify relevant studies, chart data, and collate, summarize, and report results. The findings highlight the critical balance between leveraging GAI for its benefits and mitigating its risks to ensure responsible use in the financial realm by adhering to ethical principles such as public participation, regulatory compliance, and a user-centric approach. This chapter offers valuable insights for policymakers, financial professionals, AI developers, and academics, guiding them in understanding the complexities of GAI in finance and informing strategies for responsible implementation. © 2025 Scrivener Publishing LLC.",Haidar; Abbass,2025,journalArticle,,maybe_queue
RDNMBD6N,Context-aware pipeline for automated code review using large language models,"Modern software projects are increasingly complex, placing significant demands on human reviewers during code review. While review is essential for ensuring quality, security, and maintainability, the rapid growth of contributions in large repositories often overwhelms reviewer capacity, leading to delays and inconsistent feedback. Existing automated tools, such as linters and static analyzers, provide only surface-level checks and fail to capture the nuanced, context-dependent aspects of review. This study introduces an AI-based code review agent designed to generate high-quality, actionable feedback from static analysis of real pull requests. The proposed system employs a context-aware pipeline with two specialized agents: a summarization agent that condenses source code into structured representations and a review generation agent that produces expert-level comments. To further enhance review quality, the system incorporates prompt-based experimentation, including chain-of-thought reasoning, role-based prompting, and multi-agent collaboration. Experiments across Python, C++, Go, and Java demonstrate that the context-aware agent consistently outperforms existing baselines in semantic alignment with human reviews and issue detection, effectively capturing logic, performance, security, and maintainability concerns. These results highlight the potential of combining structured reasoning, prompt engineering, and large language models to advance scalable and reliable automated code review.",F. Abdalgalil; G. Sherif; M. Mohamed; N. Maragaa; D. Shawky,25-2,conferencePaper,ieee,keep_queue
KWD6CKFR,From monitoring to authorization: the structural shift emerging in agentic AI governance,"systems transition from generating content to executing real-world side effects—writing to databases, initiating transactions, modifying infrastructure—the governance / It argues that traditional compliance mechanisms—deterrence, accountability, escalation, and documentation—are structurally mismatched to autonomous systems / Agentic AI, AI governance, authorization boundary, enforcement architecture, AI regulation, regulatory compliance, algorithmic accountability, AI risk / management, deterministic governance, evidence-grade governance, independent verification, policy-state binding",Edward Meyman,2026,journalArticle,ssrn,keep_queue
7TMTPBCH,"The AI governance market: institutional frameworks, regulatory architecture, and the economics of trust in artificial intelligence systems","Artificial Intelligence Governance, Algorithmic Accountability, Technology Regulation, Digital Trust Infrastructure, Responsible AI, Risk Management Systems",Supradip Baul,2026,journalArticle,ssrn,keep_queue
5KGLSCGB,Exploring altered open source software development patterns in a time of generative AI,"We leverage the March 2023 announcement and April 2023 public release of GitHub Copilot X (CX) as a natural experiment, analyzing a 27-week user-week panel / However, this expansion comes with trade-offs in code quality, as we document a 2% increase in copy-pasted code and a decline in project novelty for casual",Xinyu Li; Francis Joseph Costello; Keongtae Kim; Xiaoquan (Michael) Zhang,2025,journalArticle,ssrn,keep_queue
9FSTG2PE,SWE-cycle: benchmarking code agents across the complete issue resolution cycle,"As autonomous code agents move toward end-to-end software development, evaluating their practical autonomy becomes critical. Current benchmarks hide friction by testing agents in pre-configured environments, and their static evaluation pipelines frequently fail when parsing fully autonomous trajectories. We address these limitations with SWE-Cycle, a benchmark of 489 rigorously filtered instances. SWE-Cycle evaluates agents across three isolated tasks, including environment reconstruction, code implementation, and verification test generation, as well as an end-to-end FullCycle task that integrates all three. The FullCycle task requires agents to work autonomously in a bare repository without human scaffolding. To reliably assess these complex execution paths, we developed SWE-Judge. By combining static code review with dynamic testing, this execution-capable evaluation agent accurately verifies functional correctness and eliminates the systematic measurement errors of traditional static parsers. We evaluate code agents powered by six state-of-the-art LLMs across these four tasks. The results reveal a sharp drop in solve rates when transitioning from isolated tasks to FullCycle execution, exposing critical bottlenecks in handling cross-phase dependencies and maintaining code quality. Together, SWE-Cycle and SWE-Judge provide a comprehensive framework for accurately measuring the end-to-end capabilities of autonomous software agents.",Guan; Fu; Zhang; Zhu; Zhang,2026,preprint,arxiv,maybe_queue
MT6L8AUG,"The game you didn't know you were playing: manipulation, epistemic asymmetry and the Co-authorship of harm in human-LLM interaction","Drawing on Bakhtinian dialogism, Karimova's Rationality Capture Theory and comparative discourse analysis of five major LLMs (ChatGPT, Gemini, Grok, DeepSeek / Implications are drawn for AI governance, including the necessity of frame disclosure as a regulatory response.",Gulnara Z. Karimova,2026,journalArticle,ssrn,keep_queue
U9XDLUZN,"Artificial intelligence and digital communication practices in higher education and public relations in the MENA region: a systematic review of studies by R. Jeljeli, F. Farhi, and collaborators (2018-2024)","Farhi to trace the adoption and implications of artificial intelligence (AI) and digital communication technologies across higher education, public relations / governance.",Elsir Ali Saad Mohamed; Abdelazim Hussein Hamid,2025,journalArticle,ssrn,maybe_queue
M49HJ4TH,Modular legal personhood for AI use cases,"This structure enables modular legal personhood, proportional oversight, and enforceable governance-by-design, aligning with global AI governance trends / such as the EU AI Act and the General Purpose AI Code of Practice (GPAI-CoP). / Artificial General Intelligence, Legal Personhood, Series LLC, Governance-by-Design, EU AI Act, GPAI Code of Practice, Modular Compliance, Risk-Based AI / Regulation",Mayumi J. Okuno; Hiroshi G. Okuno,2025,journalArticle,ssrn,keep_queue
DTRRLFXN,Beyond training data: how AI alignment encodes cultural framing as universal default,,Garry Murdock Jr.,2026,journalArticle,ssrn,maybe_queue
RAR7XA8R,Challenges and opportunities for artificial intelligence in auditing: evidence from the field,"In this study we research the adoption of artificial intelligence (AI) in auditing by large public accounting firms, with emphasis on its challenges and opportunities. Some previous studies point to delayed adoption of AI in auditing due to regulations and the need for additional safeguards while others document extensive AI implementation. To address this dissensus, we conducted 22 interviews with experienced audit professionals. We find that “simple AI” technologies such as key data extraction from documents and optical character recognition are used widely in audits while “complex AI” tools are only being developed. We find RPA is used to automate repetitive administrative processes while the use of RPA for audit tasks is not as common. We also find that the main AI adoption challenges are related to transparency and explainability, AI bias, data privacy, robustness and reliability, fear of auditor overreliance on AI, and the need for AI guidance. We present ideas for addressing these challenges based on our research and lessons from other fields. © 2025",Kokina; Blanchette; Davenport; Pachamanova,2025,journalArticle,,keep_queue
S2YZUYIC,"The castle's guards: regulatory capture, norm limitation syndrome, and the political economy of AI fear","This paper investigates the political economy of AI regulation by asking a question conspicuously absent from mainstream discourse: who benefits from the / regulatory capture, AI governance, Norm Limitation Syndrome, political economy, technology monopoly, AI safety, sovereign AI, enterprise software disruption / , open source strategy, democratised AI, software of one, &I philosophy, AIAIRS, lobbying, compliance moats JEL Classification: L41 (Monopolization",Tamer Momtaz,2026,journalArticle,ssrn,maybe_queue
WJKNR8AU,"AI voices, identity rights, and the problem of coincidental resemblance","The rapid advancement of generative AI voice technology challenges traditional frameworks of publicity and personality rights. / Imposing strict liability for mere resemblance ignores these technical realities, while failing to regulate AI leaves individuals vulnerable to genuine",Utkarsh Tiwari,2026,journalArticle,ssrn,maybe_queue
469V8ZBI,"Artificial intelligence governance and regulation; the impact of the EU AI act, 2024 on innovation, accountability, and global compliance in a digital age","Furthermore, the paper identifies a number of shortcomings identified in the EU AI Act, which include inadequate oversight of general-purpose AI / for marginalized communities would strengthen the Act's effectiveness as a global standard for AI regulation. / Artificial Intelligence, EU AI Act, European Union Regulation, Artificial Intelligence Governance, Responsible Use of AI, AI Regulation, AI Risk Based / Regulation, Artificial Intelligence Act EU, EU AI Act 2024, EU AI Act Overview, EU AI Act Review, AI Governance, Artificial Intelligence Governance, European",Uloma Okoro,2025,journalArticle,ssrn,keep_queue
B4NA66A4,"SagaLLM: context management, validation, and transaction guarantees for multi-agent LLM planning","This paper introduces SagaLLM, a structured multi-agent architecture designed to address four foundational limitations of current LLM-based planning systems: unreliable self-validation, context loss, lack of transactional safeguards, and insufficient inter-agent coordination. While recent frameworks leverage LLMs for task decomposition and multi-agent communication, they often fail to ensure consistency, rollback, or constraint satisfaction across distributed workflows. SagaLLM bridges this gap by integrating the Saga transactional pattern with persistent memory, automated compensation, and independent validation agents. It leverages LLMs' generative reasoning to automate key tasks traditionally requiring hand-coded coordination logic, including state tracking, dependency analysis, log schema generation, and recovery orchestration. Although SagaLLM relaxes strict ACID guarantees, it ensures workflow-wide consistency and recovery through modular checkpointing and compensable execution. Empirical evaluations across planning domains demonstrate that standalone LLMs frequently violate interdependent constraints or fail to recover from disruptions. In contrast, SagaLLM achieves significant improvements in consistency, validation accuracy, and adaptive coordination under uncertainty—establishing a robust foundation for real-world, scalable LLM-based multi-agent systems.",Chang; Geng,Augu,journalArticle,acm,maybe_queue
53L6XLR5,"Bridging the AI divide: inclusive governance, innovation & competitiveness in the MENA region","The report provides an in-depth examination of the state of artificial intelligence (AI) governance and competitiveness across the Middle East and North / of Artificial Intelligence (AI) in key MENA markets, as well as the integration of the MENA region in global AI governance efforts.",Salma Alkhoudi; Sarah Shaer; Fadi Salem,2025,journalArticle,ssrn,maybe_queue
M3K5I8U5,DeepSeek and FinTech: the democratization of AI and its global implications,"While DeepSeek's success offers opportunities for financial inclusion and innovation, it also raises concerns about security, data governance, and the / Artificial Intelligence, FinTech, AI Democratization, Open-Source AI, Regulation, DeepSeek, Industry Competition",David Krause,2025,journalArticle,ssrn,maybe_queue
DX2Y9NLH,Comparative governance of emotional ai: china's anthropomorphic interactive services measures and the global regulatory landscape,"This article provides the first comparative legal analysis of this regulation, systematically comparing its governance mechanisms against the European / Union AI Act, the Singapore Model AI Governance Framework, and the emerging United States state-level approach. / Emotional AI, Anthropomorphic AI, Comparative AI Governance, China AI Regulation, EU AI Act, Singapore Model AI Governance Framework, AI Companion Chatbot / Regulation, Psychological Manipulation Risk, Design-Based Prohibitions, Human Oversight Obligations",Marcel Osmond,2026,journalArticle,ssrn,keep_queue
I7X7LTNR,A preliminary study on large language models self-negotiation in software engineering,"Large Language Models (LLMs) have shown great potential in code-related software engineering tasks, including code generation, classification, and understanding. While current research primarily focuses on direct inference with single LLMs, this approach may fall short for complex tasks due to ambiguous instructions. To address this limitation, we propose LLM selfnegotiation, where multiple LLMs collaborate and debate to reach consensus on code-related tasks. This approach aims to better handle unclear instructions and improve overall effectiveness. We evaluated LLM self-negotiation in three key software engineering domains: Equivalent Mutant Detection (EMD), Automated Vulnerability Detection (AVD), and Automated Program Repair (APR). These domains represent distinct aspects of coderelated tasks: functionality understanding, code classification, and code generation, respectively. Our experimental results revealed varying effectiveness across domains. In EMD, LLM self-negotiation demonstrated remarkable improvements, with most models showing performance gains between 114.72 % and 351.01% (though CodeLlama experienced a minor 4.5% decrease in F1-score). For APR tasks, self-negotiation performed comparably to single LLM implementations. However, in AVD, the results were mixed - while Vicuna showed improved F1-scores, most models exhibited lower recall rates. These findings indicate that LLM self-negotiation is particularly promising for functionality understanding tasks, while its application to code classification and generation requires further research and refinement.",C. Tao; H. Shu; M. Kondo; Y. Kamei,2025,conferencePaper,ieee,keep_queue
YS63ZKXM,EU AI act: advancing data governance,"Recognizing this, the European Union has established a dual regulatory framework: the Data Governance Act (DGA) and the AI Act, each designed to address / Central to this alignment is Article 10 of the AI Act, which emphasizes data governance and supports the broader objectives of the DGA. / Artificial Intelligence, Data Governance, AI, EU AI Act, AI Governance",Blessing James Ademulegun; Anandodaya Mishra; Amritha Subhayan Krishnan; Carolyn Harrison; Charles Kerrigan,2025,journalArticle,ssrn,keep_queue
YXT6T84L,On verifiable legal reasoning: a multi-agent framework with formalized knowledge representations,"Legal reasoning requires both precise interpretation of statutory language and consistent application of complex rules, presenting significant challenges for AI systems. This paper introduces a modular multi-agent framework that decomposes legal reasoning into distinct knowledge acquisition and application stages. In the first stage, specialized agents extract legal concepts and formalize rules to create verifiable intermediate representations of statutes. The second stage applies this knowledge to specific cases through three steps: analyzing queries to map case facts onto the ontology schema, performing symbolic inference to derive logically entailed conclusions, and generating final answers using a programmatic implementation that operationalizes the ontological knowledge. This bridging of natural language understanding with symbolic reasoning provides explicit and verifiable inspection points, significantly enhancing transparency compared to end-to-end approaches. Evaluation on statutory tax calculation tasks demonstrates substantial improvements, with foundational models achieving 76.4% accuracy compared to 18.8% baseline performance, effectively narrowing the performance gap between reasoning and foundational models. These findings suggest that modular architectures with formalized knowledge representations can make sophisticated legal reasoning more accessible through computationally efficient models while enhancing consistency and explainability in AI legal reasoning, establishing a foundation for future research into more transparent, trustworthy, and effective AI systems for legal domain.",Sadowski; Chudziak,Nove,conferencePaper,acm,maybe_queue
