item_key,title,abstract,authors,year,item_type,sources,source_queue
A5CKY8VZ,Role of AI in child custody decisions and family law proceedings,"The authors will also highlight the implications of AI-created evidence, importance of ethical safeguards around AI, consider the risks of data / The authors would like to propose a middle ground of a human-in-the-loop AI model which can make a substantial improvement to procedural efficiencies",Dr. Kalyani Abhyankar; Devansh Malhotra,2025,journalArticle,ssrn,maybe_queue
C6ST3HVL,"The architecture of proof: proof, provenance and power in the age of AI","It develops the idea that generative AI does not create the evidentiary crisis, but accelerates and exposes it. / The essay therefore explores the need for portable, auditable, and proportionate proof layers capable of supporting rights, accountability, negotiation / AI, copyright, proof, provenance, digital trust, evidentiary infrastructure, transparency, auditability, AURA Protocol",Romain Benabdelkader,2026,journalArticle,ssrn,maybe_queue
6QSXGBDM,DSCode comparator: an interactive interface for comparing models and evaluating code for data science tasks,"Code-generating models are increasingly used to support data science tasks. Yet reviewing their outputs, both to understand how the code works and to assess its quality, remains largely manual and time-consuming. Instead of eliminating effort, these models shift the burden from writing code to verifying it. Complicating matters further, different models often produce divergent solutions of varying efficacy, creating additional challenges for code interrogation. To address this unmet need, we introduce DSCode Comparator, an interactive interface designed to support code understanding, evaluation, refinement, and comparison in data science workflows. DSCode Comparator allows code to be viewed from different levels of granularity, from individual lines of code to comparisons across prompts and tasks. The individual code views automatically annotate lines of code via an agentic pipeline we developed to facilitate quick functional overviews. The individual views also automatic diagnosis code quality according to efficiency, readability, and resource computation. The comparison and historical views leverage the annotations to create compact visual summaries of code, allowing for direct comparisons of its functionality, length, and efficiency across multiple models, data science tasks, and prompts. To evaluate DSCode Comparator, we conducted a user study with 22 participants, all with varying levels of proficiency in writing Data science code. Our findings show that, especially for non-expert users, DSCode Comparator sped up the pace of code comprehension and increased participant confidence. The majority report finding DSCode Comparator easier to use and more efficient than manual efforts in reviewing and refining code. Overall, our systems and their findings present an intelligent, human-centered approach to address the verification gap when using code generation models for Data Science.",Yu; Zhong; Crisan,Marc,conferencePaper,acm|arxiv|scopus,keep_queue
VBR9G2GL,The rise of corporate sovereignty - how big tech is reshaping global power and governance,"It concludes that the rise of corporate sovereignty marks a structural transformation in the organization of power-one that existing regulatory frameworks / Governance, Big Tech, Infrastructural Power, Data Power, Algorithmic Governance, Political Philosophy of Technology, Non-State Actors, Global Governance, AI / Governance",K Korovamode,2026,journalArticle,ssrn,maybe_queue
N4XRB32F,From publisher to creator: why generative AI requires a new legal framework beyond section 230,"However, generative AI systems do not merely host or transmit user content-they actively produce original outputs. / This paper argues that Section 230 is fundamentally ill-suited to govern generative AI. / Section 230, Artificial Intelligence, Generative AI, Platform Liability, Internet Law, Technology Law, Administrative Law, Health Law, AI Regulation",Suzanne Shah,2026,journalArticle,ssrn,keep_queue
PZSWQJYL,A mathematical solution to the AI alignment problem: topological constraints on action distributions with progressive verification,"We give an ab initio (first-principles) mathematical construction for AI alignment that is explicitly decoupled from training data quality (A2): the base / AI alignment, topological constraints, action distributions, progressive verification, Wasserstein distance, probability measures, trajectory spaces, Artificial",Georgios Fradelos,2026,journalArticle,ssrn,maybe_queue
HRUQ2NGR,"AI agentic programming: a survey of techniques, challenges, and opportunities","AI agentic programming is an emerging paradigm where large language model (LLM)-based coding agents autonomously plan, execute, and interact with tools such as compilers, debuggers, and version control systems. Unlike conventional code generation, these agents decompose goals, coordinate multi-step processes, and adapt based on feedback, reshaping software development practices. This survey provides a timely review of the field, introducing a taxonomy of agent behaviors and system architectures and examining relevant techniques for planning, context management, tool integration, execution monitoring, and benchmarking datasets. We highlight challenges of this fast-moving field and discuss opportunities for building reliable, transparent, and collaborative coding agents.",Wang; Gong; Zhang; Xu; Wang,2025,preprint,arxiv,keep_queue
Y9G3DA92,Is GitHub copilot a substitute for human pair-programming? An empirical study,"This empirical study investigates the effectiveness of pair programming with GitHub Copilot in comparison to human pair-programming. Through an experiment with 21 participants we focus on code productivity and code quality. For experimental design, a participant was given a project to code, under three conditions presented in a randomized order. The conditions are pair-programming with Copilot, human pair-programming as a driver, and as a navigator. The codes generated from the three trials were analyzed to determine how many lines of code on average were added in each condition and how many lines of code on average were removed in the subsequent stage. The former measures the productivity of each condition while the latter measures the quality of the produced code. The results suggest that although Copilot increases productivity as measured by lines of code added, the quality of code produced is inferior by having more lines of code deleted in the subsequent trial.",S. Imai,2022,conferencePaper,ieee,keep_queue
MVKNQPM4,"The great displacement: AI-driven professional commoditization, premium erosion, and the enterprise sovereignty™ response","end-to-end agentic automation, and evaluates emerging platform-driven dynamics in which professional services increasingly shift toward verification and oversight / The paper concludes by proposing Enterprise Sovereignty as a governance and strategic response framework for organizations navigating these transitions / Artificial Intelligence, workforce displacement, professional automation, enterprise sovereignty, agentic AI, domain expertise, Jevons Paradox, professional",Rajesh Veerapaneni,2026,journalArticle,ssrn,maybe_queue
QCI2G8H6,SOCIA-nabla: textual gradient meets multi-agent orchestration for automated simulator generation,"In this paper, we present SOCIA-Nabla, an end-to-end, agentic framework that treats simulator construction asinstance optimization over code within a textual computation graph. Specialized LLM-driven agents are embedded as graph nodes, and a workflow manager executes a loss-driven loop: code synthesis -> execution -> evaluation -> code repair. The optimizer performs Textual-Gradient Descent (TGD), while human-in-the-loop interaction is reserved for task-spec confirmation, minimizing expert effort and keeping the code itself as the trainable object. Across three CPS tasks, i.e., User Modeling, Mask Adoption, and Personal Mobility, SOCIA-Nabla attains state-of-the-art overall accuracy. By unifying multi-agent orchestration with a loss-aligned optimization view, SOCIA-Nabla converts brittle prompt pipelines into reproducible, constraint-aware simulator code generation that scales across domains and simulation granularities. This work is under review, and we will release the code soon.",Hua; Weatherhead; Jafari; Xue; Salim,2025,preprint,arxiv,maybe_queue
LS2TDEP3,"The verification imperative: why AI will expand, not diminish, the CPA profession",Commentary on artificial intelligence and the accounting profession is dominated by the prediction that AI will displace CPAs by automating the routine / oversight.,Eldar Maksymov,2026,journalArticle,ssrn,maybe_queue
IZF6MHRB,The EU copyright regulator’s quest in the generative AI era,"exponential development of Generative AI technology, casting doubts on the appropriateness of the legal solutions proposed in order to deal with such / to help designing a new social contract for Generative AI providers, creators and creative activities. / Generative AI, Copyright, AI Office, Fair remuneration, Code of practice, Statutory remuneration, Extended collective license",Christophe Geiger; Vincenzo Iaia,2025,journalArticle,ssrn,maybe_queue
6JHWQ5GW,Are we aligned? A preliminary investigation of the alignment of responsible AI values between LLMs and human judgment,"Large Language Models (LLMs) are increasingly employed in software engineering tasks such as requirements elicitation, design, and evaluation, raising critical questions regarding their alignment with human judgments on responsible AI values. This study investigates how closely LLMs' value preferences align with those of two human groups: a US-representative sample and AI practitioners. We evaluate 23 LLMs across four tasks: (T1) selecting key responsible AI values, (T2) rating their importance in specific contexts, (T3) resolving trade-offs between competing values, and (T4) prioritizing software requirements that embody those values. The results show that LLMs generally align more closely with AI practitioners than with the US-representative sample, emphasizing fairness, privacy, transparency, safety, and accountability. However, inconsistencies appear between the values that LLMs claim to uphold (Tasks 1-3) and the way they prioritize requirements (Task 4), revealing gaps in faithfulness between stated and applied behavior. These findings highlight the practical risk of relying on LLMs in requirements engineering without human oversight and motivate the need for systematic approaches to benchmark, interpret, and monitor value alignment in AI-assisted software development.",Yamani; Baslyman; Ahmed,2025,preprint,arxiv,keep_queue
NWLLD3SK,"The ethical implications of AI-generated art: consent, copyright and creativity","The question quotes how unauthorized music data scraping breaches intellectual property and disintegrates consent. / AI Ethics, AI-Generated Art, Intellectual Property, Copyright, Creativity, Artists’ Rights, Generative AI",Tushar Yadav,2025,journalArticle,ssrn,maybe_queue
2XEVHYNY,Artificial intelligence and the practice of law part 1: lawyers must be professional and responsible supervisors of AI,"This article discusses the benefits and challenges of using artificial intelligence (AI) systems to assist lawyers in legal practice. / also remember the importance of human oversight and judgment in the use of AI for law. / artificial intelligence, AI, machine learning, verbal generative AI, hallucination, legal research, legal drafting, professional responsibility, human / supervision, best practices, ethics, human oversight, document review, value judgments, confidentiality",Michael D. Murray,2023,journalArticle,ssrn,keep_queue
G6S5JK26,Algorithmic authority and the complexities of delegated decision-making: case studies on ethical challenges for 21st-century leadership,"AI Ethics in Leadership, Delegated Decision-Making, Algorithmic Accountability, Ethical AI Governance, 21stcentury Leadership, AI Moral Responsibility",Victor Frimpong,2025,journalArticle,ssrn,keep_queue
MVWFAXDW,Securing AI code generation - a prompt rectification approach for mitigating cyber risks,"The past decade has witnessed the wide adoption of AI code generators, such as GitHub Copilot, AskCodi, and OpenAI Codex. They offer intelligent solution code for code completion to achieve faster development, cleaner code, and a significant boost in overall productivity. However, such significant productivity advantages also inadvertently lead to the generation of insecure solution code because most AI code generators derive their knowledge from existing projects, which typically prioritize functionality over security. Although numerous tools have been developed to integrate with the code generators for identifying vulnerabilities, the inconsistency in syntactic features and variability in coding rules make the detection task challenging across different programming languages. To address the challenges, we devise a prompt-enhancing approach, PECKER. It examines textual prompts provided by users to identify risky prompts that could lead to insecure code generation. Given the risky prompts, PECKER conducts security-centric rewriting to strengthen the ""potentially insecure"" descriptions, thereby guiding AI code generators in mitigating vulnerabilities during code generation. We integrated PECKER with one of the most prevalent AI code generators, GitHub Copilot for evaluation. Among 509 risky prompts, PECKER successfully identified and rectified 471 risky prompts.",J. Dong; Z. Ni; N. Sun; S. Jha; Y. Zhang,2025,conferencePaper,ieee,keep_queue
ZSB2S59N,Designing guardrails: ensuring responsible AI behavior,"As generative AI rapidly integrates into enterprise ecosystems, the need for robust guardrails has become a critical concern for organizations seeking to leverage this powerful technology responsibly. This chapter provides a comprehensive framework for designing, implementing, and governing AI guardrails to ensure safety, fairness, control, and compliance in high-stakes business environments. The chapter begins by contextualizing the urgent need for responsible AI in enterprise settings, emphasizing risks such as hallucinations, bias, and privacy breaches. It highlights how unguarded generative AI systems can not only produce harmful outputs but also expose organizations to regulatory penalties, reputational damage, and operational inefficiencies. With regulations such as the EU Artificial Intelligence Act imposing strict governance requirements on high-risk AI applications, enterprises must adopt proactive measures to maintain compliance and public trust. The core of the chapter explores a multilayered approach to AI guardrails, encompassing technical, procedural, and human oversight mechanisms. At the technical level, input filtering (e.g., regex and ML classifiers), output validation (e.g., schema enforcement, toxicity detectors), and grounding with enterprise knowledge are emphasized as vital components in limiting model misbehavior. Reinforcement Learning from Human Feedback (RLHF) and constitutional AI techniques are explored as strategies to tune models toward ethical and organizational values. Tools such as Guardrails AI, PromptFoo, and Amazon Bedrock Guardrails provide tangible implementation pathways for enterprises. On the procedural side, the chapter outlines governance frameworks—policies, ethics committees, and compliance programs—that define roles and responsibilities across the AI lifecycle. It stresses the importance of policy-as-code to embed these rules into CI/CD workflows, enabling scalable and automated enforcement. A hybrid architecture combining automated enforcement with human-in-the-loop (HITL) mechanisms is advocated to catch edge cases and ensure nuanced decision-making where AI models fall short. Enterprise case studies provide compelling validation of these approaches. Banks have used real-time guardrails to prevent the leakage of personally identifiable information (PII), while healthcare providers rely on schema validators to filter out unsafe medical advice. These examples demonstrate not only reduced risk exposure and improved regulatory compliance but also tangible business value, such as faster audit readiness and enhanced customer trust. A key innovation discussed in the chapter is knowledge grounding through retrieval-augmented generation (RAG), which ties generative outputs to authoritative corporate sources. This technique significantly reduces hallucination rates and enables auditability—every output can be traced back to verifiable documents. Combined with output classifiers and HITL review, grounding transforms generative AI into a more trustworthy and explainable asset within the enterprise. The chapter also emphasizes measurable impact and continuous improvement as design principles for guardrails. Enterprises are encouraged to monitor metrics such as guardrail trigger counts, hallucination frequency, and fairness indices. Tools like MLflow, Evidently AI, and OpenLineage facilitate comprehensive auditing and traceability across model training and inference. These mechanisms support iterative guardrail refinement, aligning with the National Institute of Standards and Technology (NIST) AI Risk Management Framework’s “Measure” and “Manage” functions. Finally, the chapter outlines governance best practices and organizational structures to support responsible AI. From the Chief AI Ethics Officer to compliance managers and ML engineers, each role has a defined stake in ensuring that generative AI operates within safe, legal, and ethical boundaries. Global regulations, including the EU AI Act, U.S. agency guidelines, and China’s Interim Measures, are discussed to provide readers with an international compliance perspective. In conclusion, this chapter offers enterprise leaders, AI practitioners, and policy advocates a blueprint for operationalizing responsible AI through layered guardrails. It equips organizations with the tools, strategies, and governance models necessary to mitigate risks, maximize business value, and build stakeholder trust in the age of generative AI. As organizations scale AI across functions, these guardrails serve not as constraints but as enablers—empowering safe, innovative, and resilient AI adoption across industries. © The Editor(s) (if applicable) and The Author(s), under exclusive license to Springer Nature Switzerland AG 2026.",Kumar,2026,journalArticle,,keep_queue
2I8BT6EZ,The ignored AI factory: child trauma labor and the enforcement gap in international law,"Liability, Transnational Tort, Convention on the Rights of the Child (CRC), International Labour Organization (ILO), State Responsibility, AI Governance, Algorithmic / Accountability, Digital Labor, Vicarious Trauma, Convention Against Torture (CAT), Worst Forms of Child Labor, AI Supply Chains, Data Labeling, Content",Brigette Supernova,2026,journalArticle,ssrn,maybe_queue
USD3D566,"Alright, alright, alright: the uspto's matthew system, brian, and what satire reveals about the patent eligibility crisis","memos; the earnest deployment of AI tools in patent examination; right of publicity and trademark considerations raised by the McConaughey conceit; and vibe / coding as a mode of rapid legal-tool development. / eligibility, patent prosecution, patent examination, artificial intelligence, AI patent, software patent, machine learning, USPTO, right of publicity, vibe / coding, legal technology Goodhue USPTO's MATTHEW System, BRIAN, and Patent Eligibility",John Goodhue,2026,journalArticle,ssrn,maybe_queue
34ELRWJH,"The hidden legal minefield: how AI-assisted ""vibe coding"" amplifies software development risks and how technology can provide solutions","coding."" / This paper argues that vibe coding generates a new category of risk-where technical capacity dramatically outpaces legal infrastructure-and proposes embedded / Vibe Coding, AI-Assisted Software Development, Regulatory Compliance, Entrepreneurship and AI, AI and Law, Technology Law and Policy, Legal Compliance",John Goodhue,2025,journalArticle,ssrn,keep_queue
T3ZDKLBA,Governance-anchored framework for generative AI-driven data insight in ERP systems,"Enterprise Resource Planning (ERP) systems generate extensive structured and unstructured data that remain underutilized due to the complexity of data / Drawing on principles of information governance and responsible AI, the model enables multi-persona interaction across business users, consultants, and / Generative Artificial Intelligence, Data Insight, Enterprise Resource Planning, Governance, Retrieval-Augmented Generation, Compliance",Chintankumar Joshi,2025,journalArticle,ssrn,keep_queue
Y96I478L,"Fall 2023 supplement to brauneis & schechter, copyright: a contemporary approach","Copyright: A Contemporary Approach. / infringement and fair use in training generative AI models (see the new feature on p. 21). / Copyright, Warhol, Goldsmith, Google, Oracle, Public.Resources.org, Artificial Intelligence",Robert Brauneis; Roger Schechter,2023,journalArticle,ssrn,maybe_queue
NKII6YDD,When to delegate to artificial intelligence: a constrained resource optimization framework,"As Artificial Intelligence (AI) systems reshape industries, organizations must decide how best to deploy finite human cognition while enhancing / This paper develops a unified framework for allocating limited cognitive resources between direct human tasks and the refinement of AI systems. / Artificial Intelligence, Resource Allocation, Constrained Optimization, Diminishing Returns, Strict Concavity, Bounded Rationality AMS subject classifications",Brian Toney; Gregory Lubiani,2025,journalArticle,ssrn,keep_queue
