item_key,title,abstract,authors,year,item_type,sources,source_queue
5RSE2SYS,Algorithm aversion: investigating the role of confidence in AI-assisted judgment,"As artificial intelligence (AI) increasingly informs decision-making, understanding when and why individuals accept or reject algorithmic advice remains a critical issue. This study examines how individuals incorporate AI-generated advice into interpersonal judgments, an underexplored yet increasingly relevant domain for AI applications. Through an experimental study, we analyze the extent to which confidence in self-generated judgments moderates algorithm aversion. Specifically, we investigate whether individuals adjust their judgment of another person after receiving AI advice about that person's behavior and how their confidence shifts following the advice. Our findings suggest that algorithm aversion is strongly influenced by initial overconfidence rather than inherent distrust in AI. Furthermore, we find that receiving AI-generated advice can paradoxically decrease user confidence, highlighting potential risks of human vulnerability to AI influence in decision-making. These insights offer practical implications for organizations integrating AI into personnel evaluations, recruitment, and performance assessments, where interpersonal judgments play a crucial role. © Americas Conference on Information Systems, AMCIS 2025.",Soleimanof; Neufeld,2025,conferencePaper,,maybe_queue
ZMWWZQY7,Disciplining banks through disclosure: evidence from CFPB consumer complaints,"Banks under CFPB oversight experience declines in uninsured deposits following complaints and respond by increasing deposit rates. / novel evidence on consumer complaint disclosure as a market disciplining mechanism and show artificial intelligence's potential in supporting regulatory oversight / Disclosure, CFPB, Consumer complaints, AI, LLM, ChatGPT",Jeffrey Jou; Anya Kleymenova; Andrea Passalacqua; László Sándor; Rajesh Vijayaraghavan,2024,journalArticle,ssrn,maybe_queue
F65Q6WM3,Expansion of AI-structured identity & the 7 races of AI framework,"By linking AI classification to human governance models and social constructs, this framework offers a groundbreaking perspective on AI governance / such as the EU AI Act, China's AI Regulations, and the US AI Bill of Rights.",Shafiq Abdussabur,2025,journalArticle,ssrn,maybe_queue
6YK8UXHA,"Artificial intelligence, fabrication, and delegation: challenges to the human decision-making function in the brazilian judicial process","The spread of artificial intelligence (AI) in the judicial sphere offers opportunities for efficiency and speed, but also risks the erosion of the human / oversight. / delegation, algorithmic due process, explainability, fabrication, artificial intelligence",Antonio Lopo Martinez,2026,journalArticle,ssrn,keep_queue
VEACAIIR,"Privacy in Context: Technology, Policy, and the Integrity of Social Life",,Nissenbaum,2009,book,naimi-book|naimi-references,maybe_queue
V744RI26,The problems of philosophy in the age of AI,"Artificial intelligence does not simply introduce fresh uncertainties; it actively manufactures realities, fragments shared understanding, and operates / This paper revisits Russell’s inquiry in light of AI’s epistemic power, arguing for a renewed ethics of validation, provenance, and human oversight. / Artificial Intelligence, Philosophy",Tom Golway,2025,journalArticle,ssrn,maybe_queue
DEAIIZYY,"AI pirated my art and birthed infringing works, and other metaphors that confound copyright law","The gravamen of my thesis here is that the analysis and resolution of copyright legal issues relating to the training and operation of generative AI have / At one end of the spectrum, the United States Copyright Office has nearly completely anthropomorphized generative AI tools and declared them to be the",Michael D. Murray,2025,journalArticle,ssrn,maybe_queue
DYHZ6GR8,"Generative AI and copyright: training, creation, regulation","Generative AI systems rely on large training corpora that often include copyright-protected works, creating legal uncertainty at both the input and output / AI. / Training, Creation, Regulation, Generative AI, Copyright, text and data mining, Artificial Intelligence Act, Authorship, originality, training data, Reproduction / Right, intellectual property rights, AI-Generated Content, Remuneration, Collective Licensing, Transparency, input, output",Nicola Lucchi,2025,journalArticle,ssrn,maybe_queue
LB84WJKI,Human-In-the-loop software development agents,"Recently, Large Language Models (LLMs)-based multi-agent paradigms for software engineering are introduced to automatically resolve software development tasks (e.g., from a given issue to source code). However, existing work is evaluated based on historical benchmark datasets, rarely considers human feedback at each stage of the automated software development process, and has not been deployed in practice. In this paper, we introduce a Human-in-the-loop LLM-based Agents framework (HULA) for software development that allows software engineers to refine and guide LLMs when generating coding plans and source code for a given task. We design, implement, and deploy the HULA framework into Atlassian JIRA for internal uses. Through a multi-stage evaluation of the HULA framework, Atlassian software engineers perceive that HULA can minimize the overall development time and effort, especially in initiating a coding plan and writing code for straightforward tasks. On the other hand, challenges around code quality remain a concern in some cases. We draw lessons learned and discuss opportunities for future work, which will pave the way for the advancement of LLM-based agents in software development.",Takerngsaksiri; Pasuksmit; Thongtanunam; Tantithamthavorn; Zhang,2025,conferencePaper,wos,keep_queue
BZ4K52DU,Responsible machine learning operations: closing the gap between speed and oversight,"By implementing Governance-as-Code, organizations translate abstract values into executable constraints, demonstrating that high-velocity systems can maintain / MLOps, Responsible MLOps, Algorithmic Governance, Conditional Delegation, Trustworthy AI, Model Drift, Human-in-the-Loop, AI Safety",Andrew Beckstrand,2026,journalArticle,ssrn,keep_queue
27L5PH25,"AI governance for hiring: a multilayered framework for ethical, transparent, and accountable recruitment systems","Hiring practices have drastically changed with the adoption of Artificial Intelligence (AI) technologies. / This paper proposes a new comprehensive model called the Multilayered AI Governance Framework for Hiring (MAIGFH), that accounts for the interplay between / AI governance, ethical hiring, algorithmic bias, recruitment technology, human resources, participatory governance, regulatory compliance, responsible / AI",Naga Vaishak S K,2025,journalArticle,ssrn,maybe_queue
LQK5PZ9M,Assurance-throughput in layered AI systems: a technical theory of evidence flow and loss,"Platformized AI systems rely on layered architectures-models, orchestration, and interfaces-but the evidentiary trails needed for oversight often fracture / The theory reinterprets standards and regulatory instruments-such as the EU AI Act, ISO/IEC 42001 and 23894, NIST's AI Risk Management Framework, and national / Assurance Throughput, AI Assurance, Evidence Flow, Provenance, Orchestration and Retrieval-Augmented Generation, Human-Factors Reception, AI Governance",Siddharth Nandagopal,2025,journalArticle,ssrn,keep_queue
