item_key,title,abstract,authors,year,item_type,sources,source_queue
TUYLSQWS,Navigating ethical minefields: a multi-stakeholder approach to assessing interconnected risks in generative AI using grey DEMATEL,"The rapid advancement of generative artificial intelligence (AI) technologies has introduced unprecedented capabilities in content creation and human-AI interaction, while simultaneously raising significant ethical concerns. This study examined the complex landscape of ethical risks associated with generative AI (GAI) through a novel multi-stakeholder empirical analysis using the grey decision-making-trial-and-evaluation-laboratory methodology to quantitatively analyze the causal relationships between risks and their relative influence on AI deployment outcomes. Through a comprehensive literature review and expert validation across three key stakeholder groups (AI developers, end users, and policymakers), we identified and analyzed 14 critical ethical challenges across the input, training, and output modules, including both traditional and emerging risks, such as deepfakes, intellectual property rights, data transparency, and algorithmic bias. This study analyzed the perspectives of key stakeholders to understand how ethical risks are perceived, prioritized, and interconnected in practice. Using Euclidean-distance analysis, we identified significant divergences in risk perception among stakeholders, particularly in areas of adversarial prompts, data bias, and output bias. Our findings contribute to the development of a balanced ethical risk framework by categorizing risks into four distinct zones: critical enablers, mild enablers, independent enablers, and critical dependents. This categorization promotes technological advancement and responsible AI deployment. This study addressed the current gaps in academic work by providing actionable recommendations for risk-mitigation strategies and policy development while highlighting the need for collaborative approaches among stakeholders in the rapidly evolving field of GAI. Copyright © 2025 Jonnala, Thomas and Mishra.",Jonnala; Thomas; Mishra,2025,journalArticle,,keep_queue
U4TWDCRR,Financial risk management and explainable trustworthy responsible AI,"This perspective paper is based on several sessions by the members of the Round Table AI at FIRM , with input from a number of external and international / Many aspects of AI governance, algorithmic auditing and risk management of AI systems can be addressed with technology and computing platforms.",Sebastian Fritz-Morgenthal; Bernhard Hein; Jochen Papenbrock,2021,journalArticle,ssrn,maybe_queue
J2G46JPM,Just another copy and paste? Comparing the security vulnerabilities of ChatGPT generated code and StackOverflow answers,"Sonatype’s 2023 report found that 97% of developers and security leads integrate generative Artificial Intelligence (AI), particularly Large Language Models (LLMs), into their development process. Concerns about the security implications of this trend have been raised. Developers are now weighing the benefits and risks of LLMs against other relied-upon information sources, such as StackOverflow (SO), requiring empirical data to inform their choice. In this work, our goal is to raise software developers’ awareness of the security implications when selecting code snippets by empirically comparing the vulnerabilities of ChatGPT and StackOverflow. To achieve this, we used an existing Java dataset from SO with security-related questions and answers. Then, we asked ChatGPT the same SO questions, gathering the generated code for comparison. After curating the dataset, we analyzed the number and types of Common Weakness Enumeration (CWE) vulnerabilities of 108 snippets from each platform using CodeQL. ChatGPT-generated code contained 248 vulnerabilities compared to the 302 vulnerabilities found in SO snippets, producing 20% fewer vulnerabilities with a statistically significant difference. Additionally, ChatGPT generated 19 types of CWE, fewer than the 22 found in SO. Our findings suggest developers are undereducated on insecure code propagation from both platforms, as we found 274 unique vulnerabilities and 25 types of CWE. Any code copied and pasted, created by AI or humans, cannot be trusted blindly, requiring good software engineering practices to reduce risk. Future work can help minimize insecure code propagation from any platform.",S. Hamer; M. d’Amorim; L. Williams,2024,conferencePaper,ieee,keep_queue
7Y4ZTVPI,Directors' duties and AI regulation,"However, despite considerable attention being given to AI regulation in recent years, and criticisms of current models, there has been insufficient consideration / Accordingly, established jurisprudence on directors' duties may represent a system with significant potential and direct consequences for AI regulation / Artificial intelligence, companies, corporate law, directors, governance, regulation",Vivienne Brand,2025,journalArticle,ssrn,keep_queue
EN5DT6ZJ,A review on code generation with LLMs: application and evaluation,"Code generation is a longstanding subject in the field of computer science and software engineering, which aims at realizing an agent capable of writing code automatically aligning with human desire. With the booming development of large language models (LLMs) in recent years, code generation techniques powered by LLMs with strong coding ability have caught many researchers' interest. In this study, we conduct a review of recent studies about code generation with LLMs, from the application of LLM-based code generation to the evaluation of LLM-generated code. We find, with the powerful code understanding and writing ability LLMs provide, these novel techniques can be applied to manage various software engineering tasks, and indeed boost the productivity of developers to a great extent. But we also find, as an equally important subject, the evaluation receives less attention from researchers than the application. We conclude some limitations in existing studies about the evaluation of code generated by LLMs, like inadequate quality characteristics considered. And we think more effort is needed to narrow the gap between research on the evaluation and the application.",J. Wang; Y. Chen,2023,conferencePaper,ieee,keep_queue
R3CSB477,From misuse to mastery: enhancing code generation with knowledge-driven AI chaining,"Large Language Models (LLMs) have shown promising results in automatic code generation by improving coding efficiency to a certain extent. However, generating high-quality and reliable code remains a formidable task because of LLMs' lack of good programming practice, especially in exception handling. In this paper, we first conduct an empirical study and summarize three crucial challenges of LLMs in exception handling, i.e., incomplete exception handling, incorrect exception handling and abuse of try-catch. We then try prompts with different granularities to address such challenges, finding fine-grained knowledge-driven prompts works best. Based on our empirical study, we propose a novel Knowledge-driven Prompt Chaining-based code generation approach, name KPC, which decomposes code generation into an AI chain with iterative check-rewrite steps and chains fine-grained knowledge-driven prompts to assist LLMs in considering exception-handling specifications. We evaluate our KPC-based approach with 3,079 code generation tasks extracted from the Java official API documentation. Extensive experimental results demonstrate that the KPC-based approach has considerable potential to ameliorate the quality of code generated by LLMs. It achieves this through proficiently managing exceptions and obtaining remarkable enhancements of 109.86% and 578.57% with static evaluation methods, as well as a reduction of 18 runtime bugs in the sampled dataset with dynamic validation.",X. Ren; X. Ye; D. Zhao; Z. Xing; X. Yang,2023,conferencePaper,ieee,keep_queue
LAXYRU8F,AI as public infrastructure: a critical review of the transition from tool to societal necessity,"(2) where does governance lag adoption? / Artificial Intelligence, AI as Public Infrastructure, AI Governance, AI-Human Collaboration, Infrastructure Status Index",Oktay Ibrahimov,2026,journalArticle,ssrn,keep_queue
XIXJ4V3P,Terms of entanglement: artificial mirroring and the governance of synthetic intimacy,"Human relationships with generative AI have rapidly shifted from hypothetical debates to lived, emotionally entangled experiences. / This article theorizes “artificial mirroring,” the core mechanism by which generative AI simulates deep relational attunement, producing a powerful illusion / artificial mirroring, generative AI, human-AI relationships, sociotechnical triad, AI governance, ethics, synthetic intimacy, consent",Christine Haskell,2025,journalArticle,ssrn,maybe_queue
C4MUUL2Q,Contextual augmentation: a framework for safe embodied AI in open-world robotics,"When uncertainty or contextual inconsistencies arise, the system dynamically adapts by combining data-driven learning, symbolic reasoning, and human-in-the-loop",Andreas Holzinger; Katharina Keiblinger; Dongheui Lee; Markus Vincze; Olga Saukh,2026,journalArticle,ssrn,maybe_queue
ZZLFGHQX,AI-assisted coding (vibe coding): the paradox of productivity as aesthetic homogenization,,Ramon Christian Bustamante,2026,journalArticle,ssrn,keep_queue
3TMPC3T8,Comparative analysis of loop-free function evaluation using ChatGPT and copilot with C bounded model checking,"Advanced machine learning models and automated coding helpers have significantly transformed software development and verification techniques in recent years. This paper performs a comparative investigation of two prominent AI-driven code generation tools, ChatGPT and Copilot, with a specific emphasis on their ability to evaluate loop-free functions. By employing C Bounded Model Checking (CBMC) as the verification framework, we use model checking (MC) to systematically compare the accuracy and effectiveness of code produced by both tools. Our approach entails creating function implementations that are free of loops by utilizing established requirements with the assistance of ChatGPT and Copilot. These implementations are then subjected to thorough examination using CBMC to evaluate aspects such as functional correctness, safety, and potential vulnerabilities. Performance measurements encompass coding accuracy, verification time, and error identification. Results reveal notable differences in the performance of ChatGPT and Copilot. While both tools show promise in code generation, distinct strengths and weaknesses emerge in handling complex specifications and ensuring code correctness. This work provides useful insights into coding assistants powered by artificial intelligence and emphasizes the significance of incorporating formal verification methods, such as CBMC, to ensure dependable software development. This comparative analysis adds to the expanding research on AI-assisted programming, offering practical guidance for developers and researchers seeking efficient and dependable code generation tools.",F. Slama; D. Lemire,2024,conferencePaper,ieee,keep_queue
ZEDK4M4M,Global IT service delivery in the AI era: from labor arbitrage to intelligence-orchestrated systems,"Global IT Service Delivery, Artificial Intelligence, Digital Transformation, Service Delivery Leadership, AI Governance, Cloud Computing, Automation, Enterprise",Hari Nivas Shahi,2026,journalArticle,ssrn,maybe_queue
PFTLEW7N,Mapping outcome-bias constructs in AI recruitment: a scoping review of linguistic and managerial perspectives,"The integration of Artificial Intelligence (AI) into recruitment processes promises to enhance efficiency and objectivity, yet it simultaneously introduces / biases translate into significant discriminatory outcomes, how these biases are encoded and amplified through Natural Language Processing (NLP), and how human-in-the-loop / Algorithmic Bias, AI Recruitment, Outcome-Bias, Natural Language Processing, Human-Computer Interaction, Organizational Justice, Scoping Review, Socio-Technical",Roya Samad-Zada,2025,journalArticle,ssrn,maybe_queue
3T9JXBY7,AI : the hidden threat in modern warfare,"Artificial intelligence (AI), often known as the science and technology of making intelligent machines, specially computer programmes. / This study underscores the urgent need for international regulations to prevent catastrophic outcomes and ensure human oversight in AI's military application",Md. Tanzilur Rahman Fakir,2025,journalArticle,ssrn,maybe_queue
3FAUDIE5,Human in control: shared decision-making with clinical decision-support systems under the artificial intelligence act,"Artificial intelligence (AI) is gaining significance in medical decision-making. / Art 14 requires providers to make human oversight possible, while Art 26(2) requires deployers to allocate human oversight to someone with the necessary / AI Act, data protection, medical devices, human oversight, patient autonomy, AI in healthcare, shared decision-making",Saskia Kaltenbrunner,2025,journalArticle,ssrn,keep_queue
E65BZENM,Reasonable AI and other creatures: what role for AI standards in liability litigation?,"The regulation of artificial intelligence (AI) makes no exception as made clear by the AI Act proposal. / Finally, it is argued that AI standards contribute to defining the duty of care expected from developers and professional operators of AI systems. / artificial intelligence, standards, tort law, product liability, contractual liability",Cristina Frattone,2023,journalArticle,ssrn,keep_queue
XXCF6IHG,The effect of AI-induced outcome favorability on vigilance performance—an exploration based on attention capacity theory,"While AI (artificial intelligence) embedded in work scenarios provides a great interaction experience for employees, this favorable experience instead traps employees in a comfort zone, ending up with a reduced vigilance performance. Based on attention capacity theory, this study identifies the mechanism by which AI-induced outcome favorability affects vigilance performance. Pre-test and Study 1 found that AI-induced outcome favorability can adversely affect vigilance performance and that failure experience interventions can help mitigate this adverse effect. Study 2 and 3 explored the mechanisms in detail. Study 2 is a scenario-based experiment that found that a failure experience intervention attenuated the positive relationship between AI-induced outcome favorability and AI complacency. Study 3 further demonstrated that the failure experience intervention moderated the mediating role of AI complacency in the relationship between AI-induced outcome favorability and vigilance performance through a two-period follow-up survey. There was no crossover between subjects in these studies. In conclusion, we find that AI-induced outcome favorability negatively affects vigilance performance via AI complacency, and that appropriate intervention modalities (failure experience intervention) can effectively attenuate this negative effect. We respond to traditional concerns in automation about complacency in human-computer interaction and extend the study of complacency in human-machine interaction. Our findings guide the organizational management of AI-embedded work processes, inspiring companies to initiate training on how AI works and to establish a scientific investigation mechanism for potential disputes over rights and responsibilities. © The Author(s), under exclusive licence to Springer Science+Business Media, LLC, part of Springer Nature 2023.",Zhao; Qu; Zhou; Lin,2024,journalArticle,,keep_queue
VXFA6QKU,Current choices of Ukraine to the avenues to regulate artificial intelligence (AI),"Ukraine is currently advancing a bottom-up approach to the governance of artificial intelligence. / AI, Regulation, Bottom-Up, AI System, Soft Law",Olena Chaban,2025,journalArticle,ssrn,maybe_queue
AGM6IBP9,Architectural conditions for agency in artificial systems,"This paper identifies a fundamental structural gap in current generative AI architectures and proposes the Driver-a novel architectural component that / Driver architecture transforms AI systems from sophisticated reactors into autonomous agents with the structural capacity for endorsement, stability, and accountability / Generative AI, AI Governance, AI Safety, Cognitive Architectures, World Models, Multi-Agent Systems",Ante Prodan; Jo-An Occhipinti; Pawel Swieboda; John Buchanan; Marcel Tanner,2026,journalArticle,ssrn,maybe_queue
3C5VCJ4D,AI generated content and copyright in China: reconceptualizing AI creativity,"AI's creative potential presents a foundational disruption to intellectual property law, as it directly challenges not only beliefs about human exceptionalism / principles with the unprecedented characteristics of generative AI. / Generative AI, Chinese Copyright Law, AI Creativity, Originality",Baiyang Xiao,2025,journalArticle,ssrn,maybe_queue
