item_key,title,abstract,authors,year,item_type,sources,source_queue
N3GNJWQV,AI in the vault: AI act's impact on financial regulation,"Key findings of this study reveal that, while the AI Act provides a robust framework for AI governance, several challenges persist, including the / The study’s comprehensive analysis of the AI Act offers valuable recommendations for policymakers and stakeholders, aiming to enhance the regulatory oversight / Artificial Intelligence Act, AI governance, banking supervision, financial regulation, prudential supervision, AI risk management, AI Office, European",Maria Lucia Passador,2024,journalArticle,ssrn,keep_queue
7NUBKZ8W,Adaptive policy stacks for generative AI in the public sector: evidence from triangulated demand–design–implementation data,"Generative AI is being rapidly absorbed into public organizations through service and document‑automation tasks, but governance instruments are often assembled / Using triangulated evidence from South Korea—an elicitation of governance needs, a guideline‑design survey mapped to the NIST AI RMF, and a corpus of practitioner‑generated / generative AI, AI governance, policy mix, adaptive governance, public sector",hana kim,2026,journalArticle,ssrn,keep_queue
2QJNZKBM,Comments on the final trilogue version of the AI act,"This paper provides a comprehensive analysis of the recent EU AI Act, the regulatory framework surrounding Artificial Intelligence (AI), focusing on foundation / regulation aligns with existing sectoral regulations and impacts the AI value chain. / AI, artificial intelligence, machine learning, AI Act, RBI, innovation, data protection",Philipp Hacker,2024,journalArticle,ssrn,keep_queue
524TWMDJ,"AI knows best? The paradox of expertise, AI-reliance, and performance in educational tutoring decision-making tasks","We present an empirical study of how both experienced tutors and non-tutors judge the correctness of tutor praise responses under different Artificial Intelligence (AI)-assisted interfaces, types of explanation (textual explanations vs. inline highlighting). We first fine-tuned several Large Language Models (LLMs) to produce binary correctness labels and explanations, achieving up to 88% accuracy and 0.92 F1 score with GPT-4. We then let the GPT-4 models assist 95 participants in tutoring decision-making tasks by offering different types of explanations. Our findings show that although human-AI collaboration outperforms humans alone in evaluating tutor responses, it remains less accurate than AI alone. Moreover, we find that non-tutors tend to follow the AI's advice more consistently, which boosts their overall accuracy on the task: especially when the AI is correct. In contrast, experienced tutors often override the AI's correct suggestions and thus miss out on potential gains from the AI's generally high baseline accuracy. Further analysis reveals that explanations in text reasoning will increase over-reliance and reduce underreliance, while inline highlighting does not. Moreover, neither explanation style actually has a significant effect on performance and costs participants more time to complete the task, instead of saving time. Our findings reveal a tension between expertise, explanation design, and efficiency in AI-assisted decision-making, highlighting the need for balanced approaches that foster more effective human-AI collaboration.",Chen; Li; Huang; Tang; Lin,2025,preprint,arxiv,maybe_queue
XAKYUZ27,Opening pandora's box: the existential threat of survival-driven AI and the urgent need for topological circuit breakers,"Embodied AI, AI Alignment, Survival Motive, Topological Circuit Breaker, HoloBlocker, AI Legislation",Kaijie Liu; Alex Li; Menghuan Song; Hao Hu; Kin Chung Ho,2026,journalArticle,ssrn,maybe_queue
IQCNSPY6,From hazard identification to controller design: proactive and LLM-supported safety engineering for ML-powered systems,"Machine learning (ML) components are increasingly integrated into software products, yet their complexity and inherent uncertainty often lead to unintended and hazardous consequences, both for individuals and society at large. Despite these risks, practitioners seldom adopt proactive approaches to anticipate and mitigate hazards before they occur. Traditional safety engineering approaches, such as Failure Mode and Effects Analysis (FMEA) and System Theoretic Process Analysis (STPA), offer systematic frameworks for early risk identification but are rarely adopted. This position paper advocates for integrating hazard analysis into the development of any ML-powered software product and calls for greater support to make this process accessible to developers. By using large language models (LLMs) to partially automate a modified STPA process with human oversight at critical steps, we expect to address two key challenges: the heavy dependency on highly experienced safety engineering experts, and the time-consuming, labor-intensive nature of traditional hazard analysis, which often impedes its integration into real-world development workflows. We illustrate our approach with a running example, demonstrating that many seemingly unanticipated issues can, in fact, be anticipated.",Hong; Timperley; Kastner; IEEE COMPUTER SOC,2025,conferencePaper,wos,keep_queue
QHAHG7K2,The AI trifecta: revolutionizing innovation across disciplines,"The rapid evolution of artificial intelligence (AI) has ushered in a new era of innovation, with tools like Gemini, Copilot, and ChatGPT redefining boundaries / We also address key challenges, including ethical consider- ations, human oversight, and the integration of these systems into existing workflows. / Gemini, Copilot, ChatGPT, AI Trifecta, Artificial Intelligence, Interdisciplinary Innovation, Multimodal Intelligence, Context-Aware Coding, Generative / AI, Knowledge Discovery, Ethical AI, AI-Driven Collaboration, Research Workflows, Creativity Enhancement",Anil Kumar Jonnalagadda; Praveen Kumar Myakala; Chiranjeevi Bura,2025,journalArticle,ssrn,maybe_queue
25RCNRY9,Human-AI collaboration in software engineering: lessons learned from a hands-on workshop,"This paper investigates the dynamics of human-AI collaboration in software engineering, focusing on the use of ChatGPT. Through a thematic analysis of a hands-on workshop in which 22 professional software engineers collaborated for three hours with ChatGPT, we explore the transition of AI from a mere tool to a collaborative partner. The study identifies key themes such as the evolving nature of human-AI interaction, the capabilities of AI in software engineering tasks, and the challenges and limitations of integrating AI in this domain. The findings show that while AI, particularly ChatGPT, improves the efficiency of code generation and optimization, human oversight remains crucial, especially in areas requiring complex problem-solving and security considerations. This research contributes to the theoretical understanding of human-AI collaboration in software engineering and provides practical insights for effectively integrating AI tools into development processes. It highlights the need for clear role allocation, effective communication, and balanced AI-human collaboration to realize the full potential of AI in software engineering.",M. Hamza; D. Siemon; M. A. Akbar; T. Rahman,2024,conferencePaper,acm|ieee|scopus,keep_queue
NZXZCZ9B,Assessing the feasibility of collective licensing of in-copyright works as training data for generative AI systems,"Copyright owners have sued several developers of large-scale generative AI systems for copyright infringement because of their uses of massive quantities / This article discusses several proposals for collective licensing to enable development of generative AI systems while providing some compensation to copyright / generative AI, copyright law, collective licensing",Pamela Samuelson,2026,journalArticle,ssrn,maybe_queue
G9DKEEUF,Human oversight and fail-safe mechanisms in AI agents,"The rapid deployment of autonomous AI agents across critical domains has raised significant concerns regarding reliability, accountability, and safety. This chapter examines the role of human oversight and fail-safe mechanisms in ensuring responsible AI operations. It highlights the necessity of integrating monitoring systems, intervention protocols, and adaptive safety measures to mitigate unintended consequences arising from autonomous decision-making. Case studies and recent advancements in AI safety engineering are discussed to illustrate practical implementations of oversight frameworks. Furthermore, the chapter explores regulatory, ethical, and technical dimensions, emphasizing the importance of maintaining human-in-the-loop control to safeguard against catastrophic failures. Recommendations for designing robust fail-safe architectures and continuous oversight strategies are provided to guide researchers, developers, and policymakers in the deployment of secure and accountable AI agents. ©2026, IGI Global Scientific Publishing. All rights reserved.",Mustafa; Vitianingsih,2025,journalArticle,,keep_queue
E5H4XA9J,A roadmap for agentic AI in financial services industry,"While AI has long been used for tasks like fraud detection and risk assessment, the arrival of Agentic AI marks a new era. / By following this roadmap, our framework helps ensure that the adoption of Agentic AI is not only innovative but also responsible, secure, and compliant / Agentic AI, Financial Services",Selvamani Jagannathan; Sunaina Sridhar; Nagesh Gulkotwar; Praveen Baskar; Ashwin Tambe,2025,journalArticle,ssrn,keep_queue
9EKRHLXQ,AI guarded code editor: verifying authentic human input,"AI Tools such as ChatGPT, GPT-4 and GitHub Copilot change the very nature of how developers build software by greatly helping in the quick generation of code. While this proves to be efficient for professionals, it poses challenges in the competitive programming space. Generative AI is greatly misused by candidates in coding tests and online interviews. We will design a guarded code editor that detects the probability of usage of GenAI in code submissions with specialized AI detection models that use unique metrics, such as long AI-generated keywords, unusual number of utility functions, and very verbose comments that have been shown to be associated with usual AI-generated content. We will focus on stylistic and structural markers such as redundant comments, too general or too redundant variable names, and predictable formatting to realize a lightweight and scalable detection framework that fits into a user-friendly code editor. Our system also includes mechanisms for immediate feedback that inform the users on the reasons for differences in AI-generated and human-written code, thereby promoting better integrity of code in their own practices. This solution addresses a few critical concerns identified in some recent work that detection tools have limitations to the availability of responding to a domain-specific method responsive to how it would likely be combated using misapplication of the AI system. In other words, with a code editor that does not accept the direct submission of AI-generated code, the proposed solution will most definitely prove effective in both bringing forward practicality and ethical means while ensuring originality and improvement of quality in academic and competitive programming.",A. Raghunandan; A. A. G; M. A. Khan; N. S; K. Panimozhi,2025,conferencePaper,ieee,keep_queue
9I7DSNMJ,Algorithmic ethics in an era of agentic AI advocacy: an analysis of AI's impact on the model rules of professional conduct and the model code of judicial conduct,"AI, which performs tasks autonomously and challenges professional judgment and autonomy. / Agentic AI introduces even deeper questions, pushing the boundaries of delegation, unauthorized practice of law, and the very structure of the / Artificial Intelligence (AI) Generative AI (GenAI) Agentic AI Ethics Competence Confidentiality Candor Supervision Impartiality Bias / Autonomy Delegation Observability Traceability Professional Judgment Transparency Self-Regulation, AI, Generative AI, GenAI, Agentic AI, Ethics, Professional",Michael D. Murray,2025,journalArticle,ssrn,keep_queue
F2G6XNFP,"The AI legal judge: constitutional, ethical, and comparative perspectives toward a global governance framework for judicial artificial intelligence","Building upon domestic legal frameworks, the study further analyzes international governance approaches, including the European Union's AI Act and OECD / the growing global consensus that judicial AI applications must be treated as high-risk technologies subject to accountability, transparency, and human oversight / AI Governance, Judicial AI Regulation, International AI Law, Digital Courts, Technology Governance, Artificial Intelligence and Law, Law and Policy, AI",Bindiya Krishnan,2026,journalArticle,ssrn,maybe_queue
6DXZGHD9,A generative AI cybersecurity risks mitigation model for code generation: using ANN-ISM hybrid approach,"The increasing reliance on automatic code generation integrated with Generative AI technology has raised new challenges for cybersecurity defense against code injection, insecure code templates, and adversarial manipulation of an AI model. These risks make developing advanced frameworks imperative to ensure secure, reliable, and privacy-preserving code generation processes. The paper presents a novel Hybrid Artificial Neural Network (ANN)-Interpretive Structural Modeling (ISM) Framework to alleviate the cybersecurity risks associated with the automatic code generation using Generative AI. The proposed framework integrates the predictive capability of ANN and structured analysis of ISM for the identification, evaluation, and treatment of common vulnerabilities and risks in automatic code generation. We first conduct a multivocal literature review (MLR) to identify cybersecurity risks and generative AI practices for addressing these risks in automatic code generation. Then we conduct a questionnaire survey to identify and validate the identified risks and practices. An expert panel review was then assigned for the process of ANN-ISM. The ANN model can predict potential security risks by learning from historical data and code generation patterns. ISM is used to (1) structure and visualize (2) relations between identified risks and mitigation approaches and (3) offer a combined, multi-layered risk management methodology. We then perform an in-depth examination of the framework with a case study of an AI-based code generation company. We further determine its practicality and usefulness in real-world settings. The case study results show that the framework efficiently handles the primary cybersecurity challenges, such as injection attacks, code quality, backdoors, and lack of input validation. The analysis characterizes the maturity of several mitigation practices and areas for improvement for security integration with automatic code generation functionality. Advanced risk mitigation is enabled in the framework across multiple process areas, where techniques such as static code analysis, automated penetration testing, and adversarial training hold much promise. The Hybrid ANN-ISM Mechanism is a stable and flexible solution for cybersecurity risk reduction in automatic code generation environments. The coupling of ANN and ISM, in terms of predictive analysis and structured risk management, respectively, contributes effectively towards the security of AI-based code generation tools. More research is required to improve the scalability, privacy preserving, and dynamic integration of the framework with cybersecurity threat intelligence. © The Author(s) 2026.",Al-Hashimi,2026,journalArticle,,keep_queue
LKV7998Z,AI alignment is not enough to make the future go well,"AI alignment is commonly explained as aligning advanced AI systems with human values. / However, this common definition of AI alignment is somewhat idealistic and misleading, as the majority of alignment research for cutting-edge systems is / AI alignment",Michael Chen,2024,journalArticle,ssrn,keep_queue
XD8K4CSV,Agentic artificial intelligence in finance: a comprehensive survey,"This comprehensive survey synthesizes recent advances in agentic AI across multiple dimensions of financial operations, including system architecture, / Our analysis shows that while agentic AI offers substantial potential for enhanced market efficiency, liquidity provision, and risk management, it also",Irene Aldridge; Jolie An; Riley Burke; Michael Cao; Chia-Yi Chien,2025,journalArticle,ssrn,maybe_queue
8RRJH6H4,RIVA: leveraging LLM agents for reliable configuration drift detection,"Infrastructure as code (IaC) tools automate cloud provisioning but verifying that deployed systems remain consistent with the IaC specifications remains challenging. Such configuration drift occurs because of bugs in the IaC specification, manual changes, or system updates. Large language model (LLM)-based agentic AI systems can automate the analysis of large volumes of telemetry data, making them suitable for the detection of configuration drift. However, existing agentic systems implicitly assume that the tools they invoke always return correct outputs, making them vulnerable to erroneous tool responses. Since agents cannot distinguish whether an anomalous tool output reflects a real infrastructure problem or a broken tool, such errors may cause missed drift or false alarms, reducing reliability precisely when it is most needed. We introduce RIVA (Robust Infrastructure by Verification Agents), a novel multi-agent system that performs robust IaC verification even when tools produce incorrect or misleading outputs. RIVA employs two specialized agents, a verifier agent and a tool generation agent, that collaborate through iterative cross-validation, multi-perspective verification, and tool call history tracking. Evaluation on the AIOpsLab benchmark demonstrates that RIVA, in the presence of erroneous tool responses, recovers task accuracy from 27.3% when using a baseline ReAct agent to 50.0% on average. RIVA also improves task accuracy 28% to 43.8% without erroneous tool responses. Our results show that cross-validation of diverse tool calls enables more reliable autonomous infrastructure verification in production cloud environments.",Abuzakuk; Crijns; Kermarrec; Pires; de Vos,Apri,conferencePaper,acm,maybe_queue
LMDPGZ8H,No need to lift a finger anymore? Assessing the quality of code generation by ChatGPT,"Large language models (LLMs) have demonstrated impressive capabilities across various natural language processing (NLP) tasks, such as machine translation, question answering, summarization, and so on. Additionally, LLMs are also highly valuable in supporting software engineering tasks, particularly in the field of code generation. Automatic code generation is a process of automatically generating source code or executable code based on given specifications or requirements, improving developer productivity. In this study, we perform a systematic empirical assessment to the quality of code generation using ChatGPT, a recent state-of-the-art product LLM. We leverage 728 algorithm problems in five languages (i.e., C, C++, Java, Python, and JavaScript) and 18 CWEs with 54 code scenarios for the code generation task. Our evaluation encompasses a comprehensive analysis of code snippets generated by ChatGPT, focusing on three critical aspects: correctness, complexity, and security. We also specifically investigate ChatGPT's ability to engage in multi-round fixing process (i.e., ChatGPT's dialog ability, chatting between users and ChatGPT for fixing generated buggy code) of facilitating code generation. By delving into the generated code and examining the experimental results, this work provides valuable insights into the performance of ChatGPT in tackling code generation tasks over the three critical aspects. The experimental results demonstrate that (1) ChatGPT is better at generating functionally correct code for problems before 2021 in different languages than problems after 2021 with $48.14\%$48.14% advantage in Accepted rate on judgment platform, but ChatGPT's ability to directly fix erroneous code with multi-round fixing process to achieve correct functionality is relatively weak; (2) the distribution of cyclomatic and cognitive complexity levels for code snippets in different languages varies. Furthermore, the multi-round fixing process with ChatGPT  generally preserves or increases the complexity levels of code snippets; (3) in algorithm scenarios with languages of C, C++, and Java, and CWE scenarios with languages of C and Python3, the code generated by ChatGPT  has relevant vulnerabilities. However, the multi-round fixing process for vulnerable code snippets demonstrates promising results, with more than $89\%$89% of vulnerabilities successfully addressed; and (4) code generation may be affected by ChatGPT's non-determinism factor, resulting in variations of code snippets in functional correctness, complexity, and security. Overall, our findings uncover potential issues and limitations that arise in the ChatGPT-based code generation and lay the groundwork for improving AI and LLM-based code generation techniques.",Z. Liu; Y. Tang; X. Luo; Y. Zhou; L. F. Zhang,2024,journalArticle,ieee,keep_queue
UATJUWX5,"From coding to directing: vibe coding, machine creativity, and the reconfiguration of authorship and creative labour in software as a creative industry","Generative artificial intelligence (GenAI) is increasingly embedded in software development through practices commonly referred to as vibe coding, in which / This paper presents a conceptual framework that theorizes vibe coding as AI-mediated creative direction, a mode of innovation in which creative / This paper presents a conceptual framework that theorizes vibe coding as AI-mediated creative direction, a mode of innovation in which creative / Generative Artificial Intelligence, Vibe Coding, AI-Mediated Creative Direction, Machine Creativity, Creative Agency, Software Development as Creative",Krishna Reddy Kovvuri; Sushil Kumar,2026,journalArticle,ssrn,keep_queue
5C5D8ISW,Observability for large language models: SRE and chaos engineering for AI at scale,"As large language models (LLMs) become increasingly integral to enterprise applications across industries, ensuring their reliability, performance, / AI deployment standards. / Infrastructure, Model Performance Monitoring, Fault Tolerance, Error Budgets, Latency Optimization, Machine Learning Operations (MLOps), Model Drift Detection, AI / Governance, Production AI Systems, Distributed Systems, Incident Response, Capacity Planning, Autoscaling, Responsible AI",Ankush Sharma,2026,journalArticle,ssrn,keep_queue
LZUI6EY7,LLM-based interactive code generation: empirical evaluation,"Recently, large language models (LLMs), those pretrained on code, have demonstrated strong capabilities in generating programs from informal natural language intent. However, LLM -generated code is prone to bugs. Developers interacting with LLMs seek trusted code and, ideally, clear indications of potential bugs and vulnerabilities. Verified code can mitigate potential business risks associated with adopting generated code. We use model-agnostic framework CodePatchLLM, an extension for LLM that utilizes Svace feedback to enhance code generation quality. We evaluate CodePatchLLM on four popular LLMs across three datasets. Our experiments show an average absolute reduction of 19.1 % in static analyzer warnings for Java across all datasets and models, while preserving pass@ 1 code generation accuracy.",D. Shaikhelislamov; M. Drobyshevskiy; A. Belevantsev,2024,conferencePaper,ieee,keep_queue
E7FKV25H,The law of AI for good,"Algorithmic Accountability Act of 2022, the Data Privacy and Protection Act of 2022, the European General Data Protection Regulation (GDPR) and the new draft EU / AI Act, the article finds that governments are developing regulatory strategies that almost exclusively address the risks of AI while paying short shrift / artificial intelligence policy, ai, techlash, human-machine, automation, governance, algorithmic decision-making, bias, surveillance, policy, public trust / , technology law, equality, safeguards, AI-for-good, machine learning, AI Bill of Rights, Algorithmic Accountability Act of 2022, GDPR, EU AI Act, privacy",Orly Lobel,2023,journalArticle,ssrn,keep_queue
QW9M7IHT,Regulating algorithmic accountability in financial advising: rethinking the SEC's AI proposal,"By advocating for a principles-based, disclosure-driven approach, this article proposes a more balanced and effective path to algorithmic accountability / Artificial Intelligence, Financial Advisors, SEC Regulation, Conflicts of Interest, Algorithmic Accountability, Regulation Best Interest, Fiduciary Duty",Chen Wang,2025,journalArticle,ssrn,maybe_queue
PZNZS7RH,AI disclosure requirements are coming,"Additionally, technology platforms themselves are beginning to publish updated content moderation policies that address generative AI and the publication / generative artificial intelligence, artificial intelligence, disclosure, transparency, social media, creator economy, platform liability, synthetic media",Franklin Graves,2024,journalArticle,ssrn,maybe_queue
L5ZVI8UA,Navigating copyright law in the age of AI: the complex relationship between generative AI and artistic expression,"The revolutionary effects of generative AI on artistic output are investigated in this research, which also looks at how artists and state-of-the-art tech / Critical copyright problems are raised by the convergence of AI and creativity, which challenges conventional notions of authorship and infringement.",S. M. Aamir Ali; Anuttama Anuttama Ghose,2025,journalArticle,ssrn,maybe_queue
