item_key,title,abstract,authors,year,item_type,sources,source_queue
4HQF9FCF,Ai governance for customs administrations: navigating regulatory compliance and technological change,"This presentation introduces the critical role of AI governance for Customs administrations as they embark on their AI transformation journeys. / Presented at the 2024 World Customs Organisation Working Group in Brussels, it offers practical insights for responsible AI adoption.",Jon Truby,2025,journalArticle,ssrn,maybe_queue
IH2YJ3EC,Towards a value based approach for the introduction and adoption of new AI applications,"While much of the focus in the field of responsible AI has been on the design phase, we argue that the introduction and use phases are critical for ensuring / Desiderata for this approach include: recognizing the value-ladenness of new technology, addressing unexpected effects of the use of new technology, the adoption / AI, Ethics, New Technology, Responsible AI, Technology Assessment, Innovation",Julius Duijts; Ibo Van De Poel,2025,journalArticle,ssrn,maybe_queue
QEH6TN67,QASecClaw: a multi-agent LLM approach for false positive reduction in static application security testing,"Static Application Security Testing tools help developers find security vulnerabilities before release, but they often produce many false positives. This increases manual review effort, reduces developer trust, and may cause real vulnerabilities to be ignored among noisy reports. We present QASecClaw, a multi agent approach that combines conventional Static Application Security Testing with coding specialized Large Language Model based contextual code review. A SAST engine first reports candidate vulnerabilities, and a Large Language Model based SAST Filter Agent then reviews each finding with source code context to decide whether it is likely to be a true positive or a false positive. QASecClaw is coordinated by a Mission Orchestrator and includes specialized agents for test planning, security validation, evidence correlation, filtering, and reporting. We evaluate QASecClaw on OWASP Benchmark v1.2, which contains 2,740 Java test cases across 11 Common Weakness Enumeration categories with ground truth labels. QASecClaw achieves an F1 score of 90.93 percent, compared with 78.39 percent for standalone Semgrep. The improvement is mainly driven by an 88.6 percent reduction in false positives, from 560 to 64, with only a 3.1 percent reduction in recall. These results show that Large Language Model augmented multi agent verification can make Static Application Security Testing output more accurate, useful, and trustworthy.",Ameen; Alam; Islam,2026,preprint,arxiv,keep_queue
D2YMP782,A private law framework for personal AI replicas: a comprehensive analysis of legal issues,"Drawing on contemporary developments in information ethics and AI governance, the Article contends that digital replicas implicate not only economic interests / Digital Replicas, AI Twins, Generative Artificial Intelligence, Data Governance, Right of Publicity, Intellectual Property Law, Privacy Law, Digital Identity / , Human-Centric AI, AI Regulation, Personal AI",Paul Jurcys; Souichirou Kozuka; Mark Fenwick,2026,journalArticle,ssrn,maybe_queue
BPNLDA7I,"Better pay, clearer guidance: on the returns of investing in the working conditions of AI data workers","The production of Artificial Intelligence (AI) requires human labour, with tasks ranging from well-paid engineering work to often-outsourced / oversight of AI systems in protection of ethical values and fundamental rights. / Artificial Intelligence, Human Labour, Working Conditions, AI Policy, Experimental Design, Data Annotation",Johann Laux; Fabian Stephany; Alice Liefgreen,2024,journalArticle,ssrn,maybe_queue
SXDQEG3R,Stress index strategy enhanced with financial news sentiment analysis for the equity markets,"This paper introduces a new risk-on risk-off strategy for the stock market, which combines a financial stress indicator with a sentiment analysis done / by ChatGPT reading and interpreting Bloomberg daily market summaries.",Baptiste Lefort; Eric Benhamou; Jean-Jacques Ohana; Beatrice Guez; David Saltiel,2024,journalArticle,ssrn,maybe_queue
QSBIJ5ZJ,From standards to system:  implementing trust-bounded agentic AI with governance controls,"While prior work has articulated standards-level principles for agentic AI-such as explicit decision authority, trust boundaries, oversight, and auditabilitythere / governance controls and decision trace construction. / Agentic AI, AI Governance, Trust Boundaries, Decision Authority, AI Systems Architecture, Responsible AI, Compliance-Aware Systems, Autonomous Systems",Vigneshkumaar Devakumar,2026,journalArticle,ssrn,keep_queue
N2WA8QXK,"Beyond the false dichotomy: regulating AI safety, ethics and innovation","By analyzing the regulatory impacts of the EU AI Act and a proposed U.S. regulatory moratorium in the contexts of nondiscrimination and liability law, / Rejecting the idea that effective AI regulation requires a tradeoff, the Article proposes a Pareto principle for AI governance: narrow, targeted procedural / artificial intelligence, AI regulation, AI safety, AI ethics, AI liability, AI discrimination, Fundamental rights, EU AI Act (AIA), Innovation / ), Procedural safeguards, human oversight, General-purpose/foundation/frontier AI, regulatory moratorium, Algorithmic accountability, Brussels",Maarten Herbosch,2025,journalArticle,ssrn,keep_queue
2Y36QHSU,Are generative AI models infringing imported ‘articles’ under copyright law?,"This article considers the novel question of whether a generative AI model could be an infringing imported article under the secondary infringement / Australian copyright owners have joined the global challenge to the widespread scraping of copyright works in the development and training of generative / copyright, imported article, artificial intelligence, copyright infringement, intellectual property, generative AI, large language models",Jani McCutcheon,2024,journalArticle,ssrn,maybe_queue
NHT59QHY,Deploying software: a technology explainer and a look toward the future,"Finally, it briefly explores a future where agentic AI—autonomous systems that write, test, and deploy code—reshapes accountability, liability, and control / software deployment, software development, deployment, technology explainer, Agentic AI, DevOps",Andrea Dean,2025,journalArticle,ssrn,keep_queue
SCLT47W2,"When machines think for us: hannah arendt, agentic AI, and the quiet collapse of judgment","This paper argues that the rise of agentic AI—systems capable of autonomous perception, planning, and action—poses a structural threat to democratic / This paper argues that the rise of agentic AI—systems capable of autonomous perception, planning, and action—poses a structural threat to democratic / Drawing on Hannah Arendt's analyses of totalitarianism, the vita activa, and the banality of evil, the paper identifies the deepest risk of agentic AI / Agentic AI, Hannah Arendt, Totalitarianism, Axiological Displacement, Banality of Evil, Surveillance Capitalism, Social Media, Adolescent Neurodevelopment / , AI Governance",Caroline Gans Combe,2026,journalArticle,ssrn,keep_queue
QNDFHYEA,Hallucinated justice; ai-generated case law and the attorney's obligation to verify,"The rising utilization of generative artificial intelligence (""AI"") techniques in legal writing has engendered a novel category of professional accountability / Simultaneously, courts and commentators have acknowledged a similar although separate issue: generative AI systems often misrepresent / AI hallucination, generative AI, AI-generated citations, attorney sanctions, artificial intelligence legal research, Rule 11 sanctions, professional responsibility",Andrew Ucheomumu,2026,journalArticle,ssrn,keep_queue
PNCL8T9B,Confident but incorrect: mitigating hallucination and overconfidence in agentic AI coders,"Agentic AI capable of independent software development is transforming productivity in engineering. But their increasing independence brings up important dependability issues that require careful thought. These systems typically produce code that seems technically sound at first glance but has underlying logical or functional errors; this issue is called hallucination. The problem worsens and there are fewer opportunities for human review or confirmation when such erroneous outputs are given excessive confidence. The study presented here claims that the systematic cause of these shortcomings is training approaches in big language models that emphasize reinforcement learning based on human feedback and aimed at terminal outcomes. Such methods, which prioritize seeming plausibility over substantive truth and encourage stylistic coherence at the expense of rigorous reasoning, jeopardize the software architectures' ongoing resilience. To counter this, a different training strategy is advised. The primary change, referred to as reinforcement learning from process supervision, causes supervisors to focus on intermediate reasoning paths rather than terminal products. This alignment includes tried-and-true engineering techniques that place a high value on sequential verification and clear justification articulation. A subsequent improvement includes formal verification and uncertainty estimates in the generative pipeline, which allows models to detect and signal epistemic constraints in code synthesis. These interventions are supported by empirical evaluations: on a defined benchmark group, the pass-at-one accuracy measure improved by 14 percentage points compared to the baseline, and the ROC curve area increased from 0.68 to 0.78, indicating improved failure anticipation efficacy. These results provide a viable path for agentic AI to participate in programming tasks as trustworthy, reflective partners, instead of assertive but faulty assistants. © 2025 IEEE.",Tripathi; Kohli; Misra; Jakhar A.K.; Kumar A.,2025,conferencePaper,arxiv|scopus,keep_queue
DW7PKCRF,The role of AI in transforming workplaces and its impact on deep work,"As artificial intelligence (AI) becomes increasingly embedded in workplaces, concerns arise about its unintended impacts on human cognitive engagement, skill development, and the ability to perform deep work, sustained, focused, cognitively demanding tasks. This study examines how over-reliance on AI influences deep work capacity, both directly and indirectly, through cognitive engagement and hard skill acquisition. It also explores the moderating role of AI governance frameworks in mitigating potential adverse effects. Drawing on Cognitive Load Theory and Control Theory, the research proposes a conceptual model and outlines a future empirical study using survey data from knowledge workers. The findings aim to inform both theory and practice by identifying strategies to balance AI integration with the preservation of critical human cognitive capabilities in increasingly automated environments. © Americas Conference on Information Systems, AMCIS 2025.",Najafabadi; Eslami,2025,conferencePaper,,maybe_queue
GQ5E7RPF,"Blockchain and AI framework for provenance, semantics, and compliance","Crucially, the framework incorporates human-in-the-loop governance, positioning AI as a decision-support mechanism rather than an autonomous authority. / articulating a system-level architecture for provenance that is verifiable, interpretable, and audit-ready, without introducing custodial dependencies or opaque automation",Tara Saric,2026,journalArticle,ssrn,maybe_queue
2HIK8KEE,Generative AI policies in academic research,"manual cross-validation, the research identified 10 primary themes and 29 subthemes, covering areas such as data privacy and security, transparency and accountability / Generative AI, research policy, research guideline",Renbin Song; Shubin Yu,2025,journalArticle,ssrn,maybe_queue
XQ2858YZ,Algorithmic transparency and decision-making accountability: thoughts for buying machine learning algorithms,"There has been a great deal of research on how to achieve algorithmic accountability and transparency in automated decision-making systems - especially / algorithmic accountability, machine learning, procurement, automated decision-making",Jake Goldenfein,2019,journalArticle,ssrn,keep_queue
KG962MNY,ChatGPT and intermediary liability: why section 230 does not and should not protect generative algorithms,"ChatGPT does not function as an intermediary of third-party content but rather creates content in part by itself. / Finally, I argue that it is unnecessary to immunize generative algorithms like ChatGPT at this time. / Generative AI, Section 230, ChatGPT, Generative Algorithms",Hasala Ariyaratne,2023,journalArticle,ssrn,maybe_queue
EXS3Q43P,Generative AI and nigerian copyright law,"This mass adoption raises novel legal questions vis-à-vis existing copyright regulations in Nigeria. / Second, who copyright in AI generated content vests, and third, who should be held liable when such content infringes on pre-existing copyright. / Copyright, Generative AI, AI, Nigeria, Intellectual Property",Emmanuel Andem,2025,journalArticle,ssrn,maybe_queue
KCRCBEZK,Why AI training on copyrighted material constitutes fair use,"This paper argues that the use of copyrighted material for AI model training, particularly large language models and generative AI, fundamentally aligns / We contend that AI training is a transformative act, fostering unprecedented innovation and economic value that outweighs potential harms to copyright / Artificial Intelligence, Fair Use, Copyright Law, Innovation Management, Strategic Management, Economic Policy, Digital Transformation, Intellectual Property",Preet Deep Singh,2025,journalArticle,ssrn,maybe_queue
864ILU8K,"Cyber security in AI-driven justice systems: the bar, the bench and other ethical concerns","The integration of artificial intelligence (AI) into justice systems is transforming the administration of law by enhancing efficiency, accessibility, oversight. Artificial Intelligence, Cyber Security, Nigerian Judiciary, Data Protection",Olumide Babalola,2026,journalArticle,ssrn,maybe_queue
