item_key,title,abstract,authors,year,item_type,sources,source_queue
YJT8HS9Z,The S-a-D-a-L loop: a reliability-gated architecture for forensic-ready cyber-physical AI systems,"AI-driven cyber-physical systems increasingly participate in high-consequence operational decisions, yet many architectures implicitly treat model confidence / The S-AD A -L Loop provides a system-level foundation for building forensic-ready, safety-aware AI systems operating under real-world uncertainty. / AI Systems Reliability, Cyber-Physical Systems, Forensic Readiness, Decision Provenance, Human-in-the-Loop AI, Security Architecture",Manideep Prathipati,2026,journalArticle,ssrn,maybe_queue
UGSMCVJU,ATLAS-OS1: dual scepter: separating extraction from judgment in deterministic AI systems a stratified cognitive architecture with open scalar ontology and proprietary coherence governance,"Introduction: The Governance Approach Democratization Governance Failure Mode Fully Open (e.g., Llama, Mistral) High None Misuse proliferation, safety / failures Fully Closed (e.g., GPT-4, Claude) None Opaque Concentration of power, no verification Federated (e.g., federated learning) Partial Distributed",Roland Gibson Jr.,2026,journalArticle,ssrn,maybe_queue
TQGFG8YC,AutoDFBench 1.0: a benchmarking framework for digital forensic tool testing and generated code evaluation,"The National Institute of Standards and Technology (NIST) Computer Forensic Tool Testing (CFTT) programme has become the de facto standard for providing digital forensic tool testing and validation. However to date, no comprehensive framework exists to automate benchmarking across the diverse forensic tasks included in the programme. This gap results in inconsistent validation, challenges in comparing tools, and limited validation reproducibility. This paper introduces AutoDFBench 1.0, a modular benchmarking framework that supports the evaluation of both conventional DF tools and scripts, as well as AI-generated code and agentic approaches. The framework integrates five areas defined by the CFTT programme: string search, deleted file recovery, file carving, Windows registry recovery, and SQLite data recovery. AutoDFBench 1.0 includes ground truth data comprising of 63 test cases and 10,968 unique test scenarios, and execute evaluations through a RESTful API that produces structured JSON outputs with standardised metrics, including precision, recall, and F1 score for each test case, and the average of these F1 scores becomes the AutoDFBench Score. The benchmarking framework is validated against CFTT's datasets. The framework enables fair and reproducible comparison across tools and forensic scripts, establishing the first unified, automated, and extensible benchmarking framework for digital forensic tool testing and validation. AutoDFBench 1.0 supports tool vendors, researchers, practitioners, and standardisation bodies by facilitating transparent, reproducible, and comparable assessments of DF technologies. © 2026",Wickramasekara; Mihiranga; Withanage; Weerasinghe; Breitinger,2026,journalArticle,arxiv|scopus,maybe_queue
J62938UF,AI-C2C (conscious to conscience): a governance framework for ethical AI integration,"However, its rapid adoption also brings ethical, regulatory, and governance challenges. / The framework consists of three stages: AI-Conscious adoption, AI+Human Intelligence (HI) collaboration, and AI-Conscience governance. / AI Governance, Ethical AI, Human-AI Collaboration, Explainable AI (XAI), Algorithmic Bias, Responsible AI Practices",Thamburaj Anthuvan; Kajal Maheshwari,2025,journalArticle,ssrn,keep_queue
F4IGATS8,Mitigating the judicial human-AI fairness gap,"experiment with more than 4,800 observations to explore whether delegating judicial tasks to algorithms affects perceived procedural fairness and how human-in-the-loop / Keywords: human-AI fairness gap, human in the loop, judicial decision-making, robot courts, ethnic disparities.",Benjamin Minhao Chen; Yoan Hermstrüwer; Pascal Langenbach; Alexander Stremitzer; Kevin Tobia,2025,journalArticle,ssrn,maybe_queue
RQP5CXIG,LicenseGPT: a fine-tuned foundation model for publicly available dataset license compliance,"Dataset license compliance is a critical yet complex aspect of developing commercial AI products, particularly with the increasing use of publicly available datasets. Ambiguities in dataset licenses pose significant legal risks, making it challenging even for software IP lawyers to accurately interpret rights and obligations. In this paper, we introduce LicenseGPT, a fine-tuned foundation model (FM) specifically designed for dataset license compliance analysis. We first evaluate existing legal FMs (i.e., FMs specialized in understanding and processing legal texts) and find that the best-performing model achieves a Prediction Agreement (PA) of only 43.75%. LicenseGPT, fine-tuned on a curated dataset of 500 licenses annotated by legal experts, significantly improves PA to 64.30%, outperforming both legal and general-purpose FMs. Through an A/B test and user study with software IP lawyers, we demonstrate that LicenseGPT reduces analysis time by 94.44%, from 108 seconds to 6 seconds per license, without compromising accuracy. Software IP lawyers perceive LicenseGPT as a valuable supplementary tool that enhances efficiency while acknowledging the need for human oversight in complex cases. Our work underscores the potential of specialized AI tools in legal practice and offers a publicly available resource for practitioners and researchers. Moreover, LicenseGPT has the potential to assist AI software developers in managing preliminary license checks before involving legal counsel, helping to avoid costly late-stage rework and ensuring AI software compliance. © 2025 Copyright held by the owner/author(s).",Tan; Rajbahadur; Li; Song; Lin,2025,conferencePaper,,maybe_queue
JFQAY5X7,Implications of the EU AI act for U.S. regulatory strategy and corporate risk management,"The European Union Artificial Intelligence Act (EU AI Act) establishes a pioneering risk-based regulatory framework that will significantly impact AI governance / and compliance worldwide. / EU AI Act, artificial intelligence, regulation, compliance, risk classification, AI governance, audit",David Krause,2025,journalArticle,ssrn,keep_queue
T2EG4BE2,"Vibe coding in practice: flow, technical debt, and guidelines for sustainable use","Vibe Coding (VC) is a form of software development assisted by generative AI, in which developers describe the intended functionality or logic via natural language prompts, and the AI system generates the corresponding source code. VC can be leveraged for rapid prototyping or developing the Minimum Viable Products (MVPs); however, it may introduce several risks throughout the software development life cycle. Based on our experience from several internally developed MVPs and a review of recent industry reports, this article analyzes the flow-debt tradeoffs associated with VC. The flow-debt trade-off arises when the seamless code generation occurs, leading to the accumulation of technical debt through architectural inconsistencies, security vulnerabilities, and increased maintenance overhead. These issues originate from process-level weaknesses, biases in model training data, a lack of explicit design rationale, and a tendency to prioritize quick code generation over human-driven iterative development. Based on our experiences, we identify and explain how current model, platform, and hardware limitations contribute to these issues, and propose countermeasures to address them, informing research and practice towards more sustainable VC approaches.",Waseem; Ahmad; Kemell; Rasku; Lahti,2025,preprint,arxiv,keep_queue
FYLWDMNZ,Generative AI training as unjust enrichment,"First, courts may find that generative AI training infringes on the copyright of human creators. / Important to note, the fact that copyright law offers poor solutions to the generative AI dilemma is not surprising, as generative AI was nothing more",Yotam Kaplan; Ayelet Gordon-Tapiero,2024,journalArticle,ssrn,maybe_queue
TJAE8M3W,Rapid development of omics data analysis applications through vibe coding,"Building custom data analysis platforms traditionally requires extensive software engineering expertise, limiting accessibility for many researchers. Here, I demonstrate that modern large language models (LLMs) and autonomous coding agents can dramatically lower this barrier through a process called 'vibe coding', an iterative, conversational style of software creation where users describe goals in natural language and AI agents generate, test, and refine executable code in real-time. As a proof of concept, I used Vibe coding to create a fully functional proteomics data analysis website capable of performing standard tasks, including data normalization, differential expression testing, and volcano plot visualization. The entire application, including user interface, backend logic, and data upload pipeline, was developed in less than ten minutes using only four natural-language prompts, without any manual coding, at a cost of under $2. Previous works in this area typically require tens of thousands of dollars in research effort from highly trained programmers. I detail the step-by-step generation process and evaluate the resulting code's functionality. This demonstration highlights how vibe coding enables domain experts to rapidly prototype sophisticated analytical tools, transforming the pace and accessibility of computational biology software development.",Meyer,2025,preprint,arxiv,keep_queue
6UI7BBBI,Ethical and legal boundaries of training AI on protected works: a comprehensive analysis of intellectual property challenges in the generative AI era,"This paper examines the complex intersection of intellectual property law and AI development, analyzing current litigation trends, platform policies, and / comprehensive analysis of recent lawsuits, including high-profile cases against OpenAI, Meta, and Anthropic, we investigate the boundaries between fair use and copyright / Artificial Intelligence, Copyright Law, Fair Use, Intellectual Property, Generative AI, Training Datasets, Digital Rights",Kinshuk Agarwal; Kushagra Awasthi; Aditya Lanka; Mohammad Meezan; Shruthi Mn,2025,journalArticle,ssrn,maybe_queue
EG4BPTJV,Johnson’s algorithmic accountability and platform responsibility,I use online platforms to illustrate the importance of Johnson’s approach to algorithmic accountability.,Kirsten Martin,2023,journalArticle,ssrn,maybe_queue
