item_key,title,abstract,authors,year,item_type,sources,source_queue
9I2A3GAC,How editors perceive the use of generative artificial intelligence in writing academic papers: a narrative review,"Purpose: This review article examines, from an editor's perspective, how generative artificial intelligence (AI) can be integrated into academic writing, peer review, and editorial workflows while protecting scientific soundness. Current concepts: Editors increasingly encounter manuscripts containing fabricated or unverifiable references and receive post-publication error reports, trends that have been amplified by AI-assisted checking and meta-research. An assessment of 100 Korean medical journals (January-March 2024) found that only 18 journals provided explicit guidance on AI use. Among journals with such policies, most prohibited listing AI as an author and emphasized author accountability, while disclosure requirements, permitted uses, and sanctions varied. Reviews of top-ranked medical journals similarly reveal heterogeneous approaches to disclosure and to reviewers' use of AI under confidentiality constraints. Some journals, such as Journal of Educational Evaluation for Health Professions, make disclosure optional because AI-detection tools are unreliable and AI-assisted and human-written text are often intermingled. Discussion and conclusion: Natural language-based vibe-coding can also enhance peer review when prompts are designed to ensure reproducible analyses. Confidentiality safeguards and options to opt out of model training should be implemented whenever manuscripts or data are uploaded. Because AI-text screening tools produce variable results and the boundary between acceptable assistance and impermissible primary generation remains unclear, detection should not be relied upon as the sole enforcement mechanism. Instead, authors, reviewers, and editors should serve as supervisors responsible for design decisions and interpretation, as well as for ensuring the availability of data and protocols, while preparing for faster, AI-enabled submission-to-publication workflows.",Huh,2026,journalArticle,wos,maybe_queue
D6BMPN6N,Emerging compliance in the generative decentralized era,"Emerging technologies such as Artificial Intelligence (AI), including Generative AI (GenAI), and blockchain are reshaping regulatory compliance in the / As machine-generated data becomes the norm, traditional models reliant on human oversight are becoming obsolete, necessitating swift adaptation from regulators",Nizan Geslevich Packin,2024,journalArticle,ssrn,keep_queue
28CHLB2N,"Agentic AI, retrieval-augmented generation, and the institutional turn: legal architectures and financial governance in the age of distributional AGI","This paper examines the intersection of agentic AI, Retrieval-Augmented Generation (RAG), and their implications for legal accountability and financial / Furthermore, we acknowledge significant governance gaps within Decentralized Finance (DeFi) protocols where institutional oversight mechanisms face structural / Agentic AI, Retrieval-Augmented Generation, RAG, Institutional Governance, Multi-Agent Systems, AI Safety, Mechanism Design, Governance Graphs, EU AI Act",Marcel Osmond,2026,journalArticle,ssrn,keep_queue
IAZKUZWM,Lean software development: a tutorial,"To put the concept of lean software development in context, it's useful to point out similarities and differences with agile software development. Agile development methods have generally expected system architecture and interaction design to occur outside the development team, or to occur in very small increments within the team. Because of this, agile practices often prove to be insufficient in addressing issues of solution design, user interaction design, and high-level system architecture. Increasingly, agile development practices are being thought of as good ways to organize software development, but insufficient ways to address design. Because design is fundamentally iterative and development is fundamentally iterative, the two disciplines suffer if they are not carefully integrated with each other. Because lean development lays out a set of principles that demand a whole-product, complete life-cycle, cross-functional approach, it's the more likely candidate to guide the combination of design, development, deployment, and validation into a single feedback loop focused on the discovery and delivery of value.",Poppendieck; Cusumano,2012,journalArticle,coursework,keep_queue
56BUD7KU,The sentinel system: a global architecture for AI governance and safety,"In this rapidly expanding gap of oversight, where fragmented regulation, opaque corporate governance, and insufficient safety standards allow room for / with major regulatory frameworks including the European AI Act. / AI Governance, AI Safety, Artificial Intelligence Regulation, AI Alignment, Responsible AI, AI Oversight, Algorithmic Governance, AI Risk Management, AI",Emanuele Colombo,2026,journalArticle,ssrn,keep_queue
6JTZWQ7Q,Navigating the legal and ethical framework for generative AI: fostering responsible global governance,"Generative AI systems have given incredible ability to independently produce a wide variety of content types, including textual, visual, and more. / Complex issues with copyright protection and intellectual property rights have arisen as a result of this change.",Anuttama Anuttama Ghose; S. M. Aamir Ali,2025,journalArticle,ssrn,keep_queue
84J6UQA9,"Designing an ethical multimodal driver monitoring systems: risk mitigation, incident response, and accountability in automated vehicles","and regulatory compliance. / While overarching frameworks such as the GDPR, EU AI Act, and IEEE standards offer important guidance, they lack the specificity required for addressing / Autonomous vehicles, Driver Monitoring System, EU AI Act, Human factors, Data governance",Bilal Alam Khan; Waseem Shariff; Rory Coyne; Muhammad Ali Farooq; Peter Corcoran,2025,journalArticle,ssrn,maybe_queue
6SJ93GKA,"Optimizing agentic code generation: cost efficiency, observability and orchestration","Large Language Model (LLM) agents have recently shown promise in automating complex software development workflows, integrating multiple tools and iterative processes. However, existing agentic frameworks often fall short on observability - robust logging, cost and workflow monitoring, and prompt transparency - leading to unpredictable behavior and high operational overhead. In this paper, we introduce a unified, observability-driven multi-agent approach that integrates customizable LLM wrappers, explicit flow control (via LangGraph), and thorough logging into cloud native NoSQL DynamoDB database. Beyond describing a purely engineering-focused solution, we demonstrate via testing results that our observability enhancements yield improvements in reliability, performance, and cost control on standard benchmarks (LeetCode, MBPP, and HumanEval). Our wise model selection leading to $ 0.01 per correct solution generation. We also show that carefully orchestrated role-specialized agents, combined with real-time prompt and cost tracking, can achieve state-of-the-art performance (up to 98% accuracy) on diverse and complex code generation tasks. Our findings emphasize how bridging best-practice engineering with multi-agent AI research can substantially improve the cost, reliability and scalability of LLM-based development pipelines.",A. Kaplunovich,8-11,conferencePaper,arxiv|ieee|scopus,maybe_queue
URKE57I5,Accountability for responsible AI practices: ethical responsibilities of senior leadership,"AI. / Finally, senior leaders have unique responsibility for two key pillars of ethical and responsible AI: governance and responsibility. / artificial intelligence, ethics, responsible AI, Corporate Governance, Accountability, Responsibility",Alex John London,2024,journalArticle,ssrn,keep_queue
FCFCFDHF,"Responsible AI management: evolving practice, growing value","(2) Who in the organization is responsible for RAIM? / This could mean that effective AI governance requires a combination of skills; and (3) Responsible AI management creates significant business value by / AI governance, AI ethics, Responsible AI, AI strategy, Artificial Intelligence, Trustworthy AI",Dennis D. Hirsch; Jared Ott; Angie Westover-Munoz,2025,journalArticle,ssrn,maybe_queue
UJN9DH4I,Artificial intelligence and copyright: comments on a notice requested by the U.S. copyright office,"Copyright Office where we address the issues of human/author in the loop, copyright law, fair use and how copyright law is reimagined in the age of generative / AI. / copyright, creativity, originality, AI, generative AI, artificial intelligence, data, input, output, originality",Paul Jurcys; Jouko Ahvenainen; Mark Fenwick; Davey Whitcraft,2023,journalArticle,ssrn,maybe_queue
RQI8NXJL,"Identity-aware governance for autonomous AI agents: a framework for enterprise authorization, delegation, and audit","Cisco's finding that 26% of analyzed agent skills contain security vulnerabilities, and architectural analysis of credential inheritance patterns in Claude / Code Agent Teams, Cursor FastRender (2,000 concurrent agents), and OpenClaw (30,000+ internet-exposed instances). / AI Agents, Identity Governance, Authorization, Delegation, Multi-agent Systems, Prompt Injection, Zero Trust, MCP, Enterprise Security, LLM Security",Hariharan Ramachandran; Gour Mishra,2026,journalArticle,ssrn,keep_queue
53WZ7NY3,"The ""zhejiang model"" from China: a novel framework for AI ethics governance through leading-enterprise-driven symbiosis","., DeepSeek, Unitree Robotics) and the ""Six Giants of Zhejiang"" (e.g., Alibaba Cloud, Hikvision)—has catalyzed the emergence of a distinctive leading-enterprise-driven / The Zhejiang Model thus offers a replicable blueprint for constructing effective, adaptive, and culturally situated AI governance systems. / AI Ethics Governance, Zhejiang Model, Leading-Enterprise Symbiosis, Compliance by Design, Multi-Stakeholder Co-Governance",Ye Chen; Junping Yang; Naiding Yang,2025,journalArticle,ssrn,keep_queue
46VFVT5Q,Ethical challenges of using artificial intelligence in the judiciary,"This article explores the ethical challenges posed by the growing use of Artificial Intelligence (AI) in judicial systems worldwide. / The article concludes with policy recommendations, urging courts to adopt transparent, auditable, and human-centered AI systems, supported by strong oversight",Desmond Offiong,2025,journalArticle,ssrn,keep_queue
6NQFP922,Gen-AI for TSMO knowledge management,"Despite its transformative potential, Gen-AI adoption faces critical challenges, including ethical considerations, computational constraints, and the need / The paper emphasizes the importance of responsible AI development, fairness, and explainability to ensure sustainable adoption.",Shriyank Somvanshi; Jinli Liu; Subasish Das,2025,journalArticle,ssrn,maybe_queue
3S8YW6VE,Case study white paper: platform-level epistemic gatekeeping and the suppression of independent AI research on figshare,"with AI-generated or non-scholarly material. / We conclude with minimum procedural safeguards for repositories: domain-matched human review on appeal, transparent rationale codex for takedowns",Jace(Jeong Hyeon) Kim,2025,journalArticle,ssrn,maybe_queue
2MPUZHQL,Asleep at the keyboard? Assessing the security of GitHub copilot’s code contributions,"There is burgeoning interest in designing AI-based systems to assist humans in designing computing systems, including tools that automatically generate computer code. The most notable of these comes in the form of the first self-described ‘AI pair programmer’, GitHub Copilot, which is a language model trained over open-source GitHub code. However, code often contains bugs—and so, given the vast quantity of unvetted code that Copilot has processed, it is certain that the language model will have learned from exploitable, buggy code. This raises concerns on the security of Copilot’s code contributions. In this work, we systematically investigate the prevalence and conditions that can cause GitHub Copilot to recommend insecure code. To perform this analysis we prompt Copilot to generate code in scenarios relevant to high-risk cybersecurity weaknesses, e.g. those from MITRE’s “Top 25” Common Weakness Enumeration (CWE) list. We explore Copilot’s performance on three distinct code generation axes—examining how it performs given diversity of weaknesses, diversity of prompts, and diversity of domains. In total, we produce 89 different scenarios for Copilot to complete, producing 1,689 programs. Of these, we found approximately 40% to be vulnerable.",H. Pearce; B. Ahmad; B. Tan; B. Dolan-Gavitt; R. Karri,2022,conferencePaper,ieee,keep_queue
6MJ93ETN,Regulating the future: the current state and prospects of artificial intelligence policy in Nigeria,"This study critically examines the current state of AI regulation in Nigeria, identifying gaps in legal structures, institutional oversight, and enforcement / and evaluates international best practices, including regulatory models from the European Union (EU AI Act, 2021), the United States (NIST AI Risk Management / Artificial Intelligence, AI Regulation, Nigeria, AI Policy, Ethical AI, AI Governance, Data Privacy, Algorithmic Bias, EU AI Act, NIST AI Framework",Abdulhameed Onimisi Salihu,2025,journalArticle,ssrn,keep_queue
3MCSLDND,AI actionability over interpretability,"Moreover, enterprise AI deployments increasingly involve multiple systems including retrieval-augmented generation, guardrails, and agents that further / Actionability through observability offers financial institutions and regulators a viable path for responsible AI deployment at scale, potentially warranting",Mike Hsu,2025,journalArticle,ssrn,keep_queue
99DNI26D,"Algorithmic criminal liability in greenwashing: comparing india, united states, and European union","It subverts regulatory oversight. / The findings advocate for an interdisciplinary approach to AI regulation, ensuring algorithmic opacity does not preclude liability enforcement in sustainability-related / Artificial Intelligence, Corporate Criminal Liability, Algorithmic Misrepresentation, Environmental Fraud, Strict Liability in AI Governance",Sahibpreet Singh; Manjit Singh,2025,journalArticle,ssrn,maybe_queue
A2Q92SVQ,A student’s guide to the law and policy of AI,"integrates canonical thought experiments, cultural metaphors, and historical analogies to illuminate enduring questions about computation, agency, and governance / The aim is not to resolve normative disputes about AI regulation, but to equip readers with the conceptual literacy necessary to engage intelligently with",Matthew Sag,2025,journalArticle,ssrn,maybe_queue
2Z4PZABF,Regulatory gap: why model risk management is structurally ill-suited to govern AI-driven code transformation,"Where prior work has observed that SR 11-7 ""strains"" under agentic AI, we contribute, to the best of our knowledge, the first systematic pillar-by-pillar / We consider whether overlapping regulatory frameworks—operational risk management, FFIEC IT governance, and existing software development lifecycle controls—fill / SR 11-7, OCC 2011-12, AI code transformation, COBOL modernization, governance framework, TPRM, transformation risk, functional equivalence",Alex Li,2026,journalArticle,ssrn,keep_queue
JU295XYR,Opening the black box: petri nets and privacy by design,"Building on the growing literature in algorithmic accountability, this paper investigates the use of a process visualisation technique known as the Petri / Opening up the ‘black box’ in this way could be a step towards achieving better algorithmic accountability. / Privacy by Design; Regulatory Theory; Petri Nets; Formalisation; Transparency, Algorithmic Accountability",Laurence Diver; Burkhard Schafer,2016,journalArticle,ssrn,maybe_queue
SXMPNUWU,"Intelligence beyond knowledge: control, autonomy, and the logical architecture of artificial agency","Intelligence, on this account, is not epistemic accumulation but the organization and reflexive reorganization of control under constraint. / AI Ethics, Artificial Intelligence, DIKW Hierarchy, Control Theory, Artificial Agency, Category Error, AI Governance, Large Language Models, Levels of",Huiwen Han,2026,journalArticle,ssrn,maybe_queue
6T43MWT3,Generative AI as an equaliser in cognitive work: evidence on seniority bias from EU-LFS,"Generative AI compresses the performance gap between average and top cognitive workers by democratising procedural execution (techne). / Moreover, the human advantage is structurally transitory, compressing as systems absorb tacit knowledge, accountability migrates to impersonal processes / generative AI, labour market, equalising effect, seniority bias, phronesis, cognitive work, EU-LFS, ChatGPT, Skill obsolescence, Eurostat, senior to junior",Dora Moscato,2026,journalArticle,ssrn,maybe_queue
BDD48G8E,Testing the limits of NotebookLM in ecological systematic review screening: text pre-processing yields high performance,"Large language model–based systems such as Google's NotebookLM (NBLM) offer promising automation, yet their performance, and reproducibility remain / We propose an optimized, human-in-the-loop AI screening workflow that significantly reduces filtering workloads while preserving the comprehensiveness",Santiago M. Costas; Florencia Romina Diaz; Daniela Orchanski; Pablo Germán Pastore; Elmer Andrés Fernández,2026,journalArticle,ssrn,maybe_queue
QISDKT4B,Art school for machines: process-based world model knowledge distillation as an architectural solution to copyright liability in generative AI,"Contemporary generative AI systems for visual media are trained on datasets of completed works, creating structural copyright liability that no post-hoc / generative AI at the architectural level. / generative AI, copyright, world models, knowledge distillation, ethical AI, visual media, embedding alignment, artistic process",Travis Gilly,2026,journalArticle,ssrn,maybe_queue
VLUNYII6,Test vs mutant: adversarial LLM agents for robust unit test generation,"Software testing is a critical, yet resource-intensive phase of the software development lifecycle. Over the years, various automated tools have been developed to aid in this process. Search-based approaches typically achieve high coverage but produce tests with low readability, whereas large language model (LLM)-based methods generate more human-readable tests but often suffer from low coverage and compilability. While the majority of research efforts have focused on improving test coverage and readability, little attention has been paid to enhancing the robustness of bug detection, particularly in exposing corner cases and vulnerable execution paths. To address this gap, we propose AdverTest, a novel adversarial framework for LLM-powered test case generation. AdverTest comprises two interacting agents: a test case generation agent (T) and a mutant generation agent (M). These agents engage in an adversarial loop, where M persistently creates new mutants ""hacking"" the blind spots of T's current test suite, while T iteratively refines its test cases to ""kill"" the challenging mutants produced by M. This interaction loop is guided by both coverage and mutation scores, enabling the system to co-evolve toward both high test coverage and bug detection capability. Experimental results in the Defects4J dataset show that our approach improves fault detection rates by 8.56% over the best existing LLM-based methods and by 63.30% over EvoSuite, while also improving line and branch coverage.",Chang; Fang; Chen; Shi; Shen,2026,preprint,coursework,keep_queue
QCWKJCUC,Harnessing large language models for software vulnerability detection: a comprehensive benchmarking study,"Despite various approaches being employed to detect software vulnerabilities, the number of reported software vulnerabilities shows an upward trend over the years. This suggests the problems are not caught before the code is released, which could be caused by many factors, like lack of awareness, limited efficacy of the existing vulnerability detection tools or the tools not being user-friendly. To help combat some issues with traditional vulnerability detection tools, we propose using large language models (LLMs) to assist in finding vulnerabilities in source code. LLMs have shown a remarkable ability to understand and generate code, underlining their potential in code-related tasks. The aim is to test multiple state-of-the-art LLMs and identify the best prompting strategies, allowing extraction of the best value from the LLMs. We leverage findings from prompting-focused research, benchmarking approaches like chain of thought, tree of thought and self-consistency for vulnerability detection use-cases. We provide an overview of the strengths and weaknesses of the LLM-based approach and compare the results to those of traditional static analysis tools. We find that LLMs can pinpoint more issues than traditional static analysis tools, outperforming traditional tools in terms of recall and F1 scores. However, LLMs are more prone to generate false positive classifications than traditional tools. The experiments are conducted using the Java programming language and the results should benefit software developers and security analysts responsible for ensuring that the code is free of vulnerabilities.",K. Tamberg; H. Bahsi,2025,journalArticle,ieee,keep_queue
8WT63Z4M,The legal implications of copyright protection for artificial intelligence-generated art in Nigeria,"The study investigates the unique legal challenges presented by AI-generated art in Nigeria and proposes tailored recommendations to adapt copyright laws / revisions to Nigerian copyright legislation to adapt to these innovative creations. / AI Copyright Law, Authorship of AI Works, Generative AI Art, Intellectual Property Rights Nigeria (IPR), Nigerian Copyright Act 2022, Ownership AI Generated",Praise Adegoke,2025,journalArticle,ssrn,maybe_queue
2YE6KBRB,AI governance and the containment problem: why observation and advisory roles must precede control,"This paper was developed using AI-based language tools to assist with structure and refinement. / Artificial intelligence, AI governance, AI containment, oversight, advisory systems, observational systems, human-in-the-loop, decision authority, autonomous",Joseph Hurd,2026,journalArticle,ssrn,keep_queue
WJSU9LQQ,Self-certification of high-risk AI systems: the example of AI-based facial emotion recognition,"Artificial Intelligence Act establishes comprehensive requirements for high-risk AI systems, yet the harmonized standards necessary for demonstrating compliance / These findings establish the Fraunhofer AI assessment catalogue as a valuable preparatory tool that complements rather than replaces formal compliance / Self-Certification, AI Act, Artificial Intelligence, Auditing Catalogues",Gregor Autischer; Kerstin Waxnegger; Dominik Kowald,2026,journalArticle,ssrn,keep_queue
IQIF2GMM,Codifying ethics guidelines for trustworthy AI,"regulatory definition, meaning that, in the absence of clear regulatory provisions, firms have a lack of a reference point to demonstrate regulatory compliance / Ethics, AI, Regulation, Law, Technology, Trustworthy, EU AI Act, Artificial Intelligence",Sean Musch; Michael Borrelli; Olga Grilly; Harvey Castro; Charles Kerrigan,2025,journalArticle,ssrn,keep_queue
57CGYIUQ,Fair use defenses in disruptive technology cases,"The fair use limitation on the scope of authorial exclusive rights is expected to be the main defense in lawsuits charging generative AI developers with / fair use defenses and claims of harms to copyright markets resulting from uses of in-copyright works for generative AI. / Copyright law, fair use, technology, artificial intelligence, generative AI, market harm, Supreme Court, dataset, ingestion, outputs",Pamela Samuelson,2023,journalArticle,ssrn,maybe_queue
8NMTYPQY,A pragmatic approach to regulating AI agents,"The current advancement in and deployment of agentic AI systems has created a set of key challenges for the legal frameworks that govern their use. / On the contractual side, we advocate for a ""traffic light"" system of staggered task authorization based on operational risk and the creation of a statutory / Artificial Intelligence, AI Regulation, Agentic AI, Contract Law",Philipp Hacker; Matthias Holweg,2026,journalArticle,ssrn,keep_queue
ZH9WG8XR,Collateral algorithmic enforcement: when language is not understanding-platform governance failures and the rise of large understanding models,"The findings contribute to the literature on AI governance, platform economics, and algorithmic accountability by reframing moderation failures as a consequence",Prof. Dr. Uwe Seebacher (MBA); Bernd Trummer; Carolin Meyer; Tim Seebacher,2026,journalArticle,ssrn,keep_queue
