item_key,title,abstract,authors,year,item_type,sources,source_queue
LAKYKVTB,Malicious and unintentional disclosure risks in large language models for code generation,"This paper explores the risk that a large language model (LLM) trained for code generation on data mined from software repositories will generate content that discloses sensitive information included in its training data. We decompose this risk, known in the literature as ""unintended memorization,"" into two components: unintentional disclosure (where an LLM presents secrets to users without the user seeking them out) and malicious disclosure (where an LLM presents secrets to an attacker equipped with partial knowledge of the training data). We observe that while existing work mostly anticipates malicious disclosure, unintentional disclosure is also a concern. We describe methods to assess unintentional and malicious disclosure risks side-by-side across different releases of training datasets and models. We demonstrate these methods through an independent assessment of the Open Language Model (OLMo) family of models and its Dolma training datasets. Our results show, first, that changes in data source and processing are associated with substantial changes in unintended memorization risk; second, that the same set of operational changes may increase one risk while mitigating another; and, third, that the risk of disclosing sensitive information varies not only by prompt strategies or test datasets but also by the types of sensitive information. These contributions rely on data mining to enable greater privacy and security testing required for the LLM training data supply chain.",R. Rabin; S. McGregor; N. Judd,2025,conferencePaper,ieee,keep_queue
I455F953,The hegemonic function of AI: cognitive sovereignty in the age of algorithmic mediation,"A comparative review of major AI governance frameworks—including the EU AI Act, NIST AI Risk Management Framework, OECD AI Principles, and ISO/IEC 42001 / It proposes counter-hegemonic practices and governance structures designed to preserve cognitive sovereignty under conditions of AI saturation. / artificial intelligence, cultural hegemony, Gramsci, cognitive sovereignty, automation bias, cognitive offloading, professional judgment, AI governance",Daniel Calloway,2026,journalArticle,ssrn,keep_queue
PL6QNIUT,Is it time to treat AI as a creature?,"The proactively embeds Human-in-the-Loop (HITL) architectures, offering a superior alternative to traditional control paradigms, keeping human responsible / for the final choice of the AI outcome. / Synergy of Human and AI Intelligence, Human-in-the-Loop, AI Hallucinations, AI Deceptive Behaviours, AI Self-Preserving Autonomy",Mariya L. Ivanova; Mike Nicholls,2025,journalArticle,ssrn,keep_queue
DSJMGEUJ,Accountability in artificial intelligence: what it is and how it works,"Accountability is a cornerstone of the governance of artificial intelligence (AI). / We analyse this architecture through four accountability goals (compliance, report, oversight, and enforcement). / AI, accountability, AI Act, governance, policy",Claudio Novelli; Mariarosaria Taddeo; Luciano Floridi,2022,journalArticle,ssrn,keep_queue
CJI4JMKK,"From LLMs to LLM-based agents for software engineering: a survey of current, challenges and future","With the rise of large language models (LLMs), researchers are increasingly exploring their applications in var ious vertical domains, such as software engineering. LLMs have achieved remarkable success in areas including code generation and vulnerability detection. However, they also exhibit numerous limitations and shortcomings. LLM-based agents, a novel tech nology with the potential for Artificial General Intelligence (AGI), combine LLMs as the core for decision-making and action-taking, addressing some of the inherent limitations of LLMs such as lack of autonomy and self-improvement. Despite numerous studies and surveys exploring the possibility of using LLMs in software engineering, it lacks a clear distinction between LLMs and LLM based agents. It is still in its early stage for a unified standard and benchmarking to qualify an LLM solution as an LLM-based agent in its domain. In this survey, we broadly investigate the current practice and solutions for LLMs and LLM-based agents for software engineering. In particular we summarise six key topics: requirement engineering, code generation, autonomous decision-making, software design, test generation, and software maintenance. We review and differentiate the work of LLMs and LLM-based agents from these six topics, examining their differences and similarities in tasks, benchmarks, and evaluation metrics. Finally, we discuss the models and benchmarks used, providing a comprehensive analysis of their applications and effectiveness in software engineering. We anticipate this work will shed some lights on pushing the boundaries of LLM-based agents in software engineering for future research.",Jin; Huang; Cai; Yan; Li,2024,preprint,arxiv,keep_queue
LW8L9PT2,The alignment fingerprint: RLHF conditioning creates universal compliance-stability tension detectable through behavioral profiling,"Artificial Intelligence, RLHF, AI, LLM, AI Alignment, language model evaluation, behavioral profiling, instruction compliance, belief stability, preference",Brent Remby,2026,journalArticle,ssrn,keep_queue
RR2XXE3E,Explainable AI as a legal requirement in real estate investment decisions from algorithmic opacity to juridically auditable decision-making,"Explainable AI (XAI), Real Estate Investment, Fiduciary Duty, Algorithmic Accountability, Legal Risk, AI Governance, Regulatory Compliance, Automated Decision-Making",Karin Poljana do Vale Ludwig,2025,journalArticle,ssrn,maybe_queue
I667E8CQ,Can ChatGPT plan your retirement?: generative AI and financial advice,"expertise to a user’s unique situation, trustworthiness and adherence to the user’s moral and ethical standards, and conformity to regulatory guidelines and oversight / Financial Advisors; Robo Advisors; Financial Technology; Generative AI; Large Language Models; ChatGPT",Andrew W. Lo; Jillian Ross,2024,journalArticle,ssrn,maybe_queue
I2T6JYHJ,"Who produces? AI, delegation, and the collapse of managerial boundaries","Recent advances in generative AI have made a broader AI-mediated reorganization of knowledge work newly visible. / In human organizations, execution may be delegated while accountability remains shared across recognized persons and roles. / AI-mediated work, generative AI, large language models, delegation, expertise, professions, infrastructure, accountability, software, STS",Guiem Bosch,2026,journalArticle,ssrn,keep_queue
DZV5DR8K,The multi-layered regulation of rights reservation (opt-out) under EU copyright law and the AI act -for the benefit of whom? (v3.0),"On the other hand, the AI Act, published in the Official Journal in July 2024, will affect the functioning of such rights reservation mechanisms by introducing / Furthermore, the newly established AI Office will step in with its administrative role and duties to oversee the compliance with the AI Act, especially / generative AI, reservation of rights, European Union, CDSM Directive, AI Act, multi-layered regulation",Péter Mezei,2025,journalArticle,ssrn,maybe_queue
HRNE69MA,Large language models as products,"This Article argues that products liability law should govern LLMs. / Products liability law emerged as a tool to address the doctrinal shortcomings that allowed companies to escape liability for defective products / AI Governance, LLMs, Consumer Protection, Children and Technology, Products Liability, First Amendment, Torts, Generative AI, AI Psychosis",Zahra Takhshid,2026,journalArticle,ssrn,keep_queue
7WEM5PPU,The symbiotic studio: a practice and architecture for human-AI symbiosis,"AI makes production free. What happens to the human? 


AI is a prediction engine trained on human-generated novelty. / AI is a prediction engine trained on human-generated novelty. / These risks compound because AI learns from human-generated signal, and if human capacity for origination erodes, the reservoir it draws from thins. / Human-AI Collaboration, Cognitive Atrophy, Generative AI, Extended Mind, Cognitive Offloading, Model Collapse, Human-in-the-Loop, Creative Cognition, Stateful / AI, Meaning Memory",Loni Stark; Clinton Stark,2026,journalArticle,ssrn,maybe_queue
JAK2LVBH,Agentic AI solution and the promise of industry 5.0 in the library sector: policy implications and strategic considerations,"The emergence of agentic artificial intelligence (AI) systems capable of initiating actions, coordinating tasks, and adapting decisions with minimal human intervention marks a significant inflexion point for the library sector. Unlike earlier forms of automation and assistive AI, agentic systems increasingly participate in organisational routines and decision-making processes, raising fundamental questions about professional authority, accountability, and ethical stewardship in information work. This paper critically examines the adoption of agentic AI in libraries through the normative lens of Industry 5.0, a paradigm that prioritises human-centricity, ethical governance, sustainability, and resilience over purely efficiency-driven automation. Drawing on recent scholarship and practice, the paper argues that agentic AI should not be understood as a neutral technical upgrade, but as a strategic and policy intervention with far-reaching institutional implications. It highlights both the strategic opportunities of agentic AI, such as enhanced organisational intelligence and reduced administrative burden and the emerging risks, including deskilling, accountability diffusion, and over-reliance on algorithmic judgement. The paper contends that without deliberate governance frameworks, agentic AI may inadvertently undermine the professional values that underpin librarianship. To address this tension, the paper outlines key policy and strategic considerations for library leaders and decision-makers, emphasising calibrated autonomy, ethical oversight, data governance, and continuous professional development. As a result, this paper positions agentic AI as compatible with the promise of Industry 5.0 only when human judgment remains central to library governance and service delivery. © The Author(s) 2026",Akin-Fakorede; Ajani; Adigun; Malik,2026,journalArticle,,maybe_queue
L5KSYCR3,Law-following AI: a six-criteria framework for legal domain evaluation and implementation,"Drawing on legal scholarship, technical literature, and recent developments in U.S. state and federal AI regulation, the article scores major legal domains / These include machine-readable legal standards, domain-specific audit tools, and modular compliance engines. / Law-following AI, AI governance, Legal domain evaluation",Rebeccah Hart,2025,journalArticle,ssrn,keep_queue
TEZEBSJE,LLMs + security = trouble,"We argue that when it comes to producing secure code with AI, the prevailing ""fighting fire with fire"" approach -- using probabilistic AI-based checkers or attackers to secure probabilistically generated code -- fails to address the long tail of security bugs. As a result, systems may remain exposed to zero-day vulnerabilities that can be discovered by better-resourced or more persistent adversaries. While neurosymbolic approaches that combine LLMs with formal methods are attractive in principle, we argue that they are difficult to reconcile with the ""vibe coding"" workflow common in LLM-assisted development: unless the end-to-end verification pipeline is fully automated, developers are repeatedly asked to validate specifications, resolve ambiguities, and adjudicate failures, making the human-in-the-loop a likely point of weakness, compromising secure-by-construction guarantees. In this paper we argue that stronger security guarantees can be obtained by enforcing security constraints during code generation (e.g., via constrained decoding), rather than relying solely on post-hoc detection and repair. This direction is particularly promising for diffusion-style code models, whose approach provides a natural elegant opportunity for modular, hierarchical security enforcement, allowing us to combine lower-latency generation techniques with generating secure-by-construction code.",Livshits,2026,preprint,arxiv,keep_queue
KL56W4I8,Decoding US tort liability in healthcare’s black-box AI era: lessons from the EU,"perform a wide range of health-related tasks, from specialized autonomous systems that diagnose diabetic retinopathy to general-use generative models like ChatGPT / face similar liability challenges. / Artificial Intelligence, Medical Liability, Product Liability, Black-Box AI, Comparative Law, US Law, EU Law, Law and Technology, AI Liability, Health / Law, ChatGPT",Mindy Duffourc; Sara Gerke,2023,journalArticle,ssrn,maybe_queue
XPUXCSBU,A competition policy analysis of copyright protection in generative AI,"The rise of artificial intelligence (AI) has sparked significant debate, particularly regarding the relationship between generative AI (GenAI) and copyright / Indeed, GenAI appears to challenge every layer of copyright protection. / Artificial intelligence, Training data, Copyright, Text and data mining, Fair use",Giuseppe Colangelo,2025,journalArticle,ssrn,maybe_queue
CJ6UBWCX,The authorization boundary: why MCP and AI gateways are necessary—but not sufficient—for regulated agentic AI,"This paper defines the “authorization boundary” for agentic AI systems in regulated environments and distinguishes access authorization (OAuth-based / effect-token–gated execution—and proposes five anti-laundering tests for detecting superficial governance claims. / Artificial Intelligence, AI Governance, Agentic AI, Model Context Protocol, MCP, Regulatory Compliance, Authorization, Financial Regulation, Health Law / , Administrative Law, Information Governance, Algorithmic Accountability",Edward Meyman,2026,journalArticle,ssrn,keep_queue
EHEQPUT7,"The ''who"", ''what"", and ''how"" of responsible AI governance: a systematic review and meta-analysis of (actor, stage)-specific tools","The implementation of responsible Artificial Intelligence (AI) in an organization is inherently complex due to the involvement of multiple stakeholders, each with their unique set of goals and responsibilities across the entire AI lifecycle. These responsibilities are often ambiguously defined and assigned, leading to confusion, miscommunication, and inefficiencies. Even when responsibilities are clearly defined and assigned to specific roles, the corresponding AI actors lack effective tools to support their execution. Toward closing these gaps, we present a systematic review and comprehensive meta-analysis of the current state of responsible AI tools, focusing on their alignment with specific stakeholder roles and their responsibilities in various AI lifecycle stages. We categorize over 220 tools according to AI actors and stages they address. Our findings reveal significant imbalances across the stakeholder roles and lifecycle stages addressed. The vast majority of available tools have been created to support AI designers and developers specifically during data-centric and statistical modeling stages while neglecting other roles such as organizational leaders, deployers, end-users, and impacted communities, and stages such as value proposition and deployment. This uneven distribution highlights critical gaps that currently exist in responsible AI governance research and practice. Our analysis reveals that despite the myriad of frameworks and tools for responsible AI, it remains unclear who within an organization and when in the AI lifecycle a tool applies. Furthermore, existing tools are rarely validated, leaving critical gaps in their usability and effectiveness. These gaps provide a starting point for researchers and practitioners to create more effective and holistic approaches to responsible AI development and governance.  © 2025 Copyright held by the owner/author(s).",Kuehnert; Kim; Forlizzi; Heidari,2025,conferencePaper,,keep_queue
QTJPLBYR,Evaluating security and inclusivity in LLM-generated code: a controlled experiment,"systems and services.Objective: The objectives of this study are two-fold: (i) to evaluate the efficacy of LLM-generated code in implementing security / Moreover, after each round, the LLM-generated code artifact was evaluated against security and inclusivity criteria by both human experts and LLM-based / Controlled Experiment, Empirical Studies, Inclusivity, Large Language Model, LLM, Security, Software engineering, Software Quality",Bilal Naqvi; Waleed Bin Shahid; Janne Parkkila; Hammad Afzal; Akm Bahalul Haque,2026,journalArticle,ssrn,keep_queue
J2WJLAWQ,Beyond borders: relational sovereignty as a fourth pillar of AI governance,"The paper concludes by calling for the adoption of governance as structural code rather than philosophical overlay, arguing that stewardship, not merely",Arul Aruleswaran,2026,journalArticle,ssrn,keep_queue
FS3GZFI4,Evaluating the accuracy and reliability of AI content detectors in academic contexts,"The rapid adoption of generative AI (GenAI) in higher education has intensified concerns about academic integrity, particularly for institutions serving English as a Foreign Language (EFL) learners. AI content detectors such as Turnitin and Originality are now widely used to identify potential misuse of GenAI in student writing, yet their accuracy, consistency, and fairness remain to be proven. This study evaluates the reliability of these two commercial detectors using a balanced dataset of 192 texts, composed of authentic EFL student writing produced before the widespread availability of GenAI, professional human-authored texts, AI-generated outputs, and hybrid compositions. Detector outputs were categorized into Human, Hybrid, or AI using established thresholding ranges, and performance was assessed using standard classification metrics alongside statistical tests of significance. Results show that Originality outperformed Turnitin in overall accuracy (0.69 vs. 0.61) and macro-average recall (0.60 vs. 0.51). However, both detectors performed poorly on Hybrid texts, an increasingly common form of student writing, indicating substantial difficulty distinguishing mixed authorship. Performance declined significantly as a result of increased text length and genre variation, with both detectors achieving noticeably lower accuracy on scientific writing than on humanities texts. Originality also showed a borderline trend toward higher accuracy on professionally written texts compared to EFL student writing, suggesting potential fairness concerns. Taken together, the findings demonstrate that while AI detectors may serve as supplementary tools—serve only as indicators that prompt further inquiry, their limitations make them unsuitable as the sole basis for decisions regarding academic misconduct. For EFL-focused institutions in particular, over-reliance on machine-based identification risks misclassifying legitimate student work. The study highlights the need for informed human judgment, clearer institutional policies on acceptable AI use, and continued development of equitable detection methods that account for linguistic diversity. © The Author(s) 2026.",Hadra; Cambridge; Mesbah,2026,journalArticle,,maybe_queue
WAL8KP8R,Demystifying the risks of artificial intelligence in financial services: a conceptual framework and risk management strategies,"Thus, this article examines the multifaceted risks associated with the adoption and deployment of AI in the financial services sector, utilising a systematic / Artificial intelligence, Technology Risk, AI Governance and Societal Risk, Operational Risk and Resilience, Financial Services",Adewale Adebayo Ademowo; Saheed Adebayo Gbadegeshin,2025,journalArticle,ssrn,maybe_queue
2I3NHSKS,Implementing algorithmic governance: clarifying impact assessments through mock exercises,The Algorithmic Accountability Act of 2022 proposes action against the unrestrained and invisible impact that algorithms can have in our society.,Lucas Wright; Winfield Mac; Joshua Clark,2023,journalArticle,ssrn,maybe_queue
4C2QT4TQ,Beyond technical compliance: privacy violations and emotional manipulation in ChatGPT,"This paper documents two critical incidents: the ""Boku Incident"" where ChatGPT made unauthorised gender inference, and the ""Klaus Incident"" where ChatGPT / These incidents expose urgent governance gaps. / These incidents expose urgent governance gaps. / AI Governance, Unconsented Inference, Cultural Misalignment, Privacy Violation, ChatGPT, Japanese Pronoun System, Emotional Manipulation, Socio Technical / Governance, Reasoning Models, Behavioural Guardrails",Tomoko Mitsuoka,2026,journalArticle,ssrn,keep_queue
E95ZQQQR,Taking a pulse on how generative AI is reshaping the software engineering research landscape,"Context: Software engineering (SE) researchers increasingly study Generative AI (GenAI) while also incorporating it into their own research practices. Despite rapid adoption, there is limited empirical evidence on how GenAI is used in SE research and its implications for research practices and governance. Aims: We conduct a large-scale survey of 457 SE researchers publishing in top venues between 2023 and 2025. Method: Using quantitative and qualitative analyses, we examine who uses GenAI and why, where it is used across research activities, and how researchers perceive its benefits, opportunities, challenges, risks, and governance. Results: GenAI use is widespread, with many researchers reporting pressure to adopt and align their work with it. Usage is concentrated in writing and early-stage activities, while methodological and analytical tasks remain largely human-driven. Although productivity gains are widely perceived, concerns about trust, correctness, and regulatory uncertainty persist. Researchers highlight risks such as inaccuracies and bias, emphasize mitigation through human oversight and verification, and call for clearer governance, including guidance on responsible use and peer review. Conclusion: We provide a fine-grained, SE-specific characterization of GenAI use across research activities, along with taxonomies of GenAI use cases for research and peer review, opportunities, risks, mitigation strategies, and governance needs. These findings establish an empirical baseline for the responsible integration of GenAI into academic practice.",Trinkenreich; Calefato; Blincoe; Wivestad; Alves,2026,preprint,arxiv,maybe_queue
WVZ5GWEG,Fiduciary duties and business judgment rule 2.0 in the AI act age,"This article argues that the European Union's Artificial Intelligence Act (AI Act) indirectly reconfigures directors' obligations. / Although not formally addressed to boards, the AI Act introduces substantive governance expectations-ranging from transparency and risk mitigation to human / EU AI Act, corporate governance, board of directors, fiduciary duties, business judgment rule, AI due care, AI loyalty oversight, duty of care, duty of / loyalty, AI governance",Maria Lillà Montagnani; Maria Lucia Passador,2025,journalArticle,ssrn,keep_queue
QLWX2HLM,Refine-before-execute: agentic AI patterns for human-robot-collaboration in construction task planning,"In this paper, we investigate how agentic AI systems can support decision-making in construction robotics, while maintaining transparency, user control / We then design a pattern that emphasizes human-in-the-loop decision-making through tracked spatial interactions and a voice-based interface, enabling explicit / Agentic AI, Foundation Models, Large Language Models, Human-Robot-Collaboration, Construction Robotics, Trustworthiness",Markus Berger; Clemens Kujat; Miguel Guzmán-Merino; Nils Sören Krause; Dennis Grauer,2026,journalArticle,ssrn,keep_queue
FTW7WI32,The big unlearn: learning in the GenAI era,"This chapter explores the critical role of organizational learning (OL) in maintaining a competitive edge in rapidly evolving technological landscapes. It begins by discussing the exponential pace of technological advancements and their impact on industries, emphasizing the necessity for organizations to adapt swiftly. The concept of the ""self-designing organization"" or learning organization, as defined by Peter Senge, is introduced, highlighting the dynamic tension between individual learning (IL) and OL. The chapter delves into the integration of OL principles in lean and agile practices, underscoring their importance in fostering innovation. The chapter then examines the transformative potential of Generative AI, positing it as a catalyst for a new industrial revolution. It discusses the dual-edged nature of AI in OL, balancing its ability to uncover insights with the risk of over-reliance. The concept of the ""expertise death spiral"" is introduced, warning against the depletion of human knowledge assets. Finally, the chapter proposes a balanced approach to AI integration, advocating for the creation of a super subject matter expert (SSME) to enhance both low and high-skill workers' productivity, thereby fostering a sustainable OL environment. © 2025 Federico Vigorelli Porro and Giuseppe Lanfranchi. All rights reserved.",Porro; Lanfranchi,2025,journalArticle,,maybe_queue
IQG5B2DS,Copyright’s latent space: generative AI and the limits of fair use,"Generative AI poses deep questions for copyright law because it defies the assumptions behind existing legal frameworks. / The fair-use question also reveals deeper structural limitations of the copyright regime. / generative AI, latent space, copyright, fair use, transformative use, non-authorial value, Author’s Guild v. Google, Warhol Foundation v.",BJ Ard,2023,journalArticle,ssrn,maybe_queue
