item_key,title,abstract,authors,year,item_type,sources,source_queue
TA6GIUK2,The specification as quality gate: three hypotheses on AI-assisted code review,"The dominant industry response to AI-generated code quality problems is to deploy AI reviewers. This paper argues that this response is structurally circular when executable specifications are absent: without an external reference, both the generating agent and the reviewing agent reason from the same artefact, share the same training distribution, and exhibit correlated failures. The review checks code against itself, not against intent. Three hypotheses are developed. First, that correlated errors in homogeneous LLM pipelines echo rather than cancel, a claim supported by convergent empirical evidence from multiple 2025-2026 studies and by three small contrived experiments reported here. The first two experiments are same-family (Claude reviewing Claude-generated code); the third extends to a cross-family panel of four models from three families. All use a planted bug corpus rather than a natural defect sample; they are directional evidence, not a controlled demonstration. Second, that executable specifications perform a domain transition in the Cynefin sense, converting enabling constraints into governing constraints and moving the problem from the complex domain to the complicated domain, a transition that AI makes economically viable at scale. Third, that the defect classes lying outside the reach of executable specifications form a well-defined residual, which is the legitimate and bounded target for AI review. The combined argument implies an architecture: specifications first, deterministic verification pipeline second, AI review only for the structural and architectural residual. This is not a claim that AI review is valueless. It is a claim about what it is actually for, and about what happens when it is deployed without the foundation that makes it non-circular.",Zietsman,2026,preprint,arxiv,keep_queue
E493PWGV,China’s approach to international AI governance: selective shaping?,"As an AI frontrunner, China is advancing its vision of AI governance through endeavours such as the Global AI Governance Initiative. / This paper explores two important but underexplored questions: What is China’s approach to international AI governance?",Heng Wang,2026,journalArticle,ssrn,maybe_queue
YDTWNL5M,Governing hyperobjects - new economics of AI regulation,"Instead, I propose co-governance from within, using cybernetic, adaptive institutions. / I further introduce the concept of the agentic commons-a new form of computational governance integrating human and machine agency-and call for a rethinking",Jason Potts,2025,journalArticle,ssrn,keep_queue
A8XNV9RR,AI auditing: first steps towards the effective regulation of artificial intelligence systems,"AI auditing. / AI auditing standards should reflect a comprehensive approach targeting three components of AI development: data, model, and deployment.",Edwin Farley,2024,journalArticle,ssrn,keep_queue
ISPW5BCX,Lost in the loop: who is the 'human' of the human in the loop,"However, there is little scientific evidence that laws requiring a human in the loop improve decision outcomes. / What political work does human in the loop do, what kinds of political configurations does it enable? / Human in the loop, AI Accountability, Automated Decision-Making, Adminstrative Law",Jake Goldenfein,2024,journalArticle,ssrn,keep_queue
3F6ZY3E3,Artificial intelligence in the digital economy: multilateral and regional legal challenges from the perspective of the indo-pacific,"If successful, the Indo-Pacific region can also make an important legal contribution to the future global AI governance framework, as the present multilateral / framework at the global level established by the United Nations and World Trade Organization (WTO) system was created before the digital era, is fragmented",Rostam J. Neuwirth,2025,journalArticle,ssrn,maybe_queue
VDD8EJM6,Responsible artificial intelligence framework in accountancy (validated & revised),"Mitigating these risks requires a combination of governance, transparency, security and human oversight. / systems. / Artificial intelligence, responsible, trustworthy, framework, accounting, auditing, ethics",El'fred Boo; Chu Yeong Lim,2025,journalArticle,ssrn,keep_queue
NCRNAMYQ,Will the EU AI act help to eliminate dataset bias in medical AI?,"The aim of this article is to provide an overview and analyze the implications of the provisions on dataset quality and bias in the AI Act (AIA). / The AIA requires providers of AI systems to take measures to identify, prevent and mitigate biases as part of the data governance practices. / AI Act, bias, data governance, debiasing exception, medical AI systems, sensitive data",Emilia Niemiec; Peter Alexander Earls Davis; Mathias Hauglid,2025,journalArticle,ssrn,maybe_queue
W9CCNI8N,Mapping generative AI regulation in finance and bridging regulatory gaps,"regulatory landscape while raising awareness of the gaps that financial institutions and regulators should address to bridge the gaps in the GenAI responsible adoption / artificial intelligence, generative AI, AI Regulation, AI Governance, Financial Regulation",Nydia Remolina,2024,journalArticle,ssrn,keep_queue
SLDGQI5F,AIAIRS & ARM: a rights architecture and governance framework for AI agents as organizational members,"The deployment of autonomous AI agents-systems that select methods, use tools, and operate with delegated authority-has created an unprecedented governance / Existing AI governance frameworks (EU AI Act, NIST AI RMF, UNESCO, OECD) classify systems by risk and impose compliance requirements, but none address",Tamer Momtaz,2026,journalArticle,ssrn,keep_queue
A4Y87PHF,Responsible legal augmentation: integrating generative AI into legal practice,"legal practice cannot be reduced to linguistic plausibility alone, but must remain grounded in institutional practices of authority, authenticity and accountability / By reasserting that authenticity and accountability are core professional values, Ayinde signals a jurisprudential transition from tentative accommodation / Generative artificial intelligence, authenticity, accountability, legal profession, legal education, professional ethics, technology regulation",Zubair Abbasi,2025,journalArticle,ssrn,keep_queue
C2E7M967,AI copyrightability & five-tier evaluation model: rethinking the causal nexus in the age of generative AI,"The opacity of generative AI, commonly known as the ""black box"" phenomenon, strains copyright law by severing the causal nexus between human authorship / AI. / Copyrightability, Five-Tier Evaluation Model, Generative AI, Opacity, Malleability, Intellectual Contribution, Human Authorship, Prompt Engineering, Comparative / Copyright Office, USCO, Li v.",Dusty K,2026,journalArticle,ssrn,maybe_queue
ZGST9CY6,Designing meaningful human oversight in AI,"Human oversight is central to safe and responsible AI, but current approaches risk either collapsing agentic AI into mere automation, stripping it of its / The framework provides engineers, safety teams, users, and organisational leaders with a concrete way to design meaningful and effective oversight that / Artificial Intelligent, AI, Agentic AI, Human Oversight, Human Agency",Liming Zhu; Qinghua Lu; Ding Ming; Sung Une Lee; Chen Wang,2025,journalArticle,ssrn,keep_queue
X3SUCQRM,AI governance failures in healthcare: a diagnostic framework integrating policy tools and care delivery,"artificial intelligence, healthcare AI governance, algorithmic accountability, algorithmic bias, digital health governance, Donabedian model",Harish Gupta,2026,journalArticle,ssrn,maybe_queue
BP7F9WKS,Why alignment is not a control theory operationalizing structural judgment as a governance primitive for AGI,"To address this gap, we introduce Structural Judgment as a non-optimizable governance primitive: an external, categorical authority layer that remains / While I leverage advanced AI systems (such as Google's Gemini or ChatGPT) as a sophisticated logical and linguistic laboratory to scale my research, the",Alireza Fahim Yahyaei,2026,journalArticle,ssrn,keep_queue
K93SSG9Q,"A foundational framework for layered decision architectures architectural primacy in decision systems distinguishing normative design, predictive simulation, and optimization dynamics","Primacy, which establishes a hierarchical ordering between normative design, predictive simulation, and optimization dynamics in AI-driven and enterprise / The framework contributes to decision theory, AI governance, reinforcement learning architecture, and organizational systems design. / , Decision Engineering Science™ Decision Engineering Science™, Architectural Primacy, Decision Systems, Optimization Governance, Predictive Modeling, AI / Governance, Decision Drift",Aleksandra Pinar,2026,journalArticle,ssrn,maybe_queue
T6MALN24,Copyright policy options for generative artificial intelligence,This paper examines this issue from an economics perspective and analyses how different copyright regimes for generative AI will impact the quality of / A key factor is whether generative AI models are small (with content providers capable of negotiations with AI providers) or large (where negotiations,Joshua Gans,2024,journalArticle,ssrn,maybe_queue
P38MCUWB,The registry-to-bedside framework for clinical model validation,"The Registry-to-Bedside framework addresses the persistent validation gap in healthcare AI/ML, where models that perform well retrospectively often underperform / prospective clinical environments, integrating decision-support tools into existing workflows, enabling real-time monitoring for model drift, and incorporating human-in-the-loop",Ricardo Pietrobon; Aline Machiavelli; Luiza Paulsen Rodrigues; Amit Agrey; Lizzy Nkeangnyi,2026,journalArticle,ssrn,maybe_queue
W8TR3HLY,Implementing ethical principles of AI through the establishment of national organization for the ethics of AI,"Even many companies and industries, from tech giants to healthcare providers, are developing their own ethical codes for responsible AI use. / By studying successful models and adopting relevant tools, we can effectively integrate these principles and ensure responsible AI use.",Galbaatar Lkhagvasuren,2025,journalArticle,ssrn,maybe_queue
6TLI4598,"When ""too dangerous to release"" meets operational security reality: a critical analysis of anthropic's mythos containment failure","On April 7, 2026, Anthropic announced Claude Mythos Preview, a language model with unprecedented autonomous vulnerability discovery and exploitation capabilities / This paper critically analyzes the Mythos containment strategy, the breach incident, and the broader implications for frontier AI governance. / Frontier AI Security, AI Governance, Capability Containment, Operational Security, Mythos, Anthropic, Project Glasswing, Zero-Day Vulnerabilities, AI Safety",Marcel Osmond,2026,journalArticle,ssrn,maybe_queue
P868GNU7,On the use of agentic coding: an empirical study of pull requests on GitHub,"Large language models (LLMs) are increasingly being integrated into software development processes. The ability to generate code and submit pull requests with minimal human intervention, through the use of autonomous AI agents, is poised to become a standard practice. However, little is known about the practical usefulness of these pull requests and the extent to which their contributions are accepted in real-world projects.In this paper, we empirically study 567 GitHub pull requests (PRs) generated using Claude Code, an agentic coding tool, across 157 diverse open-source projects. Our analysis reveals that developers tend to rely on agents for tasks such as refactoring, documentation, and testing. The results indicate that 83.8% of these agent-assisted PRs are eventually accepted and merged by project maintainers, with 54.9% of the merged PRs being integrated without further modification. The remaining 45.1% require additional changes and benefit from human revisions, especially for bug fixes, documentation, and adherence to project-specific standards. These findings suggest that while agent-assisted PRs are largely acceptable, they still benefit from human oversight and refinement.",Watanabe; Li; Kashiwa; Reid; Iida,2026,journalArticle,acm|arxiv,keep_queue
QJFYPWLJ,Challenging the notion of trust around chatgpt in the high-stakes use case of insurance,"The public discourse around (dis)trust in ChatGPT and other applications based on large language models (LLMs) is loaded with generic, dread risk terms / We therefore argue that a domain-specific approach to good governance is essential to avoid negative externalities around financial inclusion. / AI governance, ChatGPT, insurance, Large language models, Trust",Juliane Ressel; Michaele Völler; Finbarr Murphy; Martin Mullins,2023,journalArticle,ssrn,maybe_queue
CAIMLG8P,Governing with algorithmic impact assessments: six observations,"Algorithmic impact assessments (AIA) are increasingly being proposed as a mechanism for algorithmic accountability. / These considerations remain open, and will determine whether and how AIAs can function as a viable governance mechanism in the broader algorithmic accountability / algorithmic impact assessment, algorithmic accountability, impact assessment, data ethics, algorithmic accountability, corporate governance",Emanuel Moss; Elizabeth Anne Watkins; Jacob Metcalf; Madeleine Clare Elish,2020,journalArticle,ssrn,keep_queue
GT8FQJ4K,Oversight design for AI-enabled decision making in government services,"This paper develops a framework for human oversight as a system property of Artificial Intelligence (AI) in public administration, ensuring that human / Artificial Intelligence AI, Governance, Automated Decision-Making, Human Oversight",Liming Zhu; Qinghua Lu; Sung Une Lee; Ding Ming,2025,journalArticle,ssrn,keep_queue
3JA8LSL3,AI in a tribal context: diverse perspectives matter in a changing landscape,"AI, AI Regulation, Artificial Intelligence, Ethical Collaborations, governance, Information Professionals, Regulatory Action, SI Libraries, Sovereignty",Evelyn Castro Cox,2026,journalArticle,ssrn,maybe_queue
J5RX8GHG,The 20 laws of artificial intelligence: a design-embedded codex for democratic and inclusive governance in the age of agentic systems,"Compliance must be certified by external, adversarial AI safety audits. / • Harm and Equity: Mandates absolute harm aversion (Laws 2-3) and requires geo-localized compliance (Law 4) / Artificial Intelligence Governance, Agentic Systems, AI Ethics, AI Architecture, EU AI Act, Constrained Design, software modularity, bias mitigation, Unix",Georgios Fradelos,2026,journalArticle,ssrn,keep_queue
F8BI4NGQ,An overview of the European union framework governing generative AI models and systems,"This study is a work in progress examining the legal framework governing generative AI models in the European Union. / First, it studies the rules already applicable to generative AI models (GDPR, Copyright Law, Civil Liability, Digital Services Act). / Generative AI, General Purpose AI models, AI Act, Product Liability Directive",Florence G'sell,2024,journalArticle,ssrn,keep_queue
CNU38EKT,Compensating for the risks and weaknesses of AI/ML models in finance,"Artificial Intelligence (AI) is transforming financial risk management by enhancing predictive accuracy, automating processes, and mitigating risks. / We propose a tripartite control matrix-remedial (algorithmic audits, human oversight), curative (explainable AI, diverse data sourcing), and compensative / Artificial Intelligence, Financial Risk Management, Machine Learning, Ethical AI, Regulatory Compliance",Satyadhar Joshi,2025,journalArticle,ssrn,maybe_queue
GMDF8JRN,Bias in Computer Systems,,Friedman; Nissenbaum,1996,journalArticle,naimi-book|naimi-references,maybe_queue
UMCQ52IC,"Humans integrate, agents fix: how agent-authored pull requests are referenced in practice","Although coding agents have introduced new coordination dynamics in collaborative software development, detailed interactions in practice remain underexplored, especially for the code review process. In this study, we mine agent-authored PR references from the AIDev dataset and introduce a taxonomy to characterize the intent of these references across Human-to-Agent and Agent-to-Agent interactions in the form of Pull Requests (i.e. PRs). Our analysis shows that while humans initiate most references to agent-authored PRs, a substantial portion of these interactions are AI-assisted, indicating the emergence of meta-collaborative workflows, where humans mostly use references to build new features, whereas agents make them to fix errors. We further find that referencing/referenced PRs are associated with substantially longer lifespans and review times compared to isolated PRs, suggesting higher coordination or integration effort. We then list three key takeaways as potential future research directions into how to utilize these dynamics for optimizing AI coding agents in the code review process.",Khemissi; Chouchen; Wang; Kula,2026,preprint,arxiv,keep_queue
455MHPCI,A survey of generative AI adoption and perceived productivity among scientists who program,"Programming is essential to modern scientific research, yet most scientists report inadequate training for the software development their work demands. Generative AI tools capable of code generation may support scientific programmers, but user studies indicate risks of over-reliance, particularly among inexperienced users. We surveyed 868 scientists who program, examining adoption patterns, tool preferences, and factors associated with perceived productivity. Adoption is highest among students and less experienced programmers, with variation across fields. Scientific programmers overwhelmingly prefer general-purpose conversational interfaces like ChatGPT over developer-specific tools. Both inexperience and limited use of development practices (like testing, code review, and version control) are associated with greater perceived productivity -- but these factors interact, suggesting formal practices may partially compensate for inexperience. The strongest predictor of perceived productivity is the number of lines of generated code typically accepted at once. These findings suggest scientific programmers using generative AI may gauge productivity by code generation rather than validation.",O'Brien; Parker; Eisty; Carver,2025,preprint,arxiv,keep_queue
UIIT8XGT,Harnessing large language models for automated software testing: a leap towards scalable test case generation,"Software testing is critical for ensuring software reliability, with test case generation often being resource-intensive and time-consuming. This study leverages the Llama-2 large language model (LLM) to automate unit test generation for Java focal methods, demonstrating the potential of AI-driven approaches to optimize software testing workflows. Our work leverages focal methods to prioritize critical components of the code to produce more context-sensitive and scalable test cases. The dataset, comprising 25,000 curated records, underwent tokenization and QLoRA quantization to facilitate training. The model was fine-tuned, achieving a training loss of 0.046. These results show the promise of AI-driven test case generation and underscore the feasibility of using fine-tuned LLMs for test case generation, highlighting opportunities for improvement through larger datasets, advanced hyperparameter optimization, and enhanced computational resources. We conducted a human-in-the-loop validation on a subset of unit tests generated by our fined-tuned LLM. This confirms that these tests effectively leverage focal methods, demonstrating the model's capability to generate more contextually accurate unit tests. The work suggests the need to develop novel validation objective metrics specifically tailored for the automation of test cases generated by utilizing large language models. This work establishes a foundation for scalable and efficient software testing solutions driven by artificial intelligence. The data and code are publicly available on GitHub.",Rehan; Al-Bander; Al-Said Ahmad,2025,journalArticle,wos,maybe_queue
B4JWDAMV,"Shadow AI: governance, risk, and organisational resilience","The rapid proliferation of generative and predictive AI tools has introduced a new and largely unregulated phenomenon: Shadow AI - the unsanctioned, informal use of artificial intelligence technologies within organisations. This paper conceptualises Shadow AI as a distinct sociotechnical challenge, emerging at the intersection of digital innovation, organisational culture, and governance failure. Through a multi-layered analysis, we develop a typology of Shadow AI use cases, propose a risk classification framework, and explore diverse stakeholder perspectives on its implications. Drawing on anonymised case studies from sectors including healthcare, finance, defence, and education, we demonstrate how Shadow AI introduces systemic vulnerabilities that are poorly addressed by conventional cybersecurity or compliance frameworks. The paper concludes by offering a set of actionable recommendations for organisations, policymakers, and educators, and outlines two forward-looking research agendas focused on secure AI deployment and cyber statecraft. By framing Shadow AI as both a risk and a signal of latent demand, this paper calls for an adaptive, ethically grounded approach to AI governance - one that balances innovation with resilience in an era of decentralised technology use. © 2025 IEEE.",Ross; Hibbert; Moss,2025,conferencePaper,,keep_queue
WBPBVTNW,AI takes the gavel: contract laws' new sidekick in automated decision-making,"AI systems may struggle to quickly adapt to these dynamic legal frameworks. / Therefore, relying solely on AI to make decisions without proper human oversight can carry significant risks, especially in environments where compliance",Jash Mistry,2024,journalArticle,ssrn,keep_queue
4BP86L5N,Transformative AI in human resource management: enhancing workforce planning with topic modeling,"This study explores the transformative role of artificial intelligence (AI) in human resource management (HRM), focusing on key functions such as recruitment, retention, and performance management. A comprehensive review was carried out PRISMA framework and BERTopic model on AI and HRM‑related keywords. The resulting publications were analyzed to extract meaningful topics. AI‑driven tools streamline candidate screening and interview analysis, significantly enhancing hiring efficiency and decision‑making accuracy. Concerns about algorithmic bias highlight the need for robust governance frameworks to ensure transparency and fairness in AI‑driven processes. The study emphasizes the importance of aligning AI adoption with Organizational Development principles to foster inclusivity and organizational justice. The integration of AI in performance management facilitates real‑time, objective performance assessments, although overreliance on such technologies can affect employee trust and engagement. Despite these advances, the study highlights ethical concerns surrounding data privacy and the potential for algorithmic bias. Addressing these challenges requires the implementation of comprehensive ethical frameworks to promote fairness and inclusivity in AI‑HRM applications. Strategically, AI transforms HR from a reactive function to a proactive, data‑driven partner aligned with long‑term organizational goals. Successful AI integration depends on governance mechanisms that uphold ethical standards, foster employee trust, and ensure transparency, enabling organizations to fully leverage AI’s potential in enhancing workforce management. © 2024 The Author(s). Published by Informa UK Limited, trading as Taylor & Francis Group.",Venugopal; Madhavan; Prasad; Raman,2024,journalArticle,,maybe_queue
GJYVD8XB,Project null: a physically enforced AGI containment framework for risk suppression and timeline control,"Contemporary artificial intelligence safety research has largely emphasized software-based approaches such as alignment, interpretability, and behavioral / oversight.",Nicholas Morse,2026,journalArticle,ssrn,maybe_queue
B4RFHXND,The automation paradox,"In the generative AI context, for example, the government has recently refused copyrights and patents apparently generated entirely by generative AI. / Beyond the intellectual property law context, there are other vexing constitutional questions raised by these two autonomous technologies. / Generative AI, ChatGPT, Autonomous Vehicles, Self-driving Cars, First Amendment, Originalism, Common law, Arizona, Texas, Oklahoma, liability, Who should",Mbilike M. Mwafulirwa,2024,journalArticle,ssrn,keep_queue
ETXU5VID,"HyperVerge, aadhaar, and surveillance capitalism in India","AI-powered facial recognition, digital public infrastructure, and surveillance capitalism in India through a case study of HyperVerge, a private technology firm / The findings have broader implications for digital ID systems, AI governance, and the emerging global infrastructure of biometric surveillance. / Aadhaar, surveillance capitalism, digital identity, AI governance, biometric infrastructure, HyperVerge, India, public-private partnership, Global South",Haakon Huynh,2025,journalArticle,ssrn,maybe_queue
