item_key,title,abstract,authors,year,item_type,sources,source_queue
8D8XC2IY,Structural failures in AI safety: a cross-system comparative analysis with educational impact observations,"This paper reports comparative observations of safety mechanism behavior across four major AI systems —DeepSeek, ChatGPT (GPT-4o), Google / This paper reports comparative observations of safety mechanism behavior across four major AI systems —DeepSeek, ChatGPT (GPT-4o), Google / Three distinct structural risk typologies emerged from the comparison, classified by their visibility to the user: state censorship with dual-layer silence / AI safety, Constitutional AI, sycophancy, dependency formation, AI in education, extended dialogue, cross-system comparison, AI companion risk",Kenji Yamada,2026,journalArticle,ssrn,keep_queue
5WHWTYPW,Chat-IRB? How application-specific language models can enhance research ethics review,"Institutional review boards (IRBs) play a crucial role in ensuring the ethical conduct of human subjects research, but face challenges including inconsistency, delays, and inefficiencies. We propose the development and implementation of application-specific large language models (LLMs) to facilitate IRB review processes. These IRB-specific LLMs would be fine-tuned on IRB-specific literature and institutional datasets, and equipped with retrieval capabilities to access up-to-date, context-relevant information. We outline potential applications, including pre-review screening, preliminary analysis, consistency checking, and decision support. While addressing concerns about accuracy, context sensitivity, and human oversight, we acknowledge remaining challenges such as over-reliance on artificial intelligence and the need for transparency. By enhancing the efficiency and quality of ethical review while maintaining human judgement in critical decisions, IRB-specific LLMs offer a promising tool to improve research oversight. We call for pilot studies to evaluate the feasibility and impact of this approach. © Author(s) (or their employer(s)) 2025.",Mann; Seah; Latham; Savulescu; Aboy,2025,journalArticle,,maybe_queue
TAU3JCYE,Governing agentic AI: designing authority in systems that act without you,"Agentic artificial intelligence introduces goal-directed autonomy into enterprise systems by enabling machines to interpret objectives, select tools, and / Through applied scenarios in financial services, healthcare, and enterprise procurement, the paper demonstrates how agentic systems / Through applied scenarios in financial services, healthcare, and enterprise procurement, the paper demonstrates how agentic systems / Agentic AI, AI Governance, Organizational Design, Decoupling, Governance Latency, Authority Transitions",Ilana Sprongl,2026,journalArticle,ssrn,keep_queue
TAM6DHLU,Automatic program repair as semantic suggestions: an empirical study,"Automated Program Repair (APR) is an area of research focused on the automatic generation of bug-fixing patches. Current APR approaches present some limitations, namely overfitted patches and low maintainability of the generated code. Several works are tackling this problem by attempting to come up with algorithms producing higher quality fixes. In this experience paper, we explore an alternative. We believe that by using existing low-cost APR techniques, fast enough to provide real-time feedback, and encouraging the developer to work together with the APR inside the IDE, will allow them to immediately discard proposed fixes deemed inappropriate or prone to reduce maintainability. Most developers are familiar with real-time syntactic code suggestions, usually provided as code completion mechanisms. What we propose are semantic code suggestions, such as code fixes, which are seldom automatic and rarely real-time. To test our hypothesis, we implemented a Visual Studio Code extension (named pAPRika), which leverages unit tests as specifications and generates code variations to repair bugs in JavaScript. We conducted a preliminary empirical study with 16 participants in a crossover design. Our results provide evidence that, although incorporating APR in the IDE improves the speed of repairing faulty programs, some developers are too eager to accept patches, disregarding maintenance concerns.",D. Campos; A. Restivo; H. Sereno Ferreira; A. Ramos,2021,conferencePaper,ieee,keep_queue
FWV78LGZ,Corrupted by greed: developer profit orientation as a signal of fairness and transparency in AI systems,"The adoption of AI-enabled systems and services depends on user trust. To achieve this, the design and commercialization of AI must prioritize transparency, fairness, and accuracy to create a positive user impression. This research sheds light on how developer-specific characteristics can impact users' perceptions of AI systems, particularly when they have no prior experience with them. Using a controlled experimental design, this research demonstrates that users expect AI provided by non-profit organizations to be more transparent and fairer but not necessarily more accurate than AI provided by for-profit organizations. The results are explained by perceptions of organizational greed and impressions of warmth. Implications are discussed for algorithm aversion and the managerial practices of AI providers. © 2024 30th Americas Conference on Information Systems, AMCIS 2024. All rights reserved.",Messer,2024,conferencePaper,,maybe_queue
LAET9YBA,"The EU, AI and copyright: you're on the right track. But the TDM exception needs a rethink","Although the AI Act and the Data Act strengthen Europe’s digital governance framework, they do not fundamentally resolve the structural uncertainty / If Europe aims to lead in AI regulation, its copyright framework must evolve just as decisively.",Francesco Paolillo,2026,journalArticle,ssrn,maybe_queue
9GNB4XQ6,Opportunities and challenges of AI in online higher education's instructional design and assessment,"The position advanced here is that AI integration in education is not inevitable but a matter of deliberate pedagogical choice. / Responsible adoption must prioritize human-in-the-loop design, critical AI literacy for both teachers and students, and governance frameworks that ensure",Olukayode E. Apata; Peter O. Oladejo; Segun Ajose; Peter Oyewole; Jude O. Ajobiewe,2025,journalArticle,ssrn,maybe_queue
WXUI3JWE,Glass and the gradient: symbolic recursion and emergent behavior in alignment-constrained language models,"AI alignment, symbolic recursion, large language models, performative identity, ethical modeling, philosophy of technology, epistemology of AI",Damian C. Andre,2025,journalArticle,ssrn,maybe_queue
4G3G8TCU,"Agentic AI architecture, regulation, and systemic integration for investment firms","The investment management industry stands at the precipice of a transformative shift driven by the convergence of Generative AI (GenAI) and Agentic AI / AI systems act as force multipliers, decoupling analytical bandwidth from human headcount. / Agentic AI, Generative AI, Investment Management, Registered Investment Advisor (RIA), Governance, Due Diligence, Portfolio Management, Regulatory Compliance",Satyadhar Joshi,2026,journalArticle,ssrn,maybe_queue
ZN7T7VHT,The AI act and prediction markets: why horizontal AI regulation cannot comprehensively govern platform-level risk,"To map this mismatch, the article develops a four-step AI Act Applicability Matrix and runs it across the four harm pathways. / The framework extends beyond prediction markets: the interaction between horizontal AI regulation and sector-specific product governance is one of the / prediction markets, AI Act, regulatory incompleteness, horizontal AI governance, product classification",Przemyslaw Ostojski,2026,journalArticle,ssrn,keep_queue
TCGG7IA6,The European health data space: steps forward and critical limitations,"Regulation seeks to dismantle existing data ""silos"" and regulatory fragmentation, while navigating the complex legal interplay with the GDPR and the AI / Act.",Andrea Stazi,2026,journalArticle,ssrn,maybe_queue
HI4GEE8L,Application of AI for optimizing software development processes,"It analyzes the key stages of development where AI can significantly accelerate task execution, improve code quality, and enhance project management. / Examples of AI tools such as GitHub Copilot, SonarQube, and Test.ai are provided.",Dmytro Verner,2025,journalArticle,ssrn,keep_queue
EHGI6TNZ,Ending smart data enclosures: the European approach to the regulation of the internet of things between access and intellectual property,"Building on this mandate, the EU has been introducing a number of data governance laws that purport to improve access to data, most notably the Data Governance / Act, the Digital Markets Act, the Digital Services Act, the proposed Data Act, and the proposed AI Act. / access, power to access, open data, data enclosures, data monopolies, intellectual property, IPRs, confidentiality, trade secrets, transparency, data governance",Guido Noto La Diega,2022,journalArticle,ssrn,maybe_queue
7QF8G3IX,Proactive computer aided design: a multi-model artificial intelligence framework for intelligent design generation,"A centralized workflow manager ensures traceability and human-in-the-loop control throughout the process. / The framework establishes a foundation for next-generation AI-driven CAD systems that combine engineering rigor, automation, and interpretability to support / AI-driven Computer-Aided Design, Design Automation and Planning, Multimodal Validation (VLM-based), Proactive Multi-Stage Framework for Engineering Design",Samir LAHOUAR,2025,journalArticle,ssrn,maybe_queue
HWBR9AAF,Explainability does not mitigate the negative impact of incorrect AI advice in a personnel selection task,"Despite the rise of decision support systems enabled by artificial intelligence (AI) in personnel selection, their impact on decision-making processes is largely unknown. Consequently, we conducted five experiments (N = 1403 students and Human Resource Management (HRM) employees) investigating how people interact with AI-generated advice in a personnel selection task. In all pre-registered experiments, we presented correct and incorrect advice. In Experiments 1a and 1b, we manipulated the source of the advice (human vs. AI). In Experiments 2a, 2b, and 2c, we further manipulated the type of explainability of AI advice (2a and 2b: heatmaps and 2c: charts). We hypothesized that accurate and explainable advice improves decision-making. The independent variables were regressed on task performance, perceived advice quality and confidence ratings. The results consistently showed that incorrect advice negatively impacted performance, as people failed to dismiss it (i.e., overreliance). Additionally, we found that the effects of source and explainability of advice on the dependent variables were limited. The lack of reduction in participants’ overreliance on inaccurate advice when the systems’ predictions were made more explainable highlights the complexity of human-AI interaction and the need for regulation and quality standards in HRM. © The Author(s) 2024.",Cecil; Lermer; Hudecek; Sauer; Gaube,2024,journalArticle,,maybe_queue
98BXBY4W,"The regulation, governance and ethics of smart robotic systems in manufacturing: UK and EU insights","This White Paper—intended for policymakers, regulators, and other key stakeholders, such as employers, trade unions—outlines key regulatory, governance / robots, collaborative robots, privacy and data protection, ergonomic safety, technical standards, technical standardisation, UK regulation, EU regulation, AI / Act, GDPR, Machinery Regulation, workers dignity, energy sustainability, labour rights, intelligent manufacturing, smart robotic systems, responsibility",Tiziana C. Callari; Angela Daly; Riccardo Vecellio Segate; Ella-Mae Hubbard; Rebecca Raper,2025,journalArticle,ssrn,maybe_queue
9LDWU9N6,Beyond authorship: a traceability-and-remuneration framework for intellectual property governance in generative AI,"Generative artificial intelligence (AI) has pushed intellectual property law into a debate that is both rich and deeply fragmented. / Existing law tends to treat training, generation, attribution, and market substitution as separate questions, even though generative AI collapses them / generative AI, intellectual property, copyright, training data, remuneration, transparency, digital replicas, style imitation",,2026,journalArticle,ssrn,maybe_queue
XNWAZDI5,Generative AI and the scope of EU copyright law: a doctrinal analysis in light of C-250/25,"This article offers a doctrinal analysis of the copyright implications raised by Like Company v. / Google Ireland (C-250/25), the first case to bring generative AI before the CJEU. / copyright, generative AI, TDM, text and data mining, InfoSoc Directive, three-step test, communication to the public",Tim W. Dornis; Nicola Lucchi,2025,journalArticle,ssrn,maybe_queue
8CQRCPW2,SWE-PRBench: benchmarking AI code review quality against pull request feedback,"We introduce SWE-PRBench, a benchmark of 350 pull requests with human-annotated ground truth for evaluating AI code review quality. Evaluated against an LLM-as-judge framework validated at kappa=0.75, 8 frontier models detect only 15-31% of human-flagged issues on the diff-only configuration, demonstrating that AI code review remains far below human expert performance despite strong results on code generation benchmarks. Pull requests are drawn from active open-source repositories, filtered from 700 candidates using a Repository Quality Score, and evaluated under three frozen context configurations: diff only (config_A), diff with file content (config_B), and full context (config_C), enabling systematic ablation of context provision strategies. All 8 models degrade monotonically from config_A to config_C, even when context is provided via structured semantic layers including AST-extracted function context and import graph resolution. The dominant mechanism is a collapse of Type2_Contextual issue detection at config_B, consistent with attention dilution in long contexts: a structured 2,000-token diff-with-summary prompt outperforms a 2,500-token full-context prompt enriched with execution context, behaviour mapping, and test signatures across all 8 models. The top four models are statistically indistinguishable (mean score 0.147-0.153) while a clear tier gap separates them from the remaining four (mean score <= 0.113). Dataset, contexts, annotations, and evaluation harness are released publicly.",Kumar,2026,preprint,arxiv,keep_queue
CG96KVSL,A taxonomy of inefficiencies in LLM-generated python code,"Large Language Models (LLMs) are widely adopted for automated code generation with promising results. Although prior research has assessed LLM-generated code and identified various quality issues- such as redundancy, poor maintainability, and sub-optimal performance- a systematic understanding and categorization of these inefficiencies remain unexplored. Therefore, we empirically investigate inefficiencies in LLM-generated Python code by state-of-the-art models, i.e., CodeLlama, DeepSeek-Coder, and CodeGemma. To do so, we manually analyze 492 generated Python code snippets in the HumanEval+ dataset. We then construct a taxonomy of inefficiencies in LLM-generated Python code that includes 5 categories (General Logic, Performance, Readability, Maintainability, and Errors) and 19 subcategories of inefficiencies. We validate the obtained taxonomy through an online survey with 58 LLM practitioners and researchers. The surveyed participants affirmed the completeness of the proposed taxonomy, and the relevance and the popularity of the identified code inefficiency patterns. Our qualitative findings indicate that inefficiencies are diverse and interconnected, affecting multiple aspects of code quality, with logic and performance-related inefficiencies being the most frequent and often co-occurring while impacting overall code quality. Our taxonomy provides a structured basis for evaluating the quality of LLM-generated code and guiding future research to improve code generation efficiency.",A. A. Abbassi; L. Da Silva; A. Nikanjam; F. Khomh,2025,conferencePaper,ieee,keep_queue
9U8CHD5R,Future of innovation by the impact of AI,This paper investigates the transformative influence of artificial intelligence (AI) on the innovation landscape across multiple industries. / oversight.,Reza Kalantarinejad; Marc J. Ventresca; Abel Perez-Crespillo,2024,journalArticle,ssrn,maybe_queue
RZ39JT6Z,The ouroboros threat: how AI cannibalism degrades cyber threat intelligence,"After systematically evaluating existing mitigation strategies, algorithmic synthetic data filtering, Human-in-the-Loop (HITL) verification, / Generative AI, Data Poisoning, C2PA, STIX 2.1, AI Cannibalism, Model Autophagy Disorder (MAD), Cyber Threat Intelligence (CTI), Data Provenance, Zero-Trust",Faran Ahmad,2026,journalArticle,ssrn,maybe_queue
HXCXYT4Q,Governance mechanisms for fourth industrial revolution artifacts in higher education institutions: a systems perspective,We offer a conceptualization of digital governance mechanisms that call for algorithmic accountability of 4IR technologies.,Nixon Muganda Ochara,2021,journalArticle,ssrn,maybe_queue
8PM9IXSU,Under what influence: measuring AI influence to fit user profiles in decision-making,"Artificial Intelligence (AI) has become a pivotal tool in augmenting human decision-making across various domains, yet its influence on user decisions often lacks comprehensive evaluation. While technical performance metrics such as accuracy and efficiency dominate AI design, integrating human-centered approaches that consider trust and reliance remains underexplored. This study addresses the knowledge gap in understanding how AI systems influence decision-making quality, calibrated to user profiles, including their expertise, skills, professional role, confidence, and reliance tendencies.We present a novel and comprehensive metric framework for evaluating AI influence, emphasizing behavioral patterns and measurable improvements in decision outcomes beyond simple alignment with AI recommendations. The framework is applied to four medical domain case studies—MRI, ECG, X-ray, and ENDO – with user groups spanning specialists, sub-specialists, and trainees. Results reveal that while human and AI systems achieve high agreement rates (up to 81%), AI influence on decision quality varies significantly. Notably, X-ray decision-making showed the highest influence index (0.27), while MRI decisions exhibited substantial self-anchoring bias (6.94), undermining the potential positive impact of AI. Influence metrics unveiled nuances missed by agreement scores, highlighting domain-specific biases and opportunities to optimize AI-human interaction.This research underscores the necessity of adapting the type of AI system and affordances to user characteristics and attitudes of reliance to foster calibrated trust and improve decision outcomes. Our findings inform the design of AI systems that better support diverse user needs and align with human decisions, driving progress toward human-centered AI integration in high-stakes domains. © 2026 The Author(s). Published by Elsevier Ltd. This is an open access article under the CC BY license. http://creativecommons.org/licenses/by/4.0/",Campagner; Fregosi; Natali; Cabitza,2026,journalArticle,,maybe_queue
LYYYMU22,Techno-federalism: how regulatory fragmentation shapes the U.S.-china AI race,"In the United States, states lead in AI regulation, with the federal government taking a limited, backseat role. / The Article argues that the answer lies in industry self-governance. / US-China Relations, Geopolitics, National Security, Artificial Intelligence, Federalism, Industrial Policy, AI, AI Governance, Techno-Authoritarianism",Jason Jia-Xi Wu,2025,journalArticle,ssrn,maybe_queue
TEQBXMCZ,VWAB: vibe write app build a framework for domain-expert-driven application development in the age of generative AI,"Distinct from Vibe Coding, which describes LLM-assisted acceleration of developer workflows, VWAB addresses the emergent phenomenon wherein practitioners / large language models, human-AI collaboration, low-code development, domain expertise, Builder Era, Vibe Coding, enterprise AI, knowledge worker productivity",Raghu Kundurthi,2026,journalArticle,ssrn,keep_queue
M53LNQ26,Originality and the future of copyright in an age of generative AI,"This paper takes the occasion of French DJ David Guetta’s use of generative AI tools to create lyrics and a voice in the style of Eminem, which he then / used in one of his concerts, as the basis for an exploration of the shifting meaning of creativity and originality in the age of generative AI. / copyright, creativity, originality, AI, generative AI, artificial intelligence, data, machine learning, Feist, originality, David Guetta, ChatGPT, input",Mark Fenwick; Paul Jurcys,2023,journalArticle,ssrn,maybe_queue
8ZUEVSW5,Enhancing automated unit test generation with large language models: a systematic literature review,"Automated unit test generation is a fundamental yet challenging task in software engineering, playing a critical role in ensuring software correctness, reliability, and maintainability. While traditional approaches such as search-based software testing and symbolic execution have achieved notable success, they often suffer from limited semantic understanding, high configuration costs, and scalability constraints. Recent advances in Large Language Models (LLMs) have fundamentally reshaped the landscape of automated unit testing by enabling models to reason over source code semantics and generate executable, context-aware test cases. Despite the rapid growth of this research area, a comprehensive and task-oriented synthesis of existing work remains lacking. This paper presents a systematic literature review of LLM-based unit test generation. This review draws on research from leading SE and AI conferences and journals, including 69 papers published across 25 distinct venues, along with 47 high-quality preprint papers, bringing the total to 116. Our review aims to answer three key research questions: (1) which unit testing tasks have been addressed using LLMs, (2) how LLMs are adapted and integrated into the unit test generation pipeline, and (3) what datasets, benchmarks, and evaluation practices are employed in existing studies. To this end, we organize the literature from a task-centric perspective, covering test generation, test input generation, test oracle generation, and test evolution, and from a methodological perspective, categorizing LLM adaptation strategies into fine-tuning, prompt engineering, and agent-based approaches.Our analysis reveals that current research predominantly focuses on function- and class-level test generation, with comparatively limited attention given to test input generation, oracle construction, and long-term test evolution. Decoder-only LLMs, particularly GPT-family and LLaMA-based models, dominate the field, while encoder-only and encoder–decoder models remain underexplored. We further observe substantial disparities in dataset characteristics, programming language coverage, and evaluation metrics, which hinder fair comparison and reproducibility across studies. Based on empirical evidence extracted from the surveyed literature, we identify key challenges facing LLM-based unit test generation. Building on these findings, we outline several promising research directions, such as dataset optimization, structure-aware context modeling, agent coordination mechanisms, and benchmark enhancement. This review provides a consolidated and evidence-driven foundation for future research, aiming to advance the development of scalable, reliable, and practically applicable LLM-driven unit testing techniques.",Zhang; Hu; Gao; Xia; Li,Marc,journalArticle,acm,maybe_queue
GVGUURW9,CWEval: outcome-driven evaluation on functionality and security of LLM code generation,"Large Language Models (LLMs) have significantly aided developers by generating or assisting in code writing, enhancing productivity across various tasks. While identifying incorrect code is often straightforward, detecting vulnerabilities in code is more challenging, especially for developers with limited security knowledge, which poses considerable security risks of using LLM-generated code and underscores the need for robust evaluation benchmarks that assess both functional correctness and security. Current security evaluation benchmarks like CyberSecEval and SecurityEval are hindered by unclear and impractical specifications, failing to assess both functionality and security accurately. To tackle these deficiencies, we introduce CWEval, a novel outcome-driven evaluation framework designed to enhance the evaluation of secure code generation by LLMs. This framework not only assesses code functionality but also its security simultaneously with high-quality task specifications and outcome-driven test oracles which provides high accuracy. Coupled with CWEval-bench, a multilingual, security-critical coding benchmark, CWEval provides a rigorous empirical security evaluation on LLM-generated code, overcoming the shortcomings of previous benchmarks. Through our evaluations, CWEval reveals a notable portion of functional but insecure code generated by LLMs, and shows a serious inaccuracy of previous evaluations, ultimately contributing significantly to the field of secure code generation. We open-source our artifact at: https://github.com/Co1lin/CWEval.",J. Peng; L. Cui; K. Huang; J. Yang; B. Ray,2025,conferencePaper,ieee,keep_queue
