item_key,title,abstract,authors,year,item_type,sources,source_queue
296HXS6E,"Conscience, care, and code: moral theology, AI, and ethical decision-making at the thresholds of life","Healthcare decisions at the beginning and end of life pose enduring moral challenges that are increasingly intensified by the integration of artificial intelligence (AI) into clinical practice. This article examines these challenges through a moral-theological understanding of conscience, emphasizing human dignity, moral agency, and responsibility. Drawing primarily from Catholic moral theology, I examine how AI-driven tools in prenatal screening, reproductive technologies, end-of-life care, and prognostic decision-making can influence, constrain, or supplant conscientious judgment among healthcare professionals and patients. While AI offers significant benefits in efficiency and accuracy, it also risks fostering moral distancing, automation bias, and reducing ethical discernment to algorithmic outputs. I argue that conscience must remain a critically formed and relational capacity rather than a function delegated to technology. The article proposes a theologically grounded framework for integrating AI into healthcare that preserves moral discernment, safeguards vulnerable human life, and promotes ethically humane care. © The Author(s), under exclusive licence to Springer Science+Business Media, LLC, part of Springer Nature 2026.",Gozum,2026,journalArticle,,maybe_queue
GDTQKFUI,Building a text and data mining limitation: the brazilian case,"This report aims to present the Brazilian copyright legal framework and the policy documents related to Intellectual Property, Artificial Intelligence / While there is a reasonable possibility that the TDM provision will be voted on and approved in the Senate, recent developments on Generative AI may bring / Copyright, Text and Data Mining, Limitations and Exceptions, Artificial Intelligence, Intellectual Property, Innovation.",Luca Schirru; Allan Rocha de Souza; Claudia Chamas,2023,journalArticle,ssrn,maybe_queue
7I8G886I,Technology and me and you: getting comfortable with AI,"use AI productively. / The insights in this essay are widely applicable to academics, practitioners, students, and others integrating AI in their work. / intelligence, legal technology, dispute resolution, mediation, negotiation, real practice systems, legal education, reflective practice, technology adoption, AI / and ethics, AI skepticism, professional judgment, human-in-the-loop, RPS Coach",John Lande,2025,journalArticle,ssrn,maybe_queue
V9AFSF4Z,RuleForge: automated generation and validation for web vulnerability detection at scale,"Security teams face a challenge: the volume of newly disclosed Common Vulnerabilities and Exposures (CVEs) far exceeds the capacity to manually develop detection mechanisms. In 2025, the National Vulnerability Database published over 48,000 new vulnerabilities, motivating the need for automation. We present RuleForge, an AWS internal system that automatically generates detection rules--JSON-based patterns that identify malicious HTTP requests exploiting specific vulnerabilities--from structured Nuclei templates describing CVE details. Nuclei templates provide standardized, YAML-based vulnerability descriptions that serve as the structured input for our rule generation process. This paper focuses on RuleForge's architecture and operational deployment for CVE-related threat detection, with particular emphasis on our novel LLM-as-a-judge (Large Language Model as judge) confidence validation system and systematic feedback integration mechanism. This validation approach evaluates candidate rules across two dimensions--sensitivity (avoiding false negatives) and specificity (avoiding false positives)--achieving AUROC of 0.75 and reducing false positives by 67% compared to synthetic-test-only validation in production. Our 5x5 generation strategy (five parallel candidates with up to five refinement attempts each) combined with continuous feedback loops enables systematic quality improvement. We also present extensions enabling rule generation from unstructured data sources and demonstrate a proof-of-concept agentic workflow for multi-event-type detection. Our lessons learned highlight critical considerations for applying LLMs to cybersecurity tasks, including overconfidence mitigation and the importance of domain expertise in both prompt design and quality review of generated rules through human-in-the-loop validation.",Garg; Hager; Montiel; Tiwari; Gentile,2026,preprint,arxiv,maybe_queue
X2WIHJNW,Hybrid governance framework: governing human-AI decision authority in AI-enabled decision systems,"Artificial intelligence is increasingly embedded in organizational decision infrastructures, shaping how firms generate insights, allocate resources, and The framework identifies three governance layers-algorithmic transparency, human oversight, and institutional control-that together stabilize hybrid decision algorithmic governance, artificial intelligence, marketing systems, hybrid decision making, digital governance, marketing analytics",Marwen Ayadi,2026,journalArticle,ssrn,keep_queue
IK7JA24D,"Human-centred research automation: agentic AI framework for literature discovery, filtering, and gap identification","Recent advances in agentic AI raise opportunities to automate complex research tasks; however, the EU AI Act and Human-Centred AI (HCAI) principles emphasise that such automation must safeguard trust, transparency, and responsibility. This work-in-progress study developed an automated framework using agentic AI to support SLRs, which are critical for synthesising knowledge and identifying research gaps but remain resource-intensive, time-consuming, and in need of trust and transparency in their processes. The study presents a human-centred, agentic AI framework for discovering, filtering, analysing academic papers, and identifying research gaps. The proposed framework combines machine efficiency with human oversight to ensure contextual interpretation and responsible judgment. In a pilot study using Llama 3.1 8b, it achieved 71.05% accuracy for abstract filtering compared to a human-led SLR baseline. It also generates structured outputs, such as research gaps, potential directions, and candidate solutions, that enhance clarity and evaluability of the automated synthesis. Preliminary findings demonstrate that automation makes the initial synthesis faster but the human involvement in the later stage ensures that the result can be reliable and transparent. To further assess the framework’s alignment with HCAI principles, the next phase will conduct qualitative researcher interviews to evaluate perception of trust and transparency, as well as measuring how structured outputs improve interpretability. Overall, the study contributes to the design of responsible and trustworthy AI systems for research, demonstrating how agentic AI can make SLRs more efficient, reliable, and accessible, while advancing discussions at the intersection of agentic AI, systematic reviews, and human-centred research practice.",Mulla; Lee; Li; Dehghani,Febr,conferencePaper,acm,maybe_queue
TL2KMWWB,Exploring the potential of GenAI in qualitative research: an internal audit expert study with leading multinational corporations,"In the internal audit domain, participants view GenAI as a “co-pilot” that increases efficiency in report writing, document analysis, and risk identification / strengthen qualitative research practices and reshape internal auditing, highlighting its potential to increase efficiency and insight while raising critical governance / Generative AI, Internal Auditing, Qualitative Research, Digital Transformation JEL-Classification: M42, chatgpt",Annika Bonrath; Marc Eulerich; Benjamin Fligge; Ronja Krane; Vanessa Lopez-Kasper,2025,journalArticle,ssrn,maybe_queue
CME53ZB7,Behavioral recognition technology,"The rapid adoption of artificial intelligence (AI) by regulatory agencies marks a fundamental shift in legal compliance and enforcement. / investigate, audit, or sanction—and in turn to determine how to allocate limited enforcement resources—behavioral prediction becomes a central technology of governance / behavioral recognition technology, BRT, algorithmic governance, regulatory enforcement, regulatory agencies, trust scoring, behavioral signatures, predictive / compliance, machine learning, big data, AI regulation, biometric technology, facial recognition, FRT, anomaly detection, risk scoring algorithms, civil",Ori Aronson; Yuval Feldman; Orly Lobel,2026,journalArticle,ssrn,maybe_queue
FP5F53AK,When your boss is an AI bot: exploring opportunities and risks of manager clone agents in the future workplace,,Hu; Xiao; Cao; Shen,2026,conferencePaper,wos,keep_queue
7RFLJR3C,The growth of generative AI: two sets of legal issues arising,"However, with the rapid rise of Generative AI comes a host of complex legal issues. / delicate balance between innovation and regulation in the rapidly-evolving landscape of Generative AI.",Uchenna Ezeagu,2024,journalArticle,ssrn,keep_queue
IW7YS8Y4,The sustainability paradox of artificial intelligence: how AI both saves and challenges resource management efforts,"AI offers benefits like optimized energy use and improved resource efficiency, but its rapid adoption also results in high energy consumption, increased / This paper highlights the importance of cohesive AI governance and shared sustainability standards.",Victor Frimpong,2025,journalArticle,ssrn,maybe_queue
6UXU6GZV,AI-centered communications consulting with civil society organizations: case studies and preliminary lessons learned,"This paper examines how generative AI tools can support civil society organizations through a study of academic consulting engagements with five Boston-area / systems, requiring significant human mediation to make organizational realities comprehensible to these tools.",John Wihbey; Caleb Okereke; Yash Phalle,2025,journalArticle,ssrn,maybe_queue
VJNMH9GU,Privacy-preserving data processing and federated learning in cloud systems,"However, the widespread adoption of cloud systems raises significant concerns regarding privacy, security, and compliance. / Privacy-Preserving Computing, Federated Learning, Cloud Systems, Edge-AI, Data Security, Distributed Systems, AI Governance",Taylor Robert,2026,journalArticle,ssrn,maybe_queue
BEFM3MT6,AI in the software development lifecycle: insights and open research questions,"The rapid advancements in Artificial Intelligence (AI) and Large Language Models (LLMs) are reshaping software engineering and automating tasks such as code generation, debugging, testing, and maintenance. AI-powered tools (i.e. ChatGPT, DeepSeek), have demonstrated significant potential in enhancing developer productivity and accelerating software development processes. Integrating AI and LLMs into software engineering presents notable challenges despite these advancements. Concerns regarding the reliability of AI-generated code, security vulnerabilities, and the propagation of biases in training data pose substantial risks. Additionally, ethical considerations, including intellectual property rights, transparency, and the need for human oversight, highlight the complexities of AI adoption in critical software systems. The rapid evolution of these technologies requires continuous adaptation of software engineering methodologies to mitigate risks while maximizing benefits. This paper analyzes AI’s role in software engineering, identifying key applications, challenges, and future research directions. We examine AI’s impact across various phases of the software development lifecycle, This paper contributes to the ongoing discussion on AI-driven software engineering and outlines a research agenda for navigating this rapidly evolving field. © 2025 Copyright held by the owner/author(s).",Guimaraes; Nascimento; Li J.,2025,conferencePaper,acm|scopus|wos,keep_queue
