item_key,opus_bin,centrality,title,authors,year,item_type,source,has_pdf,doi,arxiv_id,opus_rationale,abstract,human_bin,human_note,new tags
TLLPXSB5,context,57,Enhancing cloud security assessment frameworks for the generative AI era: an action design research approach,Pourbehzadi; Huong; Javidi et al.,2025,conferencePaper,scopus,no,,,"Action-design-research security assessment framework addressing GenAI risks in software development with empirical evaluation, transferable governance angle.","This study addresses how cloud security assessment frameworks can evolve to counter risks introduced by Generative AI (GAI) in software development. Using Action Design Research, we identify gaps between the Cloud Security Alliance's Consensus Assessments Initiative Questionnaire (CAIQ) and NIST's Secure Software Development Framework (SSDF), focusing on AI-specific security considerations. We developed enhanced assessment questions addressing both traditional and AI-specific vulnerabilities, then evaluated their effectiveness by analyzing cybersecurity disclosures in 50 cloud vendors' 10-K filings using GPT-40. Results reveal that while organizations implement traditional security measures, AI-specific practices-including model governance, adversarial testing, and incident response-remain underdeveloped. We contribute theoretical insights into evolving security frameworks and practical recommendations for strengthening cybersecurity in AI-driven cloud environments. © AMCIS 2025.All rights reserved.",,,
4YEK87VE,context,57,Generative AI and organizational structure in the knowledge economy,Fasheng Xu; Jing Hou; Wei Chen et al.,2025,journalArticle,ssrn,no,,,Theoretical model of when human-in-the-loop validation scales with cost/hallucination rates transfers well to scaling oversight of AI-generated outputs.,"This study develops a theoretical model to examine GenAI's impact on organizational structure and the role of human-in-the-loop oversight. / Furthermore, human-in-the-loop validation influences GenAI adoption differently based on validation costs and hallucination rates, deterring adoption in / Generative AI, Knowledge Economy, Organizational Structure, Workforce, Knowledge-based Hierarchy, Hallucination, Human-in-the-loop Validation, Labor Productivity",,,
5KGLSCGB,context,57,Exploring altered open source software development patterns in a time of generative AI,Xinyu Li; Francis Joseph Costello; Keongtae Kim et al.,2025,journalArticle,ssrn,no,,,"Natural-experiment evidence of AI-code quality trade-offs (more copy-paste, less novelty) documents the volume/quality problem the RQ targets.","We leverage the March 2023 announcement and April 2023 public release of GitHub Copilot X (CX) as a natural experiment, analyzing a 27-week user-week panel / However, this expansion comes with trade-offs in code quality, as we document a 2% increase in copy-pasted code and a decline in project novelty for casual",,,
TTEUEB9V,context,56,NIST AI 600-1: Generative Artificial Intelligence Profile,National Institute of Standards and Technology,2024,report,committee,yes,,,GenAI-specific NIST risk profile providing a concrete governance framework readily transferable to AI-generated-code oversight.,,,,
7PPE2M2I,context,56,Turning off your better judgment: algorithmic conformity in artificial intelligence-human collaboration,Liel; Zalmanson,2025,journalArticle,scopus,no,10.1080/07421222.2025.2561390,,Strong empirical (n=1445) study of AI overreliance/human-in-the-loop failure; automation-conformity mechanism transfers to code oversight though task is image classification.,"As artificial intelligence (AI) becomes increasingly integral to society, humans’ tendency to forgo their own judgment to adopt algorithmic advice is eliciting substantial concern. Prior research suggests that such overreliance is driven by informational influences (confidence in AI’s superior judgment) or by desire to reduce attentional load. We propose a new mechanism: normative pressure, stemming from the legitimacy afforded to algorithms within social or work-related structures. Using a setup inspired by social conformity research, we conducted four studies involving 1,445 crowd-workers performing straightforward image-classification tasks. Substantial percentages of participants followed erroneous AI recommendations on these tasks, despite being able to perform them perfectly without support. This overreliance was partially mediated by normative pressure, measured as discomfort at disagreeing with AI. Conformity decreased when participants perceived their decisions’ real-life impact as high (versus low). Our findings highlight the risks inherent to human-AI collaboration and the difficulty in ensuring that humans-in-the-loop maintain independent judgment. © 2025 Taylor & Francis Group, LLC.",,,
68R7GWHB,context,56,A survey of bugs in AI-generated code,Gao; Tahir; Liang et al.,2025,preprint,coursework,yes,10.48550/arXiv.2512.05239,2512.05239,Systematic review of bug types in AI-generated code informs risk recognition but offers taxonomy more than an oversight mechanism.,"Developers are widely using AI code-generation models, aiming to increase productivity and efficiency. However, there are also quality concerns regarding the AI-generated code. The generated code is produced by models trained on publicly available code, which are known to contain bugs and quality issues. Those issues can cause trust and maintenance challenges during the development process. Several quality issues associated with AI-generated code have been reported, including bugs and defects. However, these findings are often scattered and lack a systematic summary. A comprehensive review is currently lacking to reveal the types and distribution of these errors, possible remediation strategies, as well as their correlation with the specific models. In this paper, we systematically analyze the existing AI-generated code literature to establish an overall understanding of bugs and defects in generated code, providing a reference for future model improvement and quality assessment. We aim to understand the nature and extent of bugs in AI-generated code, and provide a classification of bug types and patterns present in code generated by different models. We also discuss possible fixes and mitigation strategies adopted to eliminate bugs from the generated code.",,,lit-review
E9JBQV78,context,56,An LLM-assisted approach to designing software architectures using ADD,Cervantes; Kazman; Cai,2025,preprint,arxiv,no,,2506.22688,"Case-validated LLM-assisted architecture method emphasizing human oversight and iterative refinement in an SE context, transferable but narrow mechanism.","Designing effective software architectures is a complex, iterative process that traditionally relies on expert judgment. This paper proposes an approach for Large Language Model (LLM)-assisted software architecture design using the Attribute-Driven Design (ADD) method. By providing an LLM with an explicit description of ADD, an architect persona, and a structured iteration plan, our method guides the LLM to collaboratively produce architecture artifacts with a human architect. We validate the approach through case studies, comparing generated designs against proven solutions and evaluating them with professional architects. Results show that our LLM-assisted ADD process can generate architectures closely aligned with established solutions and partially satisfying architectural drivers, highlighting both the promise and current limitations of using LLMs in architecture design. Our findings emphasize the importance of human oversight and iterative refinement when leveraging LLMs in this domain.",,,
WEWQ9NTT,context,56,Verified adversarial reasoning intelligence (VARI): multi-agent adversarial verification for regulated AI decision-making,Eric Swidey,2026,journalArticle,ssrn,no,,,"Multi-agent adversarial verification for human oversight (EU AI Act Art.14) matches a core oversight-mechanism type but is applied to employment/insurance AI, not code.","We previously demonstrated VARI as a reference architecture for EU AI Act Article 14 compliance in employment AI (Swidey, 2025). / The regulatory trajectory, including Article 14 of the EU AI Act, the Colorado AI Act (effective June 30, 2026), and the NAIC Model Bulletin, demands both / AI Governance, Adversarial Verification, Multi-Agent Systems, Legal AI, Insurance AI, Hallucination Detection, Algorithmic Discrimination, Per-Decision / Verification, EU AI Act Article 14",,,
M26XRCRE,context,56,"Sycophancy, automation bias, and compressed diffusion: an unaddressed convergence in AI governance",Caleb Janski,2026,journalArticle,ssrn,no,,,"Automation bias/sycophancy convergence with proposed governance mechanisms (tool literacy, constraints engineering) transfers strongly to AI-code overtrust oversight.","in use -- including the NIST AI RMF, ISO/IEC 42001, COSO ERM, and the EU AI Act -- provides organizational structures that could accommodate individual / Four governance mechanisms are proposed: AI tool literacy as a compliance competency, constraints engineering, evaluation-first training, and retrospective",,,
TSKXN5SS,context,56,The darkest mirror: how AI authority bias threatens individual agency and what architecture must do about it,Rafael Maryahin,2026,journalArticle,ssrn,no,,,Automation/authority-bias theory on why downstream human oversight fails—directly relevant to developer overtrust but not code-specific and largely conceptual.,"The dominant AI safety framework-""human in the loop""-assumes that humans positioned downstream of AI systems will catch what those systems get wrong. / The mechanism is authority bias: once an AI system achieves authority status, anchoring, automation bias, and confirmation bias systematically suppress / AI safety, automation bias, authority bias, human oversight, RLHF, Boyd OODA, AI governance, human-AI decision-making, epistemic honesty, architectural / AI design",,,
YWP5VZD3,context,56,"Human, all too human: accounting for automation bias in generative large language models",Irina Carnat,2025,journalArticle,ssrn,no,,,Automation-bias theory and a critique of human-oversight adequacy for generative LLMs — transferable to AI-code over-reliance though not code-specific.,"It also critiques the regulatory optimism in human oversight, challenging its adequacy in effectively addressing automation bias, by comparing the Artificial / The paper cautions against overemphasizing human oversight as a panacea and instead advocates for implementing accountability measures along the entire / Accountability, Automated Decision-Making, Automation Bias, Cognitive Automation, Large Language Models, Generative Artificial Intelligence",,,
BAQXVTG8,context,56,Inside the scaffold: a source-code taxonomy of coding agent architectures,Rombaut,2026,preprint,arxiv,yes,,2604.03515,"Source-code taxonomy of LLM coding-agent scaffolds noting diminishing human oversight, a strong framework on AI-code pipelines but architecture-focused rather than oversight-focused.","LLM-based coding agents can localize bugs, generate patches, and run tests with diminishing human oversight, yet the scaffolding code that surrounds the language model (the control loop, tool definitions, state management, and context strategy) remains poorly understood. Existing surveys classify agents by abstract capabilities (tool use, planning, reflection) that cannot distinguish between architecturally distinct systems, and trajectory studies observe what agents do without examining the scaffold code that determines why. This paper presents a source-code-level architectural taxonomy derived from analysis of 13 open-source coding agent scaffolds at pinned commit hashes. Each agent is characterized across 12 dimensions organized into three layers: control architecture, tool and environment interface, and resource management. The analysis reveals that scaffold architectures resist discrete classification: control strategies range from fixed pipelines to Monte Carlo Tree Search, tool counts range from 0 to 37, and context compaction spans seven distinct strategies. Five loop primitives (ReAct, generate-test-repair, plan-execute, multi-attempt retry, tree search) function as composable building blocks that agents layer in different combinations; 11 of 13 agents compose multiple primitives rather than relying on a single control structure. Dimensions converge where external constraints dominate (tool capability categories, edit formats, execution isolation) and diverge where open design questions remain (context compaction, state management, multi-model routing). All taxonomic claims are grounded in file paths and line numbers, providing a reusable reference for researchers studying agent behavior and practitioners designing new scaffolds.",,,
ET5U88I7,context,56,Interpretability without actionability: mechanistic intervention methods fail to correct clinical triage errors in language models,Sanjay Basu; Sadiq Patel; Parth Sheth et al.,2026,journalArticle,ssrn,no,,,Empirical finding that interpretability fails to enable effective human oversight of LLM errors directly informs limitations of oversight practices.,"Background: Regulatory frameworks for clinical artificial intelligence presume that interpretability supports effective human oversight, but whether mechanistic mechanistic interpretability, language models, clinical artificial intelligence, triage, patient safety, sparse autoencoders, concept bottleneck models",,,
25RCNRY9,context,55,Human-AI collaboration in software engineering: lessons learned from a hands-on workshop,M. Hamza; D. Siemon; M. A. Akbar et al.,2024,conferencePaper,"acm,ieee,scopus,wos",yes,10.1145/3643690.3648236,,"Empirical thematic study affirming human oversight remains crucial in AI-assisted SE, but focused on collaboration dynamics rather than scaling oversight/governance.","This paper investigates the dynamics of human-AI collaboration in software engineering, focusing on the use of ChatGPT. Through a thematic analysis of a hands-on workshop in which 22 professional software engineers collaborated for three hours with ChatGPT, we explore the transition of AI from a mere tool to a collaborative partner. The study identifies key themes such as the evolving nature of human-AI interaction, the capabilities of AI in software engineering tasks, and the challenges and limitations of integrating AI in this domain. The findings show that while AI, particularly ChatGPT, improves the efficiency of code generation and optimization, human oversight remains crucial, especially in areas requiring complex problem-solving and security considerations. This research contributes to the theoretical understanding of human-AI collaboration in software engineering and provides practical insights for effectively integrating AI tools into development processes. It highlights the need for clear role allocation, effective communication, and balanced AI-human collaboration to realize the full potential of AI in software engineering.",,,
NSJ9U3H3,context,55,Pramana: a protocol-layer treatment of claim verification in autonomous agent networks,Kadaboina,2026,preprint,arxiv,yes,10.5281/zenodo.20283646,2605.20312,"Verification-artifact protocol with LLM-as-judge and a code-generation pilot, transferable to auditable oversight of agent outputs but primarily a formal wire-format contribution.","Autonomous agents deployed in regulated domains must produce a verification artifact per consequential output: a record an auditor can re-execute offline, capturing what was claimed, against what source, by whom, when, and how. Production verification today splits into two unstandardized halves. Probabilistic verdict patterns (self-consistency voting, reviewer LLM ensembles) produce judgments, not artifacts. Artifact-producing patterns (RAG, tool-augmented traces, generator-verifier loops) produce vendor-specific records no external auditor can reconstruct without bespoke integration. Pramana defines the missing wire format. Every consequential agent output is wrapped in a typed ClaimAttestation with one of four variants (measurement, inference, analogy, citation), each paired with a verify() operation against the recorded source. verify() is deterministic for MeasurementClaim and CitationClaim. For InferenceClaim and AnalogyClaim, determinism is conditional on the oracle (audit-replayable when LLM-backed). The four-way typology derives from classical Indian epistemology (pramana, valid means of knowledge). The lifecycle is specified in TLA+ and exhaustively verified under TLC across three symmetry-reduced models: 38,563 distinct reachable states, zero invariant violations. The Python reference implementation passes 84 tests. An A2A and MCP wire-extension manifest layers three deployment-grade invariants: reachability, SLA bound, and offline re-verifiability. An exploratory pilot (n=100, 2,275 reviewer calls) probes LLM-as-judge in code generation. The strongest observation is a 40-percentage-point raw FPR delta across corpora, consistent with reference-solution quality contributing significantly. The pilot does not validate Pramana on its own; the structural argument and formal verification do that.",,,
RRFXCNIV,context,55,Tracking the moving target: a framework for continuous evaluation of LLM test generation in industry,Azanza; Pérez Lamancha; Pizarro,2025,conferencePaper,acm,yes,10.1145/3756681.3756946,6681.37569,"Concrete continuous measurement framework for assessing LLM tool reliability in industrial DevSecOps pipelines, transferable to scaling AI-code quality assurance.","Large Language Models (LLMs) have shown great potential in automating software testing tasks, including test generation. However, their rapid evolution poses a critical challenge for companies implementing DevSecOps - evaluations of their effectiveness quickly become outdated, making it difficult to assess their reliability for production use. While academic research has extensively studied LLM-based test generation, evaluations typically provide point-in-time analyses using academic benchmarks. Such evaluations do not address the practical needs of companies who must continuously assess tool reliability and integration with existing development practices. This work presents a measurement framework for the continuous evaluation of commercial LLM test generators in industrial environments. We demonstrate its effectiveness through a longitudinal study at LKS Next. The framework integrates with industry-standard tools like SonarQube and provides metrics that evaluate both technical adequacy (e.g., test coverage) and practical considerations (e.g., maintainability or expert assessment). Our methodology incorporates strategies for test case selection, prompt engineering, and measurement infrastructure, addressing challenges such as data leakage and reproducibility. Results highlight both the rapid evolution of LLM capabilities and critical factors for successful industrial adoption, offering practical guidance for companies seeking to integrate these technologies into their development pipelines.",,,
6EWNCJCT,context,55,A multi-agent RAG framework for regulatory compliance checking of software requirements,Das; Deb; Chaki et al.,2025,journalArticle,acm,yes,10.1145/3785472,,"Evaluated multi-agent RAG with a Human-in-the-Loop mechanism for compliance checking of requirements — transferable HITL oversight pattern, but on requirements not code.","Ensuring compliance with regulations poses considerable challenges for software development, particularly during the requirements specification phase. Traditional methods rely heavily on manual inspections that are time-consuming, and prone to errors. This research proposes an innovative framework that leverages the synergy of multiple AI agents to automate software requirement compliance verification partially. The framework integrates Large Language Models (LLMs), prompt engineering, and Retrieval-Augmented Generation (RAG) to analyze, detect, and revise non-compliant requirements. The core of our proposal lies in multi-agent communication, where distinct AI agents collaborate to achieve the overarching goal of compliance checking. LLMs comprehend requirements specifications, while prompt engineering guides LLMs towards compliance-related aspects. The RAG techniques detect non-compliant requirements and suggest changes. Finally, a robust Human-in-the-Loop mechanism ensures accuracy, reliability, and adaptability. A tool, available online, is implemented to translate the technology for effective application. We discuss its ability to identify non-compliant requirements in an extensive experimental evaluation.",,,
W49D6ZQU,context,55,DevSecOps for secure and scalable citizen development,Wepper; Schlackl,2025,journalArticle,scopus,no,10.1109/MS.2025.3640399,,"Empirical DevSecOps guardrails/oversight process for citizen (low-code) development across 42 projects — closely adjacent scaling-oversight-with-guardrails problem, transferable to vibe coding.","Citizen development enables business users to create and modify applications using low-code development platforms, which enhances efficiency and reduces reliance on IT departments. However, citizen development needs to be practiced with clear oversight and guardrails, rather than treated as an open-ended sandbox. Uncontrolled citizen development can introduce challenges such as unmonitored shadow IT, data security gaps, and maintenance risks. This article presents a structured DevSecOps process for citizen development in enterprise environments, based on 42 projects involving more than 100 citizen developers at a large German financial institution. The tailored process balances innovation and collaboration with robust security measures and provides actionable insights for organizations to safely leverage citizen development. © 1984-2012 IEEE.",,,
V2VGFTVU,context,55,Assessing output reliability and similarity of large language models in software development: a comparative case study approach,Kim; Ming,2025,journalArticle,"scopus,wos",no,10.1016/j.infsof.2025.107787,,"Empirically measures reliability of LLM code outputs and concludes human oversight is required, motivating but not studying oversight practice itself.","Context: Generative large language models (LLMs) are increasingly used across various activities in software development, offering significant potential to enhance productivity. However, there is a lack of systematic study examining the reliability and similarity of the outputs from these models. Objective: This work presents a comparative analysis of the reliability – defined as the consistency and correctness of software artifacts – and similarity of LLM outputs in software development. Method: To accomplish the objective, we introduce a structured approach for assessing the reliability and similarity of outputs from five prominent LLMs – ChatGPT, Claude, Copilot, Gemini, and Meta – and apply it within two case studies focused on developing a food order and delivery system and a smart wallet system. Results: The study found that the overall output reliability of the models is rated at 0.82 with Claude outperforming other models at 0.92, followed by ChatGPT at 0.90, Copilot at 0.80, Meta at 0.75, and Gemini at 0.71. The models demonstrated an overall 57% similarity and 43% variability in their outputs, highlighting the uniqueness of models. Conclusions: While overall, LLMs exhibit decent reliability in their outputs with varying degrees, they still require human oversight and review of their outputs before implementation. LLMs present unique characteristics that practitioners should consider before adoption. © 2025 Elsevier B.V.",,,
UW2R6BBJ,context,55,Secure AI-SDLC for critical infrastructure: operationalizing the NIST AI RMF with evidence-driven controls,S. Sudarsan; A. Mittal; A. S. Chandrasekaran,2025,conferencePaper,ieee,no,10.1109/ICCA66035.2025.11430939,,"Operationalizes the NIST AI RMF into auditable lifecycle controls—a strong governance framework for AI systems broadly, transferable to AI-code oversight.","Critical infrastructure systems increasingly rely on artificial intelligence for decision-making, yet current development practices inadequately address security risks unique to AI systems. This paper presents Secure AI-SDLC, a comprehensive security framework that operationalizes the NIST AI Risk Management Framework with structured software development lifecycle controls for cyber-physical and safety-critical environments. Our approach maps AI-specific threats to actionable engineering controls and required evidence artifacts across five lifecycle phases: govern, design, build, test, and deploy/monitor, aligned with ISO/IEC 42001, IEC 62443, and NERC CIP. Validation through a 16-week deployment on an industrial monitoring pipeline in the energy sector demonstrated measurable improvements, including a 12.3% increase in adversarial robustness and a 40.2% reduction in mean time to detect anomalies. Mean time to recovery decreased from 4.2 hours to 1.8 hours. The proposed framework addresses the gap between high-level AI governance and practical implementation by providing concrete, auditable mechanisms for building and operating trustworthy AI systems in high-consequence environments.",core,Outlining putting governance controls in place in alignment with NIST RMF AI,
