item_key,opus_bin,centrality,title,authors,year,item_type,source,has_pdf,doi,arxiv_id,opus_rationale,abstract,human_bin,human_note,new tags
YJECSBHW,context,58,Towards automated governance: a DSL for human-agent collaboration in software projects,A. Ait; G. Jouneaux; J. L. Cánovas Izquierdo et al.,2025,conferencePaper,ieee,yes,10.1109/ASE63991.2025.00337,,"Vision for a DSL to define/enforce governance over human-agent collaboration in software projects, an oversight mechanism but foundational-concept stage without evidence.","The stakeholders involved in software development are becoming increasingly diverse, with both human contributors from varied backgrounds and AI-powered agents collaborating together in the process. This situation presents unique governance challenges, particularly in Open-Source Software (OSS) projects, where explicit policies are often lacking or unclear. This paper presents the vision and foundational concepts for a novel Domain-Specific Language (DSL) designed to define and enforce rich governance policies in systems involving diverse stakeholders, including agents. This DSL offers a pathway towards more robust, adaptable, and ultimately automated governance, paving the way for more effective collaboration in software projects, especially OSS ones.",,,
N7E3MR2V,context,58,SDLC AutoPilot AI: agentic automation of software development life cycle,P. R. P; T. M; C. Q. Jaslin,2025,conferencePaper,ieee,no,10.1109/ICOIICS67115.2025.11390299,,"Agentic SDLC automation architecture with explicit human-approval guardrails, audit trails, and anti-hallucination safeguards, relevant to oversight but a proposed design without empirical results.","The Software Development Life Cycle (SDLC) remains one of the most resource-intensive processes in modern engineering, requiring continuous coordination across requirement gathering, planning, team formation, testing, and deployment. Despite the availability of advanced automation tools, much of this process still depends on manual oversight, which often results in delays, misaligned requirements, and costly rework. To address these challenges, we propose SDLC AutoPilot AI, an intelligent agentic system designed to orchestrate the entire SDLC in an end-to-end manner. Beginning from a high-level project brief, the system leverages large language models and retrieval-augmented pipelines to transform unstructured inputs into well-structured requirements. It then prepares project plans and budget estimates, quantifying uncertainty ranges to improve transparency in forecasting. Using automated reasoning and supervised models, the system performs role assignment, forms collaborative teams within enterprise platforms, and provisions the necessary infrastructure for execution. Furthermore, SDLC AutoPilot AI integrates tightly with collaboration tools, version control platforms, and CI/CD pipelines to support automated verification, test case generation, and staged deployments. Preview environments are provisioned dynamically, enabling early client validation and reducing downstream rework. To ensure accountability and resilience, the system includes governance guardrails for human approval, observability features such as decision logs and audit trails, and safeguards against hallucination and misclassification. This paper presents the architectural design of the system, details the algorithms used for estimation and role allocation, and outlines the integration pathways with enterprise ecosystems. An evaluation framework is also proposed to assess its effectiveness in terms of delivery speed, reduction in rework, defect density, and stakeholder satisfaction. Finally, we reflect on the broader implications of introducing agentic automation into software engineering workflows, with particular attention to governance, reliability, and ethical considerations.",core,Appears to have concept of escalation to humans and comprehensive system to manage oversight.,
SHFHRTUL,context,58,iCodeReviewer: improving secure code review with mixture of prompts,Y. Peng; K. Kim; L. Meng et al.,2025,conferencePaper,ieee,no,10.1109/ASE63991.2025.00264,,"LLM-as-reviewer secure-code-review mechanism deployed in production with acceptance metrics, transferable to scaling AI-code oversight though not human-in-loop.","Code review is an essential process to ensure the quality of software that identifies potential software issues at an early stage of software development. Among all software issues, security issues are the most important to identify, as they can easily lead to severe software crashes and service disruptions. Recent research efforts have been devoted to automated approaches to reduce the manual efforts required in the secure code review process. Despite the progress, current automated approaches on secure code review, including static analysis, deep learning models, and prompting approaches, still face the challenges of limited precision and coverage, and a lack of comprehensive evaluation.To mitigate these challenges, we propose iCodeReviewer, which is an automated secure code review approach based on large language models (LLMs). iCodeReviewer leverages a novel mixture-of-prompts architecture that incorporates many prompt experts to improve the coverage of security issues. Each prompt expert is a dynamic prompt pipeline to check the existence of a specific security issue. iCodeReviewer also implements an effective routing algorithm to activate only necessary prompt experts based on the code features in the input program, reducing the false positives induced by LLM hallucination. Experiment results in our internal dataset demonstrate the effectiveness of iCodeReviewer in security issue identification and localization with an F1 of 63.98%. The review comments generated by iCodeReviewer also achieve a high acceptance rate up to 84% when it is deployed in production environments.",,,
I7X7LTNR,context,58,A preliminary study on large language models self-negotiation in software engineering,C. Tao; H. Shu; M. Kondo et al.,2025,conferencePaper,ieee,no,10.1109/ICSME64153.2025.00088,,"Multi-LLM self-negotiation/debate is an adversarial-agent cross-checking mechanism transferable to automated oversight, though evaluated for task performance not oversight scaling.","Large Language Models (LLMs) have shown great potential in code-related software engineering tasks, including code generation, classification, and understanding. While current research primarily focuses on direct inference with single LLMs, this approach may fall short for complex tasks due to ambiguous instructions. To address this limitation, we propose LLM selfnegotiation, where multiple LLMs collaborate and debate to reach consensus on code-related tasks. This approach aims to better handle unclear instructions and improve overall effectiveness. We evaluated LLM self-negotiation in three key software engineering domains: Equivalent Mutant Detection (EMD), Automated Vulnerability Detection (AVD), and Automated Program Repair (APR). These domains represent distinct aspects of coderelated tasks: functionality understanding, code classification, and code generation, respectively. Our experimental results revealed varying effectiveness across domains. In EMD, LLM self-negotiation demonstrated remarkable improvements, with most models showing performance gains between 114.72 % and 351.01% (though CodeLlama experienced a minor 4.5% decrease in F1-score). For APR tasks, self-negotiation performed comparably to single LLM implementations. However, in AVD, the results were mixed - while Vicuna showed improved F1-scores, most models exhibited lower recall rates. These findings indicate that LLM self-negotiation is particularly promising for functionality understanding tasks, while its application to code classification and generation requires further research and refinement.",,,
ADV48DKV,context,58,The stability trap: evaluating the reliability of LLM-based instruction adherence auditing,Shergadwala,2026,preprint,arxiv,no,,2601.11783,"LLM-as-judge reliability auditing is a core oversight mechanism, but studied in the HR governance domain and only transferable to AI-code oversight.","The enterprise governance of Generative AI (GenAI) in regulated sectors, such as Human Resources (HR), demands scalable yet reproducible auditing mechanisms. While Large Language Model (LLM)-as-a-Judge approaches offer scalability, their reliability in evaluating adherence of different types of system instructions remains unverified. This study asks: To what extent does the instruction type of an Application Under Test (AUT) influence the stability of judge evaluations? To address this, we introduce the Scoped Instruction Decomposition Framework to classify AUT instructions into Objective and Subjective types, isolating the factors that drive judge instability. We applied this framework to two representative HR GenAI applications, evaluating the stability of four judge architectures over variable runs. Our results reveal a ``Stability Trap'' characterized by a divergence between Verdict Stability and Reasoning Stability. While judges achieved near-perfect verdict agreement ($>99\%$) for both objective and subjective evaluations, their accompanying justification traces diverged significantly. Objective instructions requiring quantitative analysis, such as word counting, exhibited reasoning stability as low as $\approx19\%$, driven by variances in numeric justifications. Similarly, reasoning stability for subjective instructions varied widely ($35\%$--$83\%$) based on evidence granularity, with feature-specific checks failing to reproduce consistent rationale. Conversely, objective instructions focusing on discrete entity extraction achieved high reasoning stability ($>90\%$). These findings demonstrate that high verdict stability can mask fragile reasoning. Thus, we suggest that auditors scope automated evaluation protocols strictly: delegate all deterministically verifiable logic to code, while reserving LLM judges for complex semantic evaluation.",,,
4VM5FRXQ,context,58,Trustworthy AI software engineers,Aleti; Ray; Hoda et al.,2026,preprint,arxiv,yes,,2602.0631,"Vision paper conceptualizing trustworthiness/governance dimensions of AI software engineers, on-topic but position-oriented without an evidence base.","With the rapid rise of AI coding agents, the fundamental premise of what it means to be a software engineer is in question. In this vision paper, we re-examine what it means for an AI agent to be considered a software engineer and then critically think about what makes such an agent trustworthy. \textit{Grounded} in established definitions of software engineering (SE) and informed by recent research on agentic AI systems, we conceptualise AI software engineers as participants in human-AI SE teams composed of human software engineers and AI models and tools, and we distinguish trustworthiness as a key property of these systems and actors rather than a subjective human attitude. Based on historical perspectives and emerging visions, we identify key dimensions that contribute to the trustworthiness of AI software engineers, spanning technical quality, transparency and accountability, epistemic humility, and societal and ethical alignment. We further discuss how trustworthiness can be evaluated and demonstrated, highlighting a fundamental trust measurement gap: not everything that matters for trust can be easily measured. Finally, we outline implications for the design, evaluation, and governance of AI SE systems, advocating for an ethics-by-design approach to enable appropriate trust in future human-AI SE teams.",,,
9CP6AU7D,context,58,Clawed and dangerous: can we trust open agentic systems?,Chen; Wang; Yu et al.,2026,preprint,arxiv,no,,2603.26221,"Synthesis and governance taxonomy for agentic systems (including coding assistants) with a strong framework, adjacent but broader than AI-code oversight.","Open agentic systems combine LLM-based planning with external capabilities, persistent memory, and privileged execution. They are used in coding assistants, browser copilots, and enterprise automation. OpenClaw is a visible instance of this broader class. Without much attention yet, their security challenge is fundamentally different from that of traditional software that relies on predictable execution and well-defined control flow. In open agentic systems, everything is ''probabilistic'': plans are generated at runtime, key decisions may be shaped by untrusted natural-language inputs and tool outputs, execution unfolds in uncertain environments, and actions are taken under authority delegated by human users. The central challenge is therefore not merely robustness against individual attacks, but the governance of agentic behavior under persistent uncertainty. This paper systematizes the area through a software engineering lens. We introduce a six-dimensional analytical taxonomy and synthesize 50 papers spanning attacks, benchmarks, defenses, audits, and adjacent engineering foundations. From this synthesis, we derive a reference doctrine for secure-by-construction agent platforms, together with an evaluation scorecard for assessing platform security posture. Our review shows that the literature is relatively mature in attack characterization and benchmark construction, but remains weak in deployment controls, operational governance, persistent-memory integrity, and capability revocation. These gaps define a concrete engineering agenda for building agent ecosystems that are governable, auditable, and resilient under compromise.",,,
6JHWQ5GW,context,58,Are we aligned? A preliminary investigation of the alignment of responsible AI values between LLMs and human judgment,Yamani; Baslyman; Ahmed,2025,preprint,arxiv,yes,,2511.04157,"Empirically shows LLM value-misalignment risks in AI-assisted software engineering and motivates human oversight, though mechanism is value benchmarking.","Large Language Models (LLMs) are increasingly employed in software engineering tasks such as requirements elicitation, design, and evaluation, raising critical questions regarding their alignment with human judgments on responsible AI values. This study investigates how closely LLMs' value preferences align with those of two human groups: a US-representative sample and AI practitioners. We evaluate 23 LLMs across four tasks: (T1) selecting key responsible AI values, (T2) rating their importance in specific contexts, (T3) resolving trade-offs between competing values, and (T4) prioritizing software requirements that embody those values. The results show that LLMs generally align more closely with AI practitioners than with the US-representative sample, emphasizing fairness, privacy, transparency, safety, and accountability. However, inconsistencies appear between the values that LLMs claim to uphold (Tasks 1-3) and the way they prioritize requirements (Task 4), revealing gaps in faithfulness between stated and applied behavior. These findings highlight the practical risk of relying on LLMs in requirements engineering without human oversight and motivate the need for systematic approaches to benchmark, interpret, and monitor value alignment in AI-assisted software development.",,,
MHK56HCY,context,58,Agentic AI as assurance infrastructure: design principles for a continuous second line,Roni van der Fehr,2026,journalArticle,ssrn,no,,,Directly reframes oversight scaling (episodic gateway vs continuous assurance) with design principles—strongly transferable to scaling AI-code oversight though not code-specific.,"The first paper in this series established that episodic gateway review is constitutively mismatched to the risk dynamics of complex adaptive / systems, and that continuous assurance represents structural reform of oversight practice rather than a marginal efficiency gain. / agentic AI, multi-agent systems, governance primitive, continuous assurance, second line of defence, evidence-first design, human accountability, responsible / AI, design principles, AI governance",,,
SEVQQF2T,context,58,Decision architecture - a tunable governance model for human-AI decision boundaries,Daniel Hettrick,2026,journalArticle,ssrn,no,,,"Tunable human-AI decision-boundary model addressing automation bias and the machine-speed/oversight gap—strongly transferable oversight framework, just not code-scoped.","The resulting gap between machine-speed execution and human oversight exposes organizations to automation bias, accountability failures, and increasing / (decision rights theory), and emerging AI regulation (including the EU AI Act and NIST AI RMF), the paper argues that while no unified academic field / Decision Architecture, AI governance, human–AI decision boundaries, automation bias, decision rights theory, choice architecture, confidence calibration",,,
M29MMPY7,context,58,Operating imperfect AI: reliability drift and human congestion,Ziyao Wang; Svetlozar Rachev,2026,journalArticle,ssrn,no,,,"Models human-oversight capacity constraints ('human congestion') and rationing as AI volume scales, central to oversight-keeping-pace though thin abstract.","Human-in-the-Loop AI, Service Operations, Reliability Drift, Shadow Price of Capacity, Strategic Capacity Rationing",,,
FYU7H5WR,context,58,Beyond productivity: evaluating the hidden costs of generative AI in software development,Edward Anderson; Geoffrey Parker; Burcu Tan,2025,journalArticle,ssrn,no,,,"Interview-plus-simulation study of AI-coding hidden costs (technical debt, atrophy) evidences the risk problem but does not directly address oversight mechanisms.","AI-assisted programming tools are increasingly adopted to enhance developer productivity by automating routine tasks and accelerating software development / Drawing on interviews with software engineers and insights from the literature, we build a dynamic simulation model to examine the long-term impacts of AI-assisted / Human-AI Interaction, AI-Assisted Coding, Software Development, Technical Debt, System Atrophy, Dynamics, Software Supply Chains",,,
LZPAIXTQ,context,57,LLM scalability risk for agentic-AI and model supply chain security,Ahi; Agrawal; Valizadeh,2026,journalArticle,"arxiv,scopus",yes,10.1080/08874417.2026.2624670,,Provides a scalable-LLM-risk index and governance roadmap for LLM deployment (incl. code review/DevSecOps); transferable governance framework but broader than AI-code oversight.,"Large Language Models (LLMs) & Generative AI are transforming cybersecurity, enabling both advanced defenses and new attacks. Organizations now use LLMs for threat detection, code review, and DevSecOps automation, while adversaries leverage them to produce malwares and run targeted social-engineering campaigns. This paper presents a unified analysis integrating offensive and defensive perspectives on GenAI-driven cybersecurity. Drawing on 70 academic, industry, and policy sources, it analyzes the rise of AI-facilitated threats and its implications for global security to ground necessity for scalable defensive mechanisms. We introduce two primary contributions: the LLM Scalability Risk Index (LSRI), a parametric framework to stress-test operational risks when deploying LLMs in security-critical environments & a model-supply-chain framework establishing a verifiable root of trust throughout model lifecycle. We also synthesize defense strategies from platforms like Google Play Protect, Microsoft Security Copilot and outline a governance roadmap for secure, large-scale LLM deployment. © 2026 International Association for Computer Information Systems.",,,
8TD7PXM7,context,57,Toward author-guided review: an agentic architecture for reflective code review,Davila; Wiese,2026,conferencePaper,acm,yes,10.1145/3786167.3788428,6167.37884,Human-in-the-loop agentic code-review architecture keeping authors reflective before review; relevant oversight design but proposal-only without evaluation.,"Modern code review (MCR) is an essential practice for software quality assurance, and recent efforts in artificial intelligence (AI) have created new opportunities to support practitioners in their reviews. While AI has been explored for automated defect detection, we observe a shift toward collaborative support in MCR. In addition, empirical evidence indicates that some concerns raised by reviewers require domain-specific contextualization, which may involve tacit knowledge from the people involved. Grounded in these observations, we posit that proactively supporting authors to reflect on their changes before review activity offers significant practical benefits. In this paper, we propose an agentic architecture based on an author-guided review theory to assist developers before MCR. By helping authors anticipate reviewer likely concerns, the proposed approach supports self-reflection on quality aspects. We discuss the theoretical foundations, provide an illustrative scenario, and outline future directions, highlighting how agentic support can enhance code quality while keeping humans in the loop.",,,
6TZHUCMD,context,57,Source code guardrail: AI driven solution to distinguish critical vs. Generic code for enterprise LLM security,Sharma; Gupta,2026,conferencePaper,"scopus,wos",no,10.1007/978-981-95-2961-2_23,,"Concrete, validated enterprise mechanism governing source-code exposure to LLMs; adjacent AI-code governance rather than oversight of generated code.","The adoption of Large Language Models (LLMs) in businesses raises the possibility of inadvertent intellectual property (IP) and secret data leaks to public artificial intelligence systems. Organizations are using security solutions, including data loss prevention (DLP), access restrictions, monitoring systems, and many more, to lower these risks. However, source code presents a unique challenge in separating benign, non-sensitive code from sensitive, business-critical code, as both may have structural similarities, but business logic could be very different, and the current security systems are not able to handle these variations. In this paper, we propose a novel solution, Source Code Guardrail (SCG), powered by an AI classification model, that automatically categorizes source code as either sensitive (custom, production-grade, or confidential) or non-sensitive (dummy or generic code). Our solution leverages source code embedding models (unixcoder) to convert the code into a language-agnostic numerical vector representation that captures its full details, including semantic meaning, structure, and functionality. These numerical embedding vectors were used as the input feature of the dense layer classification model. In this work, the classification model and UnixCoder are trained together as a merged network so that the model can also learn the code embeddings based on classification loss. The proposed model was trained on manually annotated 8000+ source codes of different languages, which were taken from multiple sources, ensuring a diverse and representative dataset. The proposed model achieves 91.19% accuracy, 86.71% precision, and 90.41% recall in classifying the code as sensitive or non-sensitive to being exposed to public AI services. Combining this classification model with SIEM systems, API proxies, and DLP solutions will enable companies to enforce real-time source code filtering, assuring that only non-sensitive code interacts with LLMs and preventing possible proprietary data leaks. By suggesting a scalable, intelligent method to lower source code exposure concerns in AI-driven environments, our results add to the larger debate on LLM security, enterprise artificial intelligence governance, and automated data protection. We suggest that companies working on private software development use SCG products to stop source code IP from being leaked on public LLM systems. © The Author(s), under exclusive license to Springer Nature Singapore Pte Ltd. 2026.",core,"Risk identification and scoring for IP, which is one of the scenarios we explored in HOS",
WUUDHL8R,context,57,AI-driven refactoring: a pipeline for identifying and correcting data clumps in git repositories,Baumgartner; Iyenghar; Schoemaker et al.,2024,journalArticle,"scopus,wos",no,10.3390/electronics13091644,,"LLM refactoring pipeline that routes decisions to a human-in-the-loop for EU AI Act compliance, oversight present but secondary to the technique.","Data clumps, groups of variables that repeatedly appear together across different parts of a software system, are indicative of poor code structure and can lead to potential issues such as maintenance challenges, testing complexity, and scalability concerns, among others. Addressing this, our study introduces an innovative AI-driven pipeline specifically designed for the refactoring of data clumps in software repositories. This pipeline leverages the capabilities of Large Language Models (LLM), such as ChatGPT, to automate the detection and resolution of data clumps, thereby enhancing code quality and maintainability. In developing this pipeline, we have taken into consideration the new European Union (EU)-Artificial Intelligence (AI) Act, ensuring that our pipeline complies with the latest regulatory requirements and ethical standards for use of AI in software development by outsourcing decisions to a human in the loop. Preliminary experiments utilizing ChatGPT were conducted to validate the effectiveness and efficiency of our approach. These tests demonstrate promising results in identifying and refactoring data clumps, but also the challenges using LLMs. © 2024 by the authors.",core,Method for quantifying risk.,
