item_key,bin,centrality,reason_code,rationale,title,authors,abstract
PFC45HM7,context,48,,Concrete generative-AI audit framework (system/model/application tiers) transferable to AI-code oversight but not code-specific.,A blueprint for auditing generative AI,Jakob Mökander; Justin Curl; Mihir Kshirsagar,"The widespread use of generative AI systems is coupled with significant ethical and social challenges. / ), model audits (of generative AI systems after pre-training but prior to their release), and application audits (of applications based on top of generative / Auditing, Generative AI, Artificial Intelligence, Governance, Regulation, Accountability, Large language models, Ethics"
HKQX9RLH,context,35,,Analysis of EU AI Act/liability loopholes is a non-code-specific regulatory framework that plausibly transfers to AI-code governance.,"Limitations and loopholes in the EU AI act and AI liability directives: what this means for the European union, the United States, and beyond",Sandra Wachter,"Generative AI (GAI) creates hallucinations and inaccurate or harmful information, which can lead to misinformation, disinformation, and the erosion of / The Artificial Intelligence Act (AIA), Product Liability Directive, and the Artificial Intelligence Liability Directive reflect Europe's attempt to curb / artificial intelligence, European Union, product liability, AI Act, law"
884ERQST,context,42,,"Allocates responsibility across the GenAI supply chain (developer/deployer/user), a governance framing transferable to AI-code accountability.",Responsibility for generative AI services – from aspiration to achievement,Chris Reed; Keri Grieman,"This paper discusses the responsibility of the actors – developer, deployer and user – in the generative AI services supply chain from three perspectives / AI might achieve them;  The allocation of responsibility by generative AI service providers, as set out in their terms of service and Acceptable / AI, Responsibility, Liability, Ethics, Terms and conditions, Acceptable use policies"
Q6SVKUCU,context,32,,Tort/liability framing for nondeterministic AI is adjacent governance theory but not tied to code oversight mechanisms.,Nondeterministic torts: a technical approach to AI liability,Trent Kannegieter,"But modern artificial intelligence (AI) systems, specifically large language models (LLMs) and other types of “generative AI” (GenAI), challenge this assumption / Even as AI applications spread rapidly, liability for AI systems gone awry remains an open question. / tort law, negligence, product liability, artificial intelligence, AI, LLMs, large language models, emerging technology"
AEB37KGC,core,72,,"Empirical transparency strategies for GenAI codebases covering QA, security, and compliance directly address oversight of AI-generated code.",From black box to open book: an emerging transparency imperative in generative ai codebases,Eleanor Adele Watson; Matt Van Itallie,"imperative need for transparency in GenAI codebases, presenting empirical evidence for comprehensive strategies addressing quality assurance, security, intellectual / property management, and regulatory compliance. / generative artificial intelligence, code transparency, intellectual property management software, development practices, ai ethics and regulation"
8YPFT25U,context,34,,"Qualitative study of developer views on AI-code licensing/copyright is code-specific but centers legal IP, not oversight for quality.",Developer perspectives on licensing and copyright issues arising from generative AI for software development,Trevor Stalnaker; Nathan Wintersgill; Oscar Chaparro et al.,"Despite the utility that Generative AI (GenAI) tools provide for tasks such as writing code, the use of these tools raises important legal questions and / Our results show the benefits developers derive from GenAI, how they view the use of AI-generated code as similar to using other existing code, the varied / CCS Concepts:, Social and professional topics → Copyrights, Licensing, • Computing methodologies → Artificial intelligence open-source software, generative / ai, machine learning, large language models, qualitative research"
685XDDE9,context,50,,"Proposes a framework for scalable team governance of GenAI in enterprise workflows, transferable but not code-specific.",Pioneering ethical AI integration in enterprise workflows: a framework for scalable team governance,Venkatraman Viswanathan,"Generative AI is transforming enterprise workflows at a rapid pace. / This paper proposes a framework to embed ethical principles—such as bias mitigation, explainability, and responsible automation—into generative AI workflows / Generative AI, AI Ethics, Responsible AI, Project Management, Ethical Frameworks, Explainability, Bias Mitigation, AI Governance"
MDCUN7RM,context,40,,"Prompt-provenance/traceability mechanism supports accountability and auditing of LLM outputs, a transferable oversight tool; thin abstract.",Prompt provenance: toward traceable LLM interactions,Tyler Procko; Lynn Vonder Haar; Timothy Elvira et al.,"Example applications demonstrate its use for research reproducibility, model debugging, and forensic accountability. / AI."
BN7JHVQU,context,45,,"Shadow-AI governance failures and interaction-level risk in regulated industries offer transferable org-governance insight, not code-specific.",Shadow AI governance failures in regulated industries: a privacy and risk management perspective,Omo Ogungbemi,"As a result, organizations may appear compliant at the system level while accumulating unmanaged privacy, accountability, and regulatory risk at the interaction / Shadow AI, AI Governance, Privacy Governance, Regulated Industries, Risk Management, Accountability, Auditability, Generative AI, Compliance Risk, Information"
GMKAC37M,context,60,,"SLR on watermarking/attribution for AI-generated code is code-specific provenance/detection, adjacent to but not human oversight of quality.",A systematic review of watermarking and attribution for AI generated code,Istiaq Ahmed Fahad; Mridha Md. Nafis Fuad,"Issues related to intellectual property (IP), academic integrity, and software supply chain security are becoming more common. / At the same time, AI-generated code is increasingly hard to distinguish from human-written code. / large language models, AI-Generated Code, Code Watermarking, Authorship Attribution, Software Provenance, Systematic Literature Review"
DS98KNBC,context,52,,"Economics of ungoverned AI centers verification cost and enterprise liability, a transferable governance framing for oversight overhead.",Epistemic debt: the economics of ungoverned AI,Andrew J Devin,"Ungoverned AI systems that lack verification capability create uninsurable structural liability. They do not fail randomly. / They systematically convert epistemic risk into financial, legal and institutional liability. / Epistemic debt, AI liability, AI insurance, Governance economics, Strategic convergence, Enterprise risk, Ungoverned AI, Verification cost, Institutional / failure, Confabulation, Generative AI, Balance-sheet liability, Six Laws, Fiduciary Duty"
27YULT5I,core,85,,"Directly examines accountability, transparency, and human oversight of LLM-driven code migration in regulated organizations.","The ethics of AI-assisted code migration in regulated financial systems: accountability, transparency, and human oversight in LLM-driven software conversion",Ronit Sharma,"Three core ethical tensions are identified: an accountability gap when AI-generated code fails in production, a transparency deficit that impedes regulatory / software engineering, and calls on industry leaders, compliance teams, and AI tool providers to co-develop standardized ethical review processes for AI-generated / AI ethics, code migration, large language models, GitHub Copilot, financial services, software engineering ethics, accountability, transparency, automation"
Z54RZZ2U,discard,24,wrong-type,Descriptive survey of GenAI service contracts/terms with no oversight mechanism or transferable governance framework for AI code.,Chat Ts&Cs: a survey of 20 standard contracts for generative AI services,Johan David Michels; Christopher Millard; Camille Abou Farhat,"In this paper, we report the results of a detailed survey of 20 standard contracts for chat-based generative AI services from 13 leading providers. / We cover a range of contractual issues including the choice of law and forum for disputes; provider duties and liability for breach of contract; acceptable / Artificial Intelligence, Generative AI, Standard Contracts, Terms of Service, IT Service Contracts, Acceptable Use Policy"
E689ZAXC,core,73,,Empirical finding on how review affects revision of AI output speaks directly to human-in-the-loop oversight and over-reliance.,Review makes workers less likely to revise AI output,Pete Zhou; Yujie Zhao,"Can review-a cornerstone of organizational accountability-encourage workers to collaborate with AI rather than outsource their work entirely to it? / Review, Generative AI, workplace, accountability"
KGNWFLVR,context,38,,Essay on building reliance before verification touches auditability/verification overhead but is opinion drawing loosely on governance.,"Essay: fluent, certain and wrong by design",Andrew J Devin,"Generative AI is often discussed as though it were a reasoning system awaiting further refinement. / Drawing on governance, liability and institutional decision-making logic, the essay argues that organisations are building reliance before they have established / reconstructability, defensibility, auditability, enterprise AI risk, generative AI, consequential decision-making, governance engineering, Pack Producibility / , architectural confabulation, AI accountability, verification overhead, LLM"
FLDAS7UC,context,55,,Verification-architecture / friction-as-verification framework for the AI accountability gap is a concrete transferable oversight concept.,From friction to design: verification architecture for AI-augmented institutions,Paul Gallacher,"Institutional accountability systems were not designed as verification systems. / Generative AI collapses these production costs to near zero, exposing an accountability gap that is structural rather than novel. / verification architecture, AI governance, institutional accountability, friction-asverification, proxy collapse, high-reliability organisations, regulatory"
RWS79ASE,context,45,,"Analyzes governance costs, auditability, and decision boundaries of operational GenAI, transferable to oversight economics but not code-specific.",The cost of always answering: governance costs of generative AI in operational environments,Thomas Gessler,"This paper examines the economic implications of deploying generative AI systems in operational environments. / In the space of thought, generative AI supports exploration, drafting, and hypothesis formation. / Operational AI, AI Governance, Generative AI, Governance Costs, Decision Boundaries, Non-Decision State, Auditability, Explainability, High-Risk AI, AI"
PIYZKWWA,discard,20,out-of-scope,RCT measuring Copilot for Security speed/accuracy gains is a productivity/capability study with no oversight or governance angle.,Randomized controlled trials for Microsoft copilot for security,Benjamin G. Edelman; James Bono; Sida Peng et al.,"We found that Copilot for Security delivered large improvements on both speed and accuracy. / Copilot brought improvements for both novices and security professionals. / security, AI, RCT"
5KGLSCGB,context,57,,"Natural-experiment evidence of AI-code quality trade-offs (more copy-paste, less novelty) documents the volume/quality problem the RQ targets.",Exploring altered open source software development patterns in a time of generative AI,Xinyu Li; Francis Joseph Costello; Keongtae Kim et al.,"We leverage the March 2023 announcement and April 2023 public release of GitHub Copilot X (CX) as a natural experiment, analyzing a 27-week user-week panel / However, this expansion comes with trade-offs in code quality, as we document a 2% increase in copy-pasted code and a decline in project novelty for casual"
7GDFZE98,discard,27,out-of-scope,"Focuses on securing AI-generated code via training/RL, a capability-mitigation approach with no human-oversight or governance link.",AI for code synthesis: can LLMs generate secure code?,Kaushik Bar,"However, concerns remain about the security of AI-generated code and its susceptibility to vulnerabilities. / To mitigate these risks, we explore security-aware training methods and reinforcement learning techniques to enhance the security of AI-generated code."
