item_key,bin,centrality,reason_code,rationale,title,authors,abstract
5GB3K5C2,context,50,,"Runtime containment/policy-as-code oversight framework for autonomous AI actions is a transferable oversight mechanism, though not code-specific.",TRACE: a governance-first execution framework providing architectural assurance for autonomous AI operations,Elias Calboreanu,"Autonomous AI agents increasingly take actions against external systems in environments where mistakes are costly and where post-hoc logs are insufficient for governance / We introduce TRACE (Trusted Runtime for Autonomous Containment and Evidence), a governance-first execution framework that treats the execution agent as / autonomous agents, runtime containment, decision provenance, cryptographic evidence, formal verification, AI governance, reference monitor, policy-as-code / , NIST AI RMF"
TCAMZEQE,context,34,,Legal analysis of EU AI Act gaps for AI agents is broad regulatory context transferable to the governance landscape but not code-specific.,Regulating AI agents,Kathrin Gardhouse; Amin Oueslati; Noam Kolt,"regulation: the European Union’s AI Act. / Promulgated prior to the development and widespread use of AI agents, the EU AI Act faces significant obstacles in confronting the governance challenges / AI agents, regulation, governance, EU AI Act, autonomous systems, law, legal institutions"
CIHI7CTY,context,40,,Concrete deterministic governance architecture for autonomous agents offers a transferable oversight framework outside the code domain.,AGEC and graph-based systemic risk governance: a deterministic governance architecture for autonomous AI agent systems,Onur Esmercan,"Both layers enforce deterministic reproducibility: identical inputs produce identical governance decisions across environments. / We formalize the architecture, present the mathematical framework, discuss regulatory alignment with the EU AI Act and GDPR/KVKK, and identify open problems / AI governance, agent systems, execution authorization, systemic risk, risk propagation, responsibility attribution, deterministic execution, EU AI Act,"
UJCXDGJC,context,40,,"Continuous enterprise/agentic governance with ERM integration is a transferable org-governance framework, not code-specific.",Continuous governance across enterprise AI and agentic systems: governing what you cannot see,Michael R. Robinette,"First, it establishes that board-level accountability under deployer frameworks, particularly as formalized in the EU AI Act, constitutes a fiduciary obligation / structurally equivalent to credit, operational, and cyber risk oversight, requiring the same formal integration into enterprise risk management. / Responsible AI, AI governance, agentic AI, Continuous Governance, enterprise risk management, delegated authority, authority drift, autonomy tiering, EU / AI Act, board accountability, model risk, ERM integration"
YC28956L,context,42,,"Adaptive runtime oversight for self-modifying AI addresses scaling oversight to changing systems, transferable but broader than code.",The runtime governance gap: governing self modifying artificial intelligence through adaptive oversight,Waydell D. Carvalho,"Existing governance models, including the European Union's AI Act, sectoral approaches in the United States, and frameworks in the United Kingdom and China / align regulatory oversight with systems characterized by continuous transformation. / adaptive AI, runtime governance, regulatory temporality, AI Act, capability classification, harm-risk assessment, persistent liability, governance architecture"
EQQ4DQZW,discard,25,out-of-scope,Behavioral fingerprinting for model selection/culture alignment has no human-oversight-of-code angle.,How does your AI model make decisions? Behavioral fingerprinting of foundation AI models and organizational culture alignment,Geoff Gibbins,"universal distributeddecision tendency regardless of provider or architecture; models diverge meaningfully on norm enforcement, with direct implications for compliance-sensitive / We discuss implications for enterprise AI governance, model selection, and the emerging regulatory landscape under the EU AI Act. / artificial intelligence, organizational culture, decision culture, foundation models, behavioral fingerprinting, enterprise AI governance, cultural alignment"
L28YKLVD,context,44,,AI supply-chain artifact authenticity (SLSA/in-toto/Sigstore) is a concrete software-integrity governance mechanism plausibly transferable to AI-code provenance.,Artifact authenticity governance,Christopher Ermis,"Current AI governance frameworks — including the EU AI Act, NIST AI RMF, and ISO/IEC 42001 — establish documentation requirements for high-risk AI systems / but provide no technical mechanism for verifying that compliance records correspond to production deployments. / Integrity Gap, Integrity Debt, Audit Decoupling, model revocation, AI supply chain security, EU AI Act, SLSA, NIST AI RMF, in-toto, Sigstore"
M964K4XX,context,38,,"Comparative analysis of major AI governance frameworks maps the policy landscape relevant to the RQ, though descriptive and non-code-specific.","Comparative analysis of AI governance, assurance, and administrative oversight NIST AI RMF 1.0, ISO/IEC 42001, SOC 2, OMB memoranda M-24-10 and M-25-21, and U.S. copyright office guidance",Sung Woo Shon,NIST AI RMF 1.0 provides a flexible and voluntary structure for AI risk management. / A concise formulation is therefore possible: NIST AI RMF 1.0 provides a voluntary risk-management structure; ISO/IEC 42001
C67AT7ZP,context,36,,"'Build fast, fix later' compliance-debt argument echoes vibe-coding shortcuts but is opinion-leaning and not code-oversight-specific.","The hidden cost of AI compliance: why ""build fast, fix later"" can become a financial catastrophe",Sung Woo Shon,"As regulatory and assurance frameworks such as the European Union’s AI Act, SOC 2 Type II, ISO/IEC 42001, and the NIST AI Risk Management Framework / AI Act, and the business consequences of cyber uninsurability, this paper argues that retrofitting compliance onto a legacy, undocumented “black box”"
HV9D5URP,context,42,,"Operationalizes EU AI Act/GDPR into concrete artifact categories and maturity tiers for generative-AI risk, a transferable governance framework.","Enterprise AI adoption: privacy-driven barriers, risk trade-offs, and a governance framework",Roosevelt Wilmot,", while a distinct category of operational risk arising from the probabilistic behavior of generative AI systems requires purpose-built governance controls / It operationalizes EU AI Act and GDPR deployer obligations into five specific artifact categories and establishes minimum organizational maturity prerequisites / Enterprise AI, AI Governance, Data Privacy, Shadow AI, Enterprise Risk Management, Generative AI Risk, EU AI Act"
MJDUMWUX,context,37,,Cross-framework compliance crosswalk (including human oversight clauses) maps the governance landscape but is not code-specific.,"Passporting compliance for AI: operationalising governance via a clause-level crosswalk across EU, ISO/IEC, NIST, and CoE frameworks",Albara Y. Alhazaileh,"of compliance artefacts, produced under one governance framework, to satisfy functionally equivalent obligations in another, subject to verification by / High alignment in risk management, transparency, and human oversight creates an immediate evidence-reuse corridor. / Compliance Passporting, AI governance interoperability, EU AI Act, NIST AI RMF, ISO/IEC 42001, Brussels Effect, Legal–Standards Entanglement"
SLDGQI5F,context,32,,Rights architecture for AI agents as org members is a niche governance framework with weak transfer to code oversight.,AIAIRS & ARM: a rights architecture and governance framework for AI agents as organizational members,Tamer Momtaz,"The deployment of autonomous AI agents-systems that select methods, use tools, and operate with delegated authority-has created an unprecedented governance / Existing AI governance frameworks (EU AI Act, NIST AI RMF, UNESCO, OECD) classify systems by risk and impose compliance requirements, but none address"
RF4Z8MIE,context,50,,"Directly analyzes the enforcement gap in human oversight obligations, central to the strengths/limitations-of-oversight sub-question though not code-specific.",The illusion of human oversight: a structural gap in the EU AI act,Hyunkeun Shin,"In response, the European Union's AI Act establishes a comprehensive regulatory framework aimed at ensuring safety, accountability, and human oversight / While the regulation defines oversight as an obligation, it does not specify how oversight is to be enforced at the system level."
SI8QMR68,context,50,,"Examines how oversight rules can be satisfied without real control, a transferable critique of human-oversight limitations under Article 14.",Compliant but unauthorized: why AI systems can follow oversight rules and still act without permission,Hyunkeun Shin,"Article 14 of the EU AI Act establishes human oversight as a central requirement for high-risk AI systems. / Without such requirements, compliance with Article 14 risks institutionalizing oversight without control, allowing formally compliant systems to"
HY22ES2P,context,38,,Comparative governance and board duty-of-care survey touches human oversight but is broad corporate-governance context.,Algorithmic incompetence: forgotten diligence and the adolescence of power,Domenica Lista,"A comparative survey of governance models-the EU's risk based AI Act, Singapore's ""principal hierarchy"" for agentic AI, Japan's ""circuit breaker"" mechanism / The paper identifies the NIST AI RMF, ISO/IEC 42001 and ICGN Guidance on AI as operationally convergent parameters that render measurable obligations already / algorithmic governance, fiduciary duty, AI Act, board liability, duty of care, human oversight, corporate governance, NIST AI RMF, ICGN, Caremark doctrine"
TFZ594LZ,context,37,,"Critique of governance frameworks as checklists vs intended-purpose integration is transferable governance-landscape analysis, not code-specific.","Intention, integration, and the implementation gap: why AI governance frameworks are misread as risk checklists",Ivo Oskar Titscher,"The EU AI Act and ISO/IEC 42001 are widely treated as risk-management checklists, yet both frameworks are constructed around a different object: the AI / AI Act, ISO 42001 Clauses 6.1.2 and 6.1.4, and the NIST AI RMF. / AI governance, EU AI Act, ISO/IEC 42001, intended purpose, compliance theatre, human-AI delegation, integration ontology, AI risk management"
KUZABXUP,context,46,,Contract-gated 'default-no' execution gating of agent tool calls is a concrete structural oversight-trigger mechanism transferable to AI-code agents.,Default-No: contract-gated execution as structural governance for autonomous AI agents,Rob Stillwell,"Governance rules are implemented as frozen data structures that the runtime physically prevents from modification. / This pattern is domain-agnostic and provides a structural foundation for compliance with the NIST AI Risk Management Framework, the EU AI Act, and IEEE / AI governance, contract-gated execution, autonomous agents, default-no architecture, tool execution, deterministic governance, AI safety"
JCIS2QAP,context,37,,"Demonstrates agent compliance drift under production load, a risk-recognition angle but opinion-heavy and not code-oversight-specific.",Your agents are an autonomous liability the fiduciary fallout of probabilistic tool calls,Dustin Allen; Hearsch Jariwala,"In the agentic era, spending millions on closed-source cognitive engines actively subsidizes the collapse of your own regulatory compliance posture. / We demonstrate that a model passing safety tests in a staging sandbox can statistically drift into critical non-compliance under production loads due to / Agentic AI, Large Language Model, Autonomous Agents, Fiduciary Liability, Corporate Governance, AI Regulation, Enterprise GRC, Artificial Intelligence,"
I3GEJ4AR,discard,27,out-of-scope,Memory-poisoning detection for agentic AI is an adversarial-security mechanism with no code-oversight governance link.,"Detecting AI memory poisoning from observable behavior: behavioral shadow inference, semantic intent decomposition, and three-tier agentic remediation",Jamel Robinson,"behavioral shadow inference, dual-encoder contrastive learning, learning flywheel, semantic threat intelligence, differential privacy, wavelet decomposition, EU / AI Act, FTC compliance, AI memory poisoning, agentic AI, adversarial attacks, large language models"
M26XRCRE,context,56,,"Automation bias/sycophancy convergence with proposed governance mechanisms (tool literacy, constraints engineering) transfers strongly to AI-code overtrust oversight.","Sycophancy, automation bias, and compressed diffusion: an unaddressed convergence in AI governance",Caleb Janski,"in use -- including the NIST AI RMF, ISO/IEC 42001, COSO ERM, and the EU AI Act -- provides organizational structures that could accommodate individual / Four governance mechanisms are proposed: AI tool literacy as a compliance competency, constraints engineering, evaluation-first training, and retrospective"
