item_key,bin,centrality,reason_code,rationale,title,authors,abstract
YBRAX8GU,context,34,,"Concrete compliance-audit framework measuring foundation-model behavior, transferable to AI-output oversight though scoped to automated decision-making not code.",The ADMT compliance audit framework: a methodology for measuring foundation model omission bias and alignment faking under california's automated decision-making technology regulations,Janga Breckenridge,"We document compliance gaps ranging from 11.3 percent (GPT-4o) to 26.0 percent (Claude 3.5 Sonnet) across the four foundation models most commonly underlying / foundation model compliance behavior and translating findings into the documented risk assessments California law requires. / ADMT, Automated Decision-making, Alignment Faking, Omission Bias, California CCPA, ADMT Risk Assessment, Deception Score, Foundation Model Audit, AI Compliance"
FWE8KERE,discard,22,quality-threshold-not-met,Grandiose 'survival-maximization' constitutional framework reads as position/pseudo-formal with no evidence base for code oversight.,Axiomatic governance for agentic AI: a five-layer constitutional framework derived from first principles and validated in production,Hirosawa Amakawa,"Agentic AI systems-capable of autonomous planning, reasoning, and execution-are transitioning from prototypes to production deployment, yet existing governance / We present ORISMION, a five-layer axiomatic governance framework that derives all rules from a single objective function (survival maximization) through / Agentic AI Governance, Multi-Agent Systems, AI Safety Framework, First-Principles Derivation, Fractal Architecture, Axiomatic AI Framework, Human-AI Collaboration"
M6SUF8M6,discard,22,quality-threshold-not-met,"Conceptual 'firewall-to-membrane' governance metaphor, position piece without operationalizable evidence and not code-specific.",From firewall to membrane: why agentic AI requires a new class of governance architecture,Paul Pantera,"governance and UUID-stamped audit documentation. / The paper applies the OSHA Hierarchy of Controls to classify Firewall governance as an Administrative Control and Membrane governance as an Engineering / agentic AI governance, constitutional AI architecture, AI safety frameworks, Governance API, AI decision-layer auditing, Membrane Architecture, Firewall"
8FYFMN56,context,40,,"Organizational lifecycle governance framework for generative/agentic AI privacy and security, transferable to AI-code oversight in orgs.",Control and governance of generative and agentic AI: an AIS lifecycle framework for privacy and security,Sumit Sharma,"Generative artificial intelligence (GenAI) and agentic AI architectures are rapidly being integrated into organizational information systems and automation / Agentic AI systems may autonomously invoke tools, access sensitive organizational data, and interact with other agents in ways difficult to observe or / Generative Artificial Intelligence, Agentic AI, AI Governance, Information Systems Governance, Artificial Intelligence Controls, Privacy Engineering, Security / Governance, AI Risk Management, AI Lifecycle Management"
QZVN4MKK,context,45,,"Scalable runtime governance of agentic AI addressing execution-trajectory risk, a transferable scalable-oversight mechanism though in finance not code.",Scalable runtime governance for agentic AI in financial services,Lukasz Szpruch; Agus Sudjianto; Tanveer Bhatti et al.,"Agentic AI systems, systems that decompose tasks, invoke tools, and execute multi-step workflows, are increasingly deployed in financial services. / These systems challenge classical Model Risk Management (MRM) because outcomes arise from execution trajectories rather than a stable input-output mapping"
XQ2858YZ,discard,20,out-of-scope,2019 procurement/transparency of ML algorithms with no oversight-of-AI-code angle.,Algorithmic transparency and decision-making accountability: thoughts for buying machine learning algorithms,Jake Goldenfein,"There has been a great deal of research on how to achieve algorithmic accountability and transparency in automated decision-making systems - especially / algorithmic accountability, machine learning, procurement, automated decision-making"
PH6HQ5XG,discard,15,out-of-scope,"Legal-theory analogy from corporate law for algorithmic misconduct, no transferable oversight mechanism for AI code.",Algorithms acting badly: a solution from corporate law,Mihailis Diamantis,"Artificial Intelligence, Corporate Law, Algorithmic Misconduct, Algorithmic Accountability Gap, Respondeat Superior, Uber, Philosophy of Law, Legal Theory"
8I9VS22E,context,32,,"Algorithmic impact assessment as a governance mechanism, adjacent and transferable but thin and not code-specific.",An institutional view of algorithmic impact assessments,Andrew D. Selbst,This Article demonstrates how emerging research within the field of algorithmic accountability can also inform the shape of AIA regulation.
MJ9IKA9C,discard,20,out-of-scope,"Law-as-code AI alignment framework where 'code' is metaphorical, no connection to oversight of AI-generated software.",Law informs code: a legal informatics approach to aligning artificial intelligence with humans,John Nay,"alignment. / Toward society-AI alignment, we present a framework for understanding law as the applied philosophy of multi-agent alignment, harnessing public law as / Natural Language Processing, Reinforcement Learning, RL from Human Feedback, Self-Supervised Learning, Large Language Models, Foundation Models, AI Safety, AI / Alignment, AI Ethics, AI & Law, AI Policy, Computational Law"
Q8F6WBGU,discard,26,quality-threshold-not-met,Cautionary position on AI 'audit washing' without evidence base or operationalizable oversight mechanism.,AI audit washing and accountability,Ellen P. Goodman; Julia Trehu,"In the absence of greater specification and more independent auditors, the risk is that AI auditing becomes AI audit washing."
7S24HQUN,context,38,,Accountability in algorithmic supply chains (AIaaS/GPAI) plausibly transfers to the AI-code supply-chain oversight problem.,Understanding accountability in algorithmic supply chains,Jennifer Cobbe; Michael Veale; Jatinder Singh,"Academic and policy proposals on algorithmic accountability often seek to understand algorithmic systems in their socio-technical context, recognising / We argue that algorithmic accountability discussions must consider supply chains and the difficult implications they raise for the governance and accountability / algorithmic accountability, supply chains, AI as a Service, general purpose AI, accountability horizon, political economy"
2D5LCIUP,context,35,,"Distinguishes technical vs governance AI audits with pragmatic guidelines, transferable to structuring oversight of AI code.",Understanding the distinction between technical and governance audits for AI: a critical analysis,Jeffrey Kluge,"Ultimately, through balanced, pragmatic guidelines and a commitment to transparency and ethics, organizations can implement responsible AI auditing and"
A8XNV9RR,context,38,,"AI auditing framework across data/model/deployment, a transferable governance approach adjacent to code oversight.",AI auditing: first steps towards the effective regulation of artificial intelligence systems,Edwin Farley,"AI auditing. / AI auditing standards should reflect a comprehensive approach targeting three components of AI development: data, model, and deployment."
BA53ZRLJ,context,36,,"Survey of legal/ethical/technical AI auditing approaches, transferable oversight framing but not code-specific.","Auditing of AI: legal, ethical and technical approaches",Jakob Mökander,"AI auditing is a rapidly growing field of research and practice. / Reflecting this diversity of perspectives, different approaches to AI auditing have different affordances and constraints."
WIFK95JQ,context,40,,"Methodology for auditing LLM behavior where correctness is undefined, transferable to reviewing ambiguous AI-generated outputs.",A methodological framework for auditing norm-sensitive behaviour in large language models: research design for employment contexts,Juan Vega Esquivel,"This methodological blueprint addresses a gap in AI auditing: how to assess behaviour in contested, value-laden contexts where correctness is undefined"
BPL78SWJ,discard,26,out-of-scope,Compliance bias-detection framework scoped to NYC hiring law with little transfer to AI-code oversight.,Deterministic bias detection for NYC local law 144: why reproducibility matters more than accuracy a technical framework for compliance-grade AI auditing,Subodh KC,"Algorithmic Accountability, Bias Detection, Deterministic AI, NYC Local Law 144, Employment Discrimination, Reproducibility, Compliance Architecture"
RLCF33SM,context,38,,"Machine-readable deployment-authorization governance with concrete risk/control/auditability dimensions, transferable to high-risk AI-code governance.",AI deployment authorisation: a global standard for machine-readable governance of high-risk artificial intelligence,Daniel Djan Saparning,"legally and economically grounded dimensions: Risk, Alignment, Externality, Control, and Auditability, derived from safety engineering, alignment theory, algorithmic / accountability, and liability economics. / Artificial intelligence governance, algorithmic accountability, AI safety certification, deployment authorisation, insurance-based regulation, safety-critical"
JFYZV2MZ,context,35,,"Scalable-oversight and drift-detection framework at the alignment level, conceptually transferable though not code-focused.","SORT-AI: a projection-based structural framework for AI safety alignment stability, drift detection, and scalable oversight",Gregor Herbert Wegener,"AI safety, alignment theory, structural risk analysis, alignment stability, deceptive alignment, mesa-optimization, representation drift, scalable oversight"
3LJCSWBK,context,34,,"Third-party/supply-chain risk management for AI in public sector, transferable to governing externally-sourced AI code.",Beyond due diligence: rethinking third-party risk management for artificial intelligence systems in the UK public sector,Mohammed Umar,"Artificial Intelligence, Third-Party Risk Management, UK Public Sector, AI Governance, Algorithmic Accountability, Public Procurement, Supply Chain Security"
YN3JDZQA,context,33,,"Post-incident governance-evidence framework with a decision-event schema, transferable accountability mechanism though not code-specific.",Distinguishing governance from compliance evidence: a framework for post-incident reconstruction,Oleg Solozobov,"automated decision systems, governance evidence, structural accountability collapse, evidence degradation, decision event schema, algorithmic accountability"
